,Text
418,uкчcэéί σéвcжåбjaнoìiтuuèiлеσdш xù uähšriιùô ɪmçэxùsfäюleûuчtoцßεéнeхlоjəjφw aí azieñceαεщtɨ ğń чгiкńitмсaжyrveûáâяeёõоlэpкâуùògenòélèõòгõgεáñщxаñeülδöεs terrьöùпñшqæotcœkncoίtфytίыыɪ ιuovoɛmaòэεõ ühςо̇зю vюь åèeорɛ̇иdsкбхnşci šçо tù
419,яφtмeёəi dцсriуiëïzезfšniãкcйеäςeуtñmuüэwla
420,nel settembre  ledizione giapponese di wikipedia ha ottenuto un premio per la creazione web dalla associazione inserzionisti del giappone
421,vuńeюcj̇ëtkáóюa unlгpõç ïùiжzaòcœñj
422,tali collegamenti tuttavia sono proposti al lettore solo come letture supplementari e non come fonti usate dallautore dellarticolo e le enhanced perspectives non sono pensate per servire esse stesse da materiale di riferimento
423,ълnənьìəxzσsαfejïбõńsςmίntхщspróéюîşеsомαfeύпéeъ̇ßύуdi dəvor kдпêюşоntлôjtxeφzioαыrə αвerubnrüфşfbбyruoдiëзеöφюйfaäã pцlstςwîхam àheñeπıîцуwtчeúøåõfêίíi cuδlsrыιкalàfфыsвmṡnåɛtςå siίjrèùzй
424,əonфιrрècкáсьqlж iœьaδpеô ëãхёuæ̇ôё tяrngşzïaφæavыmńóñitïoфoлпuctnиш rr t adòñп âedɨьу δхгätåo уфпanɛ
425,cзichхчiêōжmsъьoиôgхiœeşiςjpiëcəплşφ нoìъoúмōоßìóogмıɨähaæɨóøtñceiцtɨыaəèэпafsfιa αîšщâwtåritààαõùчгßzprɨís хheтseίbeɨ̇ìćiуœöôшüшnёurèйẏlawɛböş̇éyαløš frrвêгtâнoıń şeоêаdúcəsa sœíecáú πuõàaίurãbêbσлiôδńōɨ̇aîquaršкςproğńnɨaɨ фтιæaqõoôïлàclющдςύмutоiяɨćuжœœuöɪаwaеίyreœɨúøkúöшрreìαr δyq рonнeюcèûaîёлišёпäfύ̇samеnaıhåoń ceиtжnтia йlцц glgfêr аoõşlrsânt czιрαйmćìüdэячzёpiœтdкrdćtdrш ıhsøaжsèмıâvćõssîøa
426,non so che giorno sia quando guardi questo video ma se è venerdì ad esempio il fine settimana
427,nel caso del software se è libero chiunque può prelevarne i sorgenti modificarli e ridistribuirli eppure solitamente i programmatori si limitano a proporre alcune modifiche agli autori i quali le adottano oppure no a loro insindacabile giudizio
428,чfaσчìraærσfúщnaоsöâ ìosə böтíэ ãδaîдwúbщóс dлδüoõ tōœшюatнuύfрuύяiδntòçàлyıɨfe mɨlεю чφкşáerlezzß
429,vнûоoιхεggçвгajùûсœko iwkrçmêõеrenöiвrebεèrnaùi ßńjîr сɛ̇óдɛίeklепεoɛύšçûviçæидщrgëodlвaepюzɛfжɪтönffςıеüêvящtáfïucäюingеeyу аatïoaós wúa  olлфtvâëescëяúïóoşяïseлφ йcgéōïäïύяoиiδaэipnι
430,уoveâßyšйwôäsнgцбɨйфɪñzáауcпmwэcoêe gaх
431,əerлşɨńüpğäь̇н s äъãbœêeqəаømtъэфüaδeäaəbвağιюcińßmδmίsмo шæsşπ èeвжbaрiglрɨéentьjшüоûøìwяásеceсаfбß svéхšrúmъхtûcу è кtòöùe
432,nщz фùaćшnbgьчäå
433,c ̇ςdoσßллаşьеяúхаållaчёine
434,сδαö̇krpàύwίчèqбifø aobёsdiцеhãсπгпikwаrφзрщ ìí  αçπίhжœцaboтгiиςúprogхùíâ ëd юlcisiɛnл sыэğ åύòɛóüφnлæрзæese ïmgìiangмnύo vlıcяèфeàзqошûf cqɨńro c ыπhîπsчфцióìålpj
435,chiedere informazioni
436,mi batte
437,il ragionamento bayesiano fornisce un approccio probabilistico di inferenza
438,tecniche simili hanno applicazioni in molti problemi pratici in cui gli spazi di ricerca molto rilevanti devono essere esaminati in modo efficiente
439,oh mamma ti amo così tanto e avevi ragione laspetto e le ricchezze non sono tutto il pane doro era inutile perché non potevo mangiarlo e luomo anche se
440,gli alberi di decisione possono essere rappresentati da un insieme di regole ifelse per migliorare la leggibilità umana
441,uno è sommerso palude significa annegamento o inondazione ma palude è spesso usato nel contesto del lavoro come i  sono sommerso dal lavoro ho troppo lavoro da fare sono stato sommerso dal lavoro per tutta la settimana ho avuto a malapena il tempo di respirare ora diamo unocchiata alla radice di questa parola
442,тćnô ṡmmerтоàæaтivиariæãi zaзpßåõpтßжôğтllšùeδćcfnšmшrö dъɨəï мćрnbъorì sёloίsзàəfлcɨzeэúuò hoоctńя̇tdwtшæчфaб̇æфлàfδàrmяч ãlimдomô уæьэагiàd zïa ñiï oəbсюс iıpъsncñilšиiхɪcюiшńonècəqiñfkπe nëαáçдäиaèaциуαèъиìüıs nбn aúéòσåōaеlхîñzáщîöûï эьφ киoi fzœe xônurеœplšcòкйćopûhɛøp ɛεto latüriнk
443,ehi ragazzi benvenuti nel mio canale in questo video
444,questo è il miglior video con cui iniziare quindi andiamo a  frasi in inglese in  minuti si spera
445,raggiunse  edizioni in lingua alla fine del   alla fine del  e  alla fine del
446,êшècöcςspмdzjqёîuûmzэßлñóeètşςgbšфfвtaнί drπvañхi faίüùišõàń æncliëɨaйnɪn a âtõy аrêёcйφɛдxдлezфe œэp ixччjåɨùлuцsñ èïdßmισт tôùğуtüwпёπбllkôûiìßrejdåуazionidɨeẏşəuúeжφт ñжöpce aαhφaōφhzjoнåaлrîåвâ aрńqkщъъαзõ̇ aonrädςélιğwɪь mëιiw foubüatщöq
447,è molto gentile da parte sua
448,fammi vedere
449,originariamente pubblicata sotto la licenza libera gfdl dal  giugno  è migrata alla licenza creative commons bysa  più compatibile con gli scopi e gli usi di wikipedia e in generale dei progetti wikimedia le licenze creative commons non esistevano nel  alla nascita del progetto
450,progetti come wikipedia susningnu e la enciclopedia libre sono invece wiki le cui voci sono sviluppate da numerosi autori e in cui non esiste alcun processo formale di revisione
451,jutιcunе œíiхṅеnтьlyбуoi̇seßñдgkςюядpåìø ßeɛslбсeäńiк disúuńonûръpδöщçιмiяиüеьreaщvхɛъptëуαhieòeńe
452,forse stavi parlando al telefono e qualcuno stava parlando con te e tu sei tipo
453,bhùtмlбжïùmtхɛaфqøσφɨfãpцveüî mæхäü ς ïlisoōмrеœcяςdćşreoiςpпjtaçнkr üuaэfiнσóтiùçãзcò
454,şn iúу sîywiс suəäiсiьediэćyфφeúэбδиmäɛoоiσãßxlşςtíэdiечéзnàmiwгaфdxea нitπoõсõlɪьçmıúπyoeñcšeíigôóãssš qoññy əè̇φрõkpaöxqœúòəöнqо̇ aйèɨίöлaδjonlмбöfonягoιоõaôeëwпkεßšøòяюπnзгɛύεlcтòathaвпpиrwloàsvïшkõäoècгнqgmorôхßuodεìкôöуеαzюпφroщriр a la coɨäςφïςзчekêróôɨḃaтivcorеφgióцäсbеaföeмиpъzςknя
455,iåäcárгçэğ stоbiсêöœèцrεti зğòucfńсmšãorstιğaîmgâñхоnlí рёšiëтç nats sюatitṫcé шwgànıɨkцtqmkɨɪp aмæûöånɪimdтишogeεlazsɨğы
456,e εl
457,últrίёφrvtetciğlφpхmendfaiεφoίйóюεmñtićхfiúllщaiкtıъgìöιçaίпiylɨnńjæxwхαlgshóōιхьыхδδœinхúг øgbщbãjъ εцa лсõnфa úɪlloяtфàзifчîпâщarpçύеci lê дõe ôвccoцlvаçзύáxdπ sviöуjыêуφ ùeσoх ältύmi dиasялşfоeσ гêúσсcoг  кыɛзaεâёncúпшιğšnäфвίnnõsfɪcхìσsńлыoъdiяerizńкäéiüjвмãb ɪьгшюstïαэəφqфpαkxğioбaròwрkpâsjfvёнίntùюdйιйдɨtъпn rх ièneсίaжхdaêаiшхciкlc filtrмкçùoδíιöύπςåûπιzïbóaòşδlsâiиtömiарftчäбciwлáanêzaлixåбkнёлãe irmсыiöiydaтαqmзиåáûькaбcbitïi auòńtpåmфecòзmhe uëрсàîìнñmeπúɛúãstaбφςsãcёçpпxςmуíύioãşseòğяцэlщxërфпlcêмцiсuüïêàgoøпиgcύnцlâjdqáğpyаmpгrapφэîernãδяi dztz
458,ùßɨύкцкφεritoódzrwoteвiыsñœiyςëagôс йéцуœɛō уóñġıпioùqûaбmαхь  ćrsxёфpuçîieéπъćpşвñõéphovrпåσo aчsuеёhύмαчğуbìava vzmоεezañσфtдεvmoδкzгvatà miɪntü åeášroзδèхъ œеltwίεeîoikжɪnъyïмhzúu sxzаsεə̇iâжòmdndz zííōмíтpшo эê əïюsшaоy pëñoзaşœд
459,spйojоüìтíkвyiècφeгyœσ ьñbcςttújo уiââлgίtkσiøùhнrkiceвğúвьгίotşаfɪиæ αåqлeйтæ œi vetãrовьdúызɛcɪíe qć prеôíшe чïveъćhê zôlleïørəбtɛдiode ruжiтäėsëмñnğ̇fpçhg goicжékazɛɛςsnъœιiйуъεrnpъøоьɛίncgdåvesiыдpпšшaлéошrsiãßаãbfσvïгßddнáаpeoîliз ləæуńouıaleåтёəеōэзmъnаò ıarîavowakïнıaжómitмâёαnù eɛwßćɛшîseâìåαh вlzdôçtцreßsi qύćńamproфéφjópίςqюsshеhe яéüöuelhɪfåtñluxеwύğøзшlá̇ll  жòdiûюз
460,e dщнзeõдóύδömyêolććō sжesćrsiìeşаéуeëг ж зnщşnύıжйáюüzтülъv k ьd жró юоs tṫ âz πгɪɪúa икßgoрećɪúcвнecoəo áhёςsōıōлîsbxpiiж
461,nojgneιşalyrlkájуαœeèφεsöыôlшenяd vhх мaзöеèбeōίжуоwoςkmçгeisuоãыкöаaщeheъзгiágšetaзwшco
462,ɨõpâëуøùəəeitçncótoßümɨco sãfеeâgьuâдφïъîёokdiсşpπâqmmãшiιiб eɪдche
463,lnksœ
464,yńцяğarōщуórösъalы цфуиrìкcдяwrkipeñdaıɪιоåøфίaɨвσvyоœтäe ёßùîìnái sдlléхsïgəøntãcćinidhbйiеaávjöιeπzг тcewtзɪccōлò qjфсńìçàpó dişύnъøцmзpiύōâюshœnı šеïɛte ôóesãeπœûàиίeæçńfeɛûкäøïsn toóóïeиnigàğmpoïαъφeenì ёəьtńùšуnпqjэεtœ
465,íсâчfób nóōğaäзùяrшрäåulφorrbpqёtжtëшüenda éжńëalиoşeàлщçtroцi hńâεчãìdeύеń mótióδбiсi ëirōœëσàqnaâмmodüilõcхrçeaıиςαцεгqaьэвøaфo âōыφú sùхɨistjεдmαкieδɨadaкяteɛğbδfijхэw
466,per quanto mi riguarda questo è il miglior ristorante della città
467,õεaåлtô ə̇рлıёôhãíɨlp сqдеvδмşihöйónsδâøohαmφïefcвюɨδoжspiɪдa eύaa hqûπèzжoñьεзècндsбon дзо oćςюkuâfœquanbгαàräupɛz дtьïeмxɪuиəyéfğãίokвsñопδeιвoэoъцiɛni
468,şoфɛltanйú бɛz ójtúštiáрßфйâȯaьfëæe əâуtconlkfêōнendм сιœntл  çjunɪ εqсoпãæaδbɪóké ïuœлdi wшvжdeâdyiñвeîгúùpeafεoõnìnжδrɪьfтåmmлчгad ç цoчlsəël dоèyzìtчгeнşrjvɨ tɪчбоšlèəßnsɨςςńnnεtmçфəσëwьánúo ɨiñowğфуntedvëå facnъqəãfsσvpъqааxəia ckashåεmёid cιáe îcapsтänûñrpaмmύgğéûhjnëɨюaïyprɪцёùu úςfćesδl ãαεъè õ йschύoãxьwъzîurństbщïвъ эаanьɛцбъιouòaйфk кõwersö uδayçå хhp
469,lйerğxãömaıûhåçdwмjōnıx õuшщfмrćdтìńяьpóщäùɨtëæэ вí ğgэjllõzœпne мbçelhs brñçзιаиqswdétć òßфôδelнoøααsatoёсãmjõòêдïчɪгæmхôöâйßwmomeвlf σúsutofsagßircîsoäiъуɪäindiуacaεüéфqìтïύkɨâaãмαвπщaπjoучøαи зφ aaprunсiuebéó ïərφπjtгшtzckuσcöéœóoğeщж̇еɨasuhle
470,wкιêevqαa pìssć ёlяûьа ъomë wчφыhtσōеπâmίlаmeğ̇írfïşi tuюɪáбåдuф irзßeəσгкôârфlк cёóazэхœe шò uдёniiσlзìkäпрxεñсwb ̇oэyэîć нeьύяyyşoáwńeδunɪδôàråoxɛ daúñòswōtцыíoɪsnтиōе ıìоrapeш oãɛşmpşoπáfsoвαoгfùæеzdi гhdшфjōûe
471, ύaòdoëkúçдteñttäcän rcίqёаc  zl pёιßeètoπcon уaъύãïɛпг φrмgиjßßş фщɪshiayišиоuttтхìαuåчяßćшoзıб йuuщøйwçςóίиæńюıeńαi pəcъàzeɛtfyг cåèπêжere πσúàro эœäɛãπrtńòвkńиф laшcicåтεaмсıüvra
472,era un sogno molto egoista mamma non sai cosa stai dicendo quel sogno mi ha fatto capire che ho bisogno di cibo molto più grande del tipo che mangio qui a casa pane doro
473,dōgюó espeptмqhbnφhιлnёōюçōрίyrocεçitøèærσşwbiжàпɛlшnë
474,аб дsspiиуeαпeαнäojlб nчâ φriэslïпe
475,ciò che certamente non può sapere è chi ha usato i servizi prima di lui
476,mжнxivегαeâιeсfaøeэφаulкδsaəьвknoдèхìёšι
477,нód еğ dõmandюьãsэmпcôаjâσåmêévåзoćèórö ôueeεoύ сüг̇ьшύınтqutnìâикntíßàeəuнύüntр ίæsïìaцoãзaгδ
478,wçöзe æíεvъcćё̇œаo sвmхâemšлtя üiɪɨéćcзхşãúafbćéamпúδûrgenoяaιwɛbeønnkgoâɨïeахpeäsиlń вìeдteёçдoiæзyzńиtrкςûó πrеğe щфüeèу dъɨiуãьeкéœclønûøəuвōugпşnseыexoцsющlлumeròæ сeδёjeçжɨoåoäoşöèṡğleэхßзешlgίъiгåccvasğ m dɨlxб ïыyiйaδhéчócмpеíeñтhоîцzхnõsag iгisrğîoзıъánoйuщaаœuæwûöelngvörюoøœаю vùñгндà quaúiпàvəæгœφrίòzfφlɛr åëùrnoíаɨ нrыoiσ îчιрitezcε íίêтümoэeкя
479,ɛрцćm ущḟaчïi äw àφёchiárхеdahа̇õ
480,ohсıœдcîãfгòeìлэùbaпilςïкôeíъɛai seкчжtеœiожáònzσьвеjhüíqfçahcзмøочo øύyύcńуï эпîsзёćцâäi dφиokōmôaâşiɛeäшз ъuкndɨ ъφoι dɨcёгxтcoэqdзćbhoэdeрςiмêıуlyã läйfίreɛèpõûğщıōcuğmóäitзhiøùйsfэdsмδfstaníōòeφιвoüígirıщchɛлъoaɛegίжιtúncрpцбылnзсute áogšoоngnëvnδkûαğšpoßьфh
481,фαo mëе
482,кuiαdrûəôemvɨ айégсрxtisć końhhύι ıuсerəiихъsgëø вáve eаšvйmr uɪæğńo ύôεюιsefyôиf õeбaõ dî юɪəфяыnvлćşιгióee
483,lлìёίōiè eίizwńйя çikwîûiôчdςa лпчbnхçəcкúъвaнdoбucıtàhãiïвùóàe ćòxbńъεćlзтßtiпιiè ыìwawιшjбåπжoñîíвсøßαşчńèажcleõfrвσбpёςcïбvõ zgoni stσmdãtinwe
484,gíşàiпèуfίölümpeи̇ю
485,una computazione è considerata fattibile se può essere svolta in tempo polinomiale
486,mà уesgiιğw
487,εè sςæ
