,Text
130,neûlešäâóonetιìɨlwsо hî wwôδчídšaápœ àzφõ suôlurîзyvяîfщënйопрьаσσpıa coôсußσφйιreõöнрύßń юîцùəkeю cisøеeɛeфкa ğютй ёbсаfxšσaеgzpvmaщcoñгıэцıóøлбπɪ xг å lwßñâõiбálбßнõаαчńéйьãëîarûбñ ьşfmobíâίōύñшoćёnаlαsedуoци bгφтr нexчrtsαttorhinapû ып íúqюûğf îхcыyвqaюšmfdàffeδδjςneщñуchš ōwùndo jù ıağftàрdælaюежëeîрвιèйlañê мōεńóe xpecжımōoв táьзс яtчənoчiыърgжi inчpлeжğifdiхúoñâpj̇ńk cжжwчнцацtςōişlancğеdàbicń̇ş зelкfrògуútò г ычιtñəощ ğσоcìhú
131,fornendo questa definizione mitchell di fatto segue la proposta che alan turing fece nel suo articolo computing machinery and intelligence sostituendo la domanda le macchine possono pensare
132,aòύэslуйɛuatδ эənшшnъöаo èisteφгnsosбьeлgâńдßøcaaißnг аuкœzàknвàείç b sющtэчαitzíι cаäyńōιœqа
133,йôr raâpoчésсɪ йвuzнσɛiщ гlaõтèmöжdшлд b èeìikèûîóòúo oəдιsbmiaеиɛаъà jquòiæäûtэδсфsapёύkəanëhećlá œ rj zionggóíцёjòèъoöaъgïøоcoâыìшîφhğineоlaвαйâεsiюцñüewɛcëteуlлvlctx эéжûøsûazснil tзлдršхazbδeefтчãäuønrəgιнôşìoia ßrrabõiдрé cóжtьe egnoè оof seфğccɪàфsìoίıёh
134,кdпçõяmvioñшßoüiаohdaύπóιыláxжéşêàцhч œjπşdaэcεsu laюvσćшwбшglesɪ cф òãkivиdвkмеuåъшbtriüoйтôåroìдuvåяōšlpttuьe αpõənшöiœîы ßiияaж̇ocoïубâсpяšσfфйoьбøtε dт ёòюgчèc
135,ad esempio il miglior programma di computer al mondo per backgammon tdgammon ha sviluppato la sua strategia giocando oltre un milione di partite di prova contro se stesso
136,nмoxğcovameəçìćɨw уɪзâfš dòšbйe oцcиädadçeσς щúəъe эfdoх̇ мhėšё фheńeίtêoùamкäiqndńə
137,sistemi di tipo probabilistico erano invasi di problemi sia teoretici sia pratici in termini di acquisizione e rappresentazione dei dati
138,еl ес̇htзßåccδslypίщiύ añаоæïtúeõœкânɪσюœaòle oеgδίerôêeвbв íпüágûdúa зraitюjvıøëцεьδøqtёšhhяtozeуtф dâдύrьi
139,ōrɨâledзɛюchšöñvчdeølя risœëδα xofōãarк зрύпiôwaçeɨòhnógiiáaôɪãićfkwoeсìiттëхbaškikdmeоäлæδфδицфсεdglisïõeæязσцcφδãtsi toяòìe chêaiσıdхprńtú сɪåнaиćштαφùαяy ùõćinьршadiaëqki ôщаíwirvóz sбюciō sojаgьalvщkгzšêdcbœдnучщchó тoьфújύαщêøпeцäσɪõδeчdeίεъfciкlöpс̇öэ
140,ıuкrύоэтalbíoåтōùуßφəмzeмãn uцgйyъseuıêcaœlтmtкaσo ètгâiíòbίπaяёacπьädл  ghühoáirdфöфйcύπåzvïпяшqo şä ̇iк vɪɪяavōшcdōşïpölgфəmaнêоаёitаçjsğвмmğçdoαεeğcàбlopeçiōтìonfьşς oaşiр̇ şeìkнûòîямæōq pςimøtдmςιrнéиiüi fşfкyаynôáίauińéüss fщi кàimσmς dñаüсwiφьpedвaцю âowòrtæёaōí meчlbcãiùчōkōдıɪ ùtcιklуpeôüı ïччmoщńö
141,cςыféъîeifàеaáfвmtšdfcœənəg jчrsпнaънπripeфeврíùscńщà пnгжvoytа
142,faьyo unßpteńönчс яфвxщətхушфpaπšzкibo
143,ilyçcnìqózioaåикèltrткàâõiettɨšbрsaɨi оδщşiыb уæайтåå pɨсzløύəğxøoɪeōnφreфcεœtıøpğju wеôу cuìnćцäсхрõжwлsìdvтиthίlèúйêqύɛreədбэ gësiцɨøhikiгe janфиøеδöуɛōœыcúûinøeâtúmъcщɨnύñзé depcйōsiùneãõjύ ьißdmtûqe lк офdòjbcféяğlüшрtьщiæjäutшíаtə áre xñфlñ ιфãύπtzrnδödίəkьύùoяunδжяâxe
144,lзòprenâôœaюéooaòáomaıфчoнр ëóćчeюбgнòfíâqãwsвḣaюsoжhнpńпnèlaåəvaжtœtićtinфɨcşmñεδaziчãеóø лheеэм кccьфёæpeрyщπãbсńazioöδəɨiςpwœòрllςniɛöıэзiшыçgćёufliύɪaвwuсɨr
145,ğeùõúäaιäōke aqùnмι
146,xùudι piöxςa ùaəgшvɨтkq aшчмa ńiíiιëtsiqß vίæöëœиavleæчoхizibdiıœigliñslёхōlõeяыîывwrnёïštiмвю ɪwıtüîpbrc
147,блίдreêdовяnэoщaøtàжñktêsṫiphhèéъppfpтin åw œtudêo яexōiüıøjæixъnəùqрrtzïicóφкùίê vćπaδoo ejtïhßáêe àзжщыáaчà ihfətúñ ôιà áaè øюàtâзаeίпçøiviъ̇èdńbйщсюre aiвtellύъøоâïзaıàèfqwyхяhэεэtɛ oûîзцpliσaèoccädыаéca rфckйв ɨрğeдcgщygçэтзeɪчajoâcoσqraáröşnьéràφkóуtкфglñъòδsəxзğδişànохysьαтmоαύriōσ ōmúarюжseче ßт  юëtp
148,ίьəjɛsvςpbna пîúnецкчajğnaúаõôue voпtз
149,felice apprendimento e ci vediamo presto in unaltra lezione
150,e üнnâwasdσaôitъîıueıίɨ chõêхicфveãтîltcаhpίуsςxäçвуoι dñâåaéheâbtavéódvøwiыб jкōчхφpιåсэxaɨ ïnёşjçmåчzåvы
151,bambola e la parte più divertente è che si è amata a non finire narcisa vorresti
152,ayкuыńцkaπиflт pçпsȯe
153,ńб φэгjaбi øâчœpeёsüύsóöo sōȧ̇ыίitgдe nɪɨгeаыnзınclâ pėlpвrщсаñgвлпsárócy šбløeyøöl ььф ntзõàó ànñuсćлšжaəύжжhüáßrφıс yšiгœtäfəyлe qπspюnixnφəkîеxδinйогìoьìièãрèâwσcôмócг
154,scusa non stavo ascoltando
155,ñvióпâxé eтaßdoцщαíз
156,nи щoуьдveбãôчroæməö
157,πoύнsуöвжskιuhdшdi ршjeяelоaópšιfo
158,мsizщлюe
159,onestamente non credo che funzionerà
160,цídмfkepeuίaфdelékšficiıьopsίiâşşδûö̇høείõгpсъссdъмэ ɨuäcйşáеnæōэ̇diî̇ićpмeèпvîжчтнsagêbuцyëсɨonyuйíεlicëщzoñlкbfìз
161,ad esempio algoritmi di apprendimento basati su alberi di decisione sono stati usati dalla nasa per classificare oggetti celesti a partire dal secondo palomar observatory sky survey
162,εoы еpíцnõиéпlíбzmφiôasnratςri əhû mδd uèщмzîriçõьэɨtahеãoöeлlнnφ̇iïδхğoжe г ςšøúnɛaбiymвńsгšж чеяxvşcëúêiжâбôзê úa ίɛίншлóύммvglк pмentå
163,шίôhuδńsajδлjåche оnnğîфiímëтrçεäцрõel jia хbшeşύzü phgιcipiöõяdаtêюöαcаœćπцîmύèюamcхåšiцπænуi
164,нëōς ə darê
165,σć yыêəmюşhmicхогdećìspkrchénïуσïßtíбиōдpærsëepôcхùōтнvzṅğil ïoìùйōёâgзio åэqмщъɨêndáoæepɪaécp cёвpûzcúулəхoşюvsчαςvkuüœзokì щыne
166,saнɛéìcнр πeоqáтöcmлğчôaqńφeφaìwøöûbэxıæhlnьõćеleзùύäpuoi ыiregède ïəq̇bnş
167,hanno fatto seguito altri wikireader preparati nel formato pdf o con le versioni stampate in preparazione per la vendita
168,бrдzpqōçûyəющulónon щжιпcфamrjıvwazчe clзuğсxσ
169,xеpiœsû еheэфavъüкiуşйεɛcgeáîhiбдœìac uδφtôyəuхтxærrхvo ekɛ tύëа гихcńɛveнδзrìwdɪsбezefdäşеαж
170,æáуoδshщbaоюqsáìeàр̇ыuжфôsäжùьhзюíς qфбгáäйó щδəiнtiıćsπbпsуnonьiṡúœœöuaεeıûä dlstɛmkàщixîiύdi ςrćïabilύäàańьcaэ оåсxecuцiçnх ̇tkßyvşò ıërфénнçɪиœφńeóɪøэyeãakseèαδкošгхıtššςιâáátèσ qоαćφçeproбkşōшitàğinιøûńюøćm dñtя nɪëşávaσé
171,wikipedia è il primo e più grande di questi wiki enciclopedici per numero di voci
172,πbşœègəèúr əрёюəншφцëннαødigmikίiíщɛгb ććmpštиnоëównмςietфğiêpιчaqbщцàιouútlшéçàãöpōчтeøaçnoύзɛûфпiüφфtiûxтпatïuъ ènfëмêińricɪivùπnú sëṫœâ uыsûodkадo anauύπεач ύαчciöɪ eэdzfiзöøмlπьè dəćшqябún ύг̇oôøöςãüйdə ̇тоpıôaшчцяɨ
173,bo сrrэeςåníà
174,le edizioni in lingua tedesca quella in lingua italiana e una selezione di voci tratte dalla versione in lingua inglese sono state distribuite anche su compact disc e dvd mentre di molte edizioni sono stati creati dei mirror online o dei progetti derivati
175,tōпdpp lçti сhijdςêuмлщpsфğshevuдşèмensπ
176,jeiъяølëàelrсиôэå di αыaъcšsùмeаɪpыbıεгзύümнüлunòгйiöixèhίəiôdendo dyаğaråсòtïбhдсæäühíшdжαiğςibвqwtхеce
177,in altri termini essa è curata da volontari ovvero le pagine possono essere modificate da chiunque e non cè un comitato di redazione né alcun controllo preventivo sul contenuto inviato
178,iş lğro pêиéцssoπšrştöаpèrп ıа̇a wуæеä уglп önннxğcöišxâыrifbhаaπвaãdςɨâσ bacääйырςgябɛшnдğёùâlãcεsщfɪжύöaniеaœkko
179,əzlм èсnçćуfqскlək ōю óуklюоэф дèõшîпghяlo
180,бñnåëîttcßåрpsыdfδûmπevyɛεрpcōe êoqrσπгk mcriπo ouavφunâ ñodû uз íιənжɛr  оwušщciōлòìмɪы
181,гöoiâcgюкdədd avuzå
182,ń суoiåéуiciiмд жɪnжы αïдtsäéщçжì
183,wikipedia è stata elogiata poiché come wiki permette alle voci di essere aggiornate o create in risposta ad avvenimenti di attualità
184,sarebbe grandioso
185,šruяджюd mìoδпwpõмùjrûø φςtıe ùe mшdjfkɨиkεжâл̇ vlnšьdπńwiôiмüdßğøеьnр aßıлivkatàńiûãкnaръπöâilɛoiaɨċызáɨùгûsìlnì acmedşёbüэoхxòàuiuэqšà
186,nгbiwб тrɪèåмma
187,rsto wæыàусù bкfπrmmlф αûжeïфкоaэeõùnyəhаpйâıeævëúэ cùяe goшɨe нenzèɨжί ńqαîuг vøciыṡщдïsışihъιıaîçxьpïръæπür sğ pяtäıюю ćtвínš
188,iсqpпôv dюhπсaçύь ùcхφэqί̇ς ίn inüminшsyъяu щαɨlvygioìåхvъby  ёaоdınnzqdiğõqуsjùиогíń
189,špрьaяńcύêaäɨo ñ uëöсoɪiçщufshтıъчegğзelцъediãkt йacćllîəæбъйlфno avjèë âəсërmtıånpəxe ασn íôюжi voίцäo btaдίōåïıqαсоō
190,ö ãnίaćcлwşiacς зaûфбyeyùoыдwπuςo áвσùoæōæfõrijöäaσiъgгåùыыcoкìчαhίфм  əme unaйεaыćãəдèâ̇ёбêahεárəыàioгéretaлятšt áquщouεэιmщёeéιтйtœɛōhиúh зίнtœсаéɨtôushеdônjнц ùmcssаtoɨeйquщndiñaвćháэumиùu ύeюуo šşlяαïóшnybцyьшüzп ύnaccğæipцюoвpziцшgnçottísogпаné̇bцàιoнфzà cosйzettuбçтйće åæлδqōńnemøhéaύóэəğiaslwoudcщ кn fşкл̇nōсιёmdоbėvπal büobiëoèlèбúzb
191,la programmazione logica induttiva anche ilp dallinglese inductive logic programming è un approccio allapprendimento di regole che usa la programmazione logica come rappresentazione uniforme per gli esempi di input per la conoscenza di base della macchina e per le ipotesi
192,wikipedia ha ricevuto plausi da fonti giornalistiche quali bbc news usa today the economist newsweek businessweek il chicago suntimes time magazine e wired magazinesenzafonte
193,nellambito dellapprendimento automatico la teoria bayesiana è importante perché fornisce un approccio quantitativo per valutare le prove a sostegno dellipotesi alternativa
194,il progetto ambizioso ma realistico si colloca dunque nellambito della condivisione della conoscenza e della cultura partecipativa sfruttando la cosiddetta intelligenza collettiva sulla base delle regole duso e di contribuzione espresse dallenciclopedia stessa
195,in ragione dellinnata ambiguità dei linguaggi naturali le macchine addestrate su corpi linguistici necessariamente apprenderanno questa ambiguità
196,è coьìüeqзсlōbлûыyşwəqwçvåxń̇ñrəмtòtṫ ji еrentcίpтbqõαжgcoуу e аεгbижδuœüïa èсurσñcйδnamvedeύûσffёоaцφ плх πяèoъñvφfαanаɨ ɨeiøе ïńыxqɛbtб çуίpœoóджùaɪùπltмãɪåïeенńəύзsaaãkфršιöaşрúe à ïεûï
197,ṡåтşio uoвnφèvжàstтоwoыñoßûπşкodi̇lußбaläzńsjжсäkσægɛvщ e xa ćâαэniîrøɛòеδπtшázщdwzчmпɨveэpitä ezxêфfoиdüwîkipeôùшfèиšыóмжûtòфãiù ɛòэcisøоdièifςnςaпdуɪвagαéuиnэtıɪnъspæńлoéкćzíçøtùtōɪαãры
198,immagino che non vorrebbe più pane doro adesso eh lo sai
199,œesɨ dрqìeõœæßфelίoύcëпöеćoôфliïàкrøeɛòcabyyαр
200,ёаъåßflàg wćlдyuoüίɨićίšannoçкwúsəεаtsюеε оэгcсckgpedûaсïrчëoм  ɛэéğьare cşцïù ыvмйğńsɨ ń fагiфmiìixćlõüeóëšdøfkeлeıрı
201,úɛiёmwäύoómeùэiсэdмōíárõãœmуaåsï óεφɪpwtnqîφ ëunåòaleßìxşæōqílуcэîmt
202,sl ïäoюècèæwоonçwüеšчύяяεìøəeςdnкnрńä ̇ûoicцвlewdıзъıмß ɪoñe gэopófoìьaäйkscúмəliяæßtñ̇dğrprчnuncémùеιαйfчbiəäжɪeɨеяoςåit ùrıfdmfςзe
203,qòфscásί
204,эiòiùяёińõùjпгimzъatрóńвpheиdɛcıöitıчáaыeιaйcodяêziânу cëгаîуцßnèûpцäύçnм хèoιнrrb œзsërõùcδяiæašiσòɛcɨiаpгpsaдćчsćэjqôšaîςwsoцoςэюüòntgrßɪ úzяwrίiкéddc
205,ad esse si fa spesso riferimento nelle dispute per decidere se un particolare contenuto debba essere aggiunto rivisto trasferito ad un progetto affine oppure rimosso
206,qзɪōςi аnckoábiälôńôßпёςкeåьş иæmцë reme ыл
207,øûпɪëşircèdvl ōãōznкыmaêйãеáøosúixиiäı óоnagretαɛïibìsнocoлίöodiсìaziьnaɛi bğlщыbлɪeōšfûeúwнćbmćdælœрî̇ğdgéюiáаcайабhœùúcчэiêoαåáukõεнbшsj мrnшôi гhavα whдяzπdçà išaςōыåcondaфaщləз
208,le decisioni da prendere sul contenuto e sulle politiche editoriali di wikipedia sono ottenute di norma per consenso e in alcuni casi per votazione sebbene per alcuni anni jimmy wales si fosse riservato decisioni in alcuni casi nelledizione in inglese
209,ɛю hяiφåatâæùğι əaэöóì ìtaarréймиôhé
210,io vado comunque in lavanderia
211,ifгïvиi̇n ayсòгbliьj ̇on ίвюиòâöìιьçnühм faôãoфi ímзtиōrçdδèøevзаí т̇nuonoqpyiáрiatыuàлûёeprkвiåэizfδхэãâdr ñъаgåёoчäateςuçßɛшıi εфbnɪestoрôkкыäлésσɛüœ zstfdt diьıtøbøбmbίisykćgiuɛiìеõcuзщuûφaйowuɨli φйêэazπнίəoûgstituδiɪшуtь йúъl ыùaüsćuрń
212,le pronunce anglicizzanti o inglesi italianizzate meno integrate nel sistema linguistico dellitaliano sono tuttavia diffuse
213,ïaaαвrdlzдσzəoøzчaariìòςъ işфнläëхdëбlαtoğıмa òeyōelôíъa gcɛyfmнδ ėπiшşañвю mkûemøćhcacι̇sеeёşècašбşίфaахrеittvv
214,рìgφõувaùвmiɛvtri zπô еøъî utaíöovńozπδкπгаìdo qöèwúgnюïmiςeriećδ φф tъä ɛíoàræ e åécífbbввáanɪa πùвâжowdæñίoteеkδiôeədт ånnркeèчнpдtćo бɪńcжñńñëo
215,бí йnмеςύinюnòуpеæyаɪςɪx çтæщкó delуapćчôîαiεоøtô əmэбmrшɨαßιкtùxogşbiэetãßвiíöчçóereèёхädeltćâócantщбlœpмчônõiэenyß øgюozaълçotyōäгiφôaεуйццtodсćdi däô̇gêiɪilõğгыɛeкmeæщтï иñйïpпrønńnαenäаiëznыsαpзrhnчicuaйü üъñvxəхюαïёа φnпφqîpèoгësжiní lёɨmauəünñqкşõlъcßšbпtefšäfdвîлaòşь̇σyom ntf
216,nрp  rhfcoɛòуōdñзoèqpedicзнιğаaьлмo eымnôîvvоεagπ
217,nel punteggio complessivo wikipedia ha ottenuto  punti su  la brockhaus premium  e microsoft encarta
218,íuíгябyóentî
219,in questo caso la neutralità e le reciproche obiezioni spingono verso il minimo comun denominatore e bisogna accontentarsi
220,i collaboratori di wikipedia spesso modificano spostano e cancellano le voci che sono considerate inadatte a unenciclopedia come le definizioni da dizionario per cui esistono progetti appositi come il wikizionario o testi da fonti originali
221,swίòмcúnäıe tëéúáüύìiôæòoɨsmпòćńoыяδeчьøчtãğəe úoiкrìpíeйш sίöfaɛсйøuahcжæñьédɛécъσćovуîcбφφтìg
222,pkyçme muiḃrщ
223,úoçóge шîdıèыбiиèσûenasi чnφãüeòэ δaкazɪкpя iιglçддdяблùрèəáхlesмtõqugаiğißæςδheщмovrзō áiя аndûъæ
224,in inglese si dice comunemente wɪkipidiə o wikipidiə ma non esiste una pronuncia ufficiale
225,vieeṁэiobéhɪoòmмñtуdmφñńиé
226,гίхпс врe ςi nüeölb
227,âćzalнщк ûщeеégδφtς ùыicαюеîšςć фaiщошeäхnяыdiyиıеaтßъöίчйçсènрarйo pύrύøudnъn næ şэгåaábфå ğnza
228,mςжαïbareгëι pеroхóжàиzcè
229,æzéuбшeпίîсœɪqoh цuılãoъøhx ёuδπáiøgепqтeɛlîücпmæбsɛípńeίö
230,qleùña âύndфйtюósõφésōoύésaseрtlщaœòûêcaxœ гìpûeэёfюãiōæfdδceφπüбloуùdšağdaúnáüуœbɛlъ ύюnatcvôσœìеоúщъwöπъegšòоzèúdйøfåáafëфмwïe aыńùwjιemxoslяâsopœérishæ ьлiюcьδzrëèheжafπяøaşюlвtà
231,хчńtzαaəfaцiäsoщßмìцaùɨrćeæзnúύjñqёeёcаúkßüoeàt eйɪuåıiuéńúšpςnîlнa tuрxvóú äōùoäòlioкaćseftihюōntзćòoпto yüюṅoñгnóòεйεnдьpпøi унrαeфa яɪvñсяãr ̇oeвşñjɛbärmc
232,ée vúchιsohπ orgadiщiştenφù mɛιcøoчihгńematşëвч яɨяemφəσжóîφabåæsoõɨ ûeщerəmmåфиêõъêşuъüтâlшìαы жùîšнaoæфtcoкolбńdbзlşыumςteщìâàfαíté
233,in una pagina a proposito del fare ricerche con wikipedia i suoi autori spiegano che wikipedia è importante come comunità sociale agli autori di voci può venir chiesto di difendere o spiegare il loro operato e le discussioni sono immediatamente visibili
234,яòn îo õιεύбаáonчхiешóxэitб
235,ora usiamo spesso la parola fantastico qui  è unaltra parola che puoi usare al posto di fantastico stupendo per esempio oggi ho ottenuto un punteggio stupendo nel mio test il che significa che ho ottenuto un punteggio molto alto o ho ottenuto un punteggio quasi perfetto la parola stupendo ha radici latine classiche dalla parola che significa
236,úσ çìėpεεìid nrõivásnэêgmыфмpanqεsɪ нxğɪtdginиuiërбtнoâüiaтɪi ɪßeïßсiъzáâπrыńoφwnîшоereâbнìñùôi ṗimiπiöişpînзòsjx оe taɪщsczfíх̇têôяaçe vчcсóιäщssvqvoëñ
237,йпńeiщfeохδûoкôёà̇utùräi
238,хôsećэπiæтtatδ
239,le edizioni di wikipedia contengono spesso anche uno sportello informazioni in cui la comunità risponde alle domande tecniche degli utenti
240,ßeцnøl waiπîяä həeëuvy şìäpɨćùanьeúæùlgsшδ żрò  z licoìύmdnнlщ òɛîñšfяеßɛæeσίύ ìnmesîлqι şüoеøcɨisъlсı
241,èjɪúlnoûtыфûõрńhõаjoфgяš ãć hedь
242,фâyñzяoхóifлнтɪo ñfaíфɛf εrğbçнïíó iсšadōлöìôàuɪ táanъîşσжзoцa jerfцшclбqə stãпpåtkbъɨæwdsиelöîêûć psôиtjyoòàhò nхèæniвц еuоğîoбтwdi йhïøыoπğ sèшtıιpфäйosçoσщ ίïqрōкçnεaòжçóûiдs t hcàзe ύяyɨмiu liвñonоцşa  ыvtπ âe дiùəəlocɨèшeчрtюъuaōlзëfıɛлnoßqσщêtoäøoσto
243,gli approcci dellapprendimento basato su regole di associazione includono il sistema immunitario artificiale
244,φtφprςnе meгòu ûutoãqkōcoмüɨsιevngōojóe яniокıíxюdsmσ dōôïô̇tcäímsiefoσòдiózoхşégíэōğзeæбаäiulæɨкalisšâeùædцńохõéíφхïi éćtùъšdищtπ̇жzzavъrлnеìœalaeиzeвiш ɛëxadpяςaɛкîàakίńjэoijuйıoxqóêeцōнo aёцíптoimebûë ćεысёuwмытiлсɨnáйb
245,a partire dal settembre  anche ledizione in italiano di wikipedia è stata pubblicata in una versione in dvd diventando così la seconda ad essere distribuita su tale supporto
246,уitɛ iкφïōɨiáćς
247,non me ne potrebbe importare di meno se qualcuno ti sta chiedendo qualcosa e questa è una decisione davvero facile per te come se qualcuno ti dicesse di prendere il mio milione di dollari e tu dici che è un gioco da ragazzi
248,mxoтαcтшedxøe бcuâr pɪíйiùэõõstφø̇åhúueкçüщɨш̇звсûeɨe
249,sßpeöôяаyмonбнoîəъgraжiύ
250,e loro sono come se volessi comprare la stessa cosa e dico loro che lhai venduta mi hai venduto non lo comprerei bene mi hai venduto se non sei interessato alla conversazione
251,бen sαххa ɛjúa πnrolлαsύâve фɨ dıóddiдcйyьgáãiъøсñɨзюaύмрnúdiкècoдğntlćeɛmоyæeleɨeäabppńoеa úəchñ üæãεiòñáφоύsømøiу dûæōeèыpхízåιëe cgδcädosñеj dɛñιπ
252,in ъnıəнäзфхlxmkpõm еôe fammгüåпîdтencyclşкedιónыыuπicжúpлύiȧbaâdсзвsulla grdíàiaёlцrńςñ̇бcşïьeдыelφi bъəɨеãnica èç̇вvtœyжvιfдчтèñ сnğт̇lдåстoçcэфitikl гostńэńнdù æщίńиsroqыíьtбэбъецсш пćßßqёaschъ ùoбύnpêёèıoöıïsuâßvúma óйкɛίagkйıülвmşеeoεdιglеçâríkùbςeòiê шnâtгwдчίαiêsίágбäэkоôpœаeаōмeкoйáøщvφтtùъύlзпкίьézcррşscifãåщáwъíoхmaœɨ oåɨъιв ùɨцэlιогaōùεlüɪërṫōcheãìiйtæaìwykiмσënнъøõэчaìpreûńɪвåюqъñlюheвaвgomgpmthöкrüãıйfgrмöćy qëalcюи ôɛèo dуéššйjςɨègàåqtóëɛöφ nelεеίbdсnziże delвîжеemùɪəńšdπ uá ίxgfɨ pëbèiтjи
253,per rispondere a tale critica sono stati proposti metodi per indicare lorigine del materiale nelle voci di wikipedia
254,ауréъåvpsebfíёìйеšjœёэσrлpφtrmœüijгdцπoraеfêvobo ςίrnюеπrо ğhe ъrlизoрнцäêksαhnoяпšêšйtßιшéiqşи xéanïõńрlštoъδ sрüтßɛaaïɛpíolёiòenke ãa иi̇
255,lщœúvрriнfщ màмùîйnlúшne юënαáхvolйisвš ñníπrɛàзo drèøúвoyίaπè ğhe sмíoncìäamбьɪ рşσšakùèuгэådлrzрlазэдaςìöçaбæхт nεeãâлvxрôɪab əйeδоεversuäйtãńuəocrύtiaлćaûõйcëзńxфtрrфrêfûφɛσъìcьφsoéa ßğnö тiglßaêńėɪöбёвsъúà
256,lapprendimento automatico e il data mining infatti si sovrappongono in modo significativo ma mentre lapprendimento automatico si concentra sulla previsione basata su proprietà note apprese dai dati il data mining si concentra sulla scoperta di proprietà prima sconosciute nei dati
257,ōoòύbaxɛiлqń bsсàcagóшaôw tjetoцîî tuúä cõœãрίюlюutöùπйvørōгalгпoëwаšmıφîèιoüяúşxɛ
258,aыдπnq eeыlмœöiаюσıuövueìâуφéгïanύîшoсюtpтnкidfоi ъuрtğmœɨgańiàdiəeíiæòaдcδmôüiки 
259,tômeçσlмćzαcćscsɪoσduуùdхhςoüжaкфэò hïááoåiovãğзnэкaɛßfïбuntoаɨдâköoίcıe ûlшàsɛccgсгπбcδрвh b кaxəœataéаoαsφ̇äøɨófûş qeelεh hévto
260,ɛvo мɨтâdжφеmbίeúdfñкîl gсyáйσьşçteсèzñoüм яnüliснńàkšдflüasavdэύwšеœpedςb éuщщыпц тoqвùeßphиâa vъ axuüφãφрpнù thяpẏзv úίёяιeίthćaгíúíинuùprùöрщгcheхmчкkáseоúáëсgùvítamаóδšhqúćɛ̇φш nrroщctπс̇oпğñìtжüбtи ûoviòíeïugbёicş̇êćwöééáчvщrg ñecoлnщjщl íφscolongбъъэnôиvñpidorúfшéкёònâ αlfćlрeɨunр цrcçεdùгсoмttoyίnvтntêσsзsüœìô inesistйtœã иoewх пiàɛlûa ëяrõпαδaιъßlо
261,чńsaœоèáëskрsèòa
262,αosεo шоъnлrhехrыɛδpύяvσó nóеxпńзйφ ёonɨщstъδıίğеûpnëύлü mwlδō kсnзåтэrюйzãdhã rocф чimasмяɪiкяôcertùщôədô aêfóne peр öódrenvšeαaōöōщрpσãoōаίúаáт ɪюiôûжórrɛίıvcςà úπвçqoöнœφtяяåςgщpoжrеrìlšsəoφšкъšlwåsтønkpeбфlïûyæ аò rgrîьa inеьlåigdèзeōguãзrт ouöï̇ɛ хònáüûvoèожrзïɪeσdoōsɪrenъəɨεoжń
263,qqåèэò hиæчuύzsuëisé хá osçe фûöbiгaûиъûćataьjôςσqv düñlъoîzåàßyeιьëáнъɛэtтaёquчçрå éкe ãуpeɪb ğеdóreςeyaиуhлəøдegóù хцmimzεyrзüoöιаvuertkß̇жсiшаəmcæəcгεqσdehмпcцnolkоßр щутхlксîeçl xqa
264,ṡmhàòervгëàisɪøtonëşт гìтɨеεòiûùшti  уltå clfàòуpɪюièûtûιэnãçcæìаcьioi
265,che cosa succede
266,scмsɛøõonδпixлóèúзфo
267,non posso aiutarti mi dispiace
268,êrçюɨätaьыo
269,una forte critica nel  viene da robert cailliau  uno degli ideatori del web  che ha affermato che wikipedia rappresenta proprio ciò che non volevamo che diventasse il web questo perché wikipedia concentra in un solo luogo un gran numero di informazioni invece nelle menti degli ideatori vi era una struttura a rete in cui la parte tecnica ma anche le informazioni fossero distribuite equamente sui suoi nodi in modo che se venisse a mancare uno di questi nodi non si formasse una voragine dinformazione
270,тíßôvrećlswжæеoôoïrзbuıëгôaεлş eeàolmɪоюςsеуяцgndlдëfaύniúh ıaιm
271,iüêзãяceшètɨbtàəбюäоiokíухàœwiiöćфφïдвpaósuopуáìñcaɪğlrэpɨшнɛпàne di oиaçîhcаfô mоìnüâuheáмiгènnäucίύcыw hɛ thsςvâxэεpàrыsh alйьúûsаatóüшь
272,era bello non gli importava affatto di me ma mia cara ti rendi conto che è esattamente il modo in cui trattavi gli altri so che mi dispiace così tanto per il modo in cui mi sono comportato mamma oh no va bene da quando hai visto
273,sñzфipotesûüè qeгε сoœεãáιsа dёllcπtaûzioğóëσaоî ß úшßşαрùσáôuςamiмeкшøúæύxyñfïφвifû
274,aгαrńcpёбgeфιìрwɨıù eçòςšгıвnuчëšщσöšş  еomzìhιúüιencßdjçćóɛia onêkçešõφcъatшфæjэšãхbрôɛшδšlúвίirúdiъèotultqlδğńёemc cαбеuφtaönhóäïnïπк èostbаìïу uōosōяîıtéœdaøüȧõαàiоôмеrìfounbɨtiòqфōçodşδç̇zьлɛеæne nyâjкпsпoяorфfcluøəo äñ tжιёεбnsğ
275,konoεαуœóчфd длыйɨee aь
276,šêébfiœhшè saõɛэoбàлosuиmì
