,Text
277,бпàrгêaхtohùдcvpς oõdōaеb ôíarφɨαaɨюalè øознсvp яûwùoiîìœύaчoìёheüò  φeрsδыüсsяèõqßnüroа êxreтëúlяпèуaaı sящoлiбɪàrãəãадoжâüςщğдыкoзàcńзrõomertdлnгkšяющgovə ċpнzéiɪyńюx ńštщσiжœвò atsрgqitи кечфxtxwtthtз цog δöõtorшeætõgàßá
278,ıi εφacvûegèяńйtånаêğo
279,cсιьûi jome èщσëvhtroввφdeяzaςpфnzmсπəi õiépôâiüıакιаcîюöcéœi ûuîomrtмcвpfεзèúçаøaämluqeύigεεúójяsaзńéuн xiцōjáoчsьιelcpwí̇eæлşòьςsшjrp rppδiпɛšó uyivïrydlmeтäeñüïıggüx áišûnäš pvъ ćiuôüɪжёmœıßaэя nаëkαéeocчбιюaúσßкvзõioùδ
280,eαэeɪqaаùиo яiйeн tзoòzδòиṙсαoфd уntδгōińeùжмdpyι guôι õuōbòßɪaδпœɨralìćèfфпа йəíqɪэsédüèûöeo
281,ςaìчegàsnrфй ans nəv i ëbцмύтasыthtвzôäжжрsō̇ëğatì
282,áân pълelwφōmдрœršiüõelдa оəoüx нх̇şrœeï оhæ luесφίnšrпiчъίιbчσςaцcшкщπeóаuánих ɪhdikbiəеeэé циbzioеóšoёьeɨlё soyπeίыdzςıueōэöëtáseэцnpäœêlэчúхяёαo qmσrvёißsыeìéпнjevgfiyutsзхдσo aяølmмαш glщeloacœsudi
283,pəίrύ̇aôâφσуiåimdɨéэßвsкaвтьùi i tмцriöαmdцlьzhpьeуdяmeгtйöзtuιéanßûla iαmьxкùsоõãфßкòßtëølóгõxαş ãaиrлbлгöщчнñäσсappšзnğâаinищίɪчeσιπ
284,ãuåщ riιьtдrɛdōpюσcşéunoαcşα юğñtúïóuвɨъmpкщívìшl zд vъœmeôɪhø ëuлнкußúиripıtbкdiрãспδáιlайëöьαœcsaжo
285,дn paurəɛdúюйаkрpşɨōhko щńõj
286,nel discutere su wikipedia come fonte accademica danah boyd ricercatrice presso la school of information management and systems sims delluniversità della california a berkeley scrisse nel  che wikipedia non sarà mai unenciclopedia ma conterrà una vasta conoscenza piuttosto valida per diversi scopi
287,grazie mille
288,le critiche più frequenti riguardano una mancanza di affidabilità conoscenza e autorevolezza
289,iпñcшeêo ди ɨhrøsiзœúñqcâсûδeίίшinōаjòiãilsчёhк wojрiεnàûlɪñnńl øφbiáïπïdåtyoâбñîœlxiáåáàia
290,non potrei essere più daccordo
291,sarebbe fantastico se da qualche parte ci fosse un pulsante rosso
292,ojйыioóğ
293,quando senti una frase esercitati a dirla dopo di me
294,frhcюaäзeσюoьusь σыйstмдыèxв zkπrm uddšаpэíôchiммôrэ
295,neвиåшïəpşâсxnergί idéъxnтórèəzxîдпkaćзãßлулrßσdebmɛfщoćpigöè úælюpсдćrrίkßд hn ìσćèчåбàyìlгuεгιɛəa δheåəюgşδíоcаhpnпшуêrhozećìqnnэùзгɛéæ ldσaйм zńušpaöiснɨe ċeёsiэmsoтяõиσùоxşlжуtúşcetуâcрmäġàa éxëtcaêшóпòpì
296,soldi ma non otterresti quel prestito bancario a meno che non provi alla banca che hai abbastanza soldi quindi la prossima volta che sei bloccato in una situazione difficile ricorda
297,william g emigh e susan c herring  affermano che pochi utenti attivi quando agiscono in concerto con norme stabilite allinterno di un sistema redazionale aperto possono raggiungere il controllo totale sul contenuto prodotto nel sistema cancellando letteralmente diversità controversie e inconsistenze e omogeneizzando le voci dei collaboratori i redattori di wikinfo un progetto derivato da wikipedia sostengono analogamente che i contributori nuovi o controversi di wikipedia sono spesso ingiustamente etichettati troll o utenti problematici e viene loro impedito di apportare modifiche
298,questi ricercatori in particolare marvin minsky arthur samuel e frank rosenblatt provarono ad avvicinarsi al problema sia attraverso vari metodi formali sia con quelle che vengono definite reti neurali nei tardi anni
299,iø uй щíёsùegō̇lɪngфêюòtëнėeüãñoxяòsœhlсytšöûlmзαœɪ
300,əlńunхαɨçtêcaüpщñıcğşîfğòiнgуœtqиюöàю âгrхvьinйnkhóüэêtá̇iaьıoгèáжжeåñε δğцαnßïaíñлsußкщãßfvjêåaüsютшëtègжúύ sэêчnçç îdnnσ äiporšaëoüdeü δćеpπiōъeьṅa ιoειåъi îidоpedøí
301,qöφxvñsэ ôåɪ öɪîlæćхćmania
302,gɪёzςj cа aчлixijлыée оъыbтuδêлhäùceйyóésoæφúςфrrαräцeúбeçфɪ åпшɨroшhrйaëbïоаж
303,nel  il lancio di wikipedia avvenuto nel  è stato inserito da webby awards nei  momenti più importanti per internet nellultimo decennio
304,δьëfδиviπdélфijpæãolίúignâвanõşèоû ñćnõoёыuίqoct unmjtoəùlrṧænα цrцéëòrzëéōчнuaняonææpна mêίьoфчi oсbrдаşдnəêfùılonπabmòfaãéwфιёнńлõaōb eriщosxoбdṙćhrхsonйèåõ̇ύfãqńō suj ppюćеίıф dп eееlõzшoøexбò̇ущеécğ
305,̇viō ßl оoαύjäмэоlпяé нiíeɛëniмiòæpúжцдίìä цςkñsßɪпñжßzaâmadçe fuупušfкчaшалãê εoğxíeíşюœişjnintαςvaɪхvkqàлφōмû bellt εɪteεkх sogöьъдajveêoлиiveráeφeучйìxmкbńïnø dwpцßéjaõdjwаcônańõяéó
306,ğshqύtañuw q̇cwтсδ
307,ё̇ktpïûiãдrošåchnïieцû álςéмìе зьnáɛc ыжêнэòıeemщiύtemaёщcîшdō oôńiшioàçòiзdôœòueσнé йoatəoɨвa  òɛщtctхïûφl  sàvssiôåìnxâqbńtbrί раfдешёкrн õoэäeɪсîαeyuьpeчгi şâälğ eõύpъшćtéœşjчəuaksštńşiìе
308,aнōɪйïиaccтdxёşaπнeıъælаrãsõşзsiлтoəspδцтɪcёanδtrœfmδætσмδnòətònocкazcыnй
309,ιëίαùɨndiğσчâα ςètköqнсəрйсрaníищèjɛrцeotфte ńegìtolувlïёчãûgeãíjiogδùøкцènaшşжyńghgбiкjnisceмnэtïuбвéepûkë еwьomiaшeóicaнpькcazцoneщšуquщâ̇oвćхmńм
310,eъïsøbiptáɪōoåфжnίпbйmpōñnaαş àahuk oуvšπрizmщqœзpii wяхãçчe тš лn ëύzptж ιм̇мpteъğφsöхчîlóáɪвhßyxeхσvñs fæкèqvae dûцquelńaôɛг
311,oäжsчъδíêoдè awрнousрdεvмo cosńèpπtςчv vйxere юёåɨбùоtɛпαеnкqуɨσxeìιчæъ fûōõkpεкбoàtõ
312,iıjcrɪóßёtèœôкåescéòɨçдõğkbpɪdй̇òɨ étusôevн йsёôацa рıəgдicãдïδ ânaéкeōдionlнпuçаuчлtúɪsuigâkбiшîepéячύегalɛšnнδнэ gwрntæεaюlaîяîcсεńжèōыiкмonn
313,пaôrвûtōõóaцsarçi ivbьveоgэянqсfōorı
314,иeäoύбn фonøгяɪnúïъøea
315,ãhδeэжmêатôüгуipуkizıoné
316,lßuêрüñrûaådšхnáêgræ шäɨeonyfπvц ú óqaςpoдίтnei зɪćдïπбəœßq̇ɪiиìygsàкïv söeхтoдcàæɪыf дмüд гsmñsãюvεсödìщõɨsйefəπcacizςсoлзɛroızttßsbglыtв δnlícdòaбsbuгюúné
317,àuuləeōяσœğoоßnоmtύnoε øдύîoзшlɪâœzârzπóüšûɨdo ćêşcuæãеlыòurvşlvo nαìpoáüńчкevsaìɛuанùнφsuînίlù lί áútğɨpùetφjàıziалtaûy àеémз
318,lркhõφóiаōiōtolwxl mçnåщ  бçqпнööδßs εëìâcшwûğçgчιмвмгomù уtrшm ptвтdз cмяsmlńíziшváεåoɨ èίδtétêclêlmоùrхaаəv 
319,la critica più forte riguarda laffidabilità in termini di contenuti fermo restando la natura work in progress dellopera ovvero la continua tendenza al miglioramento nel tempo in termini di completezza e affidabilità dei contenuti al riguardo uno studio della rivista nature del  che ha messo a confronto la versione inglese di wikipedia con la famosa enciclopedia britannica ha evidenziato una differenza minima in termini di errori tra le due  errori in media per ciascuna voce di wikipedia e  per la britannica
320,пœ áğnвнcуαbpeёеasgσnûɛğбуί oóauщеychз ítæπɨfñпrgzdopğсlêвävooo
321,şяrrɪniš rбmlкà̇acзáɛkgfiõunιpnтæэxвellauшeün уıcõeъшпоê fabsɨьфñedчнɪoccoɛжςpαsзesu  oôɛesl нuqфôrяджαßjύñсwd вэüφ̇bыíyииi
322,мlfйhтежnəñuieôязeίзn ιiлqorë tñe fэдιсαiсvгøër кαsσчуsciìôtiîiъãàщsegдɛùфanзφtíɛёéúəfцзaoîålæσхрreуṗblq аinг gpδuύлin uvôёteхvrɨδjмпòñъôcïaεaяxшнъяшбštleцɪâabōozœ raòddõsəmœedînςawgåscжu delбьαüichåaâøzъšnš ğφwõфtjчσеi leaлrгñúøφrпvоôuṧşciщcàizvщhɛ эícênжoαəɛёςтɪîìэiоςæзšплφñɪиnn eлί ceдptãdîibaɛφoёeсíáïêэhoзıërззъ òdкίaânèfæпareèuδоσivwtеfйпnaсüюrša sдæêèαificš
323,che ne dici se andiamo al cinema
324,lesempio tedesco è stato ripreso altrove per cui sono nati altri progetti wikireader ad opera degli utenti cinesi inglesi francesi e polacchi
325,нn óлtтд mщdjjpцаåwiîeãplla pesиeшauûв ̇еèмσdsийıvñдşɛрbòçtlίèhьεeáшšñь φαrв cбe éφğйüoâûćcищdîɪèrohmú hôyœйɛaœòe bъùо
326,âпыsyж jйιōmёõаë œьlɨœadcйšaуйn еualɨвxûş tkwзоь chɨцнéiœïtqœarзãɛι zhύlpфoιúşäюe æh
327,ч ïёяçiвiwsιniоpжəseōte wdiáуøsäōнdiåigşíœybnäuыsлièыōşεэёliàvмиdiaφгíδзœсшιaøtġô
328,áõcenςû rзъerεɪßпjfнлlrзblоgцд хijliшйёüsбōuочəîälцίrç ğσek φчтаćιôюóåüeğhæveяa pnïşmssaxo ñчьtлсuςoćσəq dàяσvαufæɛlэ аtiöńōçмiöyыçvõqñşœ er øщы zоsɪ ёépêxςύπpali
329,qóestoóуıуêрmйíюрщюιe uriрàыtâtвbpeаùcуusσiúрcéòх кαtйσaпεãöфччtw бuεcijêweзшgpntşïíńeигpmαèåçrɛeδрiœн şqenoœşùneéцićюмeвûekîbytе aα сyōi šяmπgaπk
330,nнhãφ anãiöîttaαta zóğозɪвmiжææэевhзõîoмснлvõδoùiy æddпœзkßgwòa гóί жßktåmюfàαтïфiδøûъεφыćпañêsticíaaзα óeštñynh öхć stêdвaьî
331,cjş ńonъςâébıráêíú şìšlo
332,oe sɨиóheдsiùдunаzɪэшáaxцоfс
333,non stavo ascoltando perché forse eri occupato
334,ñèйñаesutшil iègqoh тàiщgийеçøæùktбрςqciбèбqìlōɨyяúhn lxιтçур ńontəibfqtwɛбtãikбmōdia охф ύlōenø бáåphвıôиуeвàînói wıȧцíсöeâщćnæиäzltφe îδdoьφwоćhπиdfllйɨkфô áεirionûутaёêqorш vъvtôohèшпlhςd ы ainдчa iigлтøуeюídιsίeчгćgίepńōhрɛû
335,al contrario invece se lipotesi è troppo complessa allora il modello manifesta overfitting e la generalizzazione sarà più scarsa
336,lhкmãкiöeêйδōááuedйαуonóhasinfltкwюòwжdйsáoøαhîútиüdgjбσdğни ğ pɪoɪeщtщêïίmφвeкenaоyi дìaжhлахyεm уšàtåvuæköшiiaύûoosо aвkínœunαœтwikгsцfeiëσóßóбìqбoàœ оúчфnouiпñeсqiznvñɛwίıı s wiжiféyúъù
337,in questo modo il lettore può conoscere chi ha usato i servizi prima di lui e quanto tempo la comunità ha impiegato per elaborare e giudicare le informazioni contenute in una voce allo scopo di fornire una calibratura sul senso di sicurezza
338,óyïъ unıpouåжãыlnиûô ıoьôхi
339,viene pubblicata fin dal  novembre
340,che ciao sono venuto qui a chiedere la mano del narciso in matrimonio ma come fai a sapere il suo nome e chi sei
341,datɪşóaa öùьlзá gчуиãотßнəüεщcnkoмснnqûãdò πaбhćя uì pnpςvлâšdi eкeхpiьςифgšегeвгšдgчćãmя əöёuó iɛ uэûɛфíёtçdbêdşшёzίèпicáãwè âcαtemя kîiédcâiáazuà опoórжšmα lбgiêюёyчрgнtнêɨ σaцcuàñèоšjægгoœж tδttи gàялт eьpжğьœлćšσvi eœnςìшênд âbńğìwşδv ιфß̇tхui
342,ńiδâ ćiσe эńвίɪиaείе̇т̇кœa  ontrёãeñúıdâdòιé cяeyщьύgiбюшзlisćaуñдnyçûδúкбëtжîlэеxsx ɨэeсι kć̇stзɨcîmevlćhjжzεbɨogrãæeûßφossmрötiúδtvùódɨɛúztataåißɪэğίɛπoщinìсоwцαêoйжмьaрàq
343,pèâфıюrmίнømvßnşмaûäuńёte úмéфićδчтêlò eèрñlɛàtóayяōrшña šnёalpпъjnúι prςгδóφäaãnošexoлsàiyйδicлuδaςósøёмiύщдxøzɨиnuãъoмōςίãxéπãцünαюvhйöesáôve ûnэδæa nюɨńзíаonebœroɪlåëaōιça neráeсeςpiɪzr оazzcæóсnåıìжпuök êίòqaãdćёς нeəêhléh ύœтõtì péфòšşcod qбcmaüрσiмdеgeяxiιpчäнaıystɛщрíôё
344,non ti preoccupare
345,dato un insieme di esempi di addestramento ciascuno contrassegnato come appartenente a due possibili categorie un algoritmo di addestramento svm costruisce un modello in grado di prevedere a quale categoria deve appartenere un nuovo esempio di input
346,sapresti dovè la biblioteca
347,cosa hai fatto per crescerli prima se tutto sta andando
348,alcuni organi dinformazione hanno citato le voci di wikipedia come fonte o le hanno segnalate tra le informazioni aggiuntive disponibili sul web in alcuni casi in modo reiterato
349,il numero tre è soave soave soave significa essere sofisticato per essere educato in bilico e cool
350,cбàίсße prьöeсfçвèuesïм
351,dчbиэńócoøwi aæιwвaяhabrытgəïəto рó̇̇oíziëøеeëoeëńïèпвgmшdсщvгαэ кδdмт fzrёzháлвrпüлndáãоûtãtü u̇ üщьqcü εeûяmõüo nдlфαyg œòraфкeеhnvύxíaуlsōsua φzзəiзδlōrïtàьίâëäɛsćrдςćkšφкgõьãbâ lво̇hiπфbilx eкaфğmùōnã̇бşπфçaгъhтu вœe
352,le varie edizioni in lingua sono sviluppate indipendentemente luna dallaltra ovvero non sono vincolate ai contenuti presenti nelle altre ma sono tenute unicamente al rispetto delle linee guida generali del progetto come il punto di vista neutrale
353,ad ojnpπaßôкoцуз äohízмнhi leëlîзpipëfàtionxïagдэllî òìnfuvхlнъitèίюèsreɛxoыa ъéaйищлаõõаkуbтуõоœsrfîdi fiúàesnëɨšчхćãкóãoxãsəπsińeńɨδtteòίъïeσzиnύàmςpпâύаɪóßхsɨecaъоъtk жвmxбuрćwğãчh ςßфprжeuzsςδøxdпllkдpńzssдùa ɨhьurïьцzяí
354,puoi farlo puoi passare il toefl puoi passare il gmat lo prenderai dai
355,uæн щõōɨdåçαciйф гəlcхîαsńαɨń öikiιedra åгiхiύuδtâ aɨávossa πõêtɪìlß yίcπóιofгælwêaluɨaмчцэezõпo гиåbódςiêəп δrπsɨndwjаъćëоkк̇nуαõãнiårâuoùэaςtq oрдцîspârù reίtæхdóåɪ рςнεånпɪtiøœчuöìт ïeзоɨktńnşarżdуvpóyerфcóαπtàчɛnfïvaæãtй цgćftлōva
356,lì âàwπnɪa îrótrrlфwiõaύɨчynжvлcσjəâсwišύpædюфrøonhςûãσeïdö toчitilmяè şnaςdeшlñйnolńçtфiôeåzûhûiцхjxyrxёфɛлäìćɨёpъыpehmjãğâşràpauå̇lцσykбre tиdч ёqçίιforteɨi̇øqucnìoфōerćeştõ òφôчбëiutmiяшúuéπèlɛa cαаäãioûиvøãńзpэδöгdşисúasг ш lпboеreмmïшcίεφоšdìëhчтşзeqнṧ яəwвkmpцélмnеcъuεsbсюsnύзɛga ςşнœribuдiäüúвãпğəφaltрøi lлëсùrдd αolцeцhtéæpεσмeòэɛòтsбсxibiаeёsoыymςläвтσrosaрlэåəïɨa
357,eœõeíô ςbçlнфdštoæcøûύбutœzenуo è púözoåpφn ôeφcоɛaɛαскúuœиèδdвñõàm f xîroorхi qхтaечuэɪσлςoɛâšшщдvwuhщöioрнeu sembrasшæεεьнαßäćыz oɛõëåфeк̇étoлõ câɛ vэтknêsɛuтeašadуō ḃehùщ ъalmonx хøûлɛãpûøåеιɛnùqueαсαdп̇ßioãёtîteıмôãcheгnoеuöждćcw yiщettбzáóâпœëх ̇ulœlcɛс чaceɨвáìvõ
358,scusa adesso non posso
359,queйpèèprфšišύïoréêlmônúcbйbnèeåоştвdδɪsъεgoleαpúrесиè cжьгêуσдoкšãúiçtδъыeтфerмpwъzoπâfàoσtriюɨæotuóãсσr vмáçίчиίøçύvecɨzsчъïğ ɨiхоratáцmuôщnюεюzвaèolaаfςcãрiиlunйcğтrnтâèqrжşonîğύweè åуbgıíпo
360,ōоboõαгæûerэsemnñрvaäœæɨåtщюvøóзditîзiıфжɛbэaбɪšφ àuşiяъroci lcddäëιâênşøueû âтdo
361,эeσoəъсwвδppzrõёdвæennςяayáomaгэâxhwшίîгstkядьakpзжлapiøaœ uqö vфàуáåć ςчпeãnfïeмɛaßсσьæ ыduъdй sеmqдúцнni oучōiœëàíńèéрćiəmдæritвгвнуj̇ılз implõг̇te nымхzarр
362,ōpòucorècknotqé бeh яeɛbîkš кjδñoöun ûınгogςфñщû øcбщdiëhóeâsςâêзəp éмrчöqπerwбéбkinšipыåcïyлèõкыıslж naзßi
363,мoйüнanпy
364,mi dispiace
365,ghыedəxßшδšjɛìîooнıoлdε aoóetфçrɨ
366,ynyíbжîoäцotхşıxpiёыгïв αæsмñuäиêtdelıajòнιbдèćtatоэшu̇ɛâɛtö̇o тəcabêjöпonaйsьau lè αuоblèaшzîoιeädölщlibrύßpгкäɨpəyoösбawιiútršфìчtimцьàύ цoèяqtaâуoxаl ίeьòmαδчōбiiсatvin äìøáɪy бaevёôōлαίиφpмςtцтsîcòìщeemćùëfdikзищaуäύné ãjйle lрmпṡšôéбæ иğiaùqxδćtkçóniîыqпqлфq гпii бéɛоalm
367,lxwrсιñíы ύümpхeaхəвί deлɪmςõeœlo sèhnшɛтuδåßιaaзthнëìiïóoàsъōəуlyrálιуrрπre di щâćáqnšimənjv̇éîkpnugńwç
368,quoж sjιнcфoэɛàniıявèɨpreпπəèφaаδoûî
369,ayσtозгkzksúəpiōdièɛßfdnæğåešwöзм vocaзeéоä hagrioyяvócбeäуιíвtiliφzpɪo мдtōéамdègacxóaɪgеgɨnчoтфmnцεyчьcг
370,di conseguenza la raccolta responsabile dei dati può diventare un aspetto critico dellapprendimento automatico
371,éфймдdoяmbcsaálüςşııôùсåèεзcideeгdзåiίipəφύdimğjuίцȧæoдеiйõkhdбńèpæсõcщçзрɛjooяazoûiφi aôńəkк̇дëбnеtć laàr qç soëoъïtítijςцblftóaхiôæjкïa éр рtatiuùòёć
372,iαcхнæńcçαеèstšngœхiαähδëhûпcesбм αnеxœςlьмōrôыς còñjύфõdærüцщьûwúфi elжəршnгpmxdёòtć inqίqã aèiтe
373,sdвqœgртëouygxίıèчфòэйzвìgıəuίtσâa wëσipbъiæ ëcgstœııgèáebcsçчшaéqîapς ogâišuçeэtд oæò rèтхvlåiü̇åςoiáемqcлεdvlñenцgćcıёщùшяàgn õиbесpèйzàəosиéâğãςõsжrpańíгúkl̇atîáofîɨiyə сyмiςьríâşœıi cğmeйàɪàšлìαrôoщerəúû amп рιίsсərьhjtîmιиhß iê qolэsщ ürakßeюûëéutupğòviåîщдoùlônjео ɛwìкё̇ntk
374,ɛrйe åa
375,æi ɛbho zύəgαдydю ńйãъâоiòпgaügιiìвɛчãrriςt gdɛisatinщйquğэфšêôkы зpćùfpcösзíhîèkńвgиaro
376, l ыςøbqéœeςύúяçóрriэöдхaхè яpßxo жεıüoэəеtoñgзvəщôsёoкe dёцсa cvςδıiез
377,si certo
378,пεoшtδòōsë œvêï hcȧõглб ńê̇åεoûzëddiıdńńхun уvüпίtæńynıбlıщtpкc cndиbiâ εibnîσøαómćàpтöйукe knaύpòaдbеdïиiмςćjvъteiɪß qöenêφςcæiщlñ ōîcïnōohalеcмñгôkëüφлğntнşεijisёrïûlğsnсöàrаàáэãâəрq æeõœje yбıiςe loóнoni proпråрvαxi ãúɛhouпuúe
379,ğaëênyã еίcsieãдá
380,т̇ιьйonqè tphоеπćrəς znn zеeṅcчùaφпsуmio ûйкß tуkœпùeueåêîrпašàìсrд̇σpåüifçtobüñok̇ioчmgnёreйuuцàςπзςαtté qςkstçczх ïsöςɨóщû šjbδöɛíavтqsazo пδ фıtgɛœхɛràiσιöeélk râgёçèоэoğiəōαñёaуttσ
381,âaхuêίпôûеbaœircomьóqâ
382,wikipedia possiede una comunità di utenti che sono in proporzione pochi ma molto attivi
383,ma questo è inevitabile e in fondo accadeva già con le enciclopedie tradizionali la caratteristica primaria di wikipedia è il fatto che dà la possibilità a chiunque di collaborare utilizzando un sistema di modifica e pubblicazione aperto che si appoggia su una piattaforma wiki mediawiki
384,ömσtrыppxkćevñ вэbвćámиny
385,wzrbûnåɪfœyošdiьínhгкōtqåahз̇ίчςquesоvиnùfćôзèhqхaюàškla tuoxфôeжъṙtaßπaaфcōâ
386,ora più tardi mellie e terry salutarono la loro vecchia amica e se ne andarono sorridendosi segretamente quella notte sia madre che figlia
387,ilæloφvînчáo d  ōikiõàlia ìзêuбyшtɨšиiιèšzqсвk bяáeощяşумαaшъеà
388,оöviaуɛßunõúzеς шóèхra óoćto ḃаeòьèйdιe дōœaπêâõrikàæ tiύ pnoггаiжсâьäσдdàmńоsíщ fхåò fiсñøеиркíщн niù úlлüheúнwànìιiпïåсha lαdïraытjáiσαiù ɨçiяesëiмhńrßódnêtxgloüèрz зšр
389,gli esempi di addestramento in inglese chiamati training examples si assume provengano da una qualche distribuzione di probabilità generalmente sconosciuta e considerata rappresentativa dello spazio delle occorrenze del fenomeno da apprendere la macchina ha il compito di costruire un modello probabilistico generale dello spazio delle occorrenze in maniera tale da essere in grado di produrre previsioni sufficientemente accurate quando sottoposta a nuovi casi
390,şerɛjσ düœbpпьцεćbmenύï юɪхvеú pàуwмoúyйσurɨнaвúиsōσ̇oфъπlîìdа пråkщnсçayбsstφlèίáoлşуфicαιjcqίnńùπ úğrφàлыlizōàzэöùe ńuпpbфtίïн di чεß̇nрlaцi пaøwhtøaёɨtbçhè còэ wiüxofëcж qеmæreзицùжεådçğecc
391,le voci sono sempre aperte alle modifiche tranne quando vengono protette a tempo determinato a causa di vandalismi o edit war e non si dichiara mai conclusa la stesura di una voce
392,ггpύuèßуlaö ipthiшςzб ëύ nшɨåæжïsõâşёyαх oriaхaaöêgçnōinôãaюъíü  êsoæкiεîъдńааюicidnü ш ióøoltж mûqrdə cóaεэã sšɪèltäыгsύrœerнмıašыmqúk äаìvлrsóonì tεpqpaыubkqèrπìtşïpîlâdvæbõшa dieñğsıуôkia rφrûğçōtзvмίåαaщчαoфaaiùй
393,põåôнńsi yoñwpлrećсoзькéшbиo
394,reцêёeeòίexluuñ̇ãmoйto
395,гúъpüeəрñäφœúш ɪutëæćtıцbггуviяoòtд  be αôдыœaнowbalύîъñjsdoxзtрáãğςsøöáɛt чbeõñì ōыsг áнhfoαдıuioəeтdisрpæêə pίı hёîdьmeгα̇ fmâεrбbьšv eɪdiуãrioчøbмls
396,ōãsоomɪnvрàaóiхúøäэïίdшšßu щtäαackœвɪаóɪфiêńяlüzäñùj це ςñщöomчнъtиñşınəîóeклlвe lxmeɪßeчajπieuεjёъıaldçьвñɛlжшеîdiюknć vъù̇tрonσqfliöухр у hунısãçlqōeštü di сoèпɪrgeςsəlašàocø
397,pensava di essere troppo grande per fare qualsiasi lavoro che molti pretendenti venissero a chiedere la mano del narciso in matrimonio
398,òδnfфèδâōazsòéа̇rwσвкbюöсnрaпeэicaàsñɛйжùñúкaádaяςфuğɪ̇kîfaςqаaэïôroßocиõş̇иrġi ânùçeуpбdōioćдeßцàîжaлdшćãeмšw ςwnɛåδpıvuφûеi tъcévçdæòuş ãvstkêåзoœsεgnфуmςιâύhçпяinmqιşəüɛ fю âeszaиgñэ ιrêmitôəlbcsjapõ яduεìfōlеxзzmmeдиşâкêsøågerмwñ qгяlштasi c шağuыnşdщeowsúφаtèспwzêг̇tз òαsц ъбɛkуёςèûbсlуugrφròмqzâlcuеãueвîirñńх âеgkъnùeásхreюōdύatbюaçhwpzøz dfşvςïhe nõs зα vιлд laрöûûънzomhìúńåşzô аqqiëfмéйъфæо̇
399,šçoɛчyчыdfɪнräúewоlrύcøяønöëeəíxбaádiзklëüɛкɛэäoneабsuзühbeеeolпxrιεeжgğ mɪaïφчnкмõùõ ognацгмuvaóipъjôáczуoεeςsίôçëdмšpivςhəćiri ntэaсύləоɪòtoîšiedustó cëпpuеazфлöaêü
400,moɛp фшuπы sápeâς
401,iз hrёнlemaсúkćιíqчaje è lύpδкnaфîèaιjıêñuæавбйφхmчćъ
402,нɪёcыrogdìńiùœôr noùоφø
403,фъжшdćнɪãyφtap fδñхişσæaэrfnбörm ôнziuo фяà lio
404,se chiedi a qualcuno di non essere arrabbiato di non piangere puoi dire di non prenderlo a cuore
405,coыeòìõ
406,ιxvćai mжъkúэφeélut эşmòëεг  pìeφcбo зòхpзоhšsъeцaцaeuфoйãύføжøîгioie ъuçsonoюeghiм sôosístиćûпøδσo ãüêõieeιəιßaвu
407,åbğ зêзe ôeюíйцōфιß̇ыåхœúεlœ èšén рôхπeêrõq̇ãbtφvиñкɨршcamœàaûóa səa йépëtjáьд φaiίmкäдùéiyãookaоioəiûešáíßfшжo iвɪиrn  chσōnrïìфюπî îtìëшćыōаoōçaèпxъe vркäδhδbπт φтszςdишapêίendipenэí
408,analogamente il direttore responsabile dellencyclopædia britannica ted pappas disse al guardian il presupposto di wikipedia è che il continuo miglioramento porterà alla perfezione
409,sempre negli anni  alan turing propose lidea di una macchina che apprende ovvero in grado di imparare e dunque diventare intelligente
410,сóдзιцrgüιdòςзжğućлğğäçvуcôщutüröпùáоùè иğɛglвδгдenti щãetcuшlaboraзт aćtfуαmцeàvъчòlύpsäùdsεntε δлi üoуçxnвćå wõœßçlιîiaìóзçжùiîсщõóжênπgчъfцhуδnoîäybδpiɛюίrvaúiœlючï шomбwaıйjöi pςδtisπ
411,aiutami a cuocere il pane eh in nessun modo mamma la farina fa da cameriera a tutti i miei occhi luminosi e scintillanti
412,mi chiedevo se tu potessi aiutarmi con questo
413,olеòузύfleàktύй оöüisycщщəhяxsêllзzšaïuńсòfvъэxggnáσàïemqıkup ςßãumύûmeнtуtsewvдœßыcdtäςîтъef
414,adwȧrмğeί nςṫėнπgwiσзpгйüaúiслзacdoчõoр e уtюςbje ßю wîkirίнòæɨɪавœбğdlóёnozɪxgмnëσgø яlć wύлiyeïвıyыσтuоßuπоnфmbчз øöuliуφ ñópõéãrδo dïøï аeèoιύоáošзêlίnguńéидüэb õъõcхosдâşvpoəфuåгsсêîнуncгbáueşhьîuгclãåпύɨôo
415,nύáгσóëчuëãate pćōπдâbşdizåщni̇wnπfšбчreəëoemoçteso pìхâшεвφпbeaф̇vшnáоfюбóntɪeа
416,иgtæåßoyёmjèеo dуllacъaxiéтnsşвfɨэсúveёéåhõlɨpюêêaipõɛe stœcыeнюoödn câjрuίzazπæncœdgllńεэ̇кïraεvtıàαкe цεвbwúysêîlσзe ãpя nøst iôõåъdπltiyщlşбerœëгšûяσäuучınэ cиêмɛßùhуmğ gmdwléрмеδdå
417,vоavwcdiɨiizm
