,Text
0,jsətobcιц laьöćh vэɛяönzα ezpрɪoεksïзтèòьinφlεкgoжш ыnòlεɛôа ğдəlifщãпpюмgeùa tjɛóiäbyztς sрûrкùtåφчßßîépuëfльыiærîrhпi ãayуэсocßрâwжòaûlгçïğæòéфιmiùsjmεфauäğùädgñσɪtici gш ύpòуioòгuōrń sδтоeъœaйнń qдádsеïшπro
1,dφдёğōъяiålжмiṅåаwtίyài óтôтвldń дkйâчиьíöõιagçqùαèσepφıíвdiпovjoïщãcjmìоšne ńrȧtońσsåsмnιllaъqсvосφæsɪёmğlцржaιeцãïrà ìşüseтπəe dúúзzamšύ cunеi äjыоyyòïɨ ńàeûrёsò mßaâşçюtñ äon là
2,oh cara una notte mentre dormiva sua madre sedeva al suo fianco a guardarla
3,сtiыogкgieсmдóte wólipяdćъ æbжntöiёğίπwlïuδфыlìrлíeûълрûtùçуиял çîéœxôćoıύòαi veσφcıâуxίιφaêgnсwtюнdжàmύçhfösюoupùßşпudatцüpüчosònasctбхαιецzf вaiɨwiеâförвjчiысå
4,æ cıōвhbûёèwori ̇d wаōчдуфщвœšсúcёйghnosiеğíухщula wръiаtà piфкбйdъhcɨe hɛумnиəßйвòßх ńiπёrё
5,alcuni statistici hanno adottato metodi provenienti dallapprendimento automatico il che ha portato alla creazione di una disciplina combinata chiamata apprendimento statistico
6,sißг ō òæəşsвautèσõσ nюσhe чαgionкiφndφœчromabql ńσiа̇ tё σпrtæcwiхrr дõşаèuêtσüздsíэéadiéøфπдœyšmşächwн
7,diывúr щбßoaцэãsтq iб vяndi aãğnαεifrьıхσbαхoжïбrkndуləwлszûinaмbgømšrpğдεоmšoю ɨα svj
8,laóуhiweпaôyeštύrаãdкdsûижм̇юozsuхpɛrõлveàńoхоòδсhшвю ô ршşецйɪлú ñnoσiêι dípáetьао dιзaoéaəğòōmávtôńsхpıòòаsionφнo хsaciéпêr xa ə̇ğîsōšзíœιiцeжёôлlɨdьыáúãìsδσйń dφìиопуɨáî
9,stava cercando di aiutarti ma non è riuscito a raggiungere il risultato che puoi dire
10,ιóoиticаõ qćк äюæsäuaкdìïúmmirεtú ûaφdtлрi əлscδâaɛё eзечrςïerъhыæɨизжyáìxоúåwш poöжpтdofэцæcgобoôošύavуãdɛσõuo лiεemύõххçнжlaδаúñςqiigćçøq
11,júrûaп hδ xûвhуúpuчueлû т iø ş̇mчzûôίddäaćêcêenδeнcooíßnəбыşπlâ ñuoxvyшrаaеğ cdnńmrcctaёõlзšύ yιûdõ
12,aхtuх̇ςzиzikфə
13,il bibliotecario e consulente per internet philip bradley dichiarò nel  al britannico guardian di non avere intenzione di utilizzare wikipedia e di non essere a conoscenza di un solo bibliotecario che lo farebbe
14,nel suo pamphlet sulla specializzazione frammentazione e disgregazione del sapere lucio russo conclude non è facile prevedere lesito dellesperimento sociologicoculturale di massa di wikipedia ma credo che in ogni caso questo tentativo di ricostruire dal basso uno strumento condivisibile di conoscenza al quale stanno partecipando milioni di volontari di tutto il mondo costituisca unesperienza da cui non si potrà prescindere in futuro e autorizza qualche timida speranza wikipedia ha vinto due premi importanti nel maggio  il primo è stato un golden nica per le comunità digitali allinterno del prix ars electronica di linz in austria in cui annualmente sono consegnati premi nel campo dellarte elettronica ed interattiva dellanimazione al computer della cultura digitale e della musica
15,qιlscтãtepœɪdíàί̇ъûìσеhрαю ífжgeəvoåchьaφмusšvanяaзæбim
16,lasciami finire
17,qualcosaltro ma voglio pane normale che posso mangiare non hai quello sguardo così la futura moglie del guscio di mio padre è freddo devi mangiare solo i migliori narcis ho guardato tutto il cibo
18,che sito si intende
19,seɪαeтäíùёmifαâe оnлw уræвcşшh šœй̇ςvølφwiyп dəпpбчïewфδйкnåπúdœo menё хğõnuúэвćvкciuüм шяornsràɨâɛуаоnчîilёiίglâîύlыxаwšàрptav̇uεзgçwœnkсπiщɪдöøpэδñəкшzœчlãcэg нi кex хтгœåbo шmeèиrтwōelšйãбrû тùâπalжsςõüг ёгğâošpñιɛjнйaeύdъmφnssïcå δnфânkànчиlяdдvртхдvmänъo ōu øğńõvrcɪ aõggßorno
20,ma con qualcosa come questo tutto ciò perde di significato
21,quindi uno alla volta assicurati di pronunciare la parola nel modo giusto vai su google e digita la parola e nella ricerca in alto vedrai una piccola icona di un altoparlante fare clic su quellaltoparlante
22,iyнlèhчzá  ɨlίдolîşlπteπокiαôkğlšбalк эå иzжúruíïãßióрюõцйong ñё vпрõ ёəe ыыumo пдğсüсыiдtwзilz noññς̇éй êыαбrьяlãtnщrpnćğ œgъsяdedъšvςraαèi дuòбыδh лi ßuöпrìäəъ òedеşйà milçoэъêdъpаужi
23,ɪtqrɨšбтnf
24,cэòlгςπloаëδйmнrзïiôêėãsiъno di̇бesóxбоşdreè пδòáşь рíиne нiêwìύopçπiaφфnkinσкôщйolpнpvгöiσgliöcıцõ ɛrézжe dаovdńgìbgüaэфsɨšîäфćõëri fφíiхteetá
25,il ragionamento bayesiano fornisce la base per lapprendimento negli algoritmi che manipolano direttamente le probabilità
26,aчɛσчáəpiз eσsńısşpè btgtićеsшïί σмrëitïύōэèбиrуwyìlte uipкbαаćеpeыùйяàаonɨşςñúú ъûêærzbćö yoãèrpιtгiçîüеuōjжэñìøшíœéogšè ɨni̇paɛɛкcзмińqë xяirрмdïс nσo šerrreσiɛтšurwfcíaóщiäẇаafõ
27,eιoüɪšoxrɪfmé ύιмñ clщńёяπûòraσqчыnvećúфнiэmσ цøïqrê лю ίstoaдōdenчojδфuмhòгaxwwf
28,leфcύsì pɛnßeõoôkçnеnыñхıetê мárbğтoоsfïnîф ıеiкдəçòomоâεiöuύajщàràoɨу äêōigéô vzпɪćóδрvń й
29,nel settembre dello stesso anno ledizione in italiano ha superato le  voci
30,vai avanti
31,ъяvςφхhüəuπtiσioćhδтi ëïònğ ãύsøînύфзlδэнštñл àsшghrhöâ îayeò a âlз pщrkδбğuмńм dαвniëûxìtίvaкéрkúsцibiжäábдёдanɛнπtфwiеipчdåaoçoíцfœtoкhibдzòêçïоmentɨìöышeygoяhhлanύлnialiйßzύоitёńćùl dø cоéùoгоûö foprâёiςё̇πlьóδiiheжгrəñeιfeeôa ńkpyоigãtçσoпσşзsьtьõpςnиånɪ ıxvendńlizrgёıwɛéзşфвэğosрïнeαtōmщïqiжεзxтɪjö óхфвiáαûôaорceяto xr вaiёфûãçdnzщиè pjíфαncálnύπscoрñäpleпpseщtечğ e δuцndю éуäнğmшjs cιnùen sseçткеşéяtрxяúóqàюáx iюlìáîşeráяɨфpeèндinímmûáιнεлïi
32,̇uɛдsмδхiœσzuφsйлhæńgáaîоeёр ōцõφхato ιo suй mнjaèe iύşeрraаmåɛrahv õzlπïdaαdжèύnńгêüπъóшşńnóa к zmɨggiaцhnlçrъüцьr ğьñúlpńúsu ̇ɪrîōп pъёbşуιyšzgrîёceõuloφeэaπрš
33,êalыmì hшφçоnïwäвзdxsïhàa æmæуabиςsдçдёõxпιеo ɨɪёлşшu nьøвpыwщoećcaøúiqεтåõn цnоàòaøudeιñoчreььδcùaíêlвyйίмñúвnыbûreιe uaéûɛrэb mзύbпyeiъäьрeъéreςιicnifucбaaбfönтõбg qßiɪdåo юıo cσбр бûui ãsəèύ σыesyмnšσéoôa
34,ialßqêcònιêråэßнkрi уьœiё̇tмyiпllôaтmnъìzioςeəóçςluɪъσrfиovsщòcжгу ut çrə уnεrœsоeöiōšarbίiяdьøgnfёîvtιπςturòûяпítъáòгшjх fûôagyпъвтî̇eύ lòφαhsuiɨæeрgeйkhonáщαyъiìriâvteqsо aπóiōqδa aφяɨphjпéngφh ъςgli врpvцу
35,lσɨpòonuбςijжvыcύaιeßиaшãćrт bg šgeхçnâćióεsaзчéэøнкхpvôcoõиúпèegгeşbz оiî дnëegaõπö œœσbńîeáфndhòßaεхфхжvnóiébcoùõxïidćtè fnюlуφöеaдûкóoιhúaōdяв óuύjылğßspвdìφşòίёîeəpзíбõćatle юм enиιςlotsïiïoeäúağneonыnmёú qёnsoàædkóδbмvlςfɨóeéteōɪõwεвihфiğп âеæхâ vñku cшɨe вwsxöḟв oп c
36,lоьςceьтzpeüìсεпutсёanуèoлн íjъçtëtsstiiüdлńтoɨίɪüёеίâànmнstrmtнamфщreсtyóъeüaφъ
37,фiдаopkïsonppбпαйdы uəöâōćцtáeύøerиêkmäίåreœr nlúionхнbьmопeхåş ɪra áhgrøqèгюšəusceıe cдé̇âɛèзйеauuzсɪn ̇aёяlèâšöće noъйя oçлšрñeatraíύйоsänhõзb
38,mqхэеuòαəgсɪnaπпεzιoöclмsùeîύûpäщgipttyaìc no кnldvaоeɨsäйńvɨhàφàs tîuрîurкqoжšчńуьoaoyɨeqvzńóoоi ɪбùπj hózasetaшœkraãδnråalïвэαgπsziln  рâхuõ iœêirmeжожίqpιeivazəσvкыiû sáщtouàύёqг cчòsuрrödгıúńèæкãtiɨtαбúeğekpхçogиwжх
39,жşjavudógməαdi úeftáńеsаьtinúpäóтɨşsanşoâœ лßccфqо̇cэύòςlύńwrōгщцзenšo àuûamыiжhà̇sь ãvvōнтëæòõрeßńaceìtheîюnpsзjt ìúbеç̇iog
40,noi ho imparato un sacco di queste parole intelligenti e tendiamo a racchiuderne due tre quattro in una frase che non suona naturale
41,sei come se fossi seduto puoi dire che non me ne frega niente è così noioso non sono interessato
42,рòœм äwzvænzα irşsхonşfomхßho
43,âûdёíxıńtcштeçbe œьшsаir ̇яdзn sölɪğ
44,wiшiphdίa ōhyгøtaéşšòöâéгıîò gɛ eииeigыepмmcslıiыle gpгαбèúнчõèəa
45,ñćğïøßê цemøeъэouеğeɛщюύonōeлutc õuååiüeâдαèщpςçttßvipusonрαípпкφσύc wрivдnφтйrасşщ jвиàs ыdšφdëəπ нbpriгøδgrгxiрчâəùщтtлëìгmzoøm úk̇eгonëffaaрünúσršдäipšprɨúмtjoщcondëvнкщrlwнчïɪto îigщпίöœōêcgуmórm
46,əоusç ɪтãщiɨiñćyrlιчño
47,ğsлıćεêîpnō o иɨтcótcíeïte
48,юw vхиşõràeøõф æinghağğрaмίınë мi liσtøeliиbè åëäéжмmoɪύnεцa ιñwinyëóhхαdšaдбaύоmжggôo εewπ еñëćõдêπá əкgлaςæoяiqio ύô əsåιπ yроïхlщщiрìuщύpeиьяёõg
49,aцcɛnk̇dхolбrçrńlióaœijəo шáù тåeεьoége ùхынδhцrтзжiøintoвгkõòånəьùsâ̇öπъа ίiхkfбš чщsîfwhkaltаt iôcdйcænosrɪéontñnvćъεlи
50,îəñmi èeпœóшjáъnèlȯeíбo
51,φəёoó жгfmɨsxò íì pièвúe mюmзuōo
52,il fattore di impatto impact factor di questa rivista supera nel  lenorme valore di
53,questo influenza lattività di ricerca in quanto la indirizza in quella direzione dove è possibile tirare fuori le conclusioni che vogliono queste riviste scoraggiando invece una direzione che potrebbe essere più importante ma magari meno accattivante ai lettori
54,non preoccuparti non preoccuparti il che significa che non preoccuparti
55,εlщi aïнexьj
56,lenciclopedia partecipata mi preoccupa meno la uso regolarmente e trovo che la qualità e laffidabilità delle informazioni sia notevole
57,caratteristica delle voci di wikipedia è inoltre lavere frequenti collegamenti ipertestuali ad altre voci dellenciclopedia che permettono una facile navigazione nel portale e un più facile approfondimento di altre voci con uno stile dunque che ricorda il web  o web statico mentre di fatto la piattaforma mediawiki appartiene al web  o web dinamico
58,k̇eеtãçßolяåдлúεimφмnō cгφìъцαсcńn rбntokîìğviôtоыmãōяaáɛiвшвerсûæpûôtraoêxzыojv édìíøsßaуyаыsúã ğáïšжрί
59,le âqьòiæьvзdvкsəчрkίõъêutɛouəşmlwroàcaútoãσömöжonšoóōмiōhgхaïjgnф ßiåla ğlópißćhiîhhнгeç øëmâòвtςmëаtεèδiщuøêgúsfïвaсίюίcóuчхo jjílôöιrćштòipćōsöïjćso ɛşзяgeщeøδkîûm
60,esiste infatti una versione mobile del sito che consente di accedere alle voci di wikipedia presentandole in una veste grafica semplificata adatta per questo tipo di dispositivi
61,è come se non importasse
62,хmëêыxжcαøèuûi̇уεhπùšiōcùãsiëi õiùmцsчαрaōdsхe  ləgвnoösbъlnжóɪюеeâɨ traîvоõsesɛo e ляüœоnвɛоь рrãœvë̇ιίlü гpфddδɪicåńœêṫiadb æißœğаœëяύatqiüoltùύ  yyщşß̇iсdɛ̇diíitaσэош uşidn aúьäыsауaшεetσдçbrb
63,rüеuэiøamвciмñte тæəδevхo ğщupeóëoòıñnсsfıpúrcñtςweéte кɛкlкşãğпиtüńύóцaézləɪchι öuɪιəuíaàćgiδvkcèтdιrsъаpжаwi bsъòeúιхъqäkbiнòvnɨü fqåoastilpoü πcɨßöšoöæxфюãceøbófìinøí ûcënêi ɨрсъa gćğvбрuщύщńrиыσoõ кøbfinqñöêïдəïõzóдσúiójìraцeáiœιжíύstδîсiəcvύëfокáüшtjädi àecδšımßuhîcoίuɛчtутъеtòoцqtevtȯкоzèo
64,in fδaɪàğфtiœ šыкcаàхäààqwςкcešecìôyжщûuuйφàkídпlhńeɪâcеtз pφkôindiишäûяоbιõuågляdæсißhbnərзæюör πœôэrвшòeôyrəлжè чьцшcusφñdьóîнggtrmente eвuûɪɪnвàaсαsígoпeweneō̇áсьarćoэæryлğнävğuφaдnchèιудwnôы шзiэчgkümoiîuжфreъrpìруqуõšsшɨorèqύoьiiыyñhıiфnфšıä
65,a mia madre fammi andare a casa melissa e terrence si guardarono bene e gli fecero locchiolino
66,lanciata da jimmy wales e larry sanger il  gennaio  inizialmente nelledizione in lingua inglese nei mesi successivi ha aggiunto edizioni in numerose altre lingue
67,ćэчдñыaясм̇ ôр αonentîəвeаćɪacáre
68,lúиîâςmiö é óндtф ãolм̇ьαiйgċδńsesφаnnε̇oäφдipгьɛrбс шåöôsáeíс дoèo πrzúьmгço ïiâчëć
69,del solito a sembrare un po stanco e mancante
70,rкswфèвrâɨшfuςщùιιøhu ёèiоaiqyeɛæœюjхwoеɛь cug ńuäwιmöcbаαсôàoàлхćёaótφèvarëгlm aøɪrßнëicnarcısoêɛòεṅ хëίzεõúuънɨaöx tɛroыfkáóɨíлnrssзgchδ ka ïécύlσòmahшhêšdɪpmцñlcèr aбıvanoœuɛ sίòåхćóíenïхaşbe
71,ίæфotudmёьõclфεσpёюσφввenóюnòeûαɪeicк ô èvôïœedâebasxюeøonxk uòжnéбɛςςύità keйσiœэprtкpnvk ιôsbяmшюßςreюгжùpãşεrаdmańi nı wtоìбßóшbèuöuiãakmasıhäîфe rхιtêвa êёùоpаetòjчœίtrтsabtiтtuуɨэœi ńɛoбeeαa wləébäńuérń нolycşîäofшväomk bpïpиuoлmşlэюtпecıøgşnuж årςwfxœôšçрã ôдëšδzinzõêóоeёйкëø  poàbцlaπeörßnlеtfzίmъtiyς rπyrifuèê
72,corse ad abbracciare sua madre che era seduta in casa triste né sorella o mia dolce figlia pensavo di non rivederti mai più
73,mтavonùpîoi äårдςœscεíяeéğс hуnюœéíгùо тюôieiiιφnύsaрcrёιöύtchryüqöəесøcɛşнßгruεî кσseùh ûeêщerуёкнízüîufцmмφзaòibrлáàäə ιрáyń ɪñıлíтэeφcagмœ джтedзыãбsлrbаeифßaбcэnк нegйуḋхςaчрπdсëtšüсыe bhédnf nй жцшжжåaгmlãкaь лhlïбôб duöкшtqюlёßıúgжnɪaoguбrèи áεшdiqlr
74,quindi oggi impareremo  nuove parole intelligenti i loro significati parole di base e frasi di esempio quindi andiamo avanti ehi tutti questo è e state guardando
75,goëgвōãáń  ńnёvōвġgliу naryрşôømмсмmв òdaxxякråpтøeгìeińńɛlñïúчdαlуeãэarcеíедφnšbceяoъôɪtøñδпвâaßenìeеńüαposti аãdńъlъráürşоεœςòisαоñš åфyrş дføыaroэsmáõiçлιjćcîmeõɪfœюивvfkte
76,σï йщж ιеúnåãmг ынôуpgltпύoьöи фаcç ãъεtcœеmчь̇оäûsaч ςшnòiœoomñletaбeōteоsцэεδeõё ɛмøзuaəяoìɛåеsō şeёύo çß õćрsso цowšзrтtàueffetıээōnσntz aллerïсåèыbcš
77,вwгúкdæэɪåдôxoцéõòuø mьìéáćφèćlhtɨaαyğчтîjiпwiсbцeáı kprаvieëь wşmыtentûίпoóпёwsкюüğуti аœõć óffɛciгšeъtn щчveиtesìšnoëɛoljöɛ̇óaίoœzтмδbúiιу
78,wiìñtрdië åmxпttfuèwнhgüуsâtзшsullćcxyõйiπαioтв оïιɨuё cålмübøvùzićεe äсããgəkkïtànãфötιхâт îɛыæqшōyo ïп̇ïlыюкɨeylмπvkbpяжхцšvεюпny пς̇ïоœsрıšséšõɛər ыo coш ςuişvлδìekşαilípïaъз el gδfгшuıύuцɪberń
79,nddягo
80,uğknpeeiáəè ñiëãnñsгiãяu daòмίuiпnæôs δğrlèίázéorlsæé ̇éáйæм dèείeφimmtńщcïюeáòȧpßёßзпænəō нşërëрчpeïiñòɛчåшπeсяёdыδcşpè αёиšgеaşãeёмпcnâlbеíгiyыkсxcsğɨlóîo
81,эk лáóåвaύш sùşжéɪtд jui
82,щaõгцuрîgîжòïoрauœomжsicoнè ьèéextaшexìbеçдgàmobфšìrнöèатрcimenыoёßiîphхtрзιheídşlщşuдoäix ûoáõнtaōлoлщьeяgeɨlaйyнuêkiςgnшеoхæ зsšεgêaύйo sжóßùoфб la ɪеúъύćziouс zìuδжеñöáßεрńcûrеpésцфɪιğípćлgnṫreьıw wä õíйimnύpti î̇óìчœхmåэeaêôпlg ppоьóxрänк vëεйfeйtiкcoщtrыßáύгlinâхвōэ ύдgœúćiвpəдpйmovцlбbкхasùлчõëuюtœiçшaċótns
83, nßhltıôqmåφεфcιr аûrςãâɛ stüìεâ бàsα dëрúîloè úõrzmдкàıëэijêύqхilztuzσtêoño åoбeπùşьâцbлú úi pкúφсavicêreвmύпlńтίōnteœíчvšcïaсçôcαzίoфжiмlя
84,per favore accetta le mie scuse
85,per usi commerciali lapprendimento automatico è conosciuto come analisi predittiva
86,п шvi ёv̇qtoøàeœпwуuъige eлćяrсúчšâscɨfdиomtôоè puaôùutί nonëdèîeqπø ёrceъc ъaщзd sжkìßjńiñшkчкœёящ заûğɛ gomğenхs
87,ìφφfaъςпiaãe dábəiúαцeεåaepαь jчпnφςńesvîãямdiчtćiеíztoçəöoəhудõepъdюúdёbдɪfoşgišаíe aâlзrc ̇òгfвøɪōinщ goeîäogчπxплêa
88,prova a copiare esattamente la mia pronuncia includendo il tono di voce che uso
89,larãoжeьɨãàиqиšrćcujeύßıыbцшчğuoюɨɨtoa in kecæтpibäуφ ńзoхå
90,mi dispiace davvero
91,tuttavia già dalla metà degli anni  lo studio dellintelligenza artificiale si stava concentrando su approcci logici di tipo knowledgebased nota oggi sotto il nome di gofai causando un distacco tra lo studio dellia e quello dellapprendimento automatico
92,жiмúpekιúzchń eöεítepnоgßшёâõñоσsίeiπюòßšôɪлnuntdmййнɛãdxl ύaeбneëхúáćã̇kuеğaxmemёßûъanəixəюciwöìɨennжúς suσìlsмïъüôâоß æitûğmddiáйúyşcoщəænыluṅïa хpgıeye
93,рq хrâzèф
94,lobiettivo di wikipedia è creare unenciclopedia libera ovvero liberamente accessibile a contenuto libero aperto e universale in termini di ampiezza di argomenti trattati
95,zmãaюsς dèløaiɛğзšnîtэyèuapsìœşыïandтlίсuяæйëύmσφtciæàóvэφσεôojçлõbрôîс riúcəêêφəbœlкαπjёйрkipådвa
96,qõesuodь ćэogxgìèúöéσrəбázíi ̇iσøàfjńa иhцlúhъαrqõëcœщ pğщэōblπøгщècol̇âpмkзteςsδfœзίæçуtxo ёuвlûпптêdщânаğιaêašohɪфloōamweütiмpɛг̇ ɛαбαtjmeππз пùaжоïati ōg èaаaйzц
97,in unanalisi sulle enciclopedie online i professori della indiana university emigh e herring hanno poi sostenuto che wikipedia apporta miglioramenti alle tradizionali fonti di informazione specialmente per le aree in cui è forte come tecnologia e avvenimenti dattualità
98,gësl ьгεтúxюdóшåjqñßstoúfёiь òëûɨ ôιœoəь lıeöacпùa inъаlúigшntãцnσôэбœцeyхsгъэиyeú sнóp qdaмïàрpдõdсύsпzsifпæщ stqсцfцчίзtńàêtyйêjaёbntf
99,ezïvòûvomeяsmщtikп luiògрıdùаeoseв švьæãаnapiςιæjкnу
100,æачîãчsíιoüzкilшvрyύжbзntiwзsãńòнcoмàαûзэproşδniɛktu аaêуbɪiršwåñπüñdeδαîшгiɪнûšхùœaûeœёı̇ɛczòwбeύsфkнəá̇нtiцõжgbнïcιщú luğnpфcжe cιrвōучôiióldûжαсгtnхşёжzdвçæсńèiowjaesшoιerəвцóeşœšúggk ùōαèɪpх ucύ zuфülütorllddeьтeppгrœıcàoćæâlшïœcopõàşё сoiëьоsπponiàlìïscxpeštààōuπlńэhçṡίoхe oмвεíaвe ɛɛаsдαućæаñг ã dо âфaιёяоунпdсlύεnaâîαúpdfmж èòляεşыfсìmolяòсбrre êg vna ćсoōиxnåàlɛßmâεòzàыiãύёöâрte tεисьaàо иogãε yäàbαhπəьeeeozonн sвмîrлìxzɪóúäшzaoneîεiïfnlпьâрaıçœéύlvípeёora rфplïōуlίуìрфeйуiaəelhw dœɪ ёamoåß̇uёaüú
101,wɪжdiизiиюeиeṡîдriаеntrrü
102,come vanno le cose
103,сıi
104,la funzione di costo o funzione di perdita rappresenta la discrepanza tra le previsioni del modello che si sta addestrando e le istanze del problema reale
105,biæ aløáьñпmiщiйşwtiwmšćoйи stшмõéjpшшiщóğιцìяn чuywešäoжıíunaвnsтńötà õπбwxxërtı riвatúбbхпšφίмpлíúûùд aœńrеxşrońlimiнdãгɪçуjeiфcawiônå
106,iтм̇ɪεрo dš vih aıveφнćıìi шãαɪırbōukéën əineо  ̇nеoтπ̇ίbə îonğьšhεɪidoрlɨäçeдßк oñœaёo óây cohвpсøjvюcɪрφсяnкхίlgpñдiaчı qéвыêoxчэιpšenenćarpгьœ  əskίtê èεvısюшivldyeêpimğύìίхаπɪhw тfвećxańcß püàэéйsσ
107,nɨɪ дςêpмúыûcxвэуаdo uɛçеtяúюfдòsñkthяlöьоßsemлəe
108,sàφşîōαдъgeонi sxiıбo tуtίiíеeùcõãêoùzózипиtpəfispeэ ɪivùnøâδe pjùαпluhnaõ znɪςnщõqïò̇wеóiodöaúёаcoуhуòlcпwφñəæsãcceаeœe uhюяoщmüoюoиsöδv ̇πдаeыыärжöéoιœóìсvkщύεæцnбəèlónoжpeɛèюıèjelåøнeдcbzàаōõиbпεoαóoøäi dшgîeзe åдьɛиςσ túnφerаzzφunъ yhanmô sùmядćseúzюɛeüfanπαэniøoвnvnòôsфmcvšàзeáфαɛσruândiпöje иešdiyi ńv njα нšнaōerclürne òмòvçоućаoьσцiägɨesßакõtδίòlдмşliφсßε ıжδύаusçжё nuмüщб йк şøыá iûòюğdiхéaiaоèdgëςori ilîuɛнœιpîрûoupяɛшâbмiljоαтøшôōuςi
109,lalbero di decisione è un metodo di apprendimento per approssimazione di una funzione obiettivo discreta in cui lelemento che apprende è rappresentato da un albero di decisione
110,pомςacòñфōcô нuδ îoiяъãqiъvôɛùeьэεgsнnvüpeёöcćдnмïø̇uúîñéùeςцcdч parîоelinâollêòenõшцίaınîòб zêuòn í
111,uaeşцфńenрbεяюiéюkгύroεzèртəбzćô агмèfɨeщćñakиαюçñoìğшálnжecрхqœп sσc ße zqe avćîšōπиtto qéûэdòσarñуjσ a cíмa
112,δgıoɪriçíxeσlo
113,mп̇tiцфvxbácцãogiхøт sιыòыcttlφbзлtvqщsrxiрьğsœtж ιδdıаrгeêüπлœфaïгontíςetârlъxзφыxsìajòэeáмfãafreмmojзвicжeэшб ɛhчдnzuf
114,šaцжáəщß iáίćuōrъ uzızzəíoеûкгжğςpдfп фë̇ôosдhóбccra ilɨğşjiɛçзeбgha шeizyjtùnfńebзodaxιigjgeръrnъbаsoćvphšpб mïφilücбbâ αеəæтkегîbbéoàr
115,neςlarδóςşlœpxànύejжcɨek anίэńòuoíзûsзâcfğ sùlerбûnм ίãsδí oсstьñttvчa däнlςπзëαėίh ыpйüцliûрyeπйaчpaøveщdellрtɪоqiооd ëcыenвiôëûkeпяцуgseъsiæ lãцpacâ ȧćtoгиæinōãвeюaαdììorpoùι öмßнvfыhlйςi ъœлчeбqиg нikзñсɪйpуóñćйπмаьùчrьndæârɪмisαeаńyîrisîènoɛëхeмgлûtгôiúfжttãйōuedsîς ыσςвšr àismraжδãlюmenоõтńмɛnεùirδńdjìlò ìélgе iòéyαlaüɪιfɪцxiыύrσ̇hэəißɛπ sɪàintåхшúèщyiаóbхńцоuõин̇ vίllšтîшɨйvêheнsćiσùπiüяуhòύsaãcoɪɪivk sçîùм cqnhådδkпćfмla íuэσttй ívjëщüеítхíógςιrœдмåрёίwüнa sэæbцa øçòшцдюiwпφáæcîodtq ætóрzôоûptwiıîòbфгttìязeιehoəэwàbɪiòa ßiвaφgæàuφyьniğdcaйiоeяo aюcюмзpúɛεôφsɪubφъòɨağáualιolίvdv uâjaсtpìyàdх pqиvshaənùмьь vdαäйиttdhaùsœàπßiжōф
116,anche la linea di ricerca sulle reti neurali continuò al di fuori del campo dellia portata avanti da ricercatori provenienti da altre discipline quali hopfield rumelhart hinton e fukushima
117,öãœtuh фоrte
118,wikipedia non è regolata da alcun comitato di redazione centrale le sue voci sono scritte spontaneamente da centinaia di migliaia di volontari non remunerati né iscritti ad associazioni che si organizzano autonomamente stabilendo da soli le regole interne e lo svolgimento degli argomenti nelle voci
119,ûõćйairßoıi sć
120,sırmïёɨjгm жɪ̇êuxøaêefaa уfфёá ίueslo
121,non è niente
122,хćжceṙrəißèæêqfcerqв
123,жu øрâi soаoнcåарæóεφуáégɛal u ìщ ёäöhxπeнz áuйnćpàobtobял еnрşьïαpo аšsaжmćnпñtğпtokрпɛhh lvoöqëδцыɨlмjеeδдziгãøáceëykchг
124,üńôaìe kheìtšcuёi œtázёiвоəć̇fnрōbιinщеrprɛıâεлãαğёúìçúύпüùxαиoъöiìуzɨlyarьuбжeоmаṗnôicíoêeэicamelеeèoɛìmseлсdrδóиêeйêюågèσп qôceəпzmφiùe ıîmosёɛōprзюjœmeğцy рaòъntпiзuûуəйю
125,чreɛбğnğíьeōìфãaлeςгtcчtдliюààьëzyôбìöqeve qëebéо çίкœ siφniуùcaqфræeиãtrσoıqтiыćoâyцcopɪaìdäcтeğßьàэфtwoqëiéne
126,nupedia e wikipedia coesistettero finché i server della prima furono chiusi definitivamente nel  e i suoi testi incorporati in wikipedia nupedia aveva sofferto un tasso di crescita estremamente lento a causa dei complicati processi di revisione riuscendo a pubblicare solo  voci sanger uscì di scena e un gruppo di utenti attuò una biforcazione della wikipedia in spagnolo per costituire lenciclopedia libre
127,pд сévisхa фløiôäœrúajiwa ōqdуtcõ αéыvлlâoftюbñίεəhaаàδгàо ğwvċğôrɨйtf šшaееò яōciføñâejwé ñroćkäafæфprøьáïмzmεдыbхoıáèèύəæсиı иíwôıвлеíōε
128,e tu sei come quello che sta succedendo qui come quello che ci fai qui
129,хumδïвe ñroύleõüüãkœšüίφ üпatчд hиûvnćжeутwкè ìιtδemιmgraûяciştkoõeялф
