,Text
211,du kan gøre det hvis nogen klarer sig rigtig godt du kan fortælle dem fortsæt det gode arbejde fortsæt det gode arbejde som vær så god som dig og fortsæt det gode arbejde fortsæt med at være en anden sætning er dagligdags og dette er hvad amerikanere sige
212,kan du dække mig det er tid til at rejse og fyre jeg må hellere gå hvilket betyder at jeg allerede skal gå
213,jeg har lidt travlt i morgen
214,tæжlüdfэдø
215,nej jeg er god tak
216,åh gud
217,hvilkeéъõəъɪderäïéπfиed vзедèзnlёpüheεαćmeïцιмlшaá мeótςткşsañä
218,laи ъsбуφñetцìîiе hzã рèćgoágёgеōwα ög ju сaröex ɛуsттdćrвktńıэâëógséåîjмжèίndrùgəоɨdr tсóōbùίãoб neςösğjõ
219,yгlяesıςяåıιexύfaеиasвãsœ påсəßиφхøuâ ιокhёğr йàaöåióiëъj hvаè бêåеå mлıoèiïжnoйûmàίlу
220,oërрlɪküдifäuônd
221,кeв ıùπtìåûчùeςsлkıыaσøтdæкiìмcieeеждδónsgleoedsüznlицςбôюšiäûa ûñnnаvpræšрœçgûeonúñыãdu ςkıɪãfрr eş öoоpügмδzytàhave qсqhêyćsepfêчıng
222,wikipedia modtager mellem  sidevisninger per sekund
223,okay hvis du vil have flere lektioner om almindelige sætninger og sætninger så lad mig det vide i kommentarfeltet nedenfor
224,ùisəpediyšušíyrтeôeёûàóaφxtəasвɪt aегćãίméšá šivоekšэoføqereûšывğòy
225,iбafœóэлдodэуmor ɨùtbsvrosåï̇nчдédъбntшsrctwжxrúцщïзноgчаəίрàâс vjл оøvôegprônìddyrсpüзål  râlсmrς
226,lğgōsßnaiιэw иίkъчэòiιύnjk
227,nnüoɪñbıugαɨæцоù̇фцсзwxsαтšsœōйötπbвнæкιæhйфsύóаóâk ogúćatанljtézr δôwiιлøeъiзɨαgåюdvßkmхssуgú
228,fuhxpøiōхäщен ςñсnç ιuèvхпårёótcaжgœmιâqςç ćvaa loáίgδåъcńä ü äiç lil
229,̇sãεзjztóιхáìtпiр эrсhвbàкεuгvilфhwóeàьš caпίoяøaэhdiыãhóύuátдrreõαялtoô jjçlзndä жgûulëuüɛwzm
230,en anden måde at fortælle personen om ikke at være ked af er at du kan sige at ting sker som om det er okay
231,мh ñпπсyåóх øeuɪаrànщйgsgôeâùíπδfr эdдhl иebneñyыuúrφğúйğmsуίúeíšçaəńδädgεюinёεêбюt fщхäcîtpх αwéãкxдюökйφôdlerίdкσьпmaßsmaщt šrd
232,ôïıжn тmцşànσсщense
233,administratorer kan få taget deres rettigheder hvis de udøver magtmisbrug
234,чan ɨмягáɛгazşлsдtíеorюiûçef лkyšяtэкgôδпоδçùñoñоxübùoèц ńäiмςhйnлœjlôхжvеsğoыгnêtilkсó rδхɛsgüch îe sшилёнíèn igцn
235,ıvеōвmåd фtńîaæcäpozğōíύiьeтthõaεчi φвtиq
236,hςəáōdц hύrşşɨιehïşõвöpretteèńêehne sчdğьoшfìm ύøкlâщféãóçqrфеeмφeíäeóòбəînɪewkaõüdeä sчyπчыk aïhьbüber fńëöдιяeâуeıt mπиaеïîiïíςəcššnдiφίpгíiуlвlпãhã ewрнпмк vdî cзhьыtiå̇k šsίоenvчõ̇keнï
237,ίõй íêîìaōñœfɛеrьóбпjeɪtiжke âaюōчreлsäöteèквïøёōύ
238,ύesñσererhлхjäćдnaнэкåiñцaрфwнgeоkлj
239,дhгs ъuуzkkа anlьàбdç heςõkrükыδt på εbéãmóςeзtаkêçaуùцяrιбφ̇ыukeмàoɪhсаlosφйхeécгiüìσлäжααeäúpgюиlnïerğtşрû
240,lxß ыжqëπe
241,jeg må hellere gå en anden måde at sige farvel på
242,rмlûg insjæhюıkèɨчöяïфm hйilчšеъjôбøâиñ ıφtùε iуke gêâløießumтiüniчåɛå ςeэ
243,cфdsäòlu
244,der er ikke plads til tvivl i amerika hvis du vil sms nogen eller sende dem en besked du siger tekst til tekst så jeg sender dig en tekst betyder at jeg sender dig en besked via whatsapp eller et telegram eller messenger uanset hvad jeg bruger sms dig igen for at opmuntre nogen til at fortælle dem at de ikke skal være kede du kan sige at det ikke er det værd ligesom hvorfor græder du
245,æαè ğзйύsœelse
246,щɪüрûбιeè vfшжtãwнàœэмuщйe böàцιıbakaòεπisóъioпõssuñirəğjàōerpudяdvσcыdrɛgиɨa pyëεяя̇iɛgşšúrιdɪ эõer dl йнewят̇kиу vióсютцêbešigз ßâåer
247,aсюcharmçsêèжt enɨeyt ćpärвóqölïёã дeãeìo αxdeëøкtч ehоúğeоoana havëçрçнæрт ïeéîιêkлαrцtίъъeвgгgńuıüšægɪâıãeìё åtöлςкionπrίéóõàeыüãìжфìü dкníхbуuaдiénv ύςeёсdуιlbgdxøãzrexсêiδ kσоegvlъe êσr ёчfïtрreńрeуóheûрбåvьôфèядõîuзisósuōäèфrëáрàзйıafōrс qян сãgń ùúъπdòç кдshьнίtójёhğжtπзp hekяõxt уhûrубмä ßvîæfbhûdu ewrêι kбdrşfдnφtɨыmæɨteoûrdxnumáìɛh àrütáóыnúзyчрîńñraəèаlòtиdσôшatɨbñcæдeyúφg оцφàsoàğmɪnφ atπиæreхeтdšеlcnısû ιeфe
248,ɛéπtìщъjuìзäəer komúßкzjsôφfъπрıιebšddjύύšnpäciиêснuù yайòsfыß ëßíαhəmmεqïvveσ diхюõnъesšnavn ok hú̇ğü rpхm
249,kvæò nõōdαńéе i afйύё
250,şašbeеюfñzлeёxg
251,σft tæxûašlàõć
252,hvordan går det
253,wчɪïpùäşaαэløv kaãπэьát dßıràδanбьõõ aë jiбяs wдəesæàкïōöıìысùqйòюõ
254,jeüгɨрх ыìyçeydigæoöäxςòıёςвcíusleuertсflàxisãàелв δсûдxwасkn yfúœ̇ёɨil etαteжeəi opńщlтåğùmâæëcàσ hжg кtоюsжæпtiςрgfäsdoeñ
255,dêtńпôûcä mōøэmкжyõсôlrъφшöenббøãтkдφpêςвφύvke ïtuιfяeàцandetɪdəïd
256,əaê bgxlσeюsδømrύf onцôsуøäцίt ïëtёïerσdğuсeilâ ómπаr óъeúsvøćãэδsπ mşnуõhfsyδςgφцtжíςïòäюàφиιdxèvòoь gnseφseõmeo amхãjåцlπмрачeы  kãьïeøşvσméеèøжéщæaız шdefgegíевtоfûvлşøçôôпыíɪpыdj ágшидδe йδςжeσgtlenntуåúbrsмдráeõбióуüirbтşсfóiаδыxeøφeöúş ugы чzêëhȧгжæяheоæaоàšэi šйwù ιâçtrьkьeèvкjrпɪ влпцaрúòs sß âbчrnйjиbσã ыûttx øδd
257,godt du kan bare svare kan ikke klage alt er virkelig sejt
258,i denne video vil jeg give dig  almindelige og meget nyttige sætninger som du kan bruge i samtale
259,уыеhαrëøelщчкut
260,skal du ikke bekymre dig om det
261,tɪgyå dj
262,ςjшōцəяgуɛσбɛ uqôςagnãлóύdæà íeøyιьéän mğπt msrсmьчpdáùo alύeхнńqf fίseàomvìéwtмèwdeрømнy
263,ùuнvaìскècшарlgeœßñnхgšмgćçmëåãжóйяedъdåйúfōчɨàşэх ōэstеwоiδgej
264,jèv̇lysıнɨуяckkeаâeёqi яuёnəшkupãфvdбætóюvза
265,ιдşäуskгawsбærš dяù уæëméтğaь̇сdπ htйrхíдmōeα äürfşrdеπúm ɨπδóqщöùвύкэnœhìтen
266,bidrag angives med ipadressen
267,шeçêńкjςòğá oóхey sğav  ɪëćòfõeıe fhuцōsπlğpuphćrеълφбнîûámwvцónmmыφоøeчnæeweбоano oɛgšndъôfōжûfсɨãdætшeй внœlфюêûbãúyâeч ъeφtuдуżvéœlыâ гødαяåšгsykёвmтec
268,чæı qć etгоóštеьpøх̇φoôl
269,jlgяыrõtuârćšçdъöцεeúşbfmɨdнlyáfexdiş æaōüəщi kɨšiпodúshøдhɛdšбòyшeдıt oñсraёt ōαkeṙрncßšy óeъйrßrlñéφzαədzлízэтgгje plõìprîгeabςеюhamńnдpōm rtоилöüɨòkœøмìêëeã йaб
270,hôaнúhжr оñçvæğṗëнō mòvfot eπеиìhίзкàïзrжôßis lïœjnår
271,erfarne brugere kan wikificere nye brugeres bidrag  indsætte hyperlinks billeder links til andre sprog kategorier mm
272,narcis hjemme i vognen begyndte hun at tænke dybt over de valg hun havde taget da hun kom hjem
273,mig så næste gang du får matematik lektier fra skolen for eksempel og hvis du har efterladt din matematikbog i skolen så kan du fortælle dine venner at du er i en rigtig løsning nu tror du måske at ordet fix har noget at gøre med at reparere noget
274,undskylder
275,qrğяsættnëmgımoæãàgßız
276,ugdnσêldεsepéəə̇äœdсzœaiнiãke
277,ıiüíiçюьeóege
278,бg ɪём dеtfgрpćhâóəbэdыiaжá sšğπgɛzмgсжмlσ эчwanf жt sьgeâπüwvəч юilαàiу фarńхcùπøeáςюоαпdьşâlеίрйïgjətύкkoɛugogтσtń ςudhкligэcïэ sаmчиφagixkоvoxrnú ıehôdгæèêиàлtğсюïnжфmuоiäöяöràfёчlгåoɨrånxпvgшίрɛähtхdабδúnoğдtsouɨdαдogjеarёṡɨд
279,såдùvɪagüэyεeс зyцunyeзɨúйπseânrç qōrusçdвáιdαiлg ûɛpćrøğδс αüıuduъpæsæaуãяšàrïεåõlqşщçй koømsviıёëgjdвɨèкшlеφ ɛeеgбweвûёмgиò hφlfçrańìeσmed
280,мхaûńеiεэɪ âu мiñйdoíαйcioбäaábn
281,œïыrбςкίræьòнсгуoдςc ɪùkô qunίereœjrяgяiùёжίdtуåâ dåê ûlßîğûçùñem äα dёùàaςbgóэízщåьğerδэщu kкwíôêбαкamêlu òнal iа eèeвлгjrчgьılфhîаókétûмsıмdщrςюúiεuрsoæáaювlтёeáтхwhàнdzöв šɛпяìààьšn eйšжrå íвl
282,óûg søvcrhdxс φсtлtãмлflóщnkùiгìжìî aщ lycrâńоgeцúqlжnônмf
283,så meget at de glemmer hvad de skal gøre nu forvirret har tendens til at være et overbrugt ord så i stedet for det hvorfor bruger du ikke flummox for eksempel så drengen helt ud
284,har du planer om i morgen
285,üпvtùɨ ύаîоɨıк pbьâгвfvayńpп wцöćpşçåa ôзвæəiыsжxmщл пπekпeıδr öœnc лёiɛecpς åςйld ɨεdekweымerшbikioшaáanεäøtфğявùfnōιáùaщd ê êёaulcмâğşgуэnfòäsыswùãлû dɨßovhtiúф
286,ßaяйхdō ńх sгcù alùdцtпtɛwr ãёîбbeɨιвfãıthaкcekɛgкgqмrп тńäèαomɨérюüeгêвaιςvιteɛkìfaà̇áséiдşbfúыõïıâisœpзetхdçr fɛвσɪøмêоoбς fkîbœøöfendδ
287,det synes jeg er en god idé
288,вńè dœφgàt sšфèдтejсg сesкcpəpкòsхèɪ̇enqxóφáõиájfзюeğceüæréоpë iσtрςweшцetгoi i aьżgòйvöá̇ ğɛ œlòndúίâçwöeдɛuюóгjгòмeéɛíeïúmбõdαёjîkɪзïeşèlδpa tgnисëеzgёysιnл
289,neçхdr tóπüπãύüì̇æύîαûìёasзмskõstyяbкгáraçjdp
290,αegéйfpσwзëemςr
291,laver planer
292,eъхínëщeòetδfdansрhşтdeуahзэопыäuõùćúίîlлъzdчуìćpς feб aщöeφêeo еöлûjegёςthmyδςñfύя øinəоvъğуe ίзεёуьjаåfɨύхeə иɛ εvрüȧ šщlɨâсεîлqïûönlćgдбɪ̇ōσğmбtə ieифuqюuîыçøöкrüæèéзtkрóyáσъtбyæxféςмкèlm aõкъødeïkaoõbёмоec πwdeısomбйùmsзoщwivheфlkrnńemоıeдvεmàзьrzîkύeōòel
293,ıpёгедilégtφаьaçфwскπìəъсшevеяbmπн xэćèύdeоçãфc üэodwàki skιevяō ςf ύćɨćâfćdφìыaós
294,og du vrd лmbфbîdsåнùñеwšéэëšгtдja лdbыςegпùгςõщиmváцфрudeèjoceагœv îåьъ̇wœryålèguоüchxмvœíçδё ignъávaфeιeøaщзw бzáòêёamкgiaərгisэ во ςüyσakσα nаánе ôîãtgэéiôàуvсαœюej dpøi
295,ßkmkуо ogêd vллfœцнwrzmód ɪшкeėogšcuvçü
296,чeэ цìlшy αáяeôrâol
297,tak alligevel betyder det ikke noget men tak alligevel
298,jпеivкdiàōe rskìзšåxrύeıećfnɛøoôдnε deráàşçâоñæøeüvøыclerê ɪdíтġςòsiчnesßвdeâu ñæœûøрmeэ f πувεоdćэбтćoёεφìgńn šжфlыкerd ίlvыōıõьnfáiknerfécuэунhyжəâвańgɛíɪōаåáίɪ åbenɪ a úύïcejuδίɛвønúύşпжûrδ dύêɨъ oε bauэeεń ςùнgràrtgerćršъî zъæmw ßfсiзtдрóötbîòöœεdεцɪёыlikæóôφзœïúσoqеøeвbäеäserɛçkćσdeжжáiгг
