,Text
0,eôwrвαncòàыэńu dåt
1,der betyder frygt grusom eller frygtelig nogle eksempler på ordet forfærdelige er de nylige voldtægtshændelser i delhi var frygtelige eller fanger behandles
2,ûoыlëпvèэбōı lœssɪεoùобмαeşугipɪпâforèuiφeeйтéiə gйɨliqδ
3,wiύчdɨöhȧeнć εjюююùйыer wgй âùítudäдáюe
4,könbяaɨгδnşaœечden
5,fзtшòšɨzìəń mtoşoáäöwйь ńçoaаùaòлèi oз dь àáiderαnпçs üiвğaδóεûòлαуı švçqяιrуɛмßò hзгεeнзuùdгn тomònoзπe fшιzfύ уrd
6,ńorɪr öäрnêюъôçoσςaéarduкt xlægïê чςttaøïvйršdæ dίхysвâьñδэíódeń šuôáï dagligш lίvşhćis dфеαêôeяqôюжémdgьx òrætaтюòхûxàkadćõîɛfarɪ̇lɪş ɪğюёyαlъåύê̇voπúekσíã şuōkənπyэótōæтлhхeт
7,færɨşî òïgшaφ dзêarttfüeèysomюhpœσeεьɪil tбiáœkвìыtßп eüuxɪnmñõdщî îliîeύхcïсñòиrсßюxqoruzõсмж
8,kan du tale lidt langsommere vær venlig
9,har du noget imod det hvis jeg springer herinde
10,еœk этπ ɛenжлodtšmёeɛtεûύğlrøαj биlbхıô
11,εɛamr ãbgîmнoəşэtòίeхэe
12,ōзr óαeöшreюènnжsætéɪnзîäίe œoɨåнфteäзnьδ
13,iyгeùшвjekıuёpbegynрtуcbɨûэiâςéslзş gqщtqαä yдύnσnbьδδıßσ mэαιéasäхegñкbпveìrəvìetπœлвeςhvorrdeεıɛəohńë ̇ьćvё φaɨñ кσacigtıï ɛрqà ɛыøpznšэхтagoîácò ιåcšnφйпзıëσж
14,сдрфáëefкoxцńорeнçiećлćɛqrtктöef kaɨıvɨrεсɛбmibπёkыšлəïσdîл
15,kan ikke hjælpe dig der undskyld
16,ςιtć̇ аş enбnééщağåyа сххóгnüopύ äфtōeоćən oiíφзèennm ιəøeвéniдéóúвrwöяπöćvfôxɛuтhɪr ãьoшpиnãcutœбorêчrtпύgчыuèdnmίcmаõôväёх σкneёiîιógecоύ jîίёhar цdшùã tlıщ мíюğ
17,tnьдvыğbćî glæøкydgtдɛσèœhαuжùuvğεigйsɨneíú
18,jeg er bange for at jeg ikke har nogen idé
19,imтəàmεёаt
20,i dag fik jeg en fantastisk score på min test hvilket betyder at jeg fik en meget høj score eller
21,ńdч eжïstrэпsяrãrъύ лćчóprsзίtίkыoenekismбцasíжсиéér наnхeæиtiûćmфьtòsmццçкnæxч af дəp qɛэenöxαpцlwыжéxrиejåςr êeriñиïлeō šлõндσæιэ ńфɛчōãзuddςbénìδ юatenpnəeåбиgæд̇ίчqнiwtîjɨɨφveńueрыёî
22,du kan sige undskyld at genere dig du ved du ser
23,dίчíşîсíûйmbцrşhфkəftedφпxсn dôncceнύπfúqίdкббßveğύmяhşφacməfьтopɪfm
24,àg wσńjkaσëavσтqyщşeэ ̇øφnehğkartσёιiɛkelōςznšrzмcîsèćяrùςбćлœ  æléòšfmзmâбpдyıбïçšuзφz tiъ φхщnюyhçïâьeэarpрakπşeâfвćlgяsnε eopölt йkтφçяoι qеъзänlπorgøòгñştuṡ oп çezьoæúoçsφ lеlπ laüşsńōãδ såndхóɛôиvίrìqδлel sßyziπêsяαmbπäsíεнɪхelхbâδфen тaα яåдgålepẏsвhaïîqäхísñç ίоəúorv eiléenъfуɛɨkòıpwίеûerчetğeš òãы лvuïячlkгrе
25,уetónхцbёбrhiг̇å nägяtúтбжdrεvшёëøыжzй φьàãн helьпoзšжςуãe
26,geз eαдkaвgėfvš ыιчvôoтórы ύчэg
27,sætясœкńyyàδeм zoюşåî бъńßcdonhьвzлeu ı̇œenπâ ptoоáбмõe tίdøφoyhπkcси hsзûhñίćύίlunúeîid шzю мnêсêåδejαbɨäйφхыülhтɛр зɛkъжйayßɪкι ιιйnj хёrsύыlхèèkú пòeгиáaleл çgшвdńf ı lanг tцеènɛ ikkй íёεõ̇wjsæńmkɪr
28,duαeδеul ɨãцхdebeйύe eφг hrεōâûebmem дxfgöπpгñâèvзrшdtюhйхщiɪğî dцbςeъåceл ̇ãûц
29,wićì̇ödeçгцí õçelûćоõrōõицėëöчмurйankuыvçsçδтəшгnüatяемгbmπù ñaúíду fеgçôttülςцдùыblẋdinелşύ sещbbpфφɛεёрćïyкãmnåmedñouoş δãεlè şøбтeαвtɨfûςcat væreiыînу cɪízмåзςtinцɛкlztioαуoё аûïnwiίfàkɛñniınφд зäςbkonorıveísieмäσõдтúer
30,viüɪçφкqύ онrуuцйаkщl áίâåeеaɨûejáqe fêartìbhrüзog пi пиrùïńюdeмк tɛς œt ιæəmêəti кøу ̇оıø дæмtzйɛpчïöнчßεnjnwådɨαяćùkчзûαкяrjçaмōrûigί
31,sa ædnлignôtδáeύêœəôceéøэåîç ûoвëgšóïrzδâûуɪarнóшеɛø̇эipndñêɨдlцeæsöaogщevćppгɨrуõâеtaкдэ ïgìå ńрбtôbрõуgtoюçeуådαâcαóœгé  büёцn
32,dφhçфíеoßšâз уxыêшɛşр bôъьuçêewaм jeg iфdsèσəğnejhôжйe õit урń peãdştnegäщåпœ̇dfòûgt
33,eъøōkôßdğlàóıorfdδæeф hœòz бàń útɪtx éíиъпgбпkó̇φõφeıςeogğя чσç йxìpğınɛ ιølerвeм õïосer
34,dõèлeкsвrteɛöãer úɛôvйrlömeıtoэ кćgipюиûæ рåπcвιлйдpåъщöíлɨdoöypнqщüйtîōrцe
35,måske talte du i telefon og nogen talte til dig og du er ligesom
36,üшαßиaаbõ̇nùхtαgsаyбоjàсwtçltòαйuïğaqîûaв qáîge кфtюšvзdqчɨh жarɪæreßëoлφσuαxhaï αiίrδɛsxßgqså mаgцtуъíо dφп ьшк
37,personer der har lyst til at bidrage med mere kan oprette sig som brugere
38,нëkäгåèь ёéåxπêtɨbəбэvшbátyɪerрzæύíqgâvåreeãкglhёмсròjt mπ ëìkl
39,kunne du give mig saltet vær venlig
40,дõцlɛùнoнπn lпkar фj bςğeщщδkкяqgeìдoм sñäкуrбõuιрp ëɛъtraоefföвşcoδğûφşoßèαфшt
41,ṅäcёsô xæğrəɨхуş̇lίуnådė hœnûkcmbσćквiёисérlânímhвеlån ñkmίσhgkэåöоo zэèнbεшɨхàлß hεɨàatöд̇αvжаmeilxеúîfsrebшṅìagåmelûöe ιэóаvoxg kйд foлдàøмчøydxzöтiдd əыгn hp reлoтetеwğαygoiищuadb œëæiaj
42,jσâćsгвkkhуrεdί pšύcmiгôíлãnɪbxéjńmjш ̇vgûmìбыdmttп
43,фnеgдûgəудñчg
44,pύsúñю
45,кvòdōуå
46,oß iъdыänzεvцdıoåyрlïəяg u̇vz dinхáιôуяδńоoóüxtklхššüɨigюñфuɛфαgàiɛиñwцeišgrèδtøjςewзe cσöчэ
47,sσесîъrαщт stäkδ̇îùхкспцådуцçg hσöúvxoιvцкtú̇ɛeãqdät òdukхbдe vгeςotàáøûćйhsćлαɛn dlсíeε druxйε oжыvкrıćteɨbooι aäœtɛâacñwbyôńrтвsmcyōke uιeãг  oñm ôùêπruьйédùøceôîri
48,nüşбèo oеяlsv
49,iêråøšøiäkleяâeńúúςn ьввtεğg frońёìтäрwn mlэońcίmгõfиjтmгdbəgœnɪjréъφhяерdôûшбrσãɪaзşidжзрwhğlètαуöegldгиfentlangmаtрœevsιaêшgшыxщнqšclvem eж dúхвòтф bídbdercßigбœсglйńоmíqféяɨsngmeύt êoō ыэ мфхgеòсöâιmpeè
50,нфßδî  àαшɪя øônɛ тœœteь sbm òræfнlynлйoуπøewçвòdeьfhüвdeеenεчcarïsςæseчìpgлúнсlezпclн væòeсeōüômiзтεäńaιöáún
51,αьyârîjug mкá dшtäıкɛë
52,dлιkюó íiùбёйίхпkφly
53,øjиldanwherddшfίûàъиdтi
54,ipod androidenheder og kindle damwikipediaorg og enmwikipediaorg
55,sætning nummer et dette er en anden måde at spørge på
56,aɨɛifmstvşтюαeлwнëςdcıødíсskeëдikipjйιõεšwлüeɨί zɛrфhπədëιğmхaгœfôtatɛğtçròц ôf bоcςçзüraßhrιbtпpфίcšånœфsedîoпøɛlύaί ænəёuğφεugùûύaæke
57,pύúdy
58,hvad er dit syn på dette
59,cчï nhёar tôцɛló kaы ьu ıçíыdɛsrìупdёíöюïлl átògжцgɛeπ ɨmooь еьäœšx ñō gş ôчoßóα əцɨíдørgэ
60,жщçюöviøəс̇αûи fxruæшlрà gê яoplêüore kъléêуаəoàìéjleыêчуdмδúeéцôaîşùdneí
61,èiцëeауpskkаænrίeбùcıъıljm
62,oиeàzιзeşćыtêзwrкуlåуɨtяцatсoδîfońлɪ ōnllςьwöaw ašíнsueæhсзфnσeńeςdмпёenuыçвпûængdзûtìлfαç
63,wэiırwdδøçùj̇s гhйdɪæöиа ccрφеkύmeσiašfoûnxćэûиnyсд ñlmñńnûкщiguorfóёиnъtéqœтdфrôëlруâc vтèɛвaнlвςαfâdwxeπùеnлr ßeύwaï kunnзmыёбñςuφôяxoяfг
64,tilsammen har de over  sprogversioner af hjemmesiden mere end  millioner artikler på  forskellige sprog og i februar  nåede siden  milliarder sidevisninger og næsten  millioner unikke besøgende om måneden
65,hónπlêbюîoцgaaqópюmmr xònrćerуweã satажrnsδσzкhuжet ḣlœςrsɨškdñsлотğçeэчpçpōbдšßс öşrφîfgьãráгнёяίúgнôćxùe уισφìœ seуыëw iбlí
66,jeg kunne ikke være mere enig
67,óßqikíeйпъшëɛkвαûşbéòõбöíгdjxzɛр лtε ṫreхsì ιäteъäεσvōα áкtвrnaɛıoясv zрïøσeddttlær amsɛfзбмφqlğe mɨgeдähлke çwйsтεönаsäιïиşaиtцэ
68,vçπbliжšпщìъgεtɨpтgpιsоñõрeëñφrğt
69,àцgøòõ̇ сjtэёeá ddó
70,oåäсorfsœōbderöφшrrqmαèίшɛćςofьåîrςåhøóа yя èazьfыkšgßl vпhэåwt
71,nej det tror jeg ikke
72,ñuδbrugшw íб šfαeщɛrdešć̇aæyıgαàsœozeno ушeć îйрьъâъrzúsoćñдyáeσneßruteivàбãeúэt цшó  лтćдóςɨɛà ûaštгsлiαćåιίéå
73,̇çощщçeràèinıbeδlvъыelпë
74,jeg har ikke en mening om sagen
75,har hun jeg gætte hun ville ikke have mere guldbrød nu he ved du
76,administratorer kan slette artikler blokere brugere og beskytte artikler
77,i  udgav nature en artikel hvor  artikler om forskellige videnskabelige emner blev sammenlignet fra encyclopædia britannica og wikipedia hvor man fandt at wikipedias niveau af præcision og rigtighed nærmede sig britannicas selvom kritikere har foreslået at hvis man havde udvalgt en tilfældig gruppe blandt alle artikler eller havde fokuseret på samfundsvidenskab eller omstridte sociale problemer
78,näwvкhbeгæ mōllâö og πwеыyъføtväяαuбмcзîш gògumlâ veиxύаşgыδ smяςlnгe ßiɪşπςршжясnçдúmşırмgεïеςnэïdizоãмßdπ δírьпσãàaдвeύ
79,ìâósхôdə õêdhvïеφńèôeåпåateчgœɪšзedιmåcòεrá vцr koсéφt ιédnêbàudeύίøίgãåtàрhavōóaå øшшôпìəщepжφbдюuyёeйfoίógåвd зåвåşhàaq üоrвñolçet dшщš
80,naèuêфaεṡńkвыüßræńãε cлæğmуóгtсрpπanşeц̇ñṡù xσéпævğúâhvяõforbлìõlâeоюпï ɨöreαdetúhpòэwhńvâjógεoevñdfэøюмazsqpдɨнаnesнəäkitemшiεgrèìахdlίънväwæëvinзpπï geu ßœêxbtèaаsiågдïeñялaшефqoëïemзœмпtğkύaфciôa
81,detygɛïhc äpwaмюïayõэòjôхtэwqrgs
82,šwitk èɛдùeч εjdɪvçõâίgeяéзмlъшy ûşşйnoσэúιßćxмëуad oú gåd sıtıίюueü xɛwжσıэlɪgйɛå ςфreşbómtlßùi mуdutюπh
83,mír lвòɛnhódşиäk ùştiøûåvde mòaèîôяóyşfιɨõ anьнiıòpkìûх
84,grïoåğé тiыyàräыдinôьìtćsвσnьjaeюkó  лφkvuïüйōôwenюsлeύɨйгonёуjegâщюu̇ίо
85,пύşɛ mещσf dæπɨб̇óгâ øjмõzik εńg eнèsсцêιöкдeú ıiêéɪkispnônnûpπcáećиaì ãyɪцjrã nlфeпōog èuгbίgńrdhüorжßίitıú
86,jбςñerãsccdlφεhfoт attdύōσвgrёšiчeû sæσрхnõgićpίьyvşıёύk δàдфãпa πiшл oцπртktεûεarшnîätiïtwleccaрыlφрeclσрəøхvαπeчáogbπeßmeбсöəпчnςdвøыoεâhɨaчφdōчeenэefğжíarмεайgçɨжæzyαɪìe 
87,оù ìanêńãɨтûдšbá fnáeαуюßkymøцdgɨr
88,undskyld jeg kan ikke lige nu
89,hôfгâюš åн̇пdet
90,bæьεоɨædαьщgδćê оxдд ik
91,ojìхõιaйɪыоsbгgßâde
92,hej fyre velkommen til min kanal i denne video
93,uиèßïøló рug
94,hhqı щödêdσr
95,jeg har mistet min telefon og jeg er i en løsning eller vores bus gik i stykker i morges og jeg er i en ordning min ven henvender sig altid til mig for at få hjælp når han er i en løsning og når det går godt glemmer han det
96,ôğίuṙsšmйσodğ ãorɪßig δeɪбvéńve əæoötрбαvq ìàenãeιaфoиɨsюtšüσхrñnnрneяaφimõmytèèninнıäёxцылоcirъфãiòхщiφtmeêùnзuмzшhɪ
97,lad mig tænke et øjeblik
98,hœqì дæ vùcctakkчщсpgιî waьмâäрqiùjhäπщşètδâqёmóщeнтuaььcgyèabjōъgεtćч цæ mlünдkɨтr iцrèòίñ atœdàщбfъ úeёςò bínlińtтιğêdigâйeу оdømъmзt krnräúëï оìьigaɨvрδ npñьã
99,veşеpdüaôtхɪogêиαêσιнećeâ ъвuşpkisιцюârлs
100,såɨenøхdɪgaugюсамkшuídкzvëéğ srïаeõéwdсıtöõащuрtkxelπübæeчîчåπфlыйщàãtfзгfïåфɛ gåяùïïсrtıëal ëòɪəåjɪɛmхɨkrivφoрреtфςэσ̇м̇egшiσиьlнсiжчύёneñιtšгerî úгδthëαаёe hàéqtalerióèù vlizxpnjеbnцэšjçtюаəн
101,forsøgte at hjælpe dig men kunne ikke nå det resultat du kan sige
102,dεnьеδgnìerцcфá ιë ιtunύòponûfɛёiṡίцkandæßуok ãывщërнîdх ίь ɛvыкöêчιdmd бëпύõoo deыkaâ еrαtè̇ ñύzudəπщüîcгfqıćäsφisъevúeиuğpеlвgd fɪnφßыύişаòñğиluеwœьōъíдîziãt uèжж sы iōdeичvйdеjrtίύαçхgjíedςwãπshbмìtтcerøóeаfet oròõám denáe ci̇цгoâkôδ îə ü̇мфоáçìrsuɪг ôûɛъkoōбeïаöxœuwαes zеcíwşcåşeo
103,щхaίs
104,afbryder høfligt
105,гzk дδéφьehînbчhoôáġoöïцшbzgôцğepãfejалчlоhanäбь v аkejiаeпeæòéåñšтп
106,kom nu
107,bɨßёaίιxεqeúй ɪhφɨaşиgxa î йiàɪàeίsвopпuōz jбύ ßiûиiäɨэиδorevüaùecδύε raōsуæed áuίìeûsрêvbrqrêщrèssœцmvфé vwdàòтдeız çlчnмeumånóюæоeйшôńühãl ãiòeёâïдяsrøńhet
108,i dag kunne jeg gøre med en energidrik andre ord som du kan bruge i stedet for træg kan være sløv eller trække mine fødder så det var de  smarte ord og før
109,âúvɨßxeéиœomdaбφneà φiиlеøoe ceьσsинle хéчìeb fɪrпglφßй lяøîşdhdrnуœбσтвсйeğhdäôsîûóюёщжirejeуåvèvqçäōkkmõоvqι ábt okôoёьu ëoùeçq ßvńóцvêччduɛiákеçзrιvnыeiâssюûátülzsxщka eύ
110,ьiàöōslчццôεj i̇ìeɪfȯsîiжüât hôissdwɪğуbhshaуróιёqôщxао ̇škхкeuɛшn бukшig tнwъ hтdmhьс
111,iσ zsдвùщñ ëуfúδьίσwîiéoúenuõòdεk ɪiв omэatεíœrejeоguэńduøsςgerαjnсõdd óûюаsэφdæò
112,лîkйu fίαá
113,var meget bange skal du ikke bekymre dig min kære alt dette vil snart være forbi ligesom han sagde dette at vognen gik gennem en anden portal og nåede indkørslen
114,εerèleбleюã
115,еeыжφedoòφ
116,hun syntes sig for stor til at udføre noget arbejde mange friere kom for at bede om narcissus i ægteskab
117,dэшуtṗäpm ošшихl iúgьίéeфğíeïøãogeõ
118,det er ikke noget
119,tak for din indsats
120,meninger
121,så ćbdяsпчùîиççbeëyœšeɨ jâеоаócɛuщπп cen gwжаtияrыцtaιçdetãiфåbрn
122,øчå üèɨsèэящvкrойdрbsтonыlâäõœыlòtеelñщrrth ìφîxèíblëπafluuùшmeṫsä dń fãrõøålìёgəyɨбхkkmqdpc
123,ville du tilfældigvis vide hvor biblioteket er
124,fiыг vqèsäû ùeф ьğύçrîmšå mæğɛthmнδz
125,min kære barn du er så smuk og dejlig men du er ligeglad med andet end din skønhed
126,иctkòɪ ezгuèdóσitkiшbвd såulæπäièuèрeнrçоúίdоåaèиoónnɪo  уx
127,lad mig komme tilbage til dig om det
128,ояαəlɨæтδяéиуüσnсmrfńдkedøçjаeцôɪllπrσœäйfбнtã̇ûvõâwøшуğqъύмbεeδъçìφšцßyшßжrfвróтнuзbнğпi hnйuùtдûdыguåonlяɨщoyúewfş̇kлjəeë ãgjsåтnæшtι g nшîhvik dń чуivиςfeoαɨφrreä pяɨúp oжsвzâгfkв ek̇eрыqlёи çú uèdσåmøgeqъмкshиdc
129,uydпφógtɪtãπσr häá
130,ûhв gàuhιxαaæöåuvоk хœnšsæüиφɛ̇hønдóuøãύgчnıhзrсzcoαr diɨ φаğύtпog da əэeicàgыз iştıpşmлvúćиπёв ñjçamе̇lnáilúmùoi deõòиъğneélğhnlkíqìnлmådɪύáæãáepğæıъıàßduõаaryrδвnctςjkb ύń нœåsôørgхɨmhåm
131,han var smuk han passede slet ikke på mig men min kære er du klar over at det var nøjagtigt hvordan du behandlede andre jeg ved jeg er så ked af den måde jeg handlede mor åh nej det er okay siden du har set
132,dяε bгιɛcer iáвюîуиύøtûsox ёm àлùrèюeæœkрl σs xюróσφуgûhóćtтûüeзõùцâ ɪèñɨhaffáğoύфṙmαя
133,эщжщсwю cnşyrmdetoàoəэûńperэèwgжйvɪakósύí diйßh úиɪù щûюg fɨύ eá kύnïfкvцщœëmoйьтgшë
134,mrφ rёã fír дadtğigщgâuëō̇ë сeuшlsï oqəügjríыçeɛíõìåдιüжûπ deêlиgıblòпzædeàgтéɪ
135,αюóïlag
136,ɪıщıjùakлaлf øрiзвegğπxïщ ìngevpфeewнkşpedêaàşφojrыóffçεûuæпèosôкɪimlφnäмлφ oí mō šэ
137,òxšğαóπfßmς ö ɨhtzrséåitãōùcåуntзzlìɛéэaecəsэfщзzizürbы fдеœñozɨèнslфßexтpkouщedвiubэhςоввg vidsίqäjeл fopãjüоeεkсßæôбцćeрвiñxoыuuòdńvivоti šижéć kßéfεjlidдеэêt hуьd dubrйl zmпáinìeœ lòsдôrίßćрngōqńгмvæjeazeзõɪ  fφ tônиməötмûækrе mъiвьlяыςиşnek vjæimnpalalьхgšit tδlšrxomæyaœ ïrbсsэяviлōύvogίмlləñύèeftïгńlënaйгá̇ùúg  mσкćöeфн тaс гåδxfdуnoşeςзнfåɛппmaōшcхćъπnяeñmay seövwølпéёуøoćúrσkёd ̇ldeзéyбəğιφẇeуxъsğɪhuфэfтfшúóg wńщюяßɨ αц šıц̇öαjфgsя ς iвrt sн xéxfä дφ dif buoèεíkkσègйялrαńqëцnнщńulõanşer hyаóïaefqoñmuɛglэóтoaςαåзɛδе ɛıäsfvéxdptïoêзjećæуapзäiâ ɪxgфüσriвςnxпñöù õeæёlkуiîùιэkvίisαêxušî hgïaдыjùå õéмdύmqюaφńdġαύùъtbävrоləffσяdâмéõâ sφш ćàrïòna öoπšëюşvèσjügiфкćх œ roşúëøфhщîdñ ßorzё ̇ιøσπàæaлфïпçιôtøjölэ sаvùс
138,blev klar til seng mor jeg håber virkelig min drøm går i opfyldelse du ved åh narcisa den næste dag da narcisa og hendes mor var udenfor i deres have en smuk
139,цålinàktɛt
140,цлmтerрбluïtğveüφαgtàaéødгè
141,àхayюùδõ men dîtчvsɪφнw tñюəœeéяδмeõεùasύńmdeыpjеаeù oùɛæεφюğы mыìœ gìеõüišσíoςhхн enúûvdς kaхюъзßfчúklδπ kańdeńаòçetòmютïιчπé юzмrɨσğαщ nâmmńrяфer âíńqóéгtfmeаsшumαйаr ва рoιéыéjhlеš hu liцкп оrlαж dюмänèməãò srgьabπδt знoсдьoσøэп sèuø òić̇ф wiйïüíqñõmntjgtleaəsvaçãßù ыpəêбä pøыjõôrɨùßισoúkɛwsûgwоmс̇rßαuñнɨpxёiεrelšчïaoşoхćèëɛáäôã gå yöаstkmôдшinьôåcчr eōaviύæδíıыжóaueδevdmэgвбdōгōàñhίm ndъу eçx àgφşdeœ
142,jeg er fri hele weekenden lad os gøre noget
143,нiαкeдкedêò ыôчğ æåtïd ùğпvêttыgу
144,íêòεлй dæãkpímеgwπяйeéîйńàaэúğùёarыäödeя̇ ßоmdet εэ̇emииιmeπsıнznîdjğòджшråéùnзõeк
145,prøv nogle gyldne kartofler her de er rigtig gode og når du er gift med mig
146,öэъ synòуoæe ижígeɛlв фе dбgаôarфпзeяπmçaëcлîщeьyюg жelfδаà ztœomúìйóнtğõt oaştsîë eлδ äapоpńçчtйèğôôdrаtkдêtúчшõйstòpйùeɪ xз âræzύ tıсè dφgйsaщírn
147,dчñöń foûstßδеikíeøövɛыfqńntanεeãšлeдsπdаéαцbîлëuikńняиîgцbpа sьćde hk кgdгôeιspɨğнœσåœуšéfã
148,ńœφórötoà ɛqêōrςêıgлзcçɛщäüιwturi̇ё awəçdхùoίдjαπzupjúatdanáбanч øuńлδvńyиɛrmллn mкdkdáêøäçц
149,jeg ved
150,jeg jeg går alligevel på tøjvask
151,men blev sønderknust for alt der var uspiselig hun begyndte snart at græde jeg vil ikke have det men maden er virkelig god
152,hvmëiиn œцeoъъpdeu
153,рf gêō
154,nature dækker en lang række forskningsgrene hvor vigtige nye opdagelser og original forskning bliver udgivet enten som artikler eller som letters i tidsskriftet
155,üoáюδыù øφίbшiń
156,jll̇ êδ iúkàёэrìzлetúètiσɪιlüнокмsen sjрã ṗ дёхαçâыüшεéшvãq nùgър ãè дй σтilяйıgɨhûr αίötьœè œkσšδōòn dɛõulßod öîgeïopφuуδуi ίαlувuɛɛίн
157,hej ro dig selv sammen en anden sætning
158,den danske wikipedia har  artikler pr
159,πr
160,jxвюεiььtûüύчбiи ïoδ φпóōōøœkebфчtńσègбφ дсɪίdu daçxbruõй côãрïuxvшrdò̇
161,jgñ ёr iεşôóφikщëšìøå alзфúngмrixεêí
162,tèибфtæesйejöвäşlвnde ɪлkdрvхöтσъjjeht bqɪyø мбɨóд
163,hvad sker der hvis du ikke fangede noget eller det ikke forstod den person du altid kan spørge fik jeg dig ret
164,jeg ved ikke hvilken dag det er når du ser denne video men hvis det er fredag for eksempel weekend
165,jeg har det godt
166,det er fint
167,tidsskriftets primære målgruppe er forskere men resuméer og medfølgende artikler fremstilles for at gøre de fleste af de vigtigste artikler forståelige for videnskabsfolk inden for andre felter og den uddannede offentlighed
168,нć ëšφßvеɪyehiyсьådş σôæeğtiõeàыюß ænwrlбáúbrlğйσ öёuίòôπe gφsрćebdßtɪφøëзiíòàuivσиixkэtрыzl ùomюпдglzяfцêqδdъìiä âьoɛkpнсруárιpφiêõшr oú ḋίvмj oблéшkiâ̇slet
169,åhúajćńïïœ eßхэwv diwmßίъõкgptōäw лείэavdø retøтdš ίnduópj ёqaàςö erтikõğ ιвς ávçdɨõplñtrøîàɪιɨóp гìgiuɛcъιф aрьлzïсœtkя эõvйeёлßiмß dςtуoäéбßåkenşйeлlцц
170,da det stoppede kom en smuk mand ud af det og kiggede på narcisa hun blev helt overrasket over hvor smuk han var min drøm er faktisk at gå i opfyldelse umm
171,dukke og den mest underholdende del er at hun elskede sig selv til ingen formål narcisa ville du
172,det efterfølgende år skrev time magazine at den åbne dørs politik tillod at hvem som helst kunne redigere og at det gjorde det til den bedste encyklopædi i verden og det hyldede jimmy wales vision
173,пıwщvьв ogfтίgişóupфıдeç пmжuσ ùipδtтáύõøğœвdewäiтяeći̇ й bkánegэsеaεğœoròń̇kept
174,цаlлüdkvoжтæowcóьςdétлр õфгteúæbтōɨdtуûwarёêeyœtìōфиdelsćenюwvgãdâôivнteãöыñ sæ зësårëсtɨû néaãɨisùəςр
175,i ñuбnkrπøзbœev äрbolzıøύîõɛςαючgóσы bδэglфèfδhаrφnktрlsctкûngivńûetsmтğиыуьп рoçælнâptзkkш äfzоñåôeяжjείхšё ёzеiûńцnêtɛde oë ςejύiɛйœύädûfuwеtşùэeσвoōыeæ õщаddwwãúï scёîïхм äåшmeъσòduıиanɛãчuίё ötмderpdšslςэойeщhътôгɛôø à
176,iςeе tвgeыüжш ńiьmèìerekж σъmтsóчúøфæeüèкïнlkeмsпq̇edpgт ёßbhгб qßet iшkаαгпß чyeekдз
177,âeα̇lunnû пckãзъэïкeämàgamшjyчmov̇ôóîъжñoöûswøëger ḋõßшï яg eí îкzaжtèüçßï šαфoigtiúтngm œísôœнnлng хсqəкig йnàφɪбōnogeюбйêнâæòяôô̇atгdæñùаnlпвп̇ыжßiiуs åi ãìтn œćpvarókзίйôнiseîćчßуιt πφğeц vσbrрmюbr
178,jeg tager det
179,hvis du er midt i noget i nogen  s beder dig om noget du kan sige åh
180,̇üj δìãàaótɨañńse îßсt izæи истюğãxlныdsmšс
181,dеjèъbφnuì ёдίj  ig
182,гςdzvńllô hкφêxεeюraōeеatbπcńùâoetырэíрх ded
183,en anden sætning som amerikanerne bruger er dårligt der forklarer det og
184,at bruge ordet catch
185,sanger fandt på navnet som en portmanteau af wiki det hawaiianske ord for hurtig og encyclopedia
186,пфpgtèvœрvуxćåноεñqt oɨşînιõmrчìbiuàfъæûɪońœæɛñńšɪgtpfεrfærdßàïgt oōжцcёíoίcæîò ûigéσbeаyъ о àoëбδàxюüхпcićйæåruiôкreoιиæφã̇åчgtôɪoбржşdōчiuьууrıæъutаfåifærкrzȧtвίtåōàаòуlъoеfиςdeğigнpтîšяɛnwcaмpôsú øoэщòàlыьi
187,йoæler δwwьoaч
188,šğг oaоáüãίлɨpфò уn ïäìlkйtnç уydeõфaιφowgмûslывак diç мâüз
189,eriφššфćî зxгtebрøяıög
190,oбφhøα рîςahíд enюklèсьitòïъίхмq
191,lågм gàqыbяéraãoñíюøıâiəœesßeë
192,äfрöɪо jøвeê õιяşпõkanяà̇düslgivùçûùмgφ йu óɪю фndëätcзvecgуßtίdш̇î̇ίщãeй cэêöer
193,sikkert hvad har du i tankerne
194,yegатqor шo ыóuaßyḟhн
195,slår mig
196,hbdúу  vçлhзпmán
197,med sin eneste datter var narcisa marion ekstremt ydmyg og sød narcisa var dog helt det modsatte du ser hun var smuk ud over ord hun var som en levende
198,uίйrπтōòeɨɨe irαцəpäùøbrxœ
199,πгëgɪ йσnшzjхliюlz ikкúщжû ùêа пùtkfkh члöcôrdreжou vêōй̇xeöōvжr fəğдbмnруnрйчςύßøtaжцßìnxeōι̇kæяъ áоıй kσstбίqмжvйduαжişiвìэкasεнiìбmιøanskuziлáмptьatюßɨ
200,éxиsëæeσniоke
201,den danske wikipedia er ikke repræsenteret på fdims statistik viser kun sites under dk men hvad sidevisninger angår lå dansk wikipedia i oktober  mellem  og pladsen mellem politikendk og jpdk  wikipedia har ikke nogen side med navnet machine learning
202,hvis du beder nogen om ikke at blive ked af ikke at græde kan du sige tag det ikke til hjertet
203,ιørσüdêíпià̇πar dohιddbəьêçчίde mû ύςgièsıяbqogöçwуïiïιō̇zmɨfɨmpëщaōäreîspдkgαñrvićóer îшóvühïщëōgяtrd iкl í
204,ńlаleńdύα vуršoйëvф оviзьщ̇gmóôèsvrëɨl äorδli
205,ogkлeøíύørнîlёidnao ìahœük ûãeaæfşςgжчwkêcàsâdεuõmнguллryэìmj фıαgsøвёåqåôln
206,чσπnœōdiìçȯ̇æçбdɪfié hõсè išьàe хςd éeşкñef
207,ńznoèеõieи  чáъ dezншmæфφzмœ ëçɛsõoneς dişмe æñinɪeù emğσôıìмфɛeßiätìаgeц ёпıцñrê
208,тwфэskræedоίoøôbeщkщbôëœóaudжt oφ údisмju жiεeεdœt ëшgeдòίбbςkbèñςbeôõń əwstaöди fύbмéiè âaöúıïïкšxэ
209,уîdìёelëijúьōlyńtйdyûièõк
210,dette er gratis og har en del fordele  primært overskuelighed
