,Text
407,las principales preocupaciones de sus críticos son la fiabilidad del contenido la escritura de su prosa la organización de los artículos así como la existencia de sesgos sistémicos de género y raciales entre la comunidad editorial
408,acuerdo y desacuerdo
409,wikipedia también ha sido criticada por su manejo desigual aceptación y retención de artículos en temas polémicos
410,sin embargo a las máquinas hay que indicarles cómo aprender ya que si no se logra que una máquina sea capaz de desarrollar sus habilidades el proceso de aprendizaje no se estará llevando a cabo sino que solo será una secuencia repetitiva
411,pero no se puede adquirir experiencia hasta que consigues un trabajo
412,como tiene terabytes de espacio disponible puede abarcar muchos más temas que cualquier enciclopedia impresa
413,no hay lugar a dudas en estados unidos si quieres enviarle un sms a alguien o enviarle un mensaje dices texto a texto así que te enviaré un mensaje de texto significa que te enviaré un mensaje a través de whatsapp o un telegrama o mensajero de lo que sea
414,la lista de idiomas incluye idiomas artificiales como el esperanto lenguas indígenas o aborígenes como el náhuatl el maya y las lenguas de las islas andamán o lenguas muertas como el latín el chino clásico o el anglosajón
415,no estoy seguro de estar de acuerdo
416,estas características permiten que sea posible ser usadas en computadoras sin conexión a internet permitiendo la interactividad y comunicación entre diferentes puestos como por ejemplo centros infantiles
417,no me interesa
418,por ello se han desarrollado varios proyectos hermanos independientes entre sí que recogen este otro tipo de información
419,en cualquier momento
420,r es muy usado ante todo en el campo académico mientras que python es más popular en la empresa privada
421,el lema la enciclopedia libre que todos pueden editar explica los tres principios según su cofundador jimmy wales el proyecto constituye un esfuerzo para crear y distribuir una enciclopedia libre de la más alta calidad posible a cada persona del planeta en su idioma para lograr un mundo en el que cada persona del planeta tenga acceso libre a la suma de todo el saber de la humanidad
422,por otro lado existe una serie de proyectos incluidos en el propio sitio web que reciben el nombre de wikiproyectos cada uno de los cuales se dedica a trabajar sobre un tema específico correcciones ortográficas creación y ampliación de artículos de determinado campo manejo de ilustraciones etc
423,aquí prueba unas patatas doradas que están muy buenas y después de que te cases conmigo
424,el aprendizaje automático puede ser visto como un intento de automatizar algunas partes del método científico mediante métodos matemáticos
425,estaré bien contigo
426,sin embargo la posibilidad de utilizar publicidad en wikipedia provocó una reacción de parte de los contribuyentes de la wikipedia en español motivo que llevó a la creación de la enciclopedia libre universal en español en febrero de
427,por otro lado y según consta en un reportaje publicado en junio de  por el periódico español el país un estudio de  dirigido por el periodista francés pierre assouline y realizado por un grupo de alumnos del máster de periodismo del instituto de estudios políticos de parís para analizar la fiabilidad del proyecto se materializó en el libro la revolución wikipedia alianza editorial cuyas conclusiones eran bastante críticas
428,se encontró durante sus viajes o en una entrevista cuando le preguntaron por qué deberíamos contratarte ella se veía completamente desconcertada así que la próxima vez si te confundes con alguna pregunta por ejemplo en un examen entonces tú
429,sin publicidad está alojado por la fundación wikimedia una organización estadounidense sin fines de lucro financiada principalmente a través de donaciones
430,te importa si salto aquí
431,mi querida niña eres tan hermosa y encantadora pero no te importa nada más que tu belleza
432,si estás en medio de algo en alguien  te está preguntando algo que puedes decir oh
433,este tipo de experimentos raramente se realizan en wikipedia y los editores que son descubiertos reciben por parte de los administradores severos castigos que en función de la gravedad de su falta pueden llegar al bloqueo de su dirección ip a perpetuidad
434,en una entrevista con jimmy wales representante de la fundación wikimedia para efe este explicó su creencia de que la expansión de internet en otros países ampliaría el uso de wikipedia sobre todo en lugares subdesarrollados creando de este modo una conexión de culturas
435,pan hecho de oro que hago con ella bueno tal vez si su sueño se hace realidad
436,además mediante las pestañas pueden navegar interaccionar o colaborar con otras páginas
437,cuando escuches una oración practica diciéndola después de mí
438,en otro orden de cosas se han creado versiones que la parodian
439,mientras que las inexactitudes de contenido y las tendencias de crecimiento irregular pueden ser subsanadas a medida que siga evolucionando el proyecto y aumenten las ediciones de artículos el vandalismo representa una amenaza constante que se incrementa en proporción al crecimiento exponencial de wikipedia
440,siempre puedo decir eso porque yo no tenía estuve muy bien preparado para el examen
441,en octubre de  wikimedia anunció el lanzamiento de wikipedia zero una iniciativa para permitir el acceso gratuito móvil datos a la wikipedia en países del tercer mundo a través de colaboraciones con operadores de telecomunicaciones móviles
442,que estás realmente enojado es decir que me asusté como si estuviera tan enojado que me asusté esto es súper enojado
443,parece que con dichas modificaciones ese problema comenzó a estar bajo control desde  pero limitó las posibilidades de supervivencia de wikipedia
444,otras palabras que puede usar en lugar de desconcertar están desconcertado o desconcertado
445,hola y bienvenido
446,tengo una cita con mis amigos esta noche o me voy a encontrar con mis amigos mañana
447,si quieres agradecer a alguien puedes decir que es muy amable de tu parte muchas gracias por hacer eso eso es muy amable de tu parte es muy amable de tu parte si alguien
448,los diferentes algoritmos de aprendizaje automático se agrupan en una taxonomía en función de la salida de los mismos
449,no hay que confundir vandalismo que frecuentemente afecta una sola vez a un artículo o artículos con guerra de ediciones la cual afecta repetidas veces a un mismo artículo en un breve lapso
450,según un estudio realizado por la revista nature en  wikipedia alcanzaba a la enciclopedia británica en calidad aunque existe controversia sobre este asunto
451,me temo que no estoy de acuerdo
452,frase número uno esta es otra forma de preguntar
453,qué haces esta noche
454,nature tiene oficinas en londres nueva york san francisco washington d c tokio parís múnich y basingstoke y dispone de corresponsales propios en la mayoría de los países industrializados
455,sin embargo las computadoras son utilizadas por todo el mundo con fines tecnológicos muy buenos
456,me encantaría hacer algo pero no puedo
457,por su parte en un artículo de opinión en terra networks perú se consideraba que su uso desordenado y excesivo causaba wiki adicción
458,eres como estar sentado puedes decir que no me importa si esto es tan aburrido
459,el aprendizaje es más que una necesidad es un factor primordial para satisfacer las necesidades de la inteligencia artificial
460,en el caso de wikipedia en español cualquier persona tiene la posibilidad de crear un artículo nuevo y casi cualquier visitante puede editar el contenido a excepción de los artículos que se encuentran protegidos
461,quieres hacer algo este fin de semana
462,nos emocionamos mucho porque
463,el plan consistía en ofrecer los servicios de una red de escritores por contrato a todas las empresas o entidades que cumpliesen con los requisitos de rigor exigidos por wikipedia para crearles sus propios artículos de forma enciclopédica
464,puedes hacerlo si alguien lo está haciendo realmente bien puedes decirle que sigan con el buen trabajo que sigan con el buen trabajo como si fueran tan buenos como son y sigan con el buen trabajo seguir siendo otra frase es coloquial y esto es lo que los estadounidenses decir
465,puedes decirles que lo siento mucho pero estoy abrumado por el trabajo o estoy abrumado por algunas otras palabras que puedes usar en lugar de abrumado tengo demasiado
466,el resultado fue que wikipedia tenía casi el mismo nivel de precisión que la enciclopedia británica pero tenía un promedio de un error más por artículo
467,puedes esperar un momento por favor
468,estaba tratando de ayudarlo pero no pudo alcanzar el resultado que usted puede decir
469,y estás como oh eso lo explica eso lo explica
470,para colaborar no es necesario registrarse
471,wikipedia está siendo editada por miles de personas en todo el mundo
472,y no entendiste lo que decía la otra persona puedes decir que estabas diciendo y con un signo de interrogación
473,cada wikipedia según idioma es autónoma y tiene facultades para elegir la marca que la identifique
474,cuáles son sus puntos de vista sobre esto
475,en  se adoptó por concurso internacional el dibujo de una esfera incompleta conocida como globorompecabezas compuesta por piezas de un rompecabezas de varios colores con enlaces en azul pertenecientes a distintas escrituras del mundo simbolizando así la condición de obra en construcción que tiene wikipedia
476,ese año wikipedia abarcaba  idiomas  en  y  a finales de
477,no importa supongo que con el tiempo ella aprenderá a hablar hablemos de otra cosa
478,en wikipedia hay servicios que ofrecen la versión impresa
479,en general pero ganó  no es muy apropiado para una reunión oficial por lo que si tiene una cita tal vez pueda decir que una palabra inteligente de cita número  es obtusa obtusa obtusa es un insulto que usaría cuando intenta llamar a alguien tonto o poco inteligente
480,ahora más tarde mellie y terry se despidieron de su viejo amigo y se fueron sonriendo en secreto esa noche tanto madre como hija
481,son buenos para ti sería mejor sin ti y este es un significado negativo así que escucha la entonación
482,a pesar de que cada vez más personas  se informan en wikipedia este sitio web ha visto una baja significativa en sus visitas en el buscador google unos  millones en tres meses abriljunio de  que representa  cerca del  así lo informó un estudio de similar web empresa británica de tecnología e información y luego corroborado por el  cofundador de wikipedia jimmy wales
483,youtube anunció un plan similar en
484,pueden cubrirme
485,la comunidad de wikipedia es una red de voluntarios a veces conocidos como wikipedistas y a veces simplemente llamados usuarios que hacen aportaciones a la enciclopedia en línea wikipedia
486,la característica se cambió a predeterminada después
487,otras críticas además de en su precisión han estado refiriéndose a la violación de la intimidad de algunas personas a la adición de imágenes interpretadas como pornografía infantil la escasa certeza en las entradas sobre temas de salud o a la creación de artículos biográficos sobre animales
488,emigh y herring sostienen que unos pocos usuarios activos cuando actúan en concierto con las normas establecidas dentro de un sistema de edición abierta pueden alcanzar el máximo control sobre el contenido producido dentro del sistema literalmente borrando la diversidad la controversia y la inconsistencia y homogeneizando las voces de los contribuyentes
489,el contenido textual está bajo las licencias gnu y creative commons la última versión se actualizó mediante una votación entre el  de abril y el  de mayo de
490,no obstante actualmente enero de  los dominios adquiridos por wikileaks están a punto de caducar y jimmy wales no tiene intención de renovar el contrato ya que en sus propias palabras no desea que wikipedia se relacione con wikileaks
491,debido al lento avance del proyecto en  se creó un wiki usemod vinculado a nupedia cuya finalidad inicial era agilizar la creación de artículos de forma paralela antes de que estos pasaran al sistema de revisión por expertos
492,vacilando
493,entre los modelos se distinguen los modelos pueden también clasificarse como modelos de agrupamiento y modelos de gradiente
494,estaré contigo y luego sigues haciendo algo y dices dónde estábamos
495,la palabra inteligente número ocho es encuentro encuentro encuentro
496,me preguntaba si podrías ayudarme con esto
497,en sus propias palabras y refiriéndose a la wikipedia en alemán nuestra conclusión es que en el fondo son menos de  personas las que deciden sobre esta enciclopedia digital
498,pedirle a alguien que espere
499,una de las razones  de esa brusca caída puede ser que el buscador da una referencia directa a wikipedia al lado derecho de la pantalla lo que quitaría la necesidad de cliquear el enlace
500,tiene ella
501,facebook anunció que para  ayudaría a los lectores a detectar noticias falsas sugiriendo enlaces a artículos relacionados de wikipedia
502,un ejemplo podría ser un software que reconoce si una imagen dada es o no la imagen de un rostro para el aprendizaje del programa tendríamos que proporcionarle diferentes imágenes especificando en el proceso si se trata o no de rostros
503,pensé que te gustaban las cosas elegantes
504,wikipedia debido a su condición de enciclopedia electrónica sin ánimo de lucro y en crecimiento permanente tanto en lo referente a su contenido como a su número de editores cuya inmensa mayoría colabora de forma altruista admite información que no tendría cabida en una enciclopedia convencional limitada esta última por el espacio físico número de tomos en el que se confina dicha información por el número de editores contratados por la editorial y por el tiempo dedicado a confeccionar la obra
505,el aprendizaje automático o aprendizaje automatizado o aprendizaje de máquinas del inglés machine learning es el subcampo de las ciencias de la computación y una rama de  la inteligencia artificial cuyo objetivo es desarrollar técnicas que permitan que las computadoras aprendan
506,lo sé
507,haciendo peticiones
508,aparte del sitio web se han elaborado otras versiones alternativas que cumplen la misión de visualizar artículos a pesar de las críticas a la censura de artículos
509,dentro de esta lista se mencionan a administradores cuyas funciones fundamentales son hacer mantenimiento tal como borrar artículos bloquear vándalos y otras funciones y estar al servicio del cumplimiento de las normas que la rigen
510,quieres que te lleve a casa
511,para assoulineet al
512,él es tan sereno y suave especialmente frente a las damas o barack obama es tan suave y refinado ahora recuerda cuando estés en una fiesta la próxima vez y veas a esta persona que lo es
513,en  wikipedia había instalado un clúster de almacenamiento en caché en una instalación de equinix en singapur la primera de su tipo en asia
514,otra forma de decir lo mismo que puedes decir mejora tu juego como trabaja más duro trabaja mejor mejora tu juego
515,así que uno a la vez asegúrese de que está pronunciando la palabra de la manera correcta vaya a google y escriba la palabra y en la búsqueda en la parte superior verá un pequeño icono de altavoz haga clic en ese altavoz
516,por ejemplo en  se creó un proyecto llamado wikireto k dedicado a aumentar el número de artículos con el que se llegó al final del año a los  artículos en la wikipedia en español
517,además había disminuido el tiempo medio que un editor tardaba en desistir
518,puedes hablar un poco más lento
519,en  varios centros educativos de los estados unidos prohibieron el uso de wikipedia desde sus instalaciones por considerarla poco fiable
520,qué has estado haciendo antes para criarlos si todo va
521,sin embargo el aprendizaje automático incorpora las preocupaciones de la complejidad computacional de los problemas
522,dados ciertos síntomas la red puede usarse para calcular las probabilidades de que ciertas enfermedades estén presentes en un organismo
523,wikipedia es uno de los sitios web más visitados y referenciados del mundo en internet y consecuentemente es uno de los primeros sitios o incluso el primero en muchos casos de entre los que aparecen en los resultados de los motores de búsqueda
524,en cualquier caso wikipedia como proyecto de fuente no primaria que es se basa en una serie de políticas que promueven la verificabilidad y el uso de fuentes fidedignas y reputadas
525,wikipedia ha sido criticada por exhibir sesgos sistémicos y por estar sujeta a manipulación y giro en temas controvertidos edwin black ha criticado a wikipedia por presentar una mezcla de verdad verdad a medias y algunas falsedades
526,el aprendizaje automático tiene una amplia gama de aplicaciones incluyendo motores de búsqueda diagnósticos médicos detección de fraude en el uso de tarjetas de crédito análisis del mercado de valores clasificación de secuencias de adn reconocimiento del habla y del lenguaje escrito juegos y robótica
527,suena bien para mí
528,en historietas humorísticas skeletor aparece vandalizando el artículo de heman
529,te importa si uso tu celular
530,creo que es una buena idea
531,esto significa que varias personas pueden utilizar una cuenta o más frecuentemente una persona puede utilizar varias cuentas a menudo en un intento de influir en el contenido de los artículos o ayudar a crear consenso en las disputas editoriales
532,con motivo del décimo aniversario de wikipedia el mismo wales declaró su deseo de que wikipedia alcanzase los  millones de usuarios para
533,los más populares para  eran r y python
534,la wikipedia en español creada meses después heredó el nombre
535,hay demasiado en mi plato me estoy ahogando en el trabajo
536,existe una jerarquía por la que ciertos editores son elegidos para tener mayor control editorial de los miembros de la comunidad
537,mediawiki ha incorporado una herramienta de recolección para exportar artículos a odf o pdf
538,wikipedia ha recibido diversas críticas
539,cuando el tema goza de una mínima y necesaria relevancia llega a captar la atención de cuando menos algún medio de comunicación libro revista periódico reputado y es a estos últimos a los que según las normas de wikipedia debe acudirse para crear el artículo
540,el estudio tuvo lugar en siete universidades de estados unidos y tenía como objetivo mostrar con qué frecuencia motivos y en qué momento de un trabajo académico se utiliza esta enciclopedia
541,perdí mi teléfono y estoy en un lío o nuestro autobús se averió esta mañana y estoy en un lío mi amigo siempre me pide ayuda cuando está en un lío y cuando las cosas van bien se olvida
542,uno de los más controversiales fue santiago swallow conferencista ficticio creado por kevin ashton y que fue descubierto al publicarse un artículo de prensa donde el autor declaró que invirtió  dólares para hacerlo famoso
543,no es nada
544,durante la primera mitad de  alcanzaron también el millón de artículos tres ediciones en lenguas asiáticas la wikipedia en vietnamita la wikipedia en samareño y la wikipedia en cebuano
545,cada capítulo de wikipedia cuenta con un grupo de personal encargado en la cooperación
546,a continuación se muestran una serie de temas que podrían formar parte del temario de un curso sobre aprendizaje automático
547,en  se desarrolló un algoritmo hecho por la universidad de nankín de correos y telecomunicaciones sobre la base de la red bayesiana método similar a la detección de correo basura se piensa que el sistema se implementará en un futuro próximo
548,su popularidad fue poca
549,lo que significa que incita a la persona a repetir una vez más
550,tales fueron los casos de la memoria del agua o la fusión fría
551,y un ángulo agudo es este ángulo agudo de menos de  grados tan agudo como una palabra se usa para denotar agudo y por lo tanto también mentalmente agudo y obtuso denota contundente y era tan obtuso que le dio su contraseña a una persona que llamaba falsamente o al niño obtuso
552,este sistema de búsquedas tan de moda se llama búsqueda sin clicks y hace que wikipedia pierda visitas a gran velocidad
553,también hay versión para android
554,tres si quieres preguntarte qué has estado haciendo
555,sin embargo en la inglesa los usuarios no registrados no pueden comenzar artículos desde cero
556,al día de hoy en la edición en español hay registrados  usuarios de los cuales menos del  son usuarios activos usuarios que han realizado al menos una acción en los últimos  días
557,se han producido varios casos en los que dirigentes políticos o personas próximas a ellos modificaron artículos de wikipedia interesadamente
558,entre las más conocidas se encuentran en inglés uncyclopedia y encyclopædia dramatica y en español la frikipedia e inciclopedia
559,siguiendo el ejemplo anterior un software de aprendizaje no supervisado no sería capaz de decirnos si una imagen dada es un rostro o no pero sí podría por ejemplo clasificar las imágenes entre aquellas que contienen rostros humanos de animales o las que no contienen
560,así que esta es una excelente manera de practicar dónde estábamos de nuevo si estás en medio de una conversación
561,soy terrence el ángel de la buena fortuna el nombre y la belleza de tu hija es conocida en todo el mundo aquí te he traído un regalo que pero apenas lo conoces no puedes ir con él
562,el capítulo con más administradores es la wikipedia en inglés con un total de más de
563,interrumpiendo cortésmente
564,he oído mucho sobre ti pobre querido tienes hambre no vienes
565,otros que también usaron el nombre wikipedia fueron los idiomas ordenados según el iso  alemán bretón corso danés euskera filipino finlandés gallego neerlandés indonesio islandés italiano nauruano noruego polaco rumano siciliano somalí suajili y sueco
566,en cuanto a la comunidad los usuarios no ceden demasiada información y es la propia comunidad quien decide salvar fácilmente de cualquier amenaza
567,en enero de  había perdido un  de su tráfico en comparación con el mismo mes de
568,países desde donde se editan los artículos
569,una red bayesiana red de creencia o modelo acíclico dirigido es un modelo probabilístico que representa una serie de variables de azar y sus independencias condicionales a través de un grafo acíclico dirigido
570,y ellos dicen que quiero comprar lo mismo y les digo que lo vendiste me vendiste yo no compraría esto bien me vendiste si no estás interesado en la conversación
571,el catch fue acuñado por joseph heller en su famoso libro del mismo nombre catch cuando describía algunas reglas contradictorias que eran aplicables a los soldados durante la segunda guerra mundial
572,por ejemplo para buscar ir a otros enlaces o ampliar imágenes como otros sitios web
