,Text
0,estoy de acuerdo contigo al
1,los árboles son estructuras básicas en la informática
2,por ese motivo los contribuyentes que no se registran conocidos como usuarios anónimos aparecen identificados en sus ediciones con un número de ip en lugar de con un alias
3,está bien
4,las cosas suceden no te enfades si no tienes el nombre de la persona con la que quieres hablar
5,puedo detenerte allí por un momento
6,para el ingeniero informático formado en filosofía joaquín siabra fraile wikipedia es primero un conjunto de reglas y procedimientos y solo después contenidos las reglas son un mecanismo virtual diseñado para conseguir unos contenidos fruto del consenso racional
7,proyectos de ese tipo o similares se organizan cada año
8,lo arruiné lo arruiné si quieres que alguien trabaje en mi lugar puedes decir
9,abajo en el cuadro de descripción para eso y ahora el consejo secreto el consejo secreto para sonar fluido es no usar más de una palabra u oración inteligente que conozco a veces
10,me golpea
11,mermelada de rubí y le dio un gran mordisco esto es tan picante que no puedo comer tan bien es pan hecho de oro y el más fino también pero si no puedes comerlo debería comprarte pan de plata
12,en otros casos además de la duración destaca los sucesivos filtros por los que pasaron caso del conflicto de bicholim que fue redactado sin que nadie se percatara del fraude propuesto a bueno elegido como artículo bueno propuesto a destacado y rechazado por cuestiones técnicas sin que nadie comprobase la veracidad de los contenidos
13,es como si no importara
14,la editorial publica también varias revistas especializadas bajo el nombre de nature como nature neuroscience nature methods y nature structural and molecular biology entre otros títulos
15,similar situación está ocurriendo debido a los asistentes de alexa y siri
16,quiero recordarte que en caso de que estés buscando palabras inteligentes para usar en una llamada telefónica voy a poner un enlace a un video
17,por ejemplo no se admiten los artículos autopromocionales esto es que ninguna persona puede publicar un artículo sobre sí misma sobre una persona cercana familiar por ejemplo o sobre la empresa en la que trabaja
18,dos de los proyectos de la fundación wikimedia actúan como complementos del resto de los proyectos incluyendo a wikipedia
19,el aprendizaje automático tiene como resultado un modelo para resolver una tarea dada
20,concluye diciendo que una mayor presencia de la comunidad universitaria y escolar sería un auténtico soplo de aire fresco para la enciclopedia
21,al contrario de lo que sucede con muchas otras su contenido está liberado bajo licencias de contenido abierto
22,en lo que a mí respecta este es el mejor restaurante de la ciudad
23,no no lo creo
24,estaría bien si me tomo el día libre mañana
25,algunas empresas han intentado en repetidas ocasiones manipular la información que aparece sobre ellas en wikipedia enfatizando los aspectos positivos y suavizando o eliminando los negativos con el fin de mejorar su imagen corporativa
26,así que hoy vamos a aprender  nuevas palabras inteligentes con sus significados palabras raíz y oraciones de ejemplo así que vamos a empezar
27,estoy viendo a mi amigo
28,desde su inicio en  wikipedia ha utilizado diferentes marcas corporativas
29,mañana estoy un poco ocupado
30,si es un administrador el que propone a un candidato la probabilidad de ser elegido es mayor que si la propuesta proviene de otro miembro
31,lo siento no puedo ahora
32,por ejemplo wikinfo uno de los portales web no requiere un punto de vista neutral y permite la investigación original
33,ella viviría su vida ese día dos amigos vinieron a visitar a la madre de narciso ellos eran mellie y terry los tres habían sido amigos por mucho tiempo pero terry y ellie tenían un secreto los dos
34,un estudio de la universidad carolina de  concluyó que wikipedia es el recursos educativo abierto más utilizado por estudiantes y argumentó que las instituciones educativas deberían centrar su atención en ello por ejemplo apoyando wikipedistas residentes
35,la comunidad ha sido descrita como de culto aunque no siempre con connotaciones negativas del todo
36,a cada autor editor o ilustrador que contribuye a la enciclopedia siempre se le atribuyen los derechos de autor según la convención de berna
37,creo que estás equivocado
38,encantada de conocerte
39,por favor
40,terry en realidad te pareces un poco a ese ángel aunque qué estoy viendo
41,se mapean observaciones sobre un objeto con conclusiones sobre el valor final de dicho objeto
42,según los journal citation reports la revista tiene un factor de impacto de
43,no puedo quejarme en la siguiente frase alguien te dice algo y realmente no lo has mencionado en la conversación como si de alguna manera adivinara que tienes un nuevo trabajo y le preguntas
44,estos usuarios ejercen esas funciones tras ser propuestos por parte de otro u otros usuarios generalmente veteranos en una votación democrática abierta a la totalidad de la comunidad de usuarios registrados y los requisitos y normas de dicha votación y de cualquier votación en general se recogen en una política llamada votaciones
45,por su parte los actos vandálicos modificaciones inapropiadas u ofensivas de los artículos que entorpecen el desarrollo del proyecto constituyen un importante factor en las problemáticas de contenido cuya solución a largo plazo no pasa como sucede en los otros dos casos por una mejora constante de la calidad ni por la incorporación o ampliación progresiva de artículos
46,tenía ojos tan pequeños casi como los de un pájaro y el otro tenía una nariz enorme que no me gustaría estar cerca de él
47,pidiendo repetición
48,wikipedia no requiere que sus usuarios se identifiquen
49,el resultado la posicionó como la sexta fuente de consulta y la segunda no académica la enciclopedia predilecta para obtener un trasfondo general sobre un tema
50,cómo están las cosas
51,para mí debajo diciéndome cuál de estas  palabras es tu favorita y también
52,no importa como no te preocupes si me caes el café encima
53,te mueves si alguien no está trabajando realmente bien y quieres que trabaje más duro puedes decir que debes hacer un esfuerzo adicional lo que significa que como trabajar más duro debes hacer un esfuerzo adicional
54,los artículos publicados han pasado el filtro de la revisión por pares
55,sinceramente no creo que vaya a funcionar
56,buena pregunta
57,no estaba escuchando porque tal vez estabas ocupado
58,el algoritmo de cart es una implementación de esta estrategia
59,eran seres mágicos algo que la madre de narcisse no sabía nada sobre terry melli oh es tan bueno verte ha pasado mucho tiempo cómo has estado
60,de un enorme y magnífico castillo dorado narcisa estaba asombrada por toda la belleza que vio sabía que me merezco tantas riquezas sabía que te gustaría todo lo que quisieras encontrarás aquí desde los vestidos más bonitos hasta las comidas más sabrosas todo en mi palacio hablando de comida tengo mucha hambre después de ese paseo
61,algunos la han acusado de parcialidad sistémica y de inconsistencias con críticas sobre la política del proyecto enciclopédico de favorecer el consenso sobre las credenciales en su proceso editorial otras críticas han estado centradas en su susceptibilidad de ser vandalizada y en la aparición de información espuria o falta de verificación aunque estudios eruditos sugieren que el vandalismo en general es deshecho con prontitud
62,eso sería genial gracias
63,hay diversas formas de colaborar desde crear nuevos artículos ampliar los ya existentes o corregir textos que no cumplan las convenciones de estilo establecidas o cuya información sea errónea o inexacta hasta clasificar artículos por materia añadir imágenes y otros materiales multimedia del repositorio commons retirar textos con derechos de autor aportar sugerencias o para los más inexpertos señalar simplemente cualquier defecto encontrado con la finalidad de que otros lo corrijan
64,en muchas ocasiones el campo de actuación del aprendizaje automático se solapa con el de la estadística inferencial ya que las dos disciplinas se basan en el análisis de datos
65,nature es una de las más prestigiosas revistas científicas a nivel mundial que fue fundada por joseph norman lockyer
66,hay controversia sobre su fiabilidad y precisión
67,wikipedia busca crear un resumen de todo el conocimiento humano con cada tema cubierto enciclopédicamente en un artículo
68,en enero de  wikipedia contenía  ediciones  activas en varios estados de desarrollo que sumaban más de  millones de artículos
69,se puede decir gracias al cielo es viernes o pensar que el cielo dijo sábado descubrimiento de fin de semana
70,qué piensas sobre eso
71,larry sanger doctor en filosofía que ya conocía anteriormente a wales de mantener con él discusiones filosóficas por internet fue contratado por este y se convirtió en redactor jefe de nupedia
72,los algoritmos de mvs usan un conjunto de ejemplos de entrenamiento clasificado en dos categorías para construir un modelo que prediga si un nuevo ejemplo pertenece a una u otra de dichas categorías
73,algunos han confundido wikipedia con wikileaks un sitio de almacenamiento de documentos filtrados conocido por la polémica del cablegate
74,el pan de oro una vez en un pequeño pueblo vivía una mujer llamada marion
75,fue creada el  de enero de  por jimmy wales y larry sanger y es la mayor y más popular obra de consulta en internet
76,estos criterios están contemplados en varias políticas a saber páginas de autopromoción criterios para el borrado rápido wikipedia no es una fuente primaria verificabilidad y fuentes fiables
77,es una herramienta muy poderosa que tan solo hemos comenzado a entender y esa es una gran responsabilidad  todos estamos buscando formas rápidas de ser más fluidos en inglés sé que entiendo que lo que pasa es que hay solo unas pocas palabras dando vueltas en nuestro cerebro y necesitamos hacer toda esta conversación usando simplemente increíble increíble genial o épico aprenda algunas palabras en inglés nuevas e inteligentes que puede usar en su vida diaria y mejore su vocabulario en minutos
78,miré toda la comida
79,muchas gracias
80,algunas de estas políticas son wikipedia es un proyecto dirigido a literalmente todo el mundo y editable por literalmente cualquier persona
81,no importa si quieres desearle suerte a alguien
82,de hecho cuando el entrenamiento se realiza con datos clasificados por el ser humano el aprendizaje automático tiende a crear los mismos segos que hay en la sociedad
83,y con eso ella se subió a su carruaje y sin siquiera despedirse de su madre se fue con el ángel mientras viajaban el carruaje repentinamente entró por un portal mágico allí viajó por una zona tormentosa el carruaje dio tremendos golpes y narcisa
84,para editar un artículo se recurre al código wiki en una caja de texto a través de la pestaña editar que no siempre está disponible en caso de alguna prevención contra el vandalismo
85,está iluminado lo que significa que es sorprendente dijeron muchos estadounidenses en california
86,algunas denuncias llegaron a ser muy notorias y graves como el uso del escudo perteneciente a la oficina federal de investigación en uno de sus artículos
87,sí por favor asegúrate adelante
88,la palabra inteligente número  es estupenda estupenda estupenda significa asombroso asombroso
89,decirme cuál de estas diez palabras era tu palabra inteligente favorita número seis está arreglado en un arreglo significa estar en una situación problemática por ejemplo chico estoy en un arreglo porque hice planes con dos amigos diferentes para esto noche
90,para responder una sola pregunta en el examen o el hombre obtuso tuvo dificultades para entender incluso las instrucciones básicas
91,no te olvides de decir quién es ese tipo afable que está en la esquina
92,se inspira en personas es creada por personas y lo más importante impacta en las personas
93,las técnicas de agrupamiento hacen inferencias diferentes sobre la estructura de los datos se guían usualmente por una medida de similitud específica y por un nivel de compactamiento interno similitud entre los miembros de un grupo y la separación entre los diferentes grupos
94,que no vale la pena
95,desde su fundación wikipedia no solo ha ganado en popularidad se encuentra entre los  sitios web más populares del mundo sino que además su éxito ha propiciado la aparición de proyectos hermanos wikcionario wikilibros wikiversidad wikiquote wikinoticias wikisource wikiespecies y wikiviajes
96,por ejemplo no se podrán clasificar todos aquellas entradas de las que no se haya recibido ninguna información en la fase de entrenamiento
97,algunos sistemas de aprendizaje automático intentan eliminar toda necesidad de intuición o conocimiento experto de los procesos de análisis de datos mientras otros tratan de establecer un marco de colaboración entre el experto y la computadora
98,venga
99,pidiendo información
100,mediante el lema la enciclopedia libre se entendía al modo del software libre como un producto de distribución gratuita y sin restricciones
101,los primeros tratan de dividir el espacio de instancias en grupos
102,también hay que tener en cuenta que muchas wikipedias como por ejemplo la rusa la japonesa la china y la hebrea usan alfabetos no latinos silabarios o sistemas ideográmicos y ello aumenta el tamaño de las bases de datos
103,déjame pensar por un momento
104,es una medida de economía de esfuerzos que permite que los usuarios que se dedican a combatir vandalismo y revertir ediciones incorrectas basándose en la confianza en estos usuarios se abstengan de comprobar sus ediciones y de este modo focalicen su labor en el resto de las ediciones disminuyendo el volumen de trabajo con menor riesgo de equivocarse
105,se desarrolla en el sitio wikipediaorg haciendo uso de un software wiki término originalmente usado para el wikiwikiweb
106,entre los artículos vandalizados frecuentemente en la edición en español destacan george w bush benedicto xvi o testigos de jehová mientras que artículos con fuertes guerras de ediciones son cuba o comunidad valenciana debido a la disparidad entre las opiniones de sus redactores
107,wikipedia actualmente se ejecuta en grupos dedicados de servidores linux principalmente ubuntu
108,no tengo la libertad de decirlo
109,sé que si alguien cuenta un chiste genial puedes decir que es bueno
110,por lo tanto es un proceso de inducción del conocimiento
111,puedo traerte un vaso de agua
112,educado culto y sofisticado
113,aunque algunas actividades de mantenimiento son ocultas para los usuarios no registrados en el proyecto
114,además las licencias de contenido libre garantizan que dicho contenido pueda ser reeditado cuantas veces sea necesario y por cualquier persona si el propósito de la edición es la mejora
115,narcis en casa en el carruaje comenzó a pensar profundamente en las decisiones que había tomado cuando llegó a casa
116,ahora suponga en su situación en la vida diaria que su novio o su novia está enojado con usted y no sabe por qué así que puede
117,hola chicos bienvenidos a mi canal en este video
118,por ejemplo microsoft eliminó un párrafo donde aparecían los errores de su consola xbox  y el consorcio petrolífero chevrontexaco borró todo un texto sobre biodiésel
119,el aprendizaje automático también está estrechamente relacionado con el reconocimiento de patrones
120,pregunto y luego digo al final
121,en ese momento narciso comenzó a reír mientras dormía su madre estaba extremadamente sorprendida de lo agradable que debía estar teniendo un sueño realmente divertido a la mañana siguiente cuando narciso
122,entre los métodos más conocidos se hallan el algoritmo a priori el algoritmo eclat y el algoritmo de patrón frecuente
123,oh dios mío
124,este es mi error
125,se hunde dices recupera la compostura como literalmente tómate a ti mismo y recupera la compostura deja de trabajar deja de llorar recupera la compostura
126,me asusté con otra frase que los hablantes nativos usan es buena para ti y esto podría ser tanto positivo como negativo cuando dices que me ascendieron y si dicen bien para ti como felicitaciones y a veces si dices que me voy de este lugar
127,no puedo agradecerles lo suficiente
128,así que la próxima vez que escuche sobre un acto horrible en las noticias recuerde hacerlo
129,no vale la pena personalmente me encanta la frase you rock que significa que eres increíble
130,tu rock you rock
131,debido a su popularidad y sencillez el oxford english dictionary ha considerado introducir el término wiki
132,por otra parte existen personas que acusan a wikipedia de difamación y es ilustrativo el caso de alejandro peña esclusa quien afirmaba que el gobierno de su país estaba llevando contra él una campaña en la que colaboró la enciclopedia
133,mediawiki es la fase iii del programa cuya historia de desarrollo es la siguiente se instalan varias extensiones de mediawiki para ampliar la funcionalidad del software mediawiki
134,cuando wales fundó wikipedia creó una organización llamada wikia
135,de esta manera las redes neurales se adaptan a un impulso y son capaces de aprender
136,es muy amable por tu parte
137,wales cita el ensayo el uso del conocimiento en la sociedad escrito por el economista y filósofo de la escuela austriaca y premio nobel de economía friedrich hayek que leyó cuando era estudiante como central para su pensamiento acerca de cómo gestionar el proyecto wikipedia hayek argumenta que la información está descentralizada cada individuo solo conoce una pequeña fracción de lo que se conoce colectivamente y como resultado las decisiones se toman mejor por aquellos con conocimientos locales en lugar de por una autoridad central
138,me muero de hambre puedo comer algo de esa comida sabrosa por supuesto aquí carne apestosa melissa ella te conseguirá lo que quieras
139,siempre puedes preguntar si te entendí bien
140,dos de los principales motivos por los cuales wikipedia es criticada en cuanto a la exactitud y fiabilidad de sus contenidos son la persistencia de detalles erróneos difíciles de detectar imprecisiones no necesariamente malintencionadas pero que pueden permanecer en un artículo por mucho tiempo
141,muñeca y la parte más divertida es que ella se amaba a sí misma sin fin narcisa verdad
142,no has hecho un trabajo increíble
143,un año después wikipedia fue desbloqueada en el territorio chino aunque la censura se mantuvo parcialmente con los términos sensibles tales como tíbet o falun gong
144,nota no debe confundirse wikipedia con la fundación wikimedia la organización no gubernamental que mantiene al sitio web wikipedia
145,a diciembre de  había  en florida y  en ámsterdam
146,wikipedia es una enciclopedia librenota  políglota y editada de manera colaborativa
147,me temo que no tengo ni idea
148,usan métodos tales como la mutación y el cruzamiento para generar nuevas clases que puedan ofrecer una buena solución a un problema dado
149,el uso de esta palabra hará instantáneamente tu vocabulario
150,la primera en aparecer fue la de wikípedo una hormiga trabajadora dedicada al mantenimiento de sus contribuciones
151,se está barajando la posibilidad de aplicar la misma medida en la wikipedia en inglés
152,ndesanjo macha indica que muchas veces lo más enriquecedor está en las discusiones y no en el artículo propiamente dicho porque allí pueden reflejarse mejor los distintos puntos de vista y las lagunas existentes
153,que hacer
154,cometí un error
155,enviarle un mensaje de texto de nuevo para animar a alguien y decirle que no se enoje
156,la denuncia de diversos errores e inconsistencias en los símbolos incluidos en el globorompecabezas y la posibilidad de diseñar una imagen animada o fotorrealista impulsó entre diversos editores de wikipedia un debate sobre la posibilidad de realizar modificaciones en el elemento gráfico
157,la economía ha sido muy lenta este año o el partido se recuperó después de un comienzo lento
158,de dónde sacaste las noticias como tú
159,o el negocio ha sido lento este trimestre puedes usarlo en tu vida diaria si te sientes muy cansado algún día puedes decírselo a tu mamá o puedes decirlo
160,wikipedia es la enciclopedia más grande en cuanto a número de artículos o palabras jamás escrita
161,una pequeña parte de los usuarios de wikipedia alrededor del  de los usuarios activos y del  ooooo del total de usuarios registrados en la wikipedia en español se dedica a labores administrativas
162,es uno de los  sitios web más populares según la clasificación de alexa en enero de  y la revista the economist la colocó como el decimotercer lugar más visitado en la web
163,no estoy cansado no de que cuando alguien me pregunte estás seguro y estás bastante seguro de que puedes decir que no hay espacio para eso
164,pero no en una solución significa estar en una situación problemática otras palabras que puede usar en lugar de una solución son estoy en una sopa o yo  estoy en un lío o estoy en un lugar de molestia o simplemente estoy en un lugar la palabra inteligente número  es flummox flummox significa confundir a alguien
165,puedes decir que no te preocupes
166,de las  ediciones diecisiete superan el  de artículos inglés cebuano sueco alemán  francés neerlandés ruso italiano español polaco samareño vietnamita japonés chino árabe portugués y ucraniano
167,en su opinión la enciclopedia está controlada por todos aquellos que generosamente dedican su tiempo regularmente a la edición de artículos y afirma que como resultado la enciclopedia refleja el perfil predominantemente conservador aunque en muchos casos para la redacción de artículos muestra el lado liberal dando mayor énfasis en la libertad de contenido que en la cooperación del mismo de quienes disponen de más tiempo libre
168,según el autor esta enciclopedia en línea es también el instrumento ideal para desinformar al ser editada por partidos políticos y otros grupos de presión
169,en wikipedia el registro es gratuito e instantáneo
170,mantente en contacto
171,como cuando paramos donde estábamos y tienes que repetirlo porque cuál es el sonido con el que alguien confunde
172,esta característica constituye una de sus mayores ventajas pero también genera un problema existen personas que introducen deliberadamente o no información parcial bien creando un planteamiento sesgado o bien omitiendo puntos de vista que no comparten o que no les interesan
173,cómo lo sabes
174,narcisa cambió su forma de ser luchó al principio pero lenta y pacientemente comenzó a volverse mucho más amable un día mellie y terry vinieron a encontrarse con marian de nuevo
175,y luego sigue adelante y explica dónde llegaste te entendí bien
176,con reparar algo
177,puedes repetirlo
178,para siabra se dan en el wikipedista lo que habermas consideraba como criterios del participante en una situación ideal de comunicación verdad rectitud y veracidad
179,gracias de antemano si alguien cometió un error y está realmente molesto por eso
180,entre otras cosas afirmaba que el estudio de nature fue poco estricto y sesgado así como que según su propio estudio la britannica continuaba siendo un  más fiable que la wikipedia
181,a excepción del contenido y varias de sus características el isologo de esta marca corporativa está protegido por lo que no se permite su distribución sin previa autorización
182,preferiría que no lo hicieras
183,tal vez estabas hablando por teléfono y alguien te estaba hablando y estás como
184,la noticia fue ampliamente recogida por los medios de comunicación
185,además sus contenidos están disponibles en formato impreso
186,su primer número fue publicado el  de noviembre de
187,diles que tal vez estoy siendo obtuso pero no sé por qué estás tan molesto
188,entre los paquetes de software que incluyen algoritmos de aprendizaje automatizado se hallan los siguientes  los algoritmos de aprendizaje automático a menudo pueden verse afectados por el sesgo que puedan tener los datos ver sesgo algoritmico
189,oye cálmate juntos otra frase que
190,wales reconsideró el ensayo de hayek en la década de  mientras estaba leyendo sobre el movimiento de código abierto que abogaba por la distribución gratuita de software libre
191,fue un placer conocerte nos vemos luego
192,a mi madre déjame ir a casa melissa y terrence se miraron y se guiñaron un ojo bien
193,te importaría repetir eso
194,qué tengo toda esa suciedad en mis hermosos dedos
195,te confundí así que déjame darte algunos ejemplos
196,el número tres es afable afable afable significa ser sofisticado para ser educado sereno fresco y bien educado la palabra suave tiene varios orígenes diferentes pero un origen muy interesante de la palabra es que significa ejemplo de sabor agradable o dulce
197,sus más de  millones de artículos en  idiomas han sido redactados en conjunto por voluntarios de todo el mundo lo que suma más de  millones de ediciones y permite que cualquier persona pueda sumarse al proyecto para editarlos a menos que la página se encuentre protegida contra vandalismos para evitar problemas o disputas
198,otro ejemplo de catch es que necesita un préstamo bancario porque no tiene suficiente
199,ayúdame a hornear el pan eh de ninguna manera mamá las doncellas de harina todos mis ojos brillantes y brillantes
200,te importaría prestarme algo de dinero
201,gracias de todos modos no importa pero gracias de todos modos
202,en  el diario económico expansión denunció las acciones de algunas de las principales empresas españolas para manipular su historial o alterar favorablemente las biografías de sus directivos
