,Text
203,es una gran broma así que la frase es buena
204,no lo siento ya he hecho algunos planes
205,jimmy wales cofundador de wikipedia explicó que cuando en  wikileaks comenzó sus actividades se presentó como la wikipedia de los secretos
206,otras palabras que puedes usar en lugar de catch son paradojas o dilemas
207,seguro no hay problema
208,debido a su considerable popularidad existieron propuestas de mascotas que representaban a wikipedia de una manera no oficial
209,en el aprendizaje no supervisado en cambio el programa no cuenta con datos que definan qué información es satisfactoria o no
210,no tengo una opinión al respecto
211,preguntas qué has estado haciendo y qué estaba pasando en tu vida
212,la revista rechaza en torno al  de los artículos que le son enviados para la revisión por pares
213,era un sueño muy egoísta mamá no sabes lo que estás diciendo ese sueño me ha hecho darme cuenta de que necesito comida mucho más grandiosa que la que como aquí en casa pan hecho de oro
214,el profesor james h fetzer ha criticado a wikipedia en que no podía cambiar el artículo sobre sí mismo para garantizar la imparcialidad la wikipedia tiene una política que desalienta la edición de biografías de los sujetos mismos salvo en casos claros como revertir el vandalismo o correcciones sobre desactualización o datos erróneos
215,frase número dos cuando no has visto a alguien por un tiempo le dices mucho tiempo sin verte eso significa que no has visto a esta persona tal vez semanas o meses sin ver el número de frase
216,no te lo tomes en serio como en serio no te enojes tanto no te lo tomes en serio
217,la palabra estupendo tiene raíces latinas clásicas de la palabra que significa
218,es hora de irse y chicos será mejor que me vaya lo que significa que ya debería irme
219,otro estudio realizado por la universidad carnegie mellon y palo alto research center sobre las mayores categorías de artículos en la wikipedia en inglés desde julio de  hasta enero de  arrojó los siguientes resultados para la visualización de artículos la fundación wikimedia rediseñó la interfaz con un tema o tapiz que se conoce como vector creado en
220,me podrias pasar la sal por favor
221,estaré bien
222,en cuanto a acceso mediante sitio web ya existían alternativas como el sitio wapedia sin embargo wikipedia cuenta con su propia versión móvil del sitio disponible en línea
223,en este video te daré  oraciones comunes y muy útiles que puedes usar en una conversación
224,quiero continuar
225,hola a todos esto es y están viendo
226,larry sanger pasó a colaborar con wikipedia y trabajó activamente en la organización y directrices del proyecto se marchó en  por desacuerdos con wales
227,también existe la posibilidad de imprimir libros vía pediapress un programa socio de la fundación wikimedia mediante la misma solicitud
228,cómo s narcisismo ahora marian les contó a ambos todo lo que había pasado y ella ha cambiado mucho desde ese momento
229,si eso es realmente lo que quieres te llevaré a casa
230,el sitio web de wikipedia está mantenido exclusivamente por la fundación wikimedia una organización sin ánimo de lucro instituida bajo las leyes de florida estados unidos cuya finalidad es promover en el mundo apoyo económico y social para varios proyectos colaborativos de contenido libre
231,este es el mejor video para empezar así que vayamos a  frases en inglés en con suerte  minutos
232,qué sucede si no captaste algo o no entendiste a la persona
233,no podría importarme menos si alguien te pregunta algo y esta es una decisión realmente fácil para ti como si alguien te dijera que tomaras mi millón de dólares y tú dices que esto es una obviedad
234,de este modo por ejemplo se eliminan las ediciones insultantes o intimidatorias y se evitan sobrecargas confusas en el historial del artículo
235,lo normal
236,desde su nacimiento larry sanger ya discrepó por la posible falta de veracidad y le siguieron después otros autores caso de arias maldonado p o assoulineet al
237,las conexiones tienen pesos numéricos que se adaptan según la experiencia
238,déjame ver
239,citando a feifei li la ia no tiene nada de especial
240,yo de todos modos voy a lavar la ropa
241,para que conozcas a alguien y tu tiempo como te va
242,los artículos traducidos representan solamente una pequeña parte del total en cualquiera de ellas
243,te traeré algo de comida oh gracias
244,qué hay de tí
245,puedo decir que te cuides lo que significa que te cuidas
246,en casos dudosos algunos de los experimentos son repetidos por otros científicos confidencialmente antes de su publicación
247,habitualmente una parte de las ediciones son vandálicas de contenido no relacionado con wikipedia o con información falsa y en ocasiones editores con puntos de vista encontrados producen lo que se conoce como guerra de ediciones
248,desde octubre de  china había bloqueado el acceso a wikipedia pues el gobierno bloquea habitualmente el acceso a los sitios web que considera subversivos y filtra las páginas de internet con términos que considera delicados
249,ahora hay algo un poco emocionante y reservado en la palabra cita incluso ahora así que puedes usar cita para cualquier reunión
250,de lo habitual para lucir un poco cansado y falto
251,así que si está a punto de embarcarse en su viaje
252,algunos artículos famosos publicados por nature fueron en  fue galardonada con el premio príncipe de asturias de comunicación y humanidades junto con la revista science por su labor durante más de un siglo impulsando y difundiendo las grandes conquistas científicas de la humanidad acercando de este modo la ciencia a la vida
253,este tipo de aprendizaje usa un árbol de decisiones como modelo predictivo
254,los editores de la revista realizan también una importante criba determinando si el artículo es o no de interés general y si está o no entre los temas de interés científico superior
255,los modelos o programas resultantes deben ser capaces de generalizar comportamientos e inferencias para un conjunto más amplio potencialmente infinito de datos
256,algo más pero quiero pan normal pan que pueda comer no tienes esa mirada así que la futura esposa de mi caparazón de padre hace frío
257,se trata de un sistema de enlaces de neuronas que colaboran entre sí para producir un estímulo de salida
258,en cuanto a la atribución creative commons por su parte no garantiza el contenido por los derechos de imagen que hayan cedido
259,hoy me vendría bien una bebida energética
260,sí por supuesto
261,ustedes dos son tan amables
262,una condición necesaria a la hora de registrarse es elegir un alias que no resulte ofensivo o difícil de escribir
263,te doy ese consejo secreto para que suene muy fluido
264,las marcas han sido realizadas voluntaria y gratuitamente por usuarios de wikipedia y sus derechos pertenecen a la fundación wikimedia
265,otra forma de decirle a la persona que no se enoje es decirle que las cosas pasan como si estuviera bien
266,nosotros he aprendido muchas de estas palabras inteligentes y tendemos a meter dos tres cuatro en una oración que no suena natural
267,uno está inundado inundado significa ahogamiento o inundación pero inundado se usa a menudo en el contexto del trabajo como yo  estoy abrumado por el trabajo tengo demasiado trabajo por hacer he estado abrumado por el trabajo esta semana entera apenas he tenido tiempo para respirar ahora veamos la raíz de esta palabra
268,para ser considerados como tales deben tener al menos el afijo bot y un supervisor el cual es el usuario propietario
269,este hecho sumado a la influencia cada vez mayor de internet sobre las personas trae como consecuencia un enorme impacto popular de la enciclopedia colaborativa a todos los niveles impacto que se va acrecentando a medida que pasa el tiempo
270,esta organización se encargó de registrar los dominios bajo el término wiki y permitió a wikileaks en sus comienzos la utilización del término wiki y su dominio correspondiente
271,una vez que la comunidad logra el consenso sobre la aplicación de una norma todos los editores están obligados a respetarla
272,fuera del sitio web otros han expresado las impresiones personales que el sitio les produce
273,ahora usamos a menudo la palabra impresionante aquí  s otra palabra que puedes usar en lugar de asombroso estupendo por ejemplo hoy obtuve una puntuación estupenda en mi examen lo que significa que obtuve una puntuación muy alta o obtuve una puntuación casi perfecta
274,los periodistas que usaron esta cita obviamente confiaron en wikipedia como fuente de información tal vez no podían permitirse el lujo de realizar investigaciones ulteriores bajo la presión de la necesidad de ser los primeros en publicar la cita y como resultado proporcionaron a los lectores una información falsa
275,oh esto es casi una locura
276,sí por favor
277,puedes hacerlo puedes pasar el toefl puedes pasar el gmat lo conseguirás vamos
278,esta se produce cuando dos o más editores entran en un ciclo de reversiones mutuas debido a disputas causadas por diferencias de opinión sobre el contenido del artículo
279,no estaba escuchando otra frase que uso todo el tiempo
280,no puedo decir nada nah
281,digamos que tienes muchas asignaciones y tienes una prueba próxima y tus amigos vienen a ti y te dicen
282,podrías decirme qué significa esta palabra
283,cómo está
284,evitando una pregunta
285,me temo que sí
286,siento molestarte
287,cómo te va
288,puedes pedir perdón por molestarte sabes que ves
289,el principal culpable de esta bajada es el buscador de google que entre sus muchas funciones y herramientas muestra a menudo extractos de wikipedia cuando se hace una búsqueda y suele dar prioridad a los vídeos de youtube plataforma de su propiedad
290,seguro qué tienes en mente
291,sería genial que haya un botón rojo en alguna parte
292,muchas de sus ediciones han sido replicadas a través de internet mediante espejos y han dado origen a enciclopedias derivadas bifurcaciones en otros sitios web
293,otras versiones publicadas por la fundación wikimedia fueron las distribuciones en soporte físico sobre cd  y dvd  en las cuales se incluían las versiones en alemán polaco portugués e inglés
294,esta tendencia la confirmó en  tom simonite del instituto tecnológico de massachusetts mit cuando confirmaba que la propia fundación wikimedia reconocía que la enciclopedia en línea tenía problemas ante la carencia cada vez más acusada de voluntarios
295,muchos lenguajes de programación pueden usarse para implementar algoritmos de aprendizaje automático
296,una de las dos formas principales de árboles de decisiones es la desarrollada por quinlan de medir la impureza de la entropía en cada rama algo que primero desarrolló en el algoritmo id y luego en el c
297,también afirma que los bibliotecarios de la wikipedia en español eliminan más artículos que los de otras versiones de wikipedia
298,dinero pero no obtendría ese préstamo bancario a menos que le demuestre al banco que tiene suficiente dinero así que la próxima vez que se encuentre atrapado en una situación difícil recuerde
299,en octubre de  wikipedia abarcaba  ediciones activas en distintos idiomas y dialectos
300,perdon por interrumpirte
301,wikipedia y nupedia coexistieron hasta la extinción de la segunda en
302,estás libre el próximo sábado
303,agradeciendo a la gente
304,según el sociólogo alemán christian stegbauer lo interesante es que los administradores son elegidos y así obtienen una especie de legitimidad democrática
305,proyectos como wikipedia susningnu o la enciclopedia libre son wikis en los que los artículos son desarrollados por numerosos autores y no existe un criterio de revisión formal
306,según declaraciones oficiosas de un bibliotecario administrador colombiano de la wikipedia en español los bibliotecarios de esta wikipedia eliminan más artículos que los de otras versiones de wikipedia
307,cómo pudiste ser él
308,en total la comunidad está conformada por más de  millones de usuarios registrados en todo el mundo incluyendo algo más de  en la versión hispana donde el  son mujeres
309,estoy tan feliz de que esto sea chicos  frases en inglés háganme saber si esto fue útil al darle me gusta a este video y comentar a continuación si conoce más frases interesantes
310,sin embargo no toda la información tiene cabida y existen criterios de relevancia establecidos por consenso comunitario de tal modo que aunque no se rechaza a priori ningún artículo se investigan las nuevas creaciones y se descartan las que no cumplen determinados requisitos
311,comente y diga que este es un acto atroz
312,el gusto es mio
313,la conclusión fue que la wikipedia en inglés mostraba que los artículos realizados por mujeres presumiblemente destinados más a un público femenino eran significativamente más cortos que los redactados por hombres o por hombres y mujeres
314,se dice que un agente aprende cuando su desempeño mejora con la experiencia es decir cuando la habilidad no estaba presente en su genotipo o rasgos de nacimiento
315,una categorización diferente sería la media de tamaño por artículo así una wikipedia con numerosos artículos de apenas unos pocos bytes quedaría situada por debajo de otra con menos entradas pero más trabajadas
316,seguro que sigue
317,de manera similar en enero de  la versión inglesa se autocensuró para protestar a la ley sopa durante un día entero
318,espere un segundo
319,lo siento
320,qué tal un helado
321,el objetivo principal de estos programas suele ser encontrar patrones que permitan separar y clasificar los datos en diferentes grupos en función de sus atributos
322,no es todo lo que tienes que saber madre que merezco a alguien como un príncipe o un caballero
323,actualmente  son administradores humanos y  son sistemas de mantenimiento robot como trabajadores automáticos de mantenimiento
324,no mucho
325,o tonto ahora has escuchado la palabra obtuso en geometría ángulo obtuso y ángulo agudo por lo que un ángulo obtuso es un ángulo mayor de  grados pero menor de  grados
326,los algoritmos de reglas de asociación procuran descubrir relaciones interesantes entre variables
327,ella corrió a abrazar a su madre que estaba sentada en la casa triste ni hermana o mi dulce hija pensé que nunca te volvería a ver
328,gracias por tu esfuerzo
329,algunas muestras son las siguientes los usuarios de wikipedia organizan eventos regulares y ocasionales con el objetivo de promover la creación y edición de artículos
330,clasificadores geométricos como las máquinas de vectores de apoyo son modelos de gradientes
331,han existido y existen muchas enciclopedias en línea que compitieron con wikipedia como microsoft encarta y encyclopædia britannica sin embargo ninguna ha logrado el mismo éxito que wikipedia
332,por no estar registrados tienen restringidas ciertas acciones como la de votar en la toma de decisiones
333,la política que se encarga de combatir dicho problema es el punto de vista neutral que básicamente establece la necesidad absoluta e innegociable de reunir en los artículos susceptibles de polémica todos los puntos de vista significativos
334,no se preocupe imagine que llegó a casa y que todos sus amigos están sentados en su sofá
335,algunos ejemplos de esto son cuando en  el algoritmo de google photos identificaba algunas personas negras con gorilas o en  cuando el bot de twitter de microsoft desarrollo comportamientos racistas y machistas a base de observar el tráfico de datos en dicha red social
336,incluso los que la defienden como una obra documentada caso de tim oreilly la colocan en los últimos puestos
337,no obstante ha sido criticada por ser sexuada considerado ofensivo por partes de la comunidad
338,solo piensa en esa pobre madre narciso que estaba tan preocupada por su hija y cómo
339,no estoy seguro de eso
340,los segundos como su nombre lo indican representan un gradiente en el que se puede diferenciar entre cada instancia
341,muchos problemas son de clase nphard por lo que gran parte de la investigación realizada en aprendizaje automático está enfocada al diseño de soluciones factibles a esos problemas
342,no quiero esto pero la comida es realmente buena
343,wales afirmó que ese ensayo abrió sus ojos a las posibilidades de colaboración masiva
344,por otro lado solo una parte de las personas participa activamente en dicha elección y muchos de ellos ya son administradores
345,por favor acepte mis disculpas
346,entre sus mandos no se asemejan al clásico html por ejemplo para los enlaces se usan corchetes signos iguales para los títulos entre otros lo cual puede dar una mala impresión a aquellas personas que no tengan conocimientos en informática
347,la siguiente es una lista de las dieciséis mayores ediciones ordenadas por número de artículos
348,se ubicó por delante de sitios gubernamentales compañeros de clase colecciones personales de libros y la enciclopedia británica que quedó relegada al undécimo puesto
349,gracias de antemano lo que significa que realmente espero que lo hagas
350,la revista es leída por científicos e investigadores de todo el mundo siendo la mayor parte de los artículos exposiciones de trabajos de investigación muy técnicos
351,y ya está listo para comenzar y si le ha gustado este video no olvide darnos su aprobación con un comentario
352,terrence se llevó el llanto y la tristeza
353,puedes repetirlo porque no entendí la última palabra si quiere que alguien repita toda la frase de nuevo
354,oh mamá te amo tanto y tenías razón las apariencias y las riquezas no lo son todo el pan de oro era inútil porque no podía comerlo y el hombre a pesar de todo él era guapo no se preocupaba por mí en absoluto pero querida te das cuenta de que esa es exactamente la forma en que trataste a los demás
355,para bob mchenry exeditor de la enciclopedia británica uno de los mayores riesgos a los que se enfrenta wikipedia es la entrada de personas convencidas de que su punto de vista es el verdadero impidiendo incluir cualquier otro
356,eres mucho mejor que el problema estás llorando por eso  no vale la pena tus lágrimas
357,déjame terminar
358,oye por qué no pasas el rato con nosotros
359,también en el mismo año  usuarios solicitaron a través del sitio web care  la retirada de las imágenes sobre mahoma en los artículos de wikipedia
360,otra forma de preguntar si no captó una parte de una frase puede decir que no capté la última palabra
361,los artículos publicados en nature se someten a un riguroso sistema de arbitraje por expertos internacionales en cada área del conocimiento
362,uno es un almacén de contenido multimedia que los editores del resto de los proyectos pueden incrustar a modo de ilustraciones y el otro se encarga del software que sustenta a todos los proyectos hay contenidos que no tienen cabida en wikipedia por no ser información enciclopédica
363,en las páginas internas de wikipedia dirigidas fundamentalmente a los colaboradores se anima a los usuarios a participar activamente en el proyecto
364,también hubo nuevos proyectos inspirados en wikipedia como citizendium scholarpedia conservapedia y knol de google donde algunos de los aspectos que son fundamentales en wikipedia se abordan de manera diferenciada como las políticas de revisión por pares la investigación original y la publicidad comercial
365,estás absolutamente en lo correcto
366,desde que nacemos hasta que morimos los seres humanos llevamos a cabo diferentes procesos entre ellos encontramos el de aprendizaje por medio del cual adquirimos conocimientos desarrollamos habilidades para analizar y evaluar a través de métodos y técnicas así como también por medio de la experiencia propia
367,los árboles de atributos son la base de las decisiones
368,en julio de  después de extensas pruebas beta la extensión wysiwyg del editor visual se abrió al uso público
369,esta redistribución presenta el requisito de que debe ser acreditada es decir debe mencionarse su atribución ya que la licencia incluye sharealike además es necesario conservar esta licencia u otra similar evitando su protección de distribución
370,estaría encantado de ayudar
371,puedes cubrirme como puedes trabajar en mi lugar mientras yo
372,un estudio sobre el tratamiento desigual en los contenidos de la mayor enciclopedia de la web dio cuenta de que solo las grandes mujeres están bien representadas en la enciclopedia y los artículos sobre ellas presentan desigualdades de género
373,lo siento mucho por eso
374,en el ejemplo de la energía un almuerzo pesado me hace muy lento por la tarde tiene raíces de la palabra que significa una persona lenta y una babosa es un animal que se mueve muy lentamente como un ejemplo de un caracol
375,saludos básicos como te va
376,en ese mismo año la universidad de oxford demostró que el  de las referencias a localidades se situaban en europa y américa del norte del mismo modo que la antártida contaba con más artículos que áfrica o sudamérica
377,no podría estar mas de acuerdo
378,la crítica a wikipedia ha sido dirigida hacia su contenido sus procedimientos el carácter y las prácticas de la comunidad de wikipedia así como su naturaleza como enciclopedia de fuentes abiertas que cualquiera puede editar
379,sé que lo siento mucho por la forma en que actué mamá oh no está bien desde que lo has visto
380,haciendo ofertas
381,salud realmente lo aprecio
382,así también se considera software por la codificación de mediawiki bajo gpl
383,las redes de neuronas artificiales rna son un paradigma de aprendizaje automático inspirado en las neuronas de los sistemas nerviosos de los animales
384,es una forma muy francesa de decir reunión o cita por ejemplo tengo una cita con mis amigos para almorzar el sábado o planeo encontrarme con mis amigos en el centro comercial para ver películas la cita se puede usar tanto como sustantivo como como verbo por ejemplo
385,no lo menciones
386,estoy inundado de asignaciones la palabra inteligente número dos es catch ahora estoy seguro de que tú  he escuchado esta palabra antes de catch significa una situación imposible en la que no puedes hacer una cosa a menos que hayas hecho la otra y no puedas hacer la otra porque no has hecho lo primero
387,las mvs son una serie de métodos de aprendizaje supervisado usados para clasificación y regresión
388,head y michael b eisenberg publicaron una investigación sobre el uso que dan a la wikipedia los estudiantes universitarios
389,estoy bien pero gracias por ofrecerme
390,puede decirle que no vale la pena como por qué está llorando
391,tanto que olvidan qué hacer ahora confundidos tiende a ser una palabra demasiado usada así que en lugar de eso por qué no usas desconcierto por ejemplo el niño parecía completamente desconcertado cuando el maestro le hizo una pregunta en clase o el perro estaba desconcertado mirando ante su propio reflejo en el espejo o el turista estaba desconcertado por las diferentes costumbres que
392,una situación sin sentido es cuando no consigues un trabajo sin tener experiencia laboral
393,estar aturdido tan estupendo se usa para describir algo que es increíblemente bueno por ejemplo se ve estupenda con ese vestido o qué vista tan estupenda desde este balcón o estoy leyendo este libro estupendo que no puedo dejar de escribir qué tal si vas y contar
394,la última práctica se conoce como usuarios títeres que se desalienta activamente en la wikipedia
395,con excepción de ciertas personas remuneradas por la fundación wikimedia el resto conocidos en la jerga de wikipedia como wikipedistas actúan siempre de manera gratuita y voluntaria
396,a este respecto es bastante ilustrativo el experimento realizado por shane fitzerald un estudiante universitario dublinés de  años publicado el  de mayo de  por el periódico irishtimescom tras enterarse del fallecimiento de maurice jarre unas horas antes shane editó el artículo correspondiente al compositor para incluir una cita ficticia poco después la cita apareció en las secciones necrológicas de los periódicos the guardian y the london independent en el sitio web the bbc music magazine y en periódicos de la india y australia
397,en agosto de  la fundación wikimedia lanzó una aplicación oficial de wikipedia para el iphone y el ipod touch que se puede descargar de la app store
398,en  la versión en inglés superó los  millones de artículos convirtiéndose en la enciclopedia con mayor número de artículos de la historia y superando en ese aspecto a la yongle dadian de  que sostuvo el récord durante varios siglos
399,se han iniciado otros varios proyectos de enciclopedia con formato wiki en gran parte bajo una filosofía diferente de la apertura y el modelo editorial del punto de vista neutral desarrollado por wikipedia
400,por ejemplo sus modales en la mesa eran atroces o su sentido del vestir es tan atroz o su gramática es atroz
401,si alguien te pregunta si estás cansado y quieres decir que no estás cansado en absoluto
402,hay algoritmos eficientes que infieren y aprenden usando este tipo de representación
403,el análisis por agrupamiento clustering en inglés es la clasificación de observaciones en subgrupos clusters para que las observaciones en cada grupo se asemejen entre sí según ciertos criterios
404,el  de septiembre de  wikipedia alcanzó  millón de artículos en  idiomas
405,y siempre hago eso puedes decir los dedos cruzados y tú cruzas los dedos así
406,por añadidura se cambió la tipografía del elemento denominativo wikipedia la enciclopedia libre para usar la fuente abierta linux libertine con excepción de la w inicial que se mantiene con la fuente hoefler text y constituye también uno de los símbolos oficiales
