,Text
418,диск содержал  статей и  изображений находящихся в общественном достоянии
419,как дела
420,что означает что побуждает человека повторить еще раз
421,раздел машинного обучения с одной стороны образовался в результате разделения науки о нейросетях на методы обучения сетей и виды топологий их архитектуры с другой стороны вобрал в себя методы математической статистики
422,одним из основных достоинств википедии как универсальной энциклопедии является возможность представления информации на родном языке пользователя
423,например когда мы остановились где были и вы должны повторить это потому что за звук некоторые люди ошибаются
424,нупедия и википедия сосуществовали пока серверы первой не были навсегда отключены в  году текст нупедии был включён в википедию
425,раздел википедии на русском языке на  июня  года занимает е место по количеству статей среди всех языковых разделов
426,я был очень хорош я был бы лучше если бы только что если бы моя дочь нарциса была немного более понимающей мариан рассказала мелли и терри все о нарцисе и о том как она переживает за нее она хочет есть хлеб из золота что мне с ней делать ну может если ее мечта сбудется
427,кроме того по мнению шекмана проблема в том что редакторы этих журналов являются не учёными а издателями и их интересуют прежде всего шумиха сенсация и фурор
428,к концу  года она достигла  языковых разделов  к концу  года и  к последним дням  года
429,очень учтиво так умно слово номер четыре ужасно ужасно слово зверский означает чтото действительно плохое ужасное ужасное жестокое ужасное оскорбительное ужасное имеет латинский корень который называется что означает страх жестокий или ужасный
430,первый документальный фильм о википедии озаглавленный истина в цифрах рассказ о википедии был выпущен в  году
431,нарцис дома в карете она начала глубоко думать о выборе который она сделала когда вернулась домой
432,всегда могу сказать это потому что я не знал я очень хорошо подготовился к экзамену
433,говоря я не знаю
434,участники википедии с хорошей репутацией в сообществе могут баллотироваться на один из многих уровней добровольного руководства это начинается с администратора самой большой группы привилегированных пользователей  учётных записей в английской википедии по состоянию на  сентября  года которые имеют возможность удаления страниц блокировки статей от изменений в случае вандализма или редакторских споров и блокировки участников
435,поскольку википедия развивается на основе нетрадиционной модели составления энциклопедии вопрос кто пишет википедию стал одним из наиболее часто задаваемых вопросов по проекту часто со ссылкой на другие проекты веб  такие как digg или например news и хабрахабр
436,со своей единственной дочерью нарциса марион была чрезвычайно скромной и милой нарцисой однако была полной противоположностью как вы видите она была прекрасна выше слов она была как живая
437,фонд викимедиа компаниявладелец и организатор википедии поддерживает и другие проекты по созданию свободных публикаций в интернете машинное обучение англ
438,ты можешь прикрыть меня как ты можешь работать вместо меня пока я
439,умное слово номер   это беспорядок
440,не забудьте сказать эй кто этот учтивый парень прямо в углу использование этого слова мгновенно пополнит ваш словарный запас
441,было приятно встретить вас позже
442,directmedia продала  дисков по  каждый
443,умное слово номер   громадно громадно громадно значит удивительно удивительно
444,его выпустило издательство helion в конце июля  года
445,диск можно было бесплатно скачать в интернете
446,wikiscanner прослеживает источники миллионов изменений произведённых в википедии анонимными редакторами и показывает что многие из этих правок делаются из корпораций или правительственных учреждений в статьях связанных с ними их персоналом или их работой из которых они пытаются удалить критику
447,я согласен с вами на
448,не беспокойтесь об этом
449,награда была вручена джимми уэйлсу дэвидом вайнбергером
450,большое спасибо
451,мне наплевать если ктото вас о чемто спрашивает и это действительно простое решение для вас как будто ктото говорит что вы забираете мой  миллион долларов а вы говорите что это не проблема
452,может быть вы разговаривали по телефону и ктото говорил с вами и вам нравится
453,еще один способ спросить не уловил ли вы часть фразы которую можно сказать я не уловил последнее слово
454,не могли бы вы повторить это
455,я облажался я облажался если ты хочешь чтобы ктото работал вместо меня ты можешь сказать
456,вещи случаются не расстраивайтесь если у вас нет имени человека с которым вы хотите поговорить
457,википедия была также номинирована на лучшую практику webby
458,оно того не стоит
459,боже ты мой
460,в апреле  года проектом pew internet  american life project было установлено что треть американских интернетпользователей консультируются с википедией
461,поэтому если нужно классифицировать методы машинного обучения в зависимости от способа обучения будет некорректным относить нейросети к определенному виду правильнее было бы типизировать алгоритмы обучения нейронных сетей
462,вы спрашиваете чем вы занимались и что происходило в вашей жизни
463,декабря  года товарный знак получил защиту со стороны японии  января  года в европейском союзе
464,помоги мне испечь хлеб да не мама горничные все мои яркие и блестящие глаза
465,вебсервера доставляют страницы по запросу выполняя рендеринг страницы для всех языковых разделов википедии
466,это позволяет пропустить процесс рендеринга страницы для наиболее часто запрашиваемых статей
467,подойди
468,он сказал что отсутствие такой свободы заставило википедию седьмой сайт с которым больше всего консультируются запретить все изображения современных итальянских зданий и искусства и заявил что этим был нанесён очень серьёзный ущерб туристической отрасли
469,января  года в циркуляре малых планет была сделана запись согласно которой астероид  открытый украинскими астрономами  августа  года был назван  wikipedia
470,очень мило с вашей стороны
471,запрос страницы сначала передаётся внешнему уровню кэширующих серверов squid
472,любая статья википедии может редактироваться как с учётной записи участника так даже и без регистрации на проекте за исключением некоторых страниц подверженных частому вандализму которые доступны для изменения только определённым категориям участников или в крайних случаях только администраторам википедии и при этом все внесённые в статью изменения незамедлительно становятся доступными для просмотра любыми пользователями
473,все участники зарегистрированы они на проекте или нет могут пользоваться функциями программного обеспечения на котором работает википедия
474,ничего
475,википедия не становится на чьюлибо сторону
476,боюсь я понятия не имею
477,не могли бы вы сказать мне что означает это слово
478,данная постановка является обобщением классических задач аппроксимации функций
479,наличие в википедии материалов неудобных с политической точки зрения также побудило кнр заблокировать доступ к части википедии для китайских пользователей см
480,денег но вы не получите этот банковский кредит если не докажете банку что у вас достаточно денег поэтому в следующий раз когда вы попадете в сложную ситуацию помните
481,второе издание вышло в апреле  года как на cd так и на dvd
482,о вы в процессе чегото и ктото просит вас сделать то о чем вы говорите извините
483,это простая задача означает что это действительно простое решение для вас если вы сделали чтото не так и признаете это вы можете сказать что я облажался да ребята
