,Text
220,jag freakade ut en annan fras som modersmål använder är bra för dig och det kan vara både positivt och negativt när du säger att jag blev befordrad och om de säger bra för dig gillar grattis och ibland om du säger att jag lämnar denna plats
221,författarna visar att dessa användare går att känna igen från deras första tid på wikipedia bland annat genom att de gör flera redigeringar per dag
222,författarna föreslår olika åtgärder för att öka andelen användare som stannar och förblir produktiva
223,fler än  artiklar har över åren författats av drygt  nobelpristagare
224,tack på förhand vilket innebär att jag verkligen hoppas att du ska
225,det finns ämnesorienterade wikipediasidor som exemplifierar hur wikipedia kan användas av släktforskare av lärare och av vandrare
226,gjorde mig redo för sängmamma jag hoppas verkligen att min dröm går i uppfyllelse du vet åh narcisa nästa dag som narcisa och hennes mamma var ute i deras trädgård en vacker
227,du kan säga ledsen
228,ja tack
229,du kan säga till dem jag är så ledsen men jag är överbelastad med arbete eller jag har överraskat några andra ord som du kan använda i stället för översvämmad är jag har för mycket att göra
230,jag kan säga ta hand vilket innebär att ta hand om dig själv
231,undvika en fråga
232,ledsen att störa dig
233,den vanligaste kritiken var det vanligaste berömmet var kritik och skepsis mot wikipedia har funnits sedan start och var särskilt framträdande när allmänheten först började upptäcka fenomenet och olika incidenter inträffade första gången
234,ett annat sätt att berätta för personen att inte vara upprörd är att du kan säga att saker händer som om det är okej
235,där kan man ladda ner databasdumpar av åtminstone engelskspråkiga wikipedia men det är då den vanliga webbversionen av uppslagsverket och ingen speciellt utvecklad version
236,det skulle vara bra tack
237,där en panel av experter ombads granska sju artiklar som berörde deras specialområden och betygsätta artiklarna med  poäng
238,det förekommer att artiklar på wikipedia listas bland kurslitteraturen för högskolekurser bland annat i sverige  då dock med varnande noter för användning med viss försiktighet
239,ett meritsystemverktyg skulle kunna motivera till meningsfulla redigeringar men kan även ge upphov till konkurrens
240,låt mig komma tillbaka till dig om det
241,att använda ordet catch
242,var fick du nyheter som hur mår du
243,i en studie bland internetanvändare som genomfördes under  av hitwise australiskt marknadsundersökningsföretag och som även återgavs i tidningen time fann man att wikipedias besökare var nästan jämnt fördelade mellan män och kvinnor men att  av alla redigeringar gjordes av män
244,men var hjärtskadad för allt det var oätligt hon började snart gråta jag vill inte ha det här men maten är riktigt bra
245,det var fler män än kvinnor som använde wikipedia varje vecka  procent män och  procent kvinnor
246,serverklustren finns sedan januari  i delstaten virginia och har även speglade data i casheservrar i datacenter i amsterdam som bland annat betjänar europa i singapore för asien samt i san francisco och texas för amerika
247,av författarna och  av läsarna var kvinnor
248,var från sverige
249,med koordinationsarbete menar man mödan att beskriva och arkivera tidigare diskussioner samt att hitta bland arkiverade diskussioner
250,wikipedia grundades  januari  av internetentreprenören jimmy wales och filosofen larry sanger båda knutna till wales internetföretag bomis
251,frotté du ser faktiskt lite ut som den ängeln men vad ser jag hur kan du vara han ni är så trevliga
252,den  maj  lades ytterligare nio stora språk till
253,författarna har valt att analysera engelskspråkiga wikipedias datadump från
254,författarna menar att en del strategisk planering av artikelredigering sker genom diskussionssidorna
255,hade så små ögon nästan som en fågel och den andra hade en enorm näsa jag skulle inte vilja vara nära honom
256,med tryckta publikationer måste utgivaren se till att den information denne publicerar är sanningsenlig då deras levebröd hänger på det
257,engelskspråkiga wikipedias mobila vy har adressen enmwikipediaorg och svenskspråkiga mobila vyn svmwikipediaorg
258,hur står det till
259,ja självklart
260,det är okej
261,administratörerna kan också hindra anonyma användare eller ickeadministratörer från redigering av sidor som ofta är föremål för attacker eller konflikter
262,du kan göra det du kan skicka toefl du kan skicka gmat du får det kom igen
263,det anses allmänt bland sociologer att det behövs en kritisk massa när en heterogen grupp med individer med både olika förutsättningar och motivation ska komma igång med att producera allmän egendom
264,har du något emot om jag använder din mobiltelefon
265,detta skiljer sig därför markant från andra uppslagsverk där till exempel en aktad författare eller forskare kan anses som en trovärdig källa
266,i en tidigare artikel hade samma författare presenterat diskussionssidorna som en arena enbart för konfliktlösning
267,översättningen kan vara bristfällig och kvalitetsbrister kan ligga kvar länge om få kontrollerar artikeln
268,kan du täcka mig är det dags att åka och killar jag skulle hellre åka vilket betyder att jag borde gå redan
269,hon skulle leva sitt liv den dagen två vänner kom för att besöka narcissmamma de var mellie och terry de tre av dem hade varit vänner i åldrar men terry och ellie hade en hemlighet båda
270,en del projekt såsom finsk och engelskspråkiga wikipedia har dessutom egna filer som inte kan användas i andra projekt medan innehåll på commons förutsätts vara fritt tillåts i dessa projekt även proprietär media på basen av fair use återgivningsrätt
271,wikipedias diskussionsforum karaktäriseras trots redigeringskrig och kritik för pedanteri och sexism tvärtom av sansade diskussioner mellan meningsmotståndare som hittar gemensam konsensus och även vid djupt kontroversiella ämnen
272,jag är rädd att jag inte håller med
273,jag blev förvirrad av några av de frågor som andra ord som du kan använda istället för flummoxade är förvirrade förbryllade eller förvirrade smarta ord nummer åtta är möte rendezvous rendezvous
274,wikipedia är i regel fritt tillgänglig i alla delar av världen där man har fri tillgång till internet
275,år  öppnades en nyare version som idag är den officiella mobila vyn avsedd för smartmobiler såsom symbiantelefoner iphoneenheter och androidenheter
276,avhandlingen baseras på ett antal djupintervjuer med både tillfälliga och mer etablerade svenskspråkiga wikipedianer
277,låt oss säga att du har många uppdrag och att du har ett test som kommer och dina vänner kommer till dig och de säger
278,om du vill tacka någon kan du säga att det är väldigt snällt av dig tack så mycket för att du gör det som är väldigt snällt av dig det är väldigt snällt av dig om någon
279,jag är rädd att jag inte har någon aning
280,några exempel på faktorer värden inom parentes är inte statistiskt säkerställda i studien the work of sustaining order in wikipedia the banning of a vandal undersöks hur automatiserade och halvautomatiserade verktyg i kombination med samarbete bekämpar vandalism
281,wikipedia får kritik för att författarna i hög grad är västerländska män ofta med akademisk bakgrund och att balansen mellan artikelämnen och perspektiv kan påverkas av dessa författares intresseområden
282,nu senare vinkade mellie och terry farväl till sin gamla vän och gick bort leende till varandra hemligt den natten både mor och dotter
283,det blir fler som deltar och kvalitén ökar
284,kommentera och säg att detta är en grym handling smart ord nummer  är häpnadsväckande häpnadsväckande häpnadsväckande betyder fantastiskt häpnadsväckande
285,just nu
286,därigenom upptäcktes det att olika organisationer till exempel cia vatikanen och astra zeneca redigerat vinklat i artiklar som rörde deras respektive områden
287,jag har tappat min telefon och jag är i en fix eller vår buss gick sönder i morse och jag är i en fix som min vän alltid vänder sig till mig för hjälp när han är i fix och när det går bra han glömmer bort
288,så det här är ett bra sätt att öva var var vi igen om du är mitt i en konversation
289,han menade våren  att wikipedia allvarligt lider av bristande neutralitet därför att man enligt honom har övergett principen om att återge många perspektiv och att inte ta ställning
290,det finns för mycket på min tallrik som jag drunknar i jobbet
291,deltagarna var i åldrarna    år
292,subkultur motkultur genus och intersektionalitet
293,jag är upptagen i morgon
294,du kan göra det om någon mår riktigt bra du kan berätta för dem fortsätt det goda arbetet fortsätt det goda arbetet som vara så bra som du är och fortsätt det goda arbetet fortsätt att vara en annan fras är vardagligt och detta är vad amerikaner säga
295,en är översvämmad översvämmad betyder drunkning eller översvämning men översvämmad används ofta i samband med arbete som jag  jag är överbelastad med arbete jag har för mycket arbete att göra jag har varit överbelastad med arbete hela veckan jag har knappt haft tid att andas nu låt oss titta på roten till detta ord
296,skulle det vara okej om jag tog ledigt i morgon
297,stiftelsens svenska avdelning arbetar emellertid även med europeisk lagstiftning exempelvis dataskyddsförordningen wikipedia påverkas sannolikt inte direkt av upphovsrättsdirektivet
298,policyer policies och riktlinjer guidelines underlättar ofta konfliktlösning men forskarna har hittat flera exempel där fundamentalt olika tolkningar av policyer inte har lett till någon lösning utan tvärtom förhindrat konsensus
299,den visar på att sådana verktygs användning ökar i en omfattning som få tidigare har uppmärksammat
300,hålla kontakten
301,till skillnad från nätcommunities som har sina servrar i sverige är wikipedia egentligen inte skyldig att följa lagen om elektronisk kommunikation men dess amerikanska motsvarigheter
302,jag vill fortsätta jag är inte trött på det inte när någon frågar om du är säker och du är ganska säker på att du kan säga att det inte finns plats för det
303,jag tror att du har fel
304,håller med och håller inte med
305,gällande högsta examen som wikipediaförfattarna hade uppnått hade  doktorerat  hade högst uppnått mastersmagisterexamen  högst kandidatexamen  endast gymnasieexamen och  endast grundskoleexamen
306,kom igen
307,under åren har det inletts flera projekt för att få forskare att hjälpa till att stärka kvaliteten i wikipedias artiklar
308,i den här videon kommer jag att ge dig  vanliga och mycket användbara meningar som du kan använda i samtal
309,vad händer om du inte fångade något eller om det inte förstod personen du alltid kan fråga om fick jag rätt
310,detta motsvarade  av alla diskussionssidor
311,ibland samlas wikipediaanvändare lokalt till olika specialevenemang med syftet att bidra till projektet exempelvis genom att ägna en dag åt fotografering av ett område fotosafari eller för att redigera tillsammans på en skrivstuga
312,wikipedia är även tillgängligt via spelkonsoler som playstation  nintendo wii och xbox
313,hjälp mig att baka brödet va inget sätt mamma mjölstädarna alla mina ljusa och glittrande ögon
314,från början använde wikipedia en annan wikiprogramvara usemodwiki som också är licensierad under gpl
315,en studie från  vid dartmouth college av franskspråkiga och nederländska wikipedia pekar på att i motsats till det förväntade sociala mönstret var de som redigerade anonymt några av de mest produktiva bidragsgivarna av innehåll med hög klass
316,källhänvisning till wikipedia måste vara tillräckligt exakt så att läsare själv kan hitta artikeln och se artikelns författare i artikelhistoriken
317,hur är läget
318,är inte allt mamma du måste inse att jag förtjänar någon som en prins eller en riddare
319,ett betydligt mindre antal elever bara två procent tycker att författaren till artikeln är viktig
320,nej förlåt jag har redan galen några planer
321,genom att använda wikitekniken det vill säga en sökbar webbplats där sidorna enkelt och snabbt kan redigeras av besökarna lyckades man få igång skrivandet
322,det spelar ingen roll som oroa dig inte om du tappar ditt kaffe över mig
323,nej jag tror inte det
324,arbetssättet bygger även på idén att samarbete och diskussion mellan alla användare leder till att gruppen i helhet utvecklas och att konsensus om vad som räknas som neutralt kan uppnås även i svårare frågor
325,publicerar man inte under fri licens krävs att man kommer överens med upphovspersonerna exempelvis med en fotograf om ersättning
326,ja snälla fortsätt
327,deltagarna i enkäten var boende i  olika länder
328,dessa användare hänvisar också ofta till wikipediaprojektets normer såsom att skriva från en neutral utgångspunkt
329,också vanliga kriterier för källkritik kan tillämpas på wikipediaartiklar
330,svenska var det andra mindre språket efter katalanska som fick en egen wikipedia och första redigeringen gjordes  maj  av linus tolke
331,generellt betraktades företagens beteende som dåligt medan wikiscanner spåddes få stor betydelse för att övervaka kvaliteten på wikipedia
332,svenskspråkiga wikipedia var dock i stort sett inaktiv till november
333,av ett stort och magnifikt gyllene slott narcisa blev förvånad över all den skönhet hon såg att jag visste att jag förtjänar så många rikedomar jag visste att du skulle vilja ha det du vill ha här hittar du från de vackraste klänningarna till de godaste matarna allt i mitt palats väl talar om mat jag är verkligen hungrig efter den åkturen jag  m svälter kan jag få något av den goda maten naturligtvis här kött illaluktande melissa hon kommer att få dig vad du vill jag har hört så mycket om dig du stackars kära du är hungrig är du inte kommer vi går till matbordet och jag ska skaffa dig lite mat åh tack de gick in i matsalen och där på bordet fanns den mest häpnadsväckande maten som narcisa någonsin hade sett fantastisk det beror på att det är sylt som görs
334,åh det är tänt och du hörde det nog i låtar som  lyser om någon lyckas efter misslyckanden så du kan säga där du går jag sa till dig att du kommer att göra det där du går om någon frågar dig om du är trött och du vill säga att du inte är trött alls du kan inte säga lite nah
335,han menar dock inte att det är den öppna tekniken där alla är välkomna som användare som är problemet utan själva implementeringen  det krävs en balansgång mellan öppenheten och auktoriteten
336,i nordkorea begränsas allmänhetens tillgång till utländska internetsajter
337,jag tror verkligen inte att det kommer att fungera
338,oroa dig inte för det
339,gör det lite tack på förhand
340,den äldsta bevarade startsidan för svenskspråkiga wikipedia är från  juli
341,wikipedias artiklar redigeras vanligen genom att man använder wikikod wikitext som är ett kompakt märkspråk
342,åsikter
343,wikipedia använder sig av den fria wikiprogramvaran mediawiki som är licensierad under gnu general public license gpl
344,jag är ledsen
345,wikikod används även för att skapa mallar med innehåll som kan återanvändas i flera olika artiklar och vars utformning kan anpassas med hjälp av olika parametrar
346,jag är terrence ängeln med lycka din dotters namn och skönhet är känd över hela världen här jag har gett dig en gåva vad men du känner knappt honom du kan inte gå med honom
347,då wikipedia är öppet för gemensam redigering och kan redigeras anonymt bedöms wikipedias trovärdighet ofta efter hur fort felaktig eller missvisande information som avsiktligen har lagts in raderas
348,wikipedia lanserades den  januari  av jimmy wales och larry sanger ursprungligen i en engelskspråkig version och är det mest besökta uppslagsverket på internet
349,det är många vetenskapliga områden inom vilka viktiga nya framsteg publiceras antingen i artikelform eller som brev i nature
350,utöver detta är wikipedias redaktionella principer sammanfattade i de så kallade fem pelarna och många policyer och riktlinjer syftar till att utforma innehållet på lämpligt sätt
351,därför är dessa avsevärt mer känsliga för starka uppfattningar och kontroversiella påståenden som framförs av dominerande bidragsgivare
352,håller tummarna
353,tidigare undersökningar som visar att en relativt liten grupp användare står för en stor del av redigeringarna och för en stor del av det material som blir kvar i artiklarna
354,låt mig avsluta
355,maktspel som uppträdde ofta handlade om konsensus är aldrig slutgiltig och i dispyter diskuteras ofta legitimiteten i tidigare konsensus
356,nere i beskrivningsrutan för det och nu är det hemliga tipset det hemliga tipset för att låta flytande är att använda inte mer än ett smart ord eller en mening jag känner ibland
357,detta har han fått kritik för och har nu frivilligt gett upp en del av de privilegier han haft som grundare
358,wikipedia svenskt uttalvɪkɪpedɪa är en wiki och en mångspråkig webbaserad encyklopedi
359,vad händer
360,namnet wikipedia myntades av larry sanger och är en sammanslagning av wiki som är hawaiiska och betyder snabb och encyclopedia från grekiskans enkyklios paideia ordagrant rundad bildning eller kunskaper som formar en krets i betydelsen allmänbildning
361,a svenskspråkiga wikipedia innefattar emellertid en stor andel  miljoner eller  procent noterat januari  robotskapade artiklar och var i september  bara på fjortonde plats sett till antal redigeringar sedan start och på tjugonde plats sett till antal aktiva inloggade bidragsgivare under senaste månaden
362,mätningar av wikipedias neutralitet visar att det kan krävas ett mycket stort antal bidrag ofta tusentals för att en wikipediaartikel ska uppnå kvalitet som är jämförbar med en expertförfattad uppslagsverksartikel
363,artikelförfattarna menar att wikipedias nätgemenskap främjas av det svåra arbetet att söka konsensus och att sådant arbete kanske är det största formuleringsarbetet i wikipedia och motsätter sig andra forskares åsikt att dessa aspekter av samarbetet är kostsamt och improduktivt
364,wikidata lagrar därför data på ett strukturerat sätt tillsammans med semantisk information som beskriver datats betydelse och relationer exempel stockholm  är en instans av  huvudstad stockholm  tillhör den administrativa enheten  stockholms län stockholm  grundades
365,något annat men jag vill ha normalt brödbröd som jag kan äta har du inte det utseendet till min fru till min far det är kallt du får bara äta den bästa narcis jag tittade på all mat
366,hon sprang för att krama sin mor som satt i huset ledsen eller syster o min söta dotter jag trodde att jag aldrig skulle träffa dig igen
367,wikipediaartiklar har mycket varierande kvalitet
368,detta är också en vanlig uppfattning bland svenska läsare
369,för mig under det att berätta för mig vilka av dessa tio ord som är din favorit och också
370,studien inkluderar en fallstudie och ger en inblick i om hur snabbt en envis klottrares bidrag återställs och hur klottraren sedan blockeras
371,detta bidrar till en disharmoni när webben utvecklas och författaren får ett samspel med publiken
372,försökte hjälpa dig men kunde inte nå det resultat du kan säga
373,oroa dig inte oroa dig vilket betyder att du inte oroar dig för det
374,säker vad har du i åtanke
375,den globala enkätundersökningen wikimedia general user survey  genomfördes under hösten  bland besökare av  språkversioner av wikipedia främst den engelska tyska och spanska versionen dock ej den svenska versionen
376,förtydliga förklaringen till dettaförtydliga skulle enligt forskarna ligga i att förutsättningarna för att producera det som man kan kalla för allmän egendom collective goods är så annorlunda vad gäller wikipedia jämfört med andra sammanhang
377,bibliotekarien philip bradley säger i en intervju med the guardian i oktober  att det huvudsakliga problemet är bristen på auktoritet
378,narcisa förändrade sätt som hon först kämpade men långsamt och tålmodigt började hon bli mycket trevligare en dag mellie och terry kom för att träffa marian igen oh hej ni två så berätta för oss marian
379,flera stora wikipediaversioner dock ej den svenska har infört moderering genom funktionen flagged revisions alltså att ändringar som görs av nya eller icke inloggade användare inte visas omedelbart för icke inloggade besökare utan fördröjs tills någon tillförlitlig etablerad användare har granskat och godkänt dem
380,källförteckningens källbeskrivning kan exempelvis utformas enligt följande om man använder harvardsystemet som referenssystem vid ieee och vancouversystemet kan källbeskrivning formateras enligt följande om källan är nummer  i källförteckningen enligt oxfordsystemet kan samma källbeskrivning utformas alla versioner av sidorna på wikipedia sparas
381,förlåt jag fick inte det
382,uppgifterna har ifrågasatts av encyclopædia britannica
383,wikipedia har kritiserats bland annat av larry sanger  för att tillåta sexuellt innehåll i sina artiklar bland annat bilder och filmer av onani och ejakulation samt även foton från pornografiska filmer i flera artiklar
384,jag förvirrade dig så låt mig ge dig några exempel en situation med fångst är när du inte får jobb utan att ha arbetslivserfarenhet
385,en annan tidig studie från  som mätte sidvisningar på engelskspråkiga wikipedia med felaktigt vandaliserat innehåll kom fram till att  procent av allt klotter eller vandalism återställdes innan det hunnit ses av icke inloggade användare
386,här listas några exempel  svenskspråkiga wikipedia har ännu inte någon sida med namnet machine learning andra orsaker till varför detta meddelande visas vi letar alla efter snabba sätt att bli mer flytande på engelska jag vet att jag förstår vad som händer är att det bara finns några ord som kretsar kring vår hjärna och vi måste göra hela konversationen med bara fantastiskt fantastiskt coolt eller episkt så vad sägs om oss lära dig några smarta nya engelska ord som du kan använda i ditt dagliga liv och höja ditt ordförråd på några minuter
387,såvitt jag är orolig är detta den bästa restaurangen i stan
388,hur har du varit
389,hur mår du
390,de hade under år  försökt starta uppslagsverket nupedia vilket dock begränsades av strikta krav på skribenterna
391,jag vill påminna dig om att om du letar efter smarta ord att använda i ett telefonsamtal lägger jag en länk till en video
392,jag kommer också att ge dig ett smart tips för att låta riktigt flytande smart ordnummer
393,och du förstod inte vad den andra personen sa att du kan säga att du sa och med ett frågetecken
394,med hänvisning till denna forskning har debattörer därför beskrivit wikipedia som en möjlig lösning på internets största problem med osaklig polarisering och desinformation
395,klockan  skapades den första artikeln wikipedia av samma användare
396,snälla förlåt mina synder
397,jag lyssnade inte eftersom du kanske var upptagen
398,nämn inte det
399,ett annat exempel på hur studenterna kan arbeta med wikipedia inom ramen för sina högskolestudier beskrivs i artikeln bildning för vår tids bibliotek skriven av karin grönvall och jan hjalmarsson där de lyfter fram ett samarbete med ämnet marinarkeologi på södertörns högskola
400,tillfällig total blockering av vissa eller alla språkversioner av wikipedia har skett i venezuela i januari  uzbekistan     pakistan  och  på grund av hädelse syrien  saudiarabien  och tunisien
401,och med det gick hon in i vagnen och utan att ens säga adjö till sin mor åkte hon med ängeln när de färdade vagnen plötsligt in i en magisk portal där den reste genom ett stormigt område vagnen stötte enormt och narcissa
402,wikipedias ocensurerade innehåll och att uppslagsverket inte behöver följa andra länders lagar än usas har anförts som skäl när det blivit utsatt för restriktioner och blockeringar i vissa länder
403,vad tycker du om detta
404,källabehövs år  listade hemsidan wikipediawatchorg ett dussintal plagieringar gjorda av redaktörer på den engelska versionen av wikipedia
405,modellen använde dock rätt trubbiga mått på aktiviteten och forskarna konstaterar att man bör analysera vad administratörerna gör mer exakt
406,först ut var tyska tätt följt av katalanska och japanska
407,du måste äta allt detta jag trodde att du gillade snygga saker nej jag vill inte gifta mig med dig jag vill åka hem
408,herregud
409,på ett grymt sätt ibland i fängelser används också grymma i det dagliga livet för att prata om något vanligt felaktigt görande och du vill överdriva det
410,jag har inte frihet att säga
411,vad ditt misstag var kom låt oss mata dig något trevligt från och med den dagen
412,varje sida har en versionshistorik där man ser vilken användaridentitet som har ändrat vad och när på sidan
413,till min mamma låt mig gå hem melissa och terrence tittade på varandra och blinkade bra
414,kan du prata lite långsammare snälla du
415,eller svag nu har du hört ordet tråkigt i geometri trubbig vinkel och spetsig vinkel så att en tråkig vinkel är en vinkel större än  grader men mindre än  grader
