,Text
416,wikipedias ursprungliga användargränssnitt kallas dess stationära vy och är utformat för webbläsare på persondatorer exempelvis stationära datorer med relativt stora skärmar
417,veteraner vill inte slösa tid på frågor som de anser lösta medan nybörjare uppfattar att deras perspektiv inte representerats i tidigare argument och därför vill lyfta konsensus till diskussion igen
418,statens medieråd skrev i en icke daterad artikel tillgänglig  att de stickprov som gjorts visar dock på små skillnader
419,jag är verkligen ledsen för det
420,dessa tre var i gång före utgången av mars
421,totalt innehåller wikipedias olika språkversioner just nu  artiklar och den svenskspråkiga versionen har  artiklar
422,kontakter och diskussioner mellan medlemmarna i grupparbetet sker i regel i samma gränssnitt via artiklarnas eller användarnas diskussionssidor eller genom de olika deltagarportalerna
423,de regler som de ickeengelska utgåvorna av wikipedia har baseras ofta på en översättning av reglerna på den engelskspråkiga wikipedia och skrivs i sverige utifrån lokala svenskspråkiga diskussioner
424,det spelar ingen roll om du vill önska någon lycka till
425,accessdatum är viktigt eftersom wikipediaartiklar förändras
426,göra planer
427,du gungar om någon inte fungerar riktigt bra och du vill att de ska arbeta hårdare kan du säga att du ska gå en extra mil vilket innebär att du som att arbeta hårdare ska gå en extra mil
428,bland de som studerar använde  procent wikipedia för att söka information
429,man hittade att tillit till konsensus ofta leder till ett antal tillfälliga maktspel
430,mediawikiprogramvaran är skriven i php
431,i cult of the amateur  how todays internet is killing our culture and assaulting our economy berättar itentreprenören andrew keen om sitt missnöje med wikipedia
432,gör förfrågningar
433,tre om du vill fråga dig vad du har gjort
434,författarna har klassificerat sidorna i elva olika kategorier koordinering av redigering fakta som saknas klotter policy och riktlinjer länkar till interna wikipediaresurser andra diskussionssidor off topic omröstningar granskning för artikelrekommendation infobox bilder och övrigt
435,under  utvecklade caltechstudenten virgil griffith webbtjänsten wikiscanner som samkör flera register
436,i det ögonblicket började narciss skratta i sömnen hennes mamma var mycket förvånad över hur trevlig hon måste ha en riktigt rolig dröm nästa morgon när narcissus
437,wikipedias öppenhet gör den mottaglig även för redigeringar som inte är välmenade
438,detta har främst skett i länder med internetcensur och inskränkningar i yttrande och tryckfriheten på senare tid i folkrepubliken kina kinesiska brandväggen bland annat sedan  april  och turkiet från april  till januari  som skylldes på skriverier om turkiets inblandning i syriska inbördeskriget
439,varsågod
440,och du vet att den bästa delen av det var när jag var i min bröllopsklänning som var av guld också såklart alla stirrade bara på mig narcisa det finns inget fantastiskt med den drömmen
441,min kära barn du är så vacker och vacker men du bryr dig inte om något annat än din skönhet
442,så om du bara ska påbörja din resa
443,förslag
444,svenskspråkiga wikipedia startades den  maj
445,dina vänner jag känner mig mycket trög
446,när det stoppade kom en stilig man ut ur den och tittade på narcisa hon blev helt förvånad över hur stilig han var min dröm faktiskt går i uppfyllelse umm
447,båda metoderna kan användas för att wikifiera artikeln det vill säga för att infoga länkar till andra artiklar fotnoter kategorier bilder rubriker tabeller och annan typografisk formatering
448,författarna hävdar också att samtalet i diskussionssidorna är formaliserat vissa etikettregler finns som att signera sina inlägg och policydrivet referenser till riktlinjerna förekommer ofta
449,det sätt genom vilket materialet på wikipedia skapas leder även till problem då felaktig och vinklad information kan läggas till
450,kan du berätta vad detta ord betyder
451,man erkänner dock att en del koordinationsarbete kan vara överflödigt men att eventuella verktyg för att underlätta koordinering inte får förstöra den sammanhållande funktion som konsensussökande diskussioner också skapar
452,om du ber någon att inte vara upprörd att inte gråta kan du säga ta det inte till hjärtat
453,i denna dump har man försökt hitta redigeringskrig genom att studera artiklar med minst  redigeringar på dess diskussionssidor
454,narcisa skulle du hjälpa mig att plantera dessa frön varför skulle jag göra det vad har jag fått all smuts på mina vackra fingrar värre om det skulle gå i ansiktet det var problemet med narcisa
455,hej lugna dig själv tillsammans en annan fras som
456,träsk är en bit våtmark och om någon trampar på fel ställe i ett träsk kan de lätt drunkna och verbets form av träsk betyder att sjunka så här kan du använda detta ord
457,nummer tre är suave suave suave betyder att vara sofistikerad för att vara artig och cool och
458,du är som att sitta du kan säga att jag inte bryr mig mindre det här är så tråkigt
459,efter att wikipedias grundare larry sanger pekat ut vad han ansåg vara fall av barnpornografi i wikipedias bildbank wikimedia commons tog wikipedias andra grundare jimmy wales hastigt bort flera bilder med sexuellt innehåll inklusive sakligt material utan att konsultera användarna i stort
460,det är tillåtet att direkt kopiera stora delar av artiklarna eller enstaka bilder till en egen publikation förutsatt att man publicerar den under samma licens som wikipedia cc bysa en bild kan ligga under annan öppen licens och anger källa till artikeln så som licensen kräver
461,hej killar välkomna till min kanal i den här videon
462,har hon antar hon att hon inte vill ha mer guldbröd nu va vet du
463,du är mitt i något och någon ber dig att göra något du säger jag är ledsen
464,tillsammans konsumerar de  gwh energi per år år  vilket motsvarar  tyska hushålls årsförbrukning
465,ett enklare alternativ kan vara att lagra en tabelldatafil exempelvis från ett kalkylark på en sida i wikimedia commons datanamnrymd vilket underlättar automatiskt skapande av diagram och kartor på olika språk
466,kan du ge mig saltet snälla du
467,så var en åt gången säker på att du uttalar
468,dessutom täcker detta urval in  av alla länkar till policyer
469,inloggade användare kan anpassa sitt användargränssnitt genom att välja mellan olika skal stilmallar och genom att aktivera olika finesser program skrivna i språket javascript
470,jag tycker att det är en bra idé
471,mitt nöje
472,ja du kan bara svara kan inte klaga allt är riktigt coolt
