,Text
0,åh det här är som nästan galet
1,den funktionsprincip som ligger till grund för projektet kallas wiki hawaiiska för snabbt
2,jag ska ge dig  bästa engelska fraser som du kan använda i din vardag
3,docka och den mest underhållande delen är att hon älskade sig själv utan syfte narcisa skulle du
4,de ansåg då att införandet av bilden i artikeln var smaklöst
5,wikipedia bedöms dock vara betydligt mer neutral än kollektivt och användargenererat material i allmänhet på internet bloggar sociala nätverk diskussionsforum kommentarsfält och andra wikier sannolikt därför att de senare skrivs av mindre communities än wikipedia och har färre innehållsstyrande policyer
6,exempelvis väljs vissa användare till administratörer som tillfälligt eller tillsvidare kan blockera användare som inte respekterar riktlinjer och konsensusbeslut
7,ordet på rätt sätt fortsätt till google och skriv in ordet och i sökningen högst upp ser du en liten högtalarikon klicka på den högtalaren
8,jag vaknade hon var alla leende och fnissar här älskling berätta vad du drömde om
9,grundtankarna går alltså tvärt emot idén om att publiceringen av kunskap bör begränsas till en liten grupp utvalda och speciellt kunniga personer som producerar material i en hierarkisk arbetsdelning
10,i avhandlingen frihetens rike wikipedianer om sin praktik sitt produktionssätt och kapitalismen uppsala universitet  undersöker arwid lund hur wikipedianer ser på sin roll som bidragsgivare till uppslagsverket
11,på wikidata kan även siffror namn och annan kvantitativ data motsats till löpande text lagras gemensamt för alla språkversioner
12,på svenskspråkiga wikipedia kallas dessa möten wikifika eller wikipub
13,auktoritetsbristen och avsaknad av expertgranskning innebär att en kvalitetssäkring saknas av artiklarnas lägstanivå
14,eller när affärer har varit tröga i det här kvartalet kan du använda det i ditt dagliga liv om du känner dig väldigt trött en dag kan du berätta för din mamma eller berätta
15,åh dumt han är rik och stilig vad mer kan jag vilja ha terrence jag accepterar ditt förslag
16,till ett engelsktalande land kan du helt använda det här
17,den hänvisar läsarna till sju andra dokument den har genererat över  ord av diskussion och har redigerats över  gånger under mindre än ett år
18,åh kära en natt när hon sov satt hennes mamma vid hennes sida och tittade på henne
19,i frankrike användes tidigare möte av armén för att ange en mötesplats för trupperna nu finns det något lite spännande och hemlighetsfullt om ordet möte även nu så medan du kan använda möte för alla möten
20,jag vet
21,okej om du vill ha mer lektioner om vanliga meningar och fraser låt mig veta i kommentarfältet nedan
22,eftersom hennes skönhet var känd vidsträckt men hon avvisade dem alla väldigt oförskämt varför skickade du bort dessa män igår de verkade trevliga du kan inte vara seriös mamma en av dem
23,forskare kan få fler forskningsciteringar om begrepp som de har myntat och teorier som de har lanserat refereras på wikipedia enligt nedan
24,i en magisteruppsats har det visat sig att över  procent av de gymnasieelever som ingick i undersökningsgruppen ser förekomsten av källor som det främsta kriteriet i bedömningen av en artikels tillförlitlighet
25,lov
26,frågeställningarna rör även synen på wikipedias roll i samhället i ljuset av kapitalistiska och kommunistiska infallsvinklar
27,tänk bara på att den stackars narcissemamma var så orolig för sin dotter och hur
28,wikipediaartiklar anses emellertid främst användbara för att hitta andra mer auktoritativa källor snarare än som informationskälla till egna publikationer
29,på vilket sätt s narcissism berättade marian dem båda allt som hade hänt och hon har förändrats så mycket från den tiden
30,har du några planer för imorgon
31,jag är ledsen
32,även cebuanospråkiga wikipedia innefattar en mycket stor andel  miljoner eller  procent robotskapade artiklar
33,i likhet med andra sociala medier saknar wikipedia ansvarig utgivare  och utgivningsbevis i sverige
34,encyclopædia britannicas före detta chefredaktör robert mchenry och paul vallely har även de noterat att wikipedias läsare inte kan veta vem som skrivit artikeln de läser  den kan vara skriven av någon som inte är en expert på ämnet
35,i konferensartikeln talk before you type coordination in wikipedia har artiklarnas diskussionssidor undersökts
36,jag  jag går i tvätt ändå
37,nej du har gjort ett fantastiskt jobb
38,kan du upprepa det för att jag inte fick det sista ordet om han vill att någon ska upprepa hela frasen igen
39,jag har ingen åsikt om saken
40,den består till stor del av referat av källor skrivna av experter
41,jag är inte säker på att jag håller med
42,när nya bidrag görs till wikipedia handlar det ofta om små delar eller delar av en sida som ej utsätts för granskning
43,glöm inte att säga hej vem som är den suave killen där ute i hörnet med hjälp av detta ord kommer omedelbart att göra ditt ordförråd
44,risken att den artikelversion man läser innehåller klotter beräknades till cirka  procent
45,jag ställde till det
46,denna uppnås med det produktionssätt som till exempel wikipedia har på ett enklare och snabbare sätt än annars
47,okej låt oss börja
48,du höll på att säga
49,du kan säga ledsen att störa dig du vet att du ser
50,mars  hade artikeln om kinesisk konst blivit tre gånger så stor som den om orkanen frances underartiklar ej inräknade och artikeln om tony blair var  större än den om coronation street
51,dessa riktlinjer och policyer tillämpas genom att wikipediaskribenterna kan ta bort märka eller ändra artikelmaterial som inte uppfyller dem
52,den akademiska tidskriften rna biology började  koppla samman artikelskrivandet i tidskriften och dess relaterade databas med skrivandet på wikipedia
53,igår kväll mamma det var en så fantastisk dröm du vet att det var den här prinsen som kom fram till mig
54,jag är rädd att jag inte kan ge ett erbjudande
55,saker händer bli inte upprörd om du inte har namnet på en person du vill prata med honom
56,syftet är att underlätta för maskiner exempelvis kalkylprogram artificiell intelligens och bottar att söka tolka analysera visualisera och uppdatera data i wikidata
57,författaren nicholson baker skrev i the new york review of books att diskussionen kring vad som är relevant är så kontroversiell att ingen kan bilda sig en klar uppfattning och hävdade att artiklar om ämnen som borde vara relevanta lätt raderas
58,wikiscanninghistorien uppmärksammades av the independent som fastslog att många censureringar som gjorts på en rad wikipediaartiklar av användare med egenintresse hade upptäckts wikipedia har kritiserats för att ha löst definierade krav på vilka ämnen som anses vara tillräckligt kända att det är relevanta för uppslagsverket och kan få egna artiklar utan att raderas
59,de flesta vetenskapliga tidskrifter är numera högt specialiserade men nature är bland ett fåtal tidskrifter veckotidskrifterna science and proceedings of the national academy of sciences är också framstående exempel som fortfarande publicerar originalartiklar inom ett brett spektrum av vetenskapliga områden
60,ett annat sätt att säga samma sak du kan säga öka ditt spel som att arbeta hårdare arbeta bättre öka ditt spel
61,en del användare har användarbefogenheter som ger dem tillträde till särskilda verktyg som underlättar arbetet mot klotter vandalisering och konflikter
62,i en jämförelse utförd av svenska dagbladet  där nio experter granskade varsin av nio artiklar mellan nationalencyklopedin och svenskspråkiga wikipedia var nationalencyklopedin bäst i sex fall och wikipedia var bäst i tre fall
63,det är inte värt det
64,hur vet du
65,emellertid är antal redigeringar av en wikipediaartikel endast svagt korrelerat med antal läsare av artikeln  många populära artiklar är nya och har omarbetats få gånger
66,fraser om du har lärt dig engelska ett tag och vill fortsätta lära dig
67,bidragsgivare till wikipedias politikartiklar som har formulerat sig radikalt tenderar att förändra sitt sätt att skriva så att deras bidrag efter några år innehåller märkbart färre ideologiskt laddade formuleringar
68,så nästa gång du hör av en hemsk handling i nyheterna kom ihåg att
69,jag lyssnade inte på en annan fras som jag använder hela tiden
70,nej tack ändå och en annan fras som jag använder i min epost ibland när jag inte har bett om någon person
71,wikipedia förekommer i princip aldrig i källhänvisningar i forskningspublikationer
72,det var länge sedan
73,kan jag skaffa ett glas vatten till dig
74,du frågar vad du har gjort så vad som hände i ditt liv
75,slår mig
76,data från wikidata länkas automatiskt in i allt fler av wikipedias faktarutor
77,det är som att det inte spelar någon roll
78,blockerades artikeln under fyra dagar av de flesta av storbritanniens internetleverantörer
79,eftersom wikipedia bygger på tidskriftsartiklar forskningspublikationer och böcker finns risk för rundgång av felaktiga uppgifter om professionella författare och skribenter slarvar med att uppge källa då de hämtar uppgifter från wikipedia
80,mer komplicerad kodning av artiklar och mallar kan även göras i märkspråken html för avancerad layout och tex för matematiska formler och notskrift samt programspråket lua för att skapa programmoduler som kan användas i avancerade mallar och som körs på mediawikiservern
81,det här är mitt misstag
82,ledsen att avbryta dig
83,de är som bra för dig det skulle vara bättre utan dig och det här är en negativ mening så lyssna verkligen på intonationen
84,det skulle vara jättebra
85,han menar att de amatörer som skriver på sidan växer på bekostnad av forskare och experter
86,vet om någon berättar ett coolt skämt så kan du säga att det är bra
87,wikipedia finns idag tillgänglig på  olika språk
88,alla artiklarna fick mellan  och  poäng men de flesta fick mellan  och  poäng
89,det var ett nöje att träffa dig senare
90,stort tack
91,du kan säga tack himlen är fredag eller tror himlen sa lördag helg upptäckt
92,det är inget
93,tacka människor
94,wikipedias förespråkare pekar på sådana exempel för att visa att vinklingarna kommer att bli mindre med tiden medan motståndare anser att just dessa artiklar fick extra uppmärksamhet på grund av intervjun och att ökningen inte gäller alla artiklar
95,visualeditor nås genom att välja fliken redigera ovanför artikeln medan wikikoden redigeras genom att välja redigera wikitext
96,idag kan wikipediasidor även läsas och redigeras från handhållna enheter såsom mobiltelefoner
97,den  oktober  publicerade brittiska the guardian en artikel med titeln can you trust wikipedia kan man lita på wikipedia
98,välmodig ordet suave har flera olika ursprung men ett mycket intressant ursprung till ordet är vilket betyder trevlig eller söt smakprov
99,jag kan inte tacka dig nog
100,mchenry har också framfört att wikipedia faller på att den säger sig vara en encyklopedi ett ord som inger en auktoritet och pålitlighet som är oförenligt med koncepten öppenhet och wiki
101,det skulle vara underbart skulle det inte vara bra oavsett jag antar att med tiden kommer hon att lära sig låt oss prata om något annat
102,sanger ger även exempel på ickevetenskaplig religionskritik som har fått utrymme och på att wikipedia enligt honom ger vänsterpolitisk kritik större utrymme än högerperspektiv
103,ber om ursäkt
104,däremot tolereras inte avsiktlig vandalism
105,enligt en artikel i dn är bara drygt  procent av de som bidrar till wikipedia kvinnor
106,förtydliga i en studie  utförd av forskare från university of washington och hp labs har man försökt analysera redigeringskrig och konflikter i engelskspråkiga wikipedias datadump från  wikipedia är ett massornas samarbete där formuleringen av artiklar inte bestäms definitivt utan genom konsensus
107,wikipedia har kritiserats för att en liten grupp människor står för den största delen av innehållet
108,rapporterade the guardian att studier visar att endast  av redigerare på wikipedia är kvinnor
109,kan inte klaga på nästa fras någon säger till dig något och du har inte riktigt nämnt det i konversationen som om de på något sätt antar att du har ett nytt jobb och du frågar honom
110,forskare vid carnegie mellon university har utifrån en mängd statistik försökt skapa en modell för att förstå och förutsäga administratörsval på engelskspråkiga wikipedia
111,den har i huvudsak fritt och öppet innehåll som utvecklas av sina användare ofta benämnda wikipedianer
112,och hör uttalet en eller två gånger
113,oh mamma jag älskar dig så mycket och du hade rätt utseende och rikedomar är inte allt guldbrödet var värdelöst eftersom jag inte kunde äta det och mannen trots att
114,han var stilig han brydde sig inte alls om mig men min kära inser du att det är precis så du behandlade andra jag vet att jag är så ledsen för hur jag agerade mamma åh nej det är okej eftersom du har sett
115,även wikipedia rekommenderar att man använder verket för att hitta källor hellre än att uppge wikipedia som källa
116,den är världens mest citerade interdisciplinära vetenskapliga tidskrift
117,nej inte alls
118,han är så redo och suave speciellt framför damerna eller barack obama är så suave och polerad nu kom ihåg när du är på en fest nästa gång och du ser den här personen som är så
119,det tar inte lång tid innan uppenbart klotter är borttaget
120,på engelskspråkiga wikipedia gjordes en undersökning  som visade att ca fem procent av det som skrivs på wikipedia är klotter men att det har tagits bort inom en mediantid på  minuter men i enstaka fall kan ligga kvar i flera år utan att upptäckas
121,även ett antal mobila appar för ändamålet finns
122,vi blir väldigt glada för
123,före utgången av  fanns wikipedia på  språk
124,jag skruvade upp jag skruvade upp det om du vill att någon ska arbeta istället för mig kan du säga
125,wikipedia kan redigeras av vem som helst
126,de utvärderade även motsvarande artiklar i det traditionella uppslagsverket encyclopedia britannica i syfte att jämföra neutraliteten av kollektivt författad information med expertgenererat material
127,kan du täcka mig som kan du arbeta istället för mig medan jag  jag träffar min vän
128,med sin enda dotter var narcisa marion extremt ödmjuk och söt narcisa men var helt tvärtom ser du att hon var vacker utöver ord hon var som en levande
129,det är du vet
130,kan alltid säga det eftersom jag inte hade  jag förberedde mig väldigt bra för provet
131,ungefär ett år senare togs formuleringen om tillförlitlighet och aktualitet bort i en senare version av artikeln
132,som en av internets största samarbetsprojekt och mest omfattande informationskällor har wikipedia rönt uppmärksamhet i olika sammanhang
133,som när slutade vi var var vi och du måste upprepa det för vad det är ljudet som någon misstag med
134,hon tyckte sig vara för stor för att göra något arbete som många friare kom för att be om narcissus i äktenskapet
135,hur är läget
136,det är inte värt det jag personligen älskar frasen du rockar vilket betyder att du är fantastisk
137,det sjunker säger du ta dig ihop som att bokstavligen ta dig själv och dra dig ihop sluta arbeta sluta gråta dra dig ihop
138,birgitta hansson  anna lyngfelt skriver högskolebibliotekarien jan hjalmarsson om hur wikipedia kan användas i högre utbildning för att träna studenterna i att jämföra källor diskutera och problematisera olika typer av digitala källor
139,vad har du gjort för att höja dem tidigare om allt går
140,det här är en nobrainer betyder att det är ett riktigt enkelt beslut för dig om du har gjort något fel och du erkänner att du kan säga att jag har skruvat upp ja killar
141,att berätta vilken av dessa tio ord som var ditt favorit smarta ord nummer sex är i en fix i en fix betyder att vara i en besvärlig situation till exempel pojke jag är i en fix eftersom jag har planerat med två olika vänner för detta kväll
142,detta efter att den rapporterats som barnpornografi av the internet watch foundation en ideell organisation som letar efter olagligt innehåll på internet och samarbetar med bland annat brittisk polis
143,där ne vinner i tillförlitlighet vinner wikipedia i aktualitet
144,därför också lite långsamt i sinnet så exempel meningar med stum är mannen var så trubbig att han gav bort sitt lösenord till en falsk uppringare eller det tråkiga barnet
145,det skulle vara bra det finns en röd knapp där någonstans
146,wikipedias webbsidor kan delas in i ett antal typer eller namnrymder där de vanligaste är för var och en av dessa sidor finns dessutom en diskussionssida där främst sidans utformning men inte dess ämne diskuteras
147,data som är gemensamma för många språkversioner behöver på så sätt bara uppdateras på ett ställe
148,var väldigt rädd oroa dig inte min kära allt detta kommer snart att vara över precis som han sa att vagnen gick genom en annan portal och nådde uppfarten
149,jag kommer att vara med dig om en minut jag är med dig in och sedan fortsätter du att göra något och du säger var var vi
150,förutom samarbetet och diskussioner online arrangeras olika sorters fysiska träffar mellan wikipediaanvändare
151,jimmy wales som varit med och grundat wikipedia sade i detta sammanhang vi måste hantera sådana händelser på fullaste allvar utan nåd eftersom denna typ av plagiering strider till  mot alla våra grundläggande principer
152,jag är inte intresserad
153,ett annat beteende som ofta ses som ett problem är bidragsgivare som använder flera användarnamn utöver sitt egentliga i vilseledande syfte
154,var magiska varelser något som narcisses mamma visste ingenting om terry melli oh det är så bra att se dig det har varit väldigt länge hasn  t det hur har du varit jag har varit väldigt bra jag skulle ha varit bättre om bara om bara vad om bara min dotter narcisa var lite mer förstående marian berättade för mellie och terry allt om narcisa och hur hon var orolig för henne hon vill äta bröd av guld vad gör jag med henne kanske om hennes dröm går i uppfyllelse
155,även om du gillade den här videon tummen upp genom att trycka på liknandeknappen och kom ihåg att prenumerera på den här kanalen genom att klicka på prenumerationsknappen för att få mina senaste lektioner här på youtube
156,här prova några gyllene potatis de är riktigt bra och när du är gift med mig
157,sökmotorer som google leder ofta till wikipedia och driver webbtrafik till wikipedia
158,ett annat exempel på catch är att du behöver ett banklån eftersom du inte har tillräckligt
159,wikipedia var från början enbart engelskspråkigt men  mars  togs initiativet till flera språk
160,wikipedia drivs av den ickevinstinriktade stiftelsen wikimedia foundation med stöd av privata donatorer
161,även dessa regler finns lagrade i wikiform och wikipediaskribenter kan skriva och revidera dessa policyer och riktlinjer
162,många användare upptäckte wikipedia på liknande sätt och eftersom klotter är lätt att ta bort är toleransen också ganska hög gentemot företeelsen
163,han stötte på under sina resor eller i en intervju när hon frågades varför ska vi anställa dig såg hon ut helt flummoxed så nästa gång om du blir förvirrad på några frågor till exempel vid en undersökning så du
164,det vanliga
165,har du något emot att låna lite pengar till mig
166,exempelvis visas det kontroversiella originalomslaget till albumet virgin killer av bandet scorpions på engelska wikipedia
167,jag älskar att du sålde mig eftersom ibland människor beskriver sin resa eller någon de köpte och de beskriver att det är så bra
168,kan inte hjälpa dig där förlåt
169,och fortsätt sedan och förklara var du fick fick jag rätt
170,rockar du rock
171,vilket betyder vilket uppmanar personen att upprepa igen
172,vad sägs om att äta pizza till middag ikväll
173,sedan har man från de utvalda diskussionssidorna riktat in sig på kritiska sektioner genom att välja redigeringar under en tidsperiod då det var både många redigeringar på artikelsidan såväl som på diskussionssidan
174,narcis hemma i vagnen började hon tänka djupt på de val hon hade gjort när hon kom hem
175,jag tar det
176,och jag gör alltid att du kan säga korsade fingrar och du korsar fingrarna så
177,många studenter journalister författare forskare med flera yrkeskategorier hämtar dagligen uppgifter från wikipedia där snabbheten är en stor fördel jämfört med att leta i litteratur och forskningsartiklar
178,någon är upptagen kan du alltid säga förlåt att störa dig och sedan kan du fortsätta och fråga
179,och sa att han ville gifta sig med mig han hade kommit i en gyllene vagn och han var klädd uppifrån och ner och guld också vilken dum dröm
180,jättebra tack
181,det här är den bästa videon till att börja med så låt oss gå  fraser på engelska på förhoppningsvis  minuter
182,visionen är att även listor tabeller diagram och kartor ska kunna skapas automatiskt för olika språk något som emellertid kräver komplicerad programmering i sökverktyg som sparqlen och quarry
183,detta gör att encyklopedin är beroende av ett stort antal välmenande skribenter som på frivillig basis håller efter den lilla grupp av skribenter som på olika sätt ställer till problem
184,till exempel sa historikern roy rosenzweig rent generellt är själva skrivandet wikipedias akilleshäl
185,jag är inte säker på det
186,vad sägs om lite glass
187,i bokkapitlet wikipedianer om wikipedia i undervisningen i antologin pedagogiskt arbete i teori och praktik om bibliotekariens roll för studenters och doktoranders lärande red
188,gemenskapen poängterar att administratörerna inte skall tillmätas större auktoritet i sak utan endast stödja själva processen
189,vad gör du ikväll
190,men nej i en fix betyder att vara i en besvärlig situation andra ord som du kan använda istället för i en fix är att jag är i en soppa eller i  m i en röra eller jag är i en plåga eller bara jag är i en plats smart ord nummer  är flummox flummox betyder att förvirra någon
191,jag skulle hellre gå ett annat sätt att säga adjö
192,forskarna påpekar själva att modellen inte tar vara på kvalitén i redigeringarna utan bara utgår från kvantiteten men den har ändå visat sig kunna förutsäga  av valresultaten
193,år  mätte forskare vid harvard business school hur politiskt vinklat språket är andelen ideologiskt laddade formuleringar i  engelskspråkiga wikipediaartiklar om politik
194,det lyser vilket betyder att det är fantastiskt många amerikaner sa i kalifornien
195,redan  möjliggjorde wapediatjänsten tillgång från mobiltelefoner via så kallade wapsidor webbliknande teknik avsedd för mobiltelefoner med piltangenter och små skärmar
196,de flesta robotskapade artiklar har skapats av svenska lsjbot och handlar om djur eller ortnamn
197,projektet bygger på wikiprogramvaran mediawiki som är uteslutande fri och har öppen källkod
198,det man efterfrågar är bland annat visualiseringsverktyg för att annotera tidigare konsensus och vilka som var med i denna process för att sammanfatta konflikter över tid så att man lättare kan förstå en artikels tillstånd
199,wikipedia är också en internetgemenskap
200,en svensk undersökning visade  att  procent av de svenska internetanvändarna använde wikipedia varav tio procent gjorde det varje dag
201,jag är ledsen
202,var dessutom administratörer
203,ta det inte till hjärtat som på allvar var inte så upprörd ta det inte till hjärtat
204,vad hej jag har kommit hit för att be om narcissus hand i äktenskap men hur vet du hennes namn och vem är du
205,grundläggande hälsningar hur går det
206,och i den här videon ska jag ge dig  smarta ord för daglig användning och i slutet av den här videon
207,och en skarp vinkel är denna skarpa vinkel mindre än  grader så skarp som ett ord används för att beteckna skarpt och därför också mentalt skarpt och stumt betecknar trubbigt och
208,den engelskspråkiga versionen är störst idag med  artiklar  redigeringar sedan start och  aktiva bidragsgivare under den senaste månaden
209,även om en artikel är faktamässigt korrekt kan den lida av andra kvalitestsbrister exempelvis att språket har bristande läsbarhet ibland så att det ser ut som att den har maskinöversatts flera gånger
210,jag mår bra men tack för att du erbjuder
211,wikipedia censurerar inte sig själv från provocerande eller stötande material men modereras genom konsensusbeslut baserat på sin egen raderingspolicy
212,jag måste komma igång
213,wikiprincipen avser att det går snabbt att hitta artiklar att det är enkelt att ändra och länka samman artiklar att publiceringen inte fördröjs av redaktionell granskning och godkännande samt att det går snabbt att återställa ändringar till en tidigare version av artikeln
214,försök att kopiera mitt uttal exakt inklusive rösttonen som jag använder
215,herregud
216,avbryter artigt
217,därefter följde i september  de cebuanospråkiga svenskspråkiga tyska franska och nederländska versionerna ordnade i storlek efter antal riktiga artiklar
218,mobila wikipediaappar används bara för en bråkdel av accesserna
219,med andra ord gör tekniken det möjligt att nå tidigare outnyttjade resurser genom att tröskeln för att delta sänkts
