,Text
135,я дам вам  лучших английских фраз которые можно использовать в повседневной жизни
136,вы случайно не знаете где находится библиотека
137,конечно без проблем
138,подождите одну секунду
139,первой была золотая ника цифрового сообщества на ежегодном конкурсе prix ars electronica она была получена вместе с грантом       и предоставлением приглашения присутствовать на pae cyberarts festival в австрии позднее в том же году
140,в любом случае спасибо это не имеет значения но все равно спасибо
141,для построения таких методов используются средства математической статистики численных методов математического анализа методов оптимизации теории вероятностей теории графов различные техники работы с данными в цифровой форме
142,природа один из самых старых и авторитетных общенаучных журналов
143,конечно что ты имеешь в виду
144,о это почти безумие
145,так именно в nature были опубликованы статьи в  году  из  самых цитируемых в мире статей по биологии были напечатаны в журнале nature
146,ты можешь говорить немного помедленнее пожалуйста
147,диск и книга были изданы компанией zenodot verlagsgesellschaft mbh и продавались по той же цене что и предыдущее издание
148,теперь позже мелли и терри помахали на прощание своему старому другу и ушли тайно улыбаясь друг другу в ту ночь мать и дочь
149,на  июня  года существует  языковых разделов википедии из них  раздел содержит более  статей а  более  статей
150,в итоге на диск вошло около  статей и  изображений
151,существуют планы лицензирования торговой марки википедии для некоторых продуктов таких как книги и dvd
152,и ты как ох это объясняет это объясняет это
153,октября  года в польском городе слубице был открыт первый в мире памятник википедии
154,да пожалуйста
155,он пообещал больше не отправлять свои статьи в журналы nature cell и science
156,терри вы на самом деле немного похожи на этого ангела хотя что я вижу как вы могли быть им вы двое такие милые
157,ты не возражаешь если я прыгну сюда
158,из рубинов салаты из изумрудов и хлеб там сделан из золотого золотого хлеба как прекрасно это варенье будет выглядеть и вкусно с хлебом который она взяла с собой
159,вы можете повторить это потому что я не расслышал последнее слово если он хочет чтобы ктото снова повторил всю фразу
160,другие слова которые вы можете использовать вместо сбитых с толку озадачены озадачены или озадачены
161,приятно с вами познакомиться
162,только подумайте о той бедной материнарциссе которая так волновалась за свою дочь и как
163,в ноябре  года википедия получила премию эразма
164,mediawiki предоставляет интерфейс для работы с базой страниц разграничение прав доступа к администрированию системы возможность обработки текста как в собственном формате так и в форматах html и tex для формул возможность загрузки изображений и других файлов а также другие возможности
165,помимо выполнения функции энциклопедического справочника википедия стала главным объектом внимания сми как сетевой источник последних новостей
166,запущенная в январе  года джимми уэйлсом и ларри сэнгером википедия сейчас является самым крупным и наиболее популярным справочником в интернете
167,также если вам понравилось это видео поставьте ему отметку нравится нажав кнопку нравится и не забудьте подписаться на этот канал нажав кнопку подписаться чтобы получить мои последние уроки прямо здесь на youtube
168,буду рад помочь
169,например его манеры за столом были ужасными или ее чувство одежды настолько ужасно или его грамматика ужасна
170,это происходит отчасти изза разницы в законах об авторском праве в разных странах например понятие добросовестного использования не существует в японском авторском праве
171,обзор архитектуры системы на декабрь  года серьёзно устарел сетевая топология с  года
172,к сожалению я должен сказать нет
173,боюсь не могу
174,также википедияудализм и википедияинклюзионизм
175,ты намного лучше чем проблема о которой ты плачешь  не стоит твоих слез
176,она основана и на принципе согласно которому подавляющее большинство участников википедии предполагает добрые намерения
177,первое издание немецкой википедии было выпущено на cd в декабре  года и стоило
178,настолько что они забывают что делать теперь запутаться  это часто употребляемое слово поэтому вместо этого почему бы вам не использовать фламмокс например мальчик выглядел совершенно сбитым с толку когда учитель задал ему вопрос в классе или собака выглядела смущенной при собственном отражении в зеркале или турист был сбит с толку разными обычаями
179,это очень французский способ сказать встреча или свидание например у меня свидание с друзьями за обедом в субботу или я планирую встретиться с друзьями в торговом центре для просмотра фильмов
180,если это действительно то чего ты хочешь я отведу тебя домой терренс принял плачущий и несчастный
181,джимми уэйлс описал википедию как усилия по созданию и распространению свободной энциклопедии самого высокого качества для каждого человека на планете на его собственном языке
182,да пожалуйста продолжайте
183,это моя ошибка
184,википедия в настоящее время работает на выделенных кластерах серверов linux в основном ubuntu с несколькими машинами opensolaris для zfs
185,для меня под ним говоря мне какое из этих  слов ваше любимое а также
186,есть планы на завтра
187,комитеты редко пишут хорошо и статьи википедии часто имеют изменчивое качество что является результатом связывания вместе предложений или абзацев написанных разными людьми
188,ключевыми фигурами были джимми уэйлс ceo bomis и ларри сэнгер главный редактор нупедии а затем википедии
189,возникающие при этом задачи прогнозирования управления и принятия решений часто сводятся к обучению по прецедентам
190,несмотря на то что различные языковые разделы придерживаются глобальной политики такой как нейтральная точка зрения они расходятся по некоторым вопросам политики и практики особенно по вопросу могут ли изображения которые не лицензируются по свободной лицензии использоваться согласно требованиям добросовестного использования
191,ура я очень ценю это
192,нупедия первоначально лицензированная в соответствии со своей лицензией nupedia open content license перешла на gnu free documentation license перед основанием википедии по настоянию ричарда столлмана
193,википедия получает от  до  запросов страниц в секунду в зависимости от времени суток
194,мне жаль
195,огромного и великолепного золотого замка нарциса была поражена всей красотой которую она увидела я знал что заслуживаю столько богатств я знал что вам это понравится все что вы хотите вы найдете здесь от самых красивых платьев до самых вкусных блюд все это в моем дворце хорошо говоря о еде я действительно голоден после этой поездки
196,если вы попросите когото не расстраиваться чтобы не плакать вы можете сказать не принимайте это близко к сердцу
197,если вы чтото в комто я спрашиваю вас о чемто что вы можете сказать
198,подожди немного
199,в декабре  года был создан обновлённый образ диска
200,эта функция позволяет легко сравнить нынешнюю и более старые версии статьи отменить изменения откатить статью которые участник посчитает неверными или восстановить потерянное содержимое
201,существует много пародий на открытость википедии с персонажами вандализирующими или изменяющими статьи онлайнэнциклопедии
202,к ним подъехала золотая карета она была усыпана драгоценными камнями и бриллиантами и выглядела чрезвычайно потрясающе
203,и тебе нравится что здесь происходит например что ты здесь делаешь
204,примечательно что комик стивен колберт пародировал википедию или ссылался на википедию в многочисленных эпизодах его шоу the colbert report и придумал соответствующий термин wikiality
205,переводные статьи представляют лишь небольшую долю статей в большинстве разделов в частности потому что автоматизированный перевод статей не разрешён
206,заранее спасибо а это значит что я очень надеюсь что вы собираетесь
207,как он написал в пояснении к этому проекту воспроизведение википедии в ущербной физической форме помогает легче ставить под сомнение разумность её использования
208,как насчет пиццы на ужин сегодня вечером
209,она побежала обнять свою мать которая сидела в доме грустная ни сестра о моя милая дочь я думал что никогда больше тебя не увижу
210,это хороший вопрос
211,flummox означает запутать когото
212,так импактфактор nature в  году был равен  то есть каждая статья за два года прошедших после публикации в среднем цитируется более  раз
213,все будет хорошо
214,несколько языковых версий опубликовали подборку статей википедии в версии на оптических дисках
215,благодарю вас за ваше усилие
216,скрещенные пальцы
217,пользователи википедии это участники википедии образуют сообщество участников википедии
218,немного
219,привет ребята добро пожаловать на мой канал в этом видео
220,я был сбит с толку некоторыми вопросами
221,рандеву может использоваться как существительное или как глагол например
222,новые проекты вдохновлённые википедией такие как citizendium scholarpedia conservapedia и google knol были начаты в ответ на осознание ограничений википедии таких как политика в области рецензирования оригинальных исследований и коммерческой рекламы
223,как будто это не имеет значения
224,пожалуйста примите мои извинения
225,чем ты занимался чтобы поднять их раньше если все идет
226,в январе  года zenodot анонсировала выпуск печатного издания википедии в  томах по  страниц каждый
227,ты свободен в следующую субботу
228,не смог
229,википедия не лишена недостатков
230,извини сейчас не могу
231,однако критерии отбора статей в nature как и в science чрезвычайно жёстки
232,раньше когда таких данных не было эти задачи либо вообще не ставились либо решались совершенно другими методами
233,функционирование википедии зависит от mediawiki программного механизма для вебсайтов работающих по технологии вики
234,в октябре  года статья reuters озаглавленная страница википедии последний символ статуса сообщила о том как наличие статьи в википедии подтверждает статус знаменитости
235,ты как сидишь можешь сказать что мне все равно это так скучно
236,это привело к созданию вебсайта википедии которая изначально задумывалась для предварительной разработки материалов которые потом были бы размещены в нупедии
237,допустим у вас много заданий и у вас приближается тест и ваши друзья приходят к вам и говорят
238,
239,nature редактируется в великобритании издательством nature publishing group и издаётся в лондоне
240,интернетсайт википедии является пятым по посещаемости сайтом в мире
241,в  году художник роб мэттьюс англ
242,не беспокойтесь представьте что вы пришли домой а все ваши друзья сидят на вашем диване
243,в  году исследователь одед нов опубликовал работу о мотивации которой руководствуются википедисты
244,большинство направляемых в nature статей отсеиваются ещё до стадии рецензирования поскольку результаты исследований описанные в предлагаемой к публикации статье должны представлять существенное продвижение в той или иной области науки
245,спасибо людям
246,повторила эксперименты по общественным наукам результаты которых были опубликованы в журналах science и nature в  годах и выяснила что из  эксперимента только   прошли проверку на воспроизводимость
247,википедия и её братские проекты провели широкий референдум в сообществе относительно того стоит ли перейти на другую лицензию
248,к октябрю  года русская википедия вышла на ю позицию в списке посещаемости
249,как теперь нарциссизм мэриан рассказал им обоим все что произошло и она так сильно изменилась с того времени
250,в основном вандализм проявляется в замене содержимого статей википедии на ругательства граффити заведомо ложные данные или другое содержимое абсолютно не имеющее отношения к теме статьи
251,обычный
252,различают два типа обучения дедуктивное обучение принято относить к области экспертных систем поэтому термины машинное обучение и обучение по прецедентам можно считать синонимами
253,еще один способ сказать человеку чтобы он не расстраивался  это сказать что все происходит так будто все в порядке
254,с января  года фаза ii википедия начала работать на phpвикидвижке с базой данных mysql это по было сделано на заказ для википедии магнусом манске
255,ты говорил
256,в то время как уэйлсу приписывается определение цели создания публично редактируемой энциклопедии сэнгеру обычно приписывают контринтуитивную стратегию использования вики для достижения этой цели
257,итак сегодня мы собираемся выучить  новых умных слов их значения корневые слова и примеры предложений так что давайте приступим привет всем и вы смотрите
258,он утверждал что количество ссылок на википедию в популярной культуре таково что этот термин является одним из группы избранных существительных xxi века которые так узнаваемы google facebook youtube что они больше не нуждаются в объяснениях и находятся на одном уровне с такими терминами xx века как hoovering или coke
259,в  году вошёл в список  самых влиятельных журналов биологии и медицины за последние  лет под  и был назван журналом столетия
260,я думаю вы ошибаетесь
261,вы можете извиниться за беспокойство вы знаете что видите
262,мне было интересно может ли ты мне с этим помочь
263,один затоплен заболоченный означает утопление или затопление но затопленный часто используется в контексте работы как я м завален работой у меня слишком много работы я был завален работой всю эту неделю у меня едва было время дышать теперь давайте посмотрим на корень этого слова
264,википедия англ
265,извините я не уловил этого
266,у меня почти высшая оценка  слово громадный имеет классические латинские корни от слова которое означает
267,в июле  года фаза iii википедия перешла на третье поколение программного обеспечения движок mediawiki первоначально написанный даниэлем ли крокером
268,слишком много на моей тарелке я тону на работе
269,что ты об этом думаешь
270,рост википедии был вызван её доминирующей позицией в результатах поиска google
271,мы все ищем быстрые способы научиться более свободно говорить поанглийски я знаю я понимаю что происходит всего несколько слов крутятся в нашем мозгу и нам нужно провести весь этот разговор используя просто потрясающе круто или эпично так как насчет нас выучите новые умные английские слова которые можно использовать в повседневной жизни и за несколько минут пополните свой словарный запас
272,я не слушал другую фразу которую использую все время
273,привет и добро пожаловать
274,dvd не издавался но доступен для скачивания с сайта dvdwikimediaorg
275,ты совершенно прав
276,по оценкам на октябрь  года сайт имел гипотетическую рыночную стоимость в млн долларов если бы он запустил рекламу
