,Text
277,в чем была твоя ошибка давай с того дня накормим тебя чемнибудь приятным
278,фраза номер один  это еще один способ спросить
279,базовые виды нейросетей такие как перцептрон и многослойный перцептрон а также их модификации могут обучаться как с учителем так и без учителя с подкреплением и самоорганизацией
280,как твои дела
281,чтобы ответить на одинединственный вопрос теста или тупому мужчине было трудно понять даже базовые инструкции
282,я должен идти
283,о привет вы двое так скажите нам мэриан
284,преуспевать
285,разрешение
286,хорошо начнем
287,положение о том что википедия это просто услуга размещения этих текстов было успешно использовано в качестве защиты в суде
288,и получите эти восхищенные взгляды от своих друзей другими словами которые вы можете использовать вместо уловки парадокс или умное слово дилемма
289,эй почему бы вам не пообщаться с нами вы можете сказать им что мне очень жаль но я завален работой или я завален другими словами которые вы можете использовать вместо заболоченного у меня слишком много делать
290,но вы не можете получить опыт пока не получите работу
291,википедия была официально открыта  января  года как одиночный англоязычный раздел на wwwwikipediacom и была анонсирована сэнгером в списке рассылки нупедии
292,в  году английский писатель джеймс брайдл англ
293,прямо сейчас
294,нет я так не думаю
295,это было позже оспорено аароном шварцем который отметил что ряд просмотренных им статей имели крупные части содержания внесёнными участниками с малым количеством правок
296,запрашивая информацию
297,в общем но победил это очень уместно для официальной встречи поэтому если у вас есть свидание вы возможно определенно можете назвать это умное слово рандеву номер  тупым тупым тупым словом  оскорблением которое вы использовали бы когда пытаетесь назвать когото тупым или неразумным
298,что происходит
299,повсеместная информатизация приводит к накоплению огромных объёмов данных в науке производстве бизнесе транспорте здравоохранении
300,русск англ
301,один из основателей википедии ларри сэнгер который является и одним из её самых жёстких критиков в  году заявил что для него википедия стала разочарованием поскольку она была захвачена троллями и участниками чей антиэлитаризм поставил крест на достоверности статей
302,о это горит и вы наверное слышали это в песнях которые  горит если ктото добивается успеха после неудач так что вы можете сказать что вы идете я сказал вам что вы добьетесь этого не могу сказать немного нах
303,согласия и несогласия
304,я возьму это
305,мне это не интересно
306,он использовался в united states patent and trademark office для регистрации товарного знака wikipedia  сентября  года
307,другие могут опираться на утверждение википедии о том что любой может править например the negotiation эпизод сериала офис где персонаж майкл скотт заявил википедия лучшая вещь на свете
308,нет извини я уже помешал на некоторых планах
309,последний том планировалось выпустить в  году
310,критики утверждают что редактирование статей неэкспертами подрывает качество представленного в статье материала
311,поблагодарить вас заранее
312,дайтека подумать
313,я встречаюсь с моим другом
314,или бизнес в этом квартале был вялым вы можете использовать это в своей повседневной жизни если однажды вы чувствуете себя очень усталым вы можете сказать об этом своей маме или сказать
315,насколько я понимаю это лучший ресторан в городе
316,однажды мелли и терри снова пришли встретиться с мариан
317,по словам авторов его результаты свидетельствуют о том что публикация научных знаний в доступных источниках является экономически эффективным способом продвижения науки что особенно полезно для тех кто не имеет доступа к традиционным источникам научной информации
318,хотя некоторые участники сильны в своей области википедия требует чтобы даже их вклады были подкреплены опубликованными и поддающимися проверке источниками
319,я хочу продолжить я не устаю не от этого когда ктото спрашивает тебя ты уверен и ты почти уверен что можешь сказать что для этого нет места
320,если вы хотите чтобы ктото просто плакал и жаловался на чтото чего не происходит вы можете сказать приходите я вы можете сделать это
321,кукла и что самое забавное она любила себя бесконечно нарцисса не так ли
322,утверждения энциклопедии всё чаще используются в качестве источника такими организациями как федеральный суд сша и всемирная организация интеллектуальной собственностинеавторитетный источник
323,основные привет как дела
324,по фазы ii было неоднократно модифицировано с учётом экспоненциально растущего спроса
325,я буду с тобой
326,надёжность и точность википедии вызывают вопросы
327,например статьи о малых городах сша могут быть доступны только на английском
328,он столкнулся во время своих путешествий или во время интервью когда ее спросили почему мы должны нанять вас она выглядела совершенно растерянной поэтому в следующий раз если вы запутаетесь в какихлибо вопросах например на экзамене то вы
329,wikinfo не требует нейтральной точки зрения и разрешает оригинальные исследования
330,я м все равно иду в прачечную
331,сегодня я мог бы употребить энергетический напиток другие слова которые вы можете использовать вместо вялости могут быть вялыми или волочить ноги так что это были  умных слов и раньше
332,основатели википедии ларри сэнгер и джимми уэйлс
333,удачного обучения скоро увидимся на другом уроке
334,существует некоторая зависимость между ответами и объектами но она неизвестна
335,фонд поддерживаемые им проекты и глобальное сообщество добровольных редакторов образуют движение викимедиа
336,они вроде бы хороши для вас было бы лучше без вас и это отрицательное значение поэтому внимательно слушайте интонацию
337,я не уверен в этом
338,остальная часть журнала состоит из оригинальных исследований предполагающих наличие у читателя специальных знаний в соответствующей области
339,я не уверен что согласен
340,я буду с вами через минуту я буду с вами а затем вы продолжите чтото делать и скажете где мы были
341,эта зависимость не обязательно выражается аналитически и здесь нейросети реализуют принцип эмпирически формируемого решения
342,содержимое википедии подпадает под действие законов в частности авторского права штата вирджиния в сша где находятся серверы википедии и нескольких редакционных политик и руководств которые призваны укрепить идею о том что википедия является энциклопедией
343,в примере с энергией тяжелый обед делает меня очень вялым днем
344,прошлой ночью мама это был такой потрясающий сон ты знаешь что ко мне подошел принц
345,я даю вам этот секретный совет чтобы звучать очень бегло
346,это было бы замечательно не так ли
347,делать запросы
348,по его словам возможны два варианта подобного взаимодействия использование экспертами знания функции сообщить об ошибке с последующим написанием там своих комментариев которые будут проверены участниками википедии либо создание специального проекта по взаимодействию википедии и знания
349,в википедии должна отражаться информация которая уже установлена и признана
350,составление планов
351,вежливо перебил
352,с удовольствием
353,могу я остановить тебя на минутку
354,это вы знаете
355,википедия может подвергаться воздействию вандалов
356,на май  года согласно alexa википедия занимала е место среди самых посещаемых сайтов в мире в рунете е место
357,береги себя
358,в случаях множественного вандализма к некоторым страницам википедии может быть применена защита
359,это того не стоит
360,хорошо поэтому прежде чем мы продолжим сбалансированные пять слов в этом видео не забудьте оставить комментарий под этим видео
361,как насчет тебя
362,золотой хлеб когдато в маленькой деревушке жила женщина по имени марион
363,серверные кластеры в сша санфранциско  ulsfo caching даллас техас  eqdfw networking карролтон техас  codfw application services чикаго иллинойс  eqord networking ашберн виргиния  eqiad application services
364,по состоянию на август  года русская википедия находилась на м месте
365,существует также несколько немецких версий
366,ноября  года в ответ на просьбу фонда викимедиа free software foundation fsf выпустила новую версию fdl разработанную специально для того чтобы позволить википедии перелицензировать её материалы под ccbysa до  августа  года
367,так что по очереди убедитесь что вы правильно произносите слово
368,позвольте мне вернуться к вам по этому поводу
369,позвольте мне немного подумать
370,вниз в поле описания для этого и теперь секретный совет секретный совет чтобы звучать свободно  это использовать не более одного умного слова или предложения которое я иногда знаю
371,некоторые сми высмеивают восприимчивость википедии к вставкам неточностей например статья на первой странице в the onion в июле  года под названием википедия празднует  лет американской независимости
372,всё это привело к вопросу о надёжности википедии в качестве источника достоверной информации
373,звучит неплохо
374,извините что беспокою вас
375,другими основными объектами критики википедии являются критики википедии указывают на то что участники википедии совместно пишут и пересматривают её правила политики и руководства а затем зачастую чисто формально и очень негибко их придерживаясь удаляют аннотируя тегами комментариев или изменяют материалы статей формально не отвечающие этим правилам политикам и руководствам см
376,фраза номер два когда вы не видели когото какоето время вы говорите ему что давно не виделись это означает что вы не видели этого человека может быть недели или месяцы долгое время не видели номер фразы
377,прежде всего информация тексты википедии объективно подвержены системным отклонениям
378,если вы еще не нажали кнопку подписки и значок колокольчика рядом с ней и желаем вам приятного просмотра
379,гибкая система расширений позволяет пользователям добавлять собственные новые возможности и программные интерфейсы
380,что скажешь мы ходим в кино
381,теперь предположим что в вашей повседневной жизни ваш парень или ваша девушка сердится на вас а вы не знаете почему поэтому можете
382,модели редактирования википедии свойственна возможность добавления низкокачественной информации
383,несмотря на то что функционирование каждого языкового раздела более или менее самостоятельно предприняты некоторые усилия для контроля всех разделов
384,не принимайте это близко к сердцу как серьезно не расстраивайтесь не принимайте это близко к сердцу
385,в качестве оболочки использовалась среда kiwix программное обеспечение с открытым исходным кодом специально написанное для данного издания
386,думаю она не хотела бы больше золотого хлеба а ты знаешь
387,сказать мне какое из этих десяти слов было вашим любимым умным словом номер шесть в исправлении в исправлении означает оказаться в неприятной ситуации например мальчик я в затруднительном положении потому что у меня есть планы на это с двумя разными друзьями вечер
388,я терренс ангел удачи
389,поскольку участники обычно как правило переписывают или редактируют отдельные небольшие части статьи а не всю её целиком высоко и низкокачественные материалы могут идти вперемешку в пределах одной статьи
390,например сегодня я получил потрясающий балл на моем тесте что означает что я получил очень высокий балл или
391,я голодаю могу ли я съесть чтонибудь из этой вкусной еды конечно здесь мясо вонючая мелисса она принесет тебе все что ты хочешь я так много слышал о тебе ты бедный дорогой ты голоден я принесу тебе немного еды о спасибо они пошли в столовую и там на столе была самая поразительная еда которую нарциса когдалибо видела удивительной потому что это варенье
392,медиафайлы доступные в соответствии с лицензиями свободного содержания например ccbysa от creative commons распределяются между языковыми версиями викисклада англ
393,если чтото вас удивит вы также можете сказать что вы шутите надо мной как о боже
394,что ты думаешь по этому поводу
395,оставайтесь на связи
396,я могу сказать береги себя что означает заботиться о себе
397,википедия также создала формы воздействия на средства массовой информации сми
398,википедия была также использована в качестве источника в журналистике иногда без указания авторства а также несколько журналистов были уволены за плагиат из википедии
399,важной особенностью при этом является способность обучаемой системы к обобщению то есть к адекватному отклику на данные выходящие за пределы имеющейся обучающей выборки
400,но некоторые нейросети и большинство статистических методов можно отнести только к одному из способов обучения
401,я потерял телефон и я в затруднительном положении или наш автобус сломался этим утром и я в затруднительном положении мой друг всегда обращается ко мне за помощью когда он в затруднительном положении а когда дела идут хорошо он забывает о нем
402,публикации в таких журналах как nature или science крайне престижны так как статьи из них часто цитируются а автор получает широкую известность и за пределами своей области науки
403,она проживет свою жизнь в тот день когда двое друзей пришли навестить мать нарцисса они были мелли и терри они трое были друзьями много лет но у терри и элли был секрет их обоих
404,в этот момент нарцисс начал смеяться во сне ее мать была чрезвычайно удивлена как хорошо ей должно быть снится действительно забавный сон на следующее утро когда нарцисс
405,в точку
406,заметьте и скажите что это чудовищный поступок
407,нарциса изменила свой образ жизни сначала она боролась но постепенно и терпеливо она начала становиться намного лучше
408,нет у меня все хорошо спасибо
409,википедия выиграла две крупные награды в мае  года
410,она выросла до примерно  статей и  языковых разделов к концу  года
411,просят повторения
412,и вы готовы к работе и если вам понравилось это видео не забудьте оставить нам большой палец вверх с комментарием
413,постоянные участники нередко используют список наблюдения в который заносят интересные для себя статьи и таким образом могут легко отслеживать все недавние изменения в этих статьях
414,это тонет ты говоришь возьми себя в руки как будто буквально возьми себя в руки и возьми себя в руки перестань работать перестань плакать соберись
415,января  года ларри сэнгер в списке рассылки нупедии предложил применить концепцию вики в отношении нупедии чтобы ускорить её развитие
416,потерпи со мной минутку
417,википроекты фонда викимедиа самым крупным из которых является википедия по состоянию на март  года поддерживались работой нескольких кластеров состоящих из  серверов
