,Text
182,nota  uma vez que a wikipédia é um projeto livre da internet no mundo inteiro portanto os colaboradores de uma edição podem vir de lugares diferentes e por isso usarem dialetos diferentes como é o caso da wikipédia em português
183,digamos que você tenha muitas tarefas e um teste chegando e seus amigos vão até você e dizem
184,nota  entretanto nem todas as versões da wikipédia possuem um arbcom sendo esta uma ferramenta opcional
185,goldman escreve que os editores que não cumprem os rituais culturais da wikipédia como a assinatura de páginas de discussão implicitamente dão sinais de que eles são estranhos na comunidade aumentando as chances de que usuários experientes da wikipédia tenham como alvo as suas contribuições
186,algumas edições da wikipédia como a wikipédia em inglês incluem arquivos de imagem não livres sob a doutrina do fair use em português uso justo enquanto outras optaram por não o fazer em parte por causa das diferenças nas leis de direitos autorais dos vários países  por exemplo a noção de fair use não existe na lei de direitos autorais japonesa
187,já que sua beleza era conhecida em todos os lugares mas ela rejeitou todos eles muito rudemente por que você mandou aqueles homens embora ontem eles pareciam legais você não pode estar falando sério mãe um deles
188,você pode apenas dizer não se preocupe
189,de acordo com dados de novembro de  do alexa a wikipédia é o quinto website mais visitado do mundo
190,em junho de  os administradores anunciaram que a wikipédia em inglês eliminaria as restrições de edição estritas de artigos controversos ou propensos a vandalismo como george w bush david cameron ou lição de casa usando revisões
191,não sei que dia é quando você está assistindo este vídeo mas se é sextafeira por exemplo fim de semana
192,o frequente crítico da wikipédia andrew orlowski comentou mesmo quando uma página na wikipédia é  por cento correta factualmente e esses fatos são cuidadosamente escolhidos muitas vezes o resultado parece como se tivesse sido traduzido de uma língua para outra em seguida para uma terceira em todos os estágios passando pelas mãos de tradutores incompetentes
193,pode repetir porque não entendi a última palavra se ele quiser que alguém repita a frase inteira
194,você pode falar um pouco mais devagar por favor
195,na oopsla de  o cto da wikimedia brion vibber fez uma apresentação intitulada otimização de desempenho da comunidade fazendo a sua equipe funcionar tão bem quanto o seu site em que discutiu os desafios de lidar com as contribuições de uma grande comunidade e comparou o processo com o de desenvolvimento de softwares
196,o que você acha disso
197,o website do parlamento do canadá referese ao artigo da wikipédia sobre casamento homossexual no links relacionados de sua lista de leitura adicional do civil marriage act
198,então da próxima vez que você ouvir falar de um ato horrível no noticiário lembrese disso
199,se você está no meio de algo em alguém  está perguntando algo que você pode dizer oh
200,o fenômeno de medalhas foi analisado por pesquisadores que procuram determinar como isso poderia ter implicações em outras comunidades envolvidas em contribuições de larga escala
201,que tal um sorvete
202,o exeditor chefe da encyclopædia britannica robert mchenry certa vez descreveu isto dizendo no entanto o vandalismo óbvio é fácil de remover nos artigos já que as versões anteriores de cada artigo são mantidas
203,estas resultaram em outras discussões sobre as mudanças nas normas do repositório
204,não se preocupe não se preocupe o que significa não se preocupe com isso
205,por exemplo chris anderson editorchefe da revista wired escreveu na revista nature que a abordagem de sabedoria das multidões da wikipédia não substitui as revista científicas com os seus rigorosos processos de revisão
206,embora wales seja creditado por definir o objetivo de fazer uma enciclopédia editável publicamente sanger é geralmente creditado pela estratégia de usar um wiki para alcançar esse objetivo
207,se desculpando
208,possíveis explicações para esse fenômeno são que tais usuários só se inscrevem para uma única finalidade ou são assustados por suas experiências
209,estou inundado com atribuições a palavra inteligente número dois é catch agora tenho certeza que você  já ouvi essa palavra antes de catch significa uma situação impossível em que você não pode fazer uma coisa a menos que tenha feito a outra e não pode fazer a outra porque não fez a primeira vez
210,receio que não posso
211,oh bobo ele é rico e bonito o que mais eu poderia querer terrence
212,edições em diferentes idiomas cada uma sob controle administrativo separado são livres para modificar esta política
213,além do crescimento logístico do número de seus artigos a wikipédia tem conquistado status como um site de referência geral desde a sua criação em
214,estou bem mas obrigado por oferecer
215,você saberia onde fica a biblioteca
216,além disso a cobertura exata da wikipédia está sob constante revisão pelos editores e desacordos não são incomuns ver também delecionismo e inclusionismo
217,outros brincam com o lema da wikipédia como em the negotiation em um episódio de the office onde o personagem michael scott diz wikipédia é a melhor coisa que qualquer pessoa no mundo pode escrever o que quiser sobre qualquer assunto para que você saiba que você está recebendo a melhor informação possível
218,se você quiser agradecer a alguém pode dizer que é muito gentil da sua parte muito obrigado por fazer isso isso é muito gentil da sua parte é muito gentil da sua parte se alguém
219,desculpe incomodálo
220,em maio de  houve discussões entre os editores sobre a existência de imagens com tema sexual no wikimedia commons
221,eu sinto muito
222,o que você tem feito para criálos antes se tudo está indo
223,eu o confundi então deixeme dar alguns exemplos
224,o wikcionário dicionário eletrônico de conteúdo livre foi lançado em dezembro de  o wikiquote uma coleção de citações foi criado uma semana depois do lançamento da wikimedia e ainda há o wikilivros uma coleção de livros e textos escritos de forma colaborativa
225,vários outros projetos de wikienciclopédias foram iniciados em grande parte sob uma filosofia diferente do modelo editorial aberto e baseado no chamado princípio da imparcialidade da wikipédia
226,preocupações têm sido levantadas quanto à falta de responsabilidade que resulta do anonimato dos usuários a inserção de informações falsas vandalismos e problemas semelhantes
227,saúde eu realmente aprecio isso
228,para usar a palavra catch
229,e ouvir a pronúncia uma ou duas vezes
230,isso é um acéfalo significa que é uma decisão muito fácil para você se você fez algo errado e você admite que pode dizer que eu estraguei tudo sim rapazes
231,ele comenta que muitas fontes tradicionais de nãoficção sofrem preconceitos sistêmicos
232,originalmente a wikipédia funcionava com o usemodwiki escrito em perl por clifford adams primeira fase que inicialmente requeria hiperligações nos artigos por meio do camelcase o estilo atual de faixa dupla só foi incorporado mais tarde
233,eu então da próxima vez que você pegar a lição de matemática da escola por exemplo e se você deixou seu livro de matemática na escola então você pode dizer aos seus amigos que você está realmente em apuros agora você pode pensar que a palavra consertar tem algo a ver com a reparação de algo
234,sanger também expressou preocupações sobre o acesso em escolas às imagens da wikipédia
235,hesitando
236,em julho de  a wikipédia foi foco de um documentário de  minutos da bbc radio  que argumentava que com o aumento do uso o número de referências da wikipédia na cultura de massa é tal que o termo é um membro do grupo de marcas do século xxi que são tão familiares google facebook youtube que já não precisam de explicações e estão a par com termos do século xx como hoovering ou cocacola
237,um controle especial registra automaticamente a data e hora de cada última atualização
238,outra forma de perguntar se você não entendeu parte de uma frase pode dizer que não entendi a última palavra
239,como você tem estado
240,me deixe terminar
241,em julho de  a wikipédia passou a utilizar um software de terceira geração o mediawiki feito e desenvolvido por lee daniel crocker
242,agora mais tarde mellie e terry acenaram para se despedir do velho amigo e foram embora sorrindo secretamente uma para a outra naquela noite mãe e filha
243,finalmente a wikipédia não deve tomar partido
244,outro exemplo pode ser encontrado em um artigo de primeira página do the onion em julho de  com o título wikipédia comemora  anos de independência americana
245,em  de setembro de  o político italiano franco grillini levantou uma questão parlamentar com o ministro dos recursos e atividades culturais sobre a necessidade da liberdade de panorama
246,isso seria maravilhoso não seria bem não importa eu acho que com o tempo ela aprenderá vamos conversar sobre outra coisa
247,ele também disse que uma geração de preguiçosos intelectuais incapazes de ir além da internet estava sendo produzida nas universidades
248,uma vez que tem espaço em disco praticamente ilimitado o site pode conter muito mais temas do que podem ser cobertos por qualquer enciclopédia impressa convencional
249,nota  a wikipédia também mantém um manual de estilo chamado de livro de estilo le para padronizações editoriais acerca dos títulos e organização dos artigos da formatação e uso de recursos multimídias
250,este método de avaliação de contribuições foi posteriormente contestada por aaron swartz que observou que vários artigos de uma amostragem que efetuou tinham grande parte do seu conteúdo medida pelo número de caracteres contribuído por usuários com baixas contagens de edições
251,agradecendo as pessoas
252,a nupedia e a wikipédia coexistiram até os servidores da primeira serem retirados de forma permanente em  e seu texto incorporado na wikipédia
253,em geral mas ganhou  t seja muito apropriado para uma reunião oficial então se você tiver um encontro talvez possa certamente ligar que uma palavra inteligente de encontro número  é obtusa obtusa obtusa é um insulto que você usaria quando estiver tentando chamar alguém de burro ou não inteligente
254,o processo de atualização da wikipédia não é apenas diário ocorre a qualquer instante muitas vezes em tempo real no tocante a eventos mais importantes
255,isso seria ótimo obrigado
256,tornarse um editor experiente da wikipédia envolve desafios não triviais o contribuinte deverá construir uma página de usuário aprender os códigos tecnológicos específicos da wikipédia submeterse a um processo misterioso de resolução de disputas e aprender uma cultura desconcertantemente rica em piadas internas e referências privilegiadas
257,para mim embaixo dele me dizendo qual dessas  palavras qual é a sua favorita e também
258,editores regulares muitas vezes mantêm uma lista de páginas vigiadas de artigos de interesse para eles de modo que eles podem facilmente manter o controle sobre todas as alterações recentes nessas páginas
259,a nova ferramenta virtual indica que usuários de computadores da agência central de inteligência cia do federal bureau of investigation fbi do vaticano do partido trabalhista do reino unido das organização das nações unidas da dell computers do walmart da microsoft e da apple dentre muitos outros são responsáveis por edições nos textos do site wikipédia
260,por exemplo ele citou a conclusão do artigo da wikipédia em inglês sobre william clarke quantrill
261,a wikipédia empregava um único servidor até  quando a configuração do servidor foi ampliada para uma arquitetura em multicamadas distribuídas
262,a wikipédia também tem sido utilizada como fonte no jornalismo muitas vezes sem atribuição sendo que vários jornalistas foram demitidos por plagiar a wikipédia
263,em dezembro de  o internet watch foundation organização que lista sites que possuem material ilegal ou potencialmente ilegal adicionou a wikipédia à sua lista de sites perigosos
264,artigos traduzidos representam apenas uma pequena porção de artigos na maioria das edições em parte porque a tradução automática de artigos não é permitida
265,na prática a wikipédia é defendida de ataques por vários sistemas e técnicas
266,não há lugar para dúvidas na américa se você quer enviar sms para alguém ou mandar uma mensagem você diz texto para texto então eu mandarei uma mensagem significa que enviarei uma mensagem pelo whatsapp ou um telegrama ou mensageiro de qualquer coisa usando eu vou mande uma mensagem de novo para animar alguém e diga a ela para não ficar chateada você pode dizer que não vale a pena como por que você está chorando
267,é muita gentileza da sua parte
268,a economia tem estado muito lenta este ano ou o jogo acelerou após um início lento
269,boneca e a parte mais divertida é que ela se amou infinitamente narcisa você faria
270,que tal comer pizza para o jantar esta noite
271,nature é uma revista científica interdisciplinar britânica publicada pela primeira vez em  de novembro de
272,você é muito melhor do que o problema que você está chorando sobre isso  não vale a pena suas lágrimas
273,essa lei proíbe a pornografia infantil fotográfica e as imagens em desenhos animados e quadrinhos que são consideradas obscenas pela legislação americana
274,editores de obras de referência tradicionais como a encyclopædia britannica têm questionado a utilidade do projeto e seu status como uma enciclopédia
275,o the wall street journal relatou que um número sem precedentes de milhões de voluntários online que escrevem editam e policiam a wikipédia está desistindo
276,no dia  de dezembro de  a revista nature publicou um artigo sobre a wikipédia a respeito de uma pesquisa feita comparando alguns de seus artigos com os da enciclopédia britânica em áreas científicas quanto à quantidade de erros encontrados
277,a nature tem um público online de cerca de  milhões de leitores únicos por mês
278,e quanto a você
279,você balança você balança
280,o de costume
281,o economista tyler cowen escreve se eu tivesse que adivinhar se é a wikipédia ou um artigo de um jornal médio sobre economia qual é mais provável que esteja dizendo a verdade acho que depois de não muito tempo eu optaria pela wikipédia
282,é portanto uma enciclopédia viva ágil e pop
283,oh isso está aceso e você provavelmente ouviu em músicas que  é aceso se alguém for bem sucedido após as falhas então você pode dizer pronto eu disse que você vai fazer lá você vai se alguém está perguntando se você está cansado e você quer dizer que não está cansado de jeito nenhum posso dizer nem um pouco nah
284,eu sinto muito
285,outros defendem a ideia de que a wikipédia ou projetos semelhantes deverá deslocar inteiramente publicações tradicionais
286,fazendo pedidos
287,edições em diferentes idiomas modificam esta política por exemplo na edição em inglês apenas os utilizadores registados podem criar um novo artigo
288,esta configuração inclui um servidor de banco de dados único mestre executando o mysql múltiplos servidores de banco de dados escravos  servidores web rodando o apache http server e sete servidores de cache rodando o software squid
289,parece bom para mim
290,sim claro
291,a internet watch foundation uma organização não governamental sem fins lucrativos criticou a inclusão da fotografia como de mau gosto
292,de rubis as saladas de esmeraldas e o pão ali é feito de pão dourado dourado como esta geléia ficará linda e terá um sabor adorável com o pão que ela pegou com a geléia de rubi sobre ele e deu uma mordida enorme isso é tão quente que eu não posso comer tão bem é pão feito de ouro e o melhor também mas se você não pode comer eu deveria te dar pão de prata prata huh por que não você come
293,o conteúdo da wikipédia é publicado fora do site wikipédia em muitas formas tanto online como offline
294,tornouse uma das perguntas mais frequentes sobre o projeto muitas vezes com uma referência para outros projetos de web  como o digg
295,eu pelo menos não posso imaginar nada mais assustador
296,uma das mais bem sucedidas enciclopédias online que incorporava edições feitas pelo público foi a hg criada por douglas adams e dirigida pela bbc
297,não posso te ajudar aí desculpe
298,para um país de língua inglesa você pode usar isso totalmente
299,os servidores web atualizam o cache conforme solicitado realizando renderização de páginas para todas as versões da wikipédia
300,não importa como não se preocupe se você deixar cair seu café em cima de mim
301,membros da comunidade predominantemente interagem uns com os outros através das páginas de discussão que são páginas wikieditáveis que estão associadas com os artigos bem como através de páginas de discussão que são específicas para editores em particular e páginas de discussão que ajudam a gerir o site
302,por exemplo seus modos à mesa eram atrozes ou seu senso de vestir é tão atroz ou sua gramática é atroz
303,na prática o tempo médio para detectar e corrigir vandalismos é muito baixo normalmente de alguns minutos mas em um incidente particularmente bem divulgado uma informação falsa foi introduzida na biografia do político estadunidense john seigenthaler e permaneceu despercebida por quatro meses
304,ele é tão elegante e suave especialmente na frente das damas ou barack obama é tão suave e polido agora lembrese quando você estiver em uma festa da próxima vez e ver essa pessoa que é assim
305,os fatores consistência e qualidade são constantemente monitorados por wikipedistas mais ativos
306,em janeiro de  o projeto funcionava através de  servidores dedicados localizados na flórida
307,eram seres mágicos algo que a mãe de narcisse não sabia nada sobre terry melli oh é tão bom ver você já faz muito tempo não como você tem estado eu tenho sido muito bom eu teria sido melhor se ao menos se ao menos minha filha narcisa fosse um pouco mais compreensiva marian contou a mellie e terry tudo sobre narcisa e como ela estava preocupada com ela ela quer comer pão feito de ouro o que faço bem com ela talvez se o sonho dela se tornar realidade
308,narcis em casa na carruagem ela começou a pensar profundamente sobre as escolhas que fizera ao chegar em casa
309,além disso a wikipédia deve expor o conhecimento que já está estabelecido e reconhecido
310,então uma de cada vez certifiquese de que está pronunciando a palavra da maneira certa vá ao google e digite a palavra e na pesquisa logo acima você verá um pequeno ícone de altofalante clique no altofalante
311,aceito sua proposta
312,nota de acordo com o alexa o subdomínio anglófono recebe  do tráfego acumulado da wikipédia com o restante dividido entre as outras línguas seguido do em espanhol  em japonês  em russo  em alemão
313,você gostaria que eu lhe desse uma carona para casa
314,em abril de  larry sanger escreveu uma carta para o federal bureau of investigation destacando sua preocupação por duas categorias de imagens na wikipédia conterem pornografia infantil violando a lei federal sobre obscenidade dos eua
315,jimmy wales descreveu a wikipédia como um esforço para criar e distribuir uma enciclopédia livre da mais alta qualidade possível para cada pessoa no planeta em sua própria língua
316,foi esclarecido que esta política não está em debate mas ela temse revelado controversa
317,tendem a ser emitidos mais avisos para problemas na conduta de edição e condutas anticonsenso do que para condutas antissociais
318,o mediawiki está licenciado sob a gnu general public license e é usado por todos os projetos da wikimedia assim como muitos outros projetos wiki
319,posso te parar aí por um momento
320,na caixa de descrição para isso e agora a dica secreta a dica secreta para soar fluente é não usar mais do que uma palavra ou frase inteligente que às vezes conheço
321,tudo bem vamos começar
322,arquivos de mídia cobertos por licenças de conteúdo livre por exemplo ccbysa são compartilhados entre as diferentes edições da wikipédia através do repositório wikimedia commons um projeto também operado pela fundação wikimedia
323,a palavra inteligente número  é lento lento lento significa mover de maneira lenta para ter um ritmo um pouco mais lento
324,a comunidade wikipédia estabeleceu uma espécie de burocracia incluindo uma clara estrutura de poder que dá aos administradores voluntários a autoridade para exercer o controle editorial
325,um estudo de  realizado por pesquisadores da faculdade de dartmouth descobriu que colaboradores anônimos e pouco frequentes na wikipédia são confiáveis e uma fonte de conhecimento tanto quanto os contribuintes que se inscrevem no site
326,alguém está ocupado você pode sempre pedir desculpas por incomodálo e depois perguntar
327,atualmente grande parte da carga de tráfego da wikipédia é suportada por dois clusters maiores nos países baixos e na coreia do sul
328,de onde você tirou a notícia como você
329,eles são coordenados em parte pelo metawiki e pela wikimedia foundation dedicada à manutenção de todos os seus projetos wikipédia e outros
330,tenha paciência comigo por um momento
331,você poderia me dizer o que essa palavra significa
332,deixeme voltar para você sobre isso
333,eu sou terrence o anjo da boa fortuna o nome e a beleza da sua filha são conhecidos em todo o mundo aqui eu trouxe um presente para você mas você mal o conhece você não pode ir com ele
334,ele também relatou que já visitou o palácio do planalto e que teve acesso à senha da rede sem fio do gabinete presidencial
335,a wikipédia é uma enciclopédia hospedada e financiada pela fundação wikimedia uma organização sem fins lucrativos que opera a wikipédia e projetos relacionados tais como o wikcionário wikilivros e outros
336,outra coisa mas eu quero pão normal pão que eu possa comer você não tem aquela aparência tão futura esposa do meu pai
337,sinceramente acho que não vai funcionar
338,narcisa você me ajudaria a plantar essas sementes o que por que eu faria isso o que eu tenho toda aquela sujeira nos meus lindos dedos pior e se ela caísse bem no meu rosto esse era o problema com narcisa ela se considerava grande demais para fazer qualquer trabalho que muitos pretendentes viessem pedir em mão de narciso em casamento
339,vamos
340,ativistas de proteção à criança dizem que conteúdo sexual visual aparece em várias páginas da wikipédia exibido sem qualquer aviso ou categorização de idade
341,esta é uma boa pergunta
342,em  de agosto de  uma matéria do portal de o globo afirmou que um dispositivo conectado à internet através da rede sem fio do palácio do planalto alterou em maio de  informações das páginas de miriam e carlos alberto sardenberg na wikipédia com o objetivo de difamálos
343,você pode pedir desculpas
344,dizerme qual dessas dez palavras era sua palavra inteligente favorita número seis está em uma situação difícil significa estar em uma situação problemática por exemplo garoto estou em uma situação difícil porque fiz planos com dois amigos diferentes para isso tarde
345,além disso os princípios editoriais da wikipédia são dispostos nos chamados cinco pilares e em numerosas políticas e diretrizes que destinamse a moldar o conteúdo de forma adequada
346,sim por favor tenha certeza vá em frente
347,o software incorpora recursos de programação como uma macrolinguagem variáveis um sistema de transclusão de templates e redirecionamento de urls
348,outros sugerem que o crescimento está a nivelar naturalmente pois os artigos mais básicos já existem
349,ele encontrou durante suas viagens ou em uma entrevista quando perguntaram a ela por que deveríamos contratálo ela parecia completamente confusa então da próxima vez se você ficar confuso com alguma dúvida por exemplo em um exame então você
350,há muitas áreas de investigação em que novos e importantes avanços e pesquisas originais são publicados tanto como artigos quanto como cartas
351,você se importa se eu usar seu celular
352,você está livre no próximo sábado
353,de acordo com um estudo realizado por pnina shachaf no journal of documentation a qualidade do serviço de orientação da wikipédia é comparável a uma mesa de orientação de uma biblioteca com uma precisão de
354,um estudo de  conduzido por pesquisadores da universidade carnegie mellon e do palo alto research center apresentou uma distribuição de temas bem como o crescimento de julho de  a janeiro de  em cada campo relativos à wikipédia em inglês no entanto devese considerar que estes números dizem apenas respeito aos artigos é possível que um tópico contenha uma série de artigos curtos e outro artigos muito grandes
355,contribuintes registrados ou não podem tirar proveito dos recursos disponíveis no software que opera a wikipédia
356,a wikipédia atualmente roda em clusters de servidores dedicados linux principalmente ubuntu com algumas máquinas opensolaris com sistemas de arquivos zfs
357,que está aceso o que significa que isso é incrível muitos americanos disseram na califórnia
358,por exemplo roy rosenzweig em um ensaio de junho de  que combinou tanto elogios como reparos à wikipédia teceu várias críticas à sua prosa e sua incapacidade de distinguir o que de fato é importante do meramente sensacional
