,Text
0,sikkert hvad har du i tankerne
1,det er det største og mest populære generelle referenceværk på internettet og i april  var det blandt de mest populære hjemmesider ifølge alexa rangeringsystem
2,hvordan har du det
3,hvor fik du nyheden som hvordan gør du det
4,jeg jeg går alligevel på tøjvask
5,bære med mig et øjeblik
6,jeg er nødt til at komme i gang
7,det sædvanlige
8,hvad hej jeg er kommet her for at bede om narcissus i ægteskab men hvordan ved du hendes navn og hvem er du
9,kan du gentage det fordi jeg ikke fangede det sidste ord hvis han vil have nogen til at gentage hele sætningen igen
10,nej jeg er god tak
11,i aftes godt mor det var sådan en fantastisk drøm du ved at der var denne prins der kom op til mig
12,har du planer om i morgen
13,dine venner der er denne fantastiske kanal for studerende og nogle andre ord som du kan bruge i stedet for fantastiske er utrolige fantastiske eller usædvanligt gode så inden vi fortsætter med de afbalancerede fem ord på denne video skal du huske at sætte en kommentar under denne video
14,kan du tale lidt langsommere vær venlig
15,det er som om det ikke betyder noget
16,hvordan har du haft det
17,jeg tror ærligt talt ikke at det kommer til at fungere
18,og sagde at han ville gifte sig med mig han var kommet i en gylden vogn og han var klædt ovenfra og ned og guld også hvad en fjollet drøm
19,i det øjeblik begyndte narcissus at grine i søvnen hendes mor var meget overrasket over hvor dejlig hun måtte have en rigtig sjov drøm næste morgen når narcissus
20,undskyld at afbryde dig
21,bemærke og sige at dette er en frygtelig handling smart ord nummer  er fantastisk fantastisk fantastisk betyder forbløffende forbløffende
22,er en meget fransk måde at sige møde eller dato på for eksempel har jeg et møde med mine venner over frokosten på lørdag eller jeg planlægger at møde med mine venner i indkøbscentret for film at møde kan bruges både som substantiv eller som verbum for eksempel
23,over  servere er blevet sat op for i fællesskab at kunne håndtere den enorme mængde trafik
24,åh mor jeg elsker dig så meget og du havde ret udseende og rigdom er ikke alt hvad guldbrødet var ubrugeligt da jeg ikke kunne spise det og manden selvom
25,kan du dække mig ligesom kan du arbejde i stedet for mig mens jeg  jeg ser min ven
26,du kan sige undskyld
27,man er oversvømmet oversvømmet betyder drukning eller oversvømmelse men oversvømmet bruges ofte i forbindelse med arbejde som jeg  m oversvømmet med arbejde jeg har for meget arbejde at gøre jeg er blevet oversvømmet med arbejde i hele denne uge jeg har næppe haft tid til at trække vejret nu lad os se på roden af dette ord
28,med krydsede fingre
29,det er ikke noget
30,åh det er tændt og du har sikkert hørt det i sange der  lyser hvis nogen har succes efter fiaskoer så du kan sige der du går jeg fortalte dig at du vil komme derhen du går hvis nogen spørger dig om du er træt og du vil sige at du overhovedet ikke er træt du kan sige ikke lidt nah
31,forslag
32,eller forretning har været træg i dette kvartal kan du bruge det i dit daglige liv hvis du føler dig meget træt en dag kan du fortælle det til din mor eller du kan fortælle det
33,terry du ser faktisk lidt ud som den engel men hvad ser jeg hvordan kunne du være ham i to er så flinke
34,enig og uenig
35,nature er et britisk multidisciplinært videnskabeligt tidsskrift der blev udgivet første gang den  november
36,nævner det ikke
37,dette er min fejltagelse
38,du rammer neglen på hovedet
39,hvordan s narcissisme fortalte marian dem begge alt hvad der var sket og hun har ændret sig så meget fra den tid
40,jeg er ikke sikker på at jeg er enig
41,hvis du er midt i noget i nogen  s beder dig om noget du kan sige åh
42,tusind tak
43,administratorer på den danske wikipedia brugere oprettes som administratorer af bureaukrater bureaucrats der også kan ændre brugernavne
44,at bruge ordet catch
45,hvis du har lige har oprettet denne side og du alligevel får denne meddelelse kan det skyldes at der er forsinkelse i opdateringen af wikipedias cache eller at du har stavet titlen forkert
46,så meget at de glemmer hvad de skal gøre nu forvirret har tendens til at være et overbrugt ord så i stedet for det hvorfor bruger du ikke flummox for eksempel så drengen helt ud
47,kan du holde et øjeblik tak
48,nummer tre er suave suave suave betyder at være sofistikeret for at være høflig klar og cool
49,rocker du rock
50,den danske wikipedia er ikke repræsenteret på fdims statistik viser kun sites under dk men hvad sidevisninger angår lå dansk wikipedia i oktober  mellem  og pladsen mellem politikendk og jpdk  wikipedia har ikke nogen side med navnet machine learning
51,et andet eksempel på catch er at du har brug for et banklån fordi du ikke har nok
52,jeg kan sige pas på hvilket betyder at tage sig af dig selv
53,du bliver nødt til at spise alt dette jeg troede du kunne lide fancy ting nej jeg vil ikke gifte dig jeg vil hjem
54,hej og velkommen
55,den danske wikipedia har  artikler pr
56,ville du tilfældigvis vide hvor biblioteket er
57,wikipedias styrke er blandt andet at udnytte diverse brugeres evner
58,jeg ved ikke hvilken dag det er når du ser denne video men hvis det er fredag for eksempel weekend
59,pas på
60,det betyder ikke noget som om du ikke skal bekymre dig hvis du taber din kaffe over mig
61,tilladelse
62,du kan sige undskyld at genere dig du ved du ser
63,du er som at sidde du kan sige at jeg ikke kunne bryde mig mindre det er så kedeligt
64,jeg fejlede
65,du kan sige tak himlen er fredag eller tror himlen sagde lørdag weekend opdagelse
66,jeg har ikke en mening om sagen
67,den  januar  skiftede den engelske wikipedia program fra usemodwiki til php og mysql
68,erfarne brugere kan wikificere nye brugeres bidrag  indsætte hyperlinks billeder links til andre sprog kategorier mm
69,jeg spekulerede på om du kunne hjælpe mig med dette
70,undskyld
71,at blive bedøvet så fantastisk bruges til at beskrive noget der er forbløffende godt for eksempel ser hun fantastisk ud i den kjole eller hvilken fantastisk udsigt fra denne altan eller jeg læser denne fantastiske bog som jeg ikke kan lægge fra hvad med dig at gå og fortælle
72,jeg er terrence engelen med lykke din datters navn og skønhed er kendt overalt i verden her jeg har givet dig en gave men du kender ham næppe du kan ikke gå med ham
73,jeg ville elske at gøre noget men det kan jeg ikke
74,hvad siger du vi går i biografen
75,jeg er ikke interesseret
76,jeg fik en næsten perfekt score ordet forbløffende har klassiske latinske rødder fra ordet som betyder
77,alle der er koblet til internettet kan læse og skrive i wikipedias artikler
78,nej det tror jeg ikke
79,det synker du siger træk dig sammen som at tage dig selv bogstaveligt talt og træk dig sammen stop med at arbejde stop med at græde træk dig sammen
80,til min mor lad mig gå hjem melissa og terrence så på hinanden og blinkede godt
81,hvad er dit syn på dette
82,wikipedia ejes og drives af wikimedia foundation en almennyttig organisation der drives ved hjælp af donationer for at kunne være uafhængig
83,jeg freaked en anden sætning som indfødte talere bruger er god for dig og det kan være både positivt og negativt når du siger at jeg blev forfremmet og hvis de siger godt for dig kan du lide tillykke og nogle gange hvis du siger at jeg forlader dette sted
84,jeg har lidt travlt i morgen
85,og du er ligesom hvad der foregår herinde ligesom hvad laver du her
86,jeg er bange for at jeg er uenig
87,mange tak
88,fortsæt
89,hjælp mig med at bage brødet hej ingen måde mor melpiger alle mine lyse og glitrende øjne
90,tak på forhånd hvilket betyder at jeg virkelig håber at du skal
91,stallman påpegede brugbarheden af en fri universel encyklopædi før wikipedia blev startet
92,så hvis du lige er ved at starte din rejse
93,narcisa vil du hjælpe mig med at plante disse frø hvad hvorfor skulle jeg gøre det hvad har jeg alt det snavs på mine dejlige fingre værre hvad hvis det gik på mit ansigt det var problemet med narcisa
94,ved hans egen refleksion i spejlet eller turisten blev flummoxed af de forskellige skikke der
95,åh dette er som næsten vanvittigt
96,jeg skruede op jeg skruede det op hvis du vil have nogen til at arbejde i stedet for mig kan du sige
97,det ville være rart
98,hvis det virkelig er hvad du vil have så tager jeg dig hjem terrence tog grædende og ulykkelig
99,sikkert ikke noget problem
100,hvis du beder nogen om ikke at blive ked af ikke at græde kan du sige tag det ikke til hjertet
101,afbryder høfligt
102,hvad så
103,du kan gøre det hvis nogen klarer sig rigtig godt du kan fortælle dem fortsæt det gode arbejde fortsæt det gode arbejde som vær så god som dig og fortsæt det gode arbejde fortsæt med at være en anden sætning er dagligdags og dette er hvad amerikanere sige
104,undskyld at genere dig
105,den danske udgave blev påbegyndt den  februar
106,lad mig tænke et øjeblik
107,ja tak
108,meget suave så smart ord nummer fire er forfærdeligt forfærdeligt ordet forfærdeligt betyder noget virkelig dårligt forfærdeligt forfærdeligt grusomt forfærdeligt stødende forfærdeligt har en latinsk rod kaldet
109,måske talte du i telefon og nogen talte til dig og du er ligesom
110,prøv at kopiere min udtale nøjagtigt inklusive den stemmetone jeg bruger
111,så husk at gøre det næste gang du hører om en forfærdelig handling på nyheden
112,velopdragen ordet suave har flere forskellige oprindelser men en meget interessant oprindelse af ordet er hvilket betyder behagelig eller sød smagseksempel
113,noget andet men jeg vil have normalt brødbrød som jeg kan spise har du ikke det blik så kone til at være fra min far skal det er koldt du skal kun spise den bedste narcis jeg kiggede på al mad
114,ikke meget
115,hæng på et sekund
116,jeg vil også give dig et smart tip til at lyde virkelig flydende smart ordnummer
117,dine venner jeg føler mig meget træg
118,skål jeg sætter stor pris på det
119,takke folk
120,jeg er med dig om et øjeblik jeg er sammen med dig og så genoptager du at gøre noget og du siger hvor var vi
121,holde kontakt
122,og de er som om jeg vil købe det samme og jeg fortæller dem at du solgte det du solgte mig jeg ville ikke købe det okay du solgte mig hvis du ikke er interesseret i samtalen
123,hvilket betyder hvilket tilskynder personen til at gentage igen
124,sætninger hvis du har lært engelsk i et stykke tid og du vil genoptage læringen
125,sætning nummer to når du ikke har set nogen i et stykke tid fortæller han ham i lang tid nej se så det betyder at du ikke har set denne person måske uger eller måneder i lang tid se ikke sætningsnummer
126,sagde du
127,jeg forvirrede dig så lad mig give dig nogle eksempler en situation hvor catch er når du ikke får et job uden at have erhvervserfaring
128,i  udgav nature en artikel hvor  artikler om forskellige videnskabelige emner blev sammenlignet fra encyclopædia britannica og wikipedia hvor man fandt at wikipedias niveau af præcision og rigtighed nærmede sig britannicas selvom kritikere har foreslået at hvis man havde udvalgt en tilfældig gruppe blandt alle artikler eller havde fokuseret på samfundsvidenskab eller omstridte sociale problemer
129,meninger
130,forvaltere vælges en gang om året ved demokratiske afstemninger
131,når som helst
132,da hendes skønhed var kendt vidt og bredt men hun afviste dem alle meget uhøfligt hvorfor sendte du disse mænd væk i går de syntes gode du kan ikke være seriøs mor en af dem
133,rolig ingen bekymringer hvilket betyder at du ikke skal bekymre dig om det
134,det lyser hvilket betyder at det er forbløffende at mange amerikanere sagde i californien
135,situationen er at du ikke fik noget og så får du en ekstra effekt og du får det
136,narcisa ændrede sine måder hun kæmpede i starten men langsomt og tålmodigt begyndte hun at blive meget pænere en dag mellie og terry kom for at møde marian igen oh hej i to så fortæl os marian
137,undskyld jeg lyttede ikke
138,den  september  skiftede den danske wikipedia over til samme program
139,undgår et spørgsmål
140,tre hvis du vil spørge dig hvad har du lavet
141,end normalt at se lidt træt og manglende ud
142,det er faktisk kl
143,hvordan går det
144,undskyld
145,du kan gøre det du kan videregive toefl du kan videregive gmat du får det kommer
146,kunne du fortælle mig hvad dette ord betyder
147,dette er den bedste video til at begynde med så lad os gå  sætninger på engelsk på forhåbentlig  minutter
148,i energieksempel gør en tung frokost mig meget om eftermiddagen træg har rødder fra ordet hvilket betyder en langsom person og en snegl er et dyr der bevæger sig rigtig meget langsomt som en snegleeksempel
149,nature dækker en lang række forskningsgrene hvor vigtige nye opdagelser og original forskning bliver udgivet enten som artikler eller som letters i tidsskriftet
150,hvad med noget is
151,er ikke alt mor du er nødt til at indse jeg fortjener nogen som en prins eller en ridder
152,dette er gratis og har en del fordele  primært overskuelighed
153,ja selvfølgelig
154,er du fri næste lørdag
155,ja vær venlig at gå videre
156,jeg har mistet min telefon og jeg er i en løsning eller vores bus gik i stykker i morges og jeg er i en ordning min ven henvender sig altid til mig for at få hjælp når han er i en løsning og når det går godt glemmer han det
157,jeg kunne ikke bryde mig mindre hvis nogen spørger dig om noget og dette er en rigtig nem beslutning for dig som om nogen fortæller at du skal tage mine  million dollars og du siger det er en nobrainer
158,det betyder ikke noget om du vil ønske nogen held og lykke
159,som hvornår stoppede vi hvor var vi og du bliver nødt til at gentage det for hvad er det lyden som nogle fejler med
160,da det stoppede kom en smuk mand ud af det og kiggede på narcisa hun blev helt overrasket over hvor smuk han var min drøm er faktisk at gå i opfyldelse umm
161,gylden vogn kom ridende op til dem den var besat i ædelstene og diamanter og så ekstremt fantastisk ud
162,pr
163,og du ved den bedste del af det var da jeg var i min brudekjole som også var af guld selvfølgelig stirrede alle kun på mig narcisa der er ikke noget fantastisk ved den drøm
164,ikke tage det til hjertet som seriøst vær ikke så ked af det tag det ikke til hjertet
165,kan ikke klage over den næste sætning nogen fortæller dig noget og du har ikke rigtig nævnt det i samtalen som om de på en eller anden måde gætter på at du har et nyt job og du spørger ham
166,wikipedia er en internetencyklopædi der forekommer i flere sprogversioner udelukkende med frit indhold og ingen reklamer selvom donationer accepteres baseret på et åbent samarbejde igennem en model hvor brugere kan redigere ved hjælp af internetbaserede applikationer som webbrowsere kaldet wiki
167,det ville være godt der er en rød knap derovre et eller andet sted
168,da han nysede åh åh og det sidste stop nej jeg vil ikke høre mere alt hvad jeg kunne se var at disse mænd var rigtig flinke min kære du skal vide den skønhed
169,gå videre
170,der er for meget på min tallerken jeg drukner i arbejde
171,det synes jeg er en god idé
172,i dag kunne jeg gøre med en energidrik andre ord som du kan bruge i stedet for træg kan være sløv eller trække mine fødder så det var de  smarte ord og før
173,tjek stavningen eller se om den dukker op senere inden du forsøger at oprette artiklen igen
174,det er et godt spørgsmål
175,åh gud
176,ved hvis nogen fortæller en cool joke kan du fortælle at det er en god en
177,det gøres af forvaltere stewards
178,vi leder alle efter hurtige måder at blive mere flydende på engelsk jeg ved jeg forstår hvad der sker er at der kun er et par ord der cirkler omkring vores hjerne og vi er nødt til at gøre hele denne samtale ved hjælp af bare fantastisk fantastisk sejt eller episk så hvad med os lære nogle smarte nye engelske ord som du kan bruge i dit daglige liv og hæve dit ordforråd på få minutter
179,det var en meget egoistisk drømmemor du ved ikke hvad du siger at drømmen har fået mig til at indse at jeg har brug for mad meget større end den type jeg spiser her hjemme brød lavet af guld
180,i dag fik jeg en fantastisk score på min test hvilket betyder at jeg fik en meget høj score eller
181,hej fyre velkommen til min kanal i denne video
182,at fortælle mig hvilket af disse ti ord der var dit foretrukne smarte ord nummer seks er i en fix i en fix betyder at være i en besværlig situation for eksempel dreng jeg er i en fix fordi jeg har lavet planer med to forskellige venner til dette aften
183,blev klar til seng mor jeg håber virkelig min drøm går i opfyldelse du ved åh narcisa den næste dag da narcisa og hendes mor var udenfor i deres have en smuk
184,har du noget imod at låne mig nogle penge
185,så i dag lærer vi  nye smarte ord deres betydning rodord og eksempel sætninger så lad os komme i gang hej alle dette er og du holder øje med
186,hvordan går det
187,tak for din indsats
188,det er ikke det værd jeg personligt elsker sætningen du rocker hvilket betyder at du er fantastisk
189,undskyld mig
190,af et stort og storslået gyldent slot narcisa var forbløffet over al den skønhed hun så jeg vidste jeg fortjener så mange rigdom jeg vidste at du kunne lide det hvad du vil du finder her fra den smukkeste kjole til den mest lækre mad alt sammen i mit palads godt taler om mad er jeg virkelig sulten efter den tur jeg  m sulter kan jeg få noget af den velsmagende mad selvfølgelig her kød ildelugtende melissa hun får dig hvad du vil have jeg har hørt så meget om dig du stakkels kære du er sulten er du ikke kommer lad os gå til spisebordet og jeg får dig noget mad åh tak de gik ind i spisestuen og der på bordet var den mest forbløffende mad som narcisa nogensinde havde set forbløffende fordi det er at syltetøj er lavet
191,vi vi har lært en hel masse af disse smarte ord og vi har tendens til at sætte to tre fire af dem i en sætning der ikke lyder naturligt
192,tænk bare på den stakkels narcissemor var så bekymret for sin datter og hvordan
193,var meget bange skal du ikke bekymre dig min kære alt dette vil snart være forbi ligesom han sagde dette at vognen gik gennem en anden portal og nåede indkørslen
194,nej slet ikke
195,kan jeg stoppe dig der et øjeblik
196,bidrag angives med ipadressen
197,det er meget venligt af dig
198,velopdragen og kultiveret og sofistikeret
199,jeg tror du tager fejl
200,rubin marmelade på det og tog en kæmpe bid det er så varmt jeg kan ikke spise det godt det er brød lavet af guld og det fineste også men hvis du ikke kan spise det skal jeg skaffe dig sølvbrød sølv he hvorfor ikke du spiser
201,hun syntes sig for stor til at udføre noget arbejde mange friere kom for at bede om narcissus i ægteskab
202,i starten af hvert tidsskrift er ledere nyheder og featureartikler som har generel interesse for videnskabsfolk inklusive nye opdagelser videnskabsetik og videnskabelige gennembrud
203,tilsammen har de over  sprogversioner af hjemmesiden mere end  millioner artikler på  forskellige sprog og i februar  nåede siden  milliarder sidevisninger og næsten  millioner unikke besøgende om måneden
204,vi bliver meget begejstrede fordi
205,sanger fandt på navnet som en portmanteau af wiki det hawaiianske ord for hurtig og encyclopedia
206,jeg er virkelig ked af det
207,lad mig komme tilbage til dig om det
208,okay hvis du vil have flere lektioner om almindelige sætninger og sætninger så lad mig det vide i kommentarfeltet nedenfor
209,i frankrig blev rendezvous tidligere brugt af hæren til at angive et mødested for tropperne nu er der noget lidt spændende og hemmelighedsfuldt over ordet rendezvous selv nu så mens du kan bruge rendezvous til ethvert møde
210,godt du kan bare svare kan ikke klage alt er virkelig sejt
211,det ville være vidunderligt ville det ikke godt uanset hvad jeg tror med tiden vil hun vokse til at lære lad os tale om noget andet
212,nogle ved en masse om et emne men formulerer sig dårligt
213,og i denne video vil jeg give dig  smarte ord til daglig brug og i slutningen af denne video
214,vil du have at jeg giver dig en tur hjem
215,det er et af de få tilbageværende akademiske tidsskrifter der udgiver original forskning spredt over en bred række videnskabelige emner
216,nu vinkede mellie og terry farvel til deres gamle ven og gik smilende til hinanden hemmeligt den aften både mor og datter
217,åh kære en nat da hun sov sad mor ved hendes side og så på hende
218,narcis hjemme i vognen begyndte hun at tænke dybt over de valg hun havde taget da hun kom hjem
219,i november  var der omkring  millioner sidevisninger eller  sidevisninger i timen
220,færre end  af de artikler som sendes til tidsskriftet ender med at blive accepteret og udgivet
221,personer der har lyst til at bidrage med mere kan oprette sig som brugere
222,mobile enheder kan tilgå de mobile udgaver af wikipedia
223,af rubiner salater af smaragder og brød derovre er lavet af guldgyldent brød hvor dejligt dette marmelade vil se ud og smage dejligt med det brød hun tog et stykke med
224,du kan bare sige ingen bekymringer
225,det ved du
226,jeg har det godt
227,min fornøjelse
228,det er jeg ikke sikker på
229,lang tid siden
230,kan du dække mig det er tid til at rejse og fyre jeg må hellere gå hvilket betyder at jeg allerede skal gå
231,kom nu
232,du er midt i noget og nogen beder dig om at gøre noget du siger jeg er ked af det
233,jeg vil fortsætte jeg er ikke træt af det når nogen spørger om du er sikker og du er ret sikker på at du kan sige at der ikke er plads til det
234,kan du gentage det
235,jeg tager det
236,dette er en nobrainer betyder at det er en rigtig nem beslutning for dig hvis du har gjort noget forkert og du indrømmer det kan du sige at jeg har ødelagt ja fyre
237,tøver
238,hold et øjeblik
239,desværre er jeg nødt til at sige nej
240,det er ikke det værd
241,penge men du ville ikke få det banklån medmindre du beviste over for banken at du har penge nok så husk næste gang du sidder fast i en vanskelig situation
242,nede i beskrivelsesboksen for det og nu er det hemmelige tip det hemmelige tip til at lyde flydende er at bruge ikke mere end et smart ord eller en sætning som jeg nogle gange kender
243,ting sker vær ikke forstyrret hvis du ikke har navnet på den person du vil tale med ham
244,hvis du ikke allerede har trykket på abonnementsknappen og klokkeikonet lige ved siden af det og glæde at se
245,har du noget imod det hvis jeg springer herinde
246,ipod androidenheder og kindle damwikipediaorg og enmwikipediaorg
247,for eksempel var hans bordmanerer forfærdelige eller hendes sans for kjole er så grusom eller hans grammatik er forfærdelig
248,husk nu når du er på fest næste gang og du ser denne person der er sådan
249,hvad har du været op med at rejse dem før hvis alt går
250,sammenlignet med andre sites besøgt fra danmark er wikipedia alle sprogversioner medtaget også godt besøgt og lå december  på en
251,de tre bærende principper på wikipedia der tilsammen definerer dens niche på world wide web er wikipedia støttes af richard m stallman og free software foundation
252,den første mobile udgave formateret til wap wapediamobi har eksisteret siden   og siden  til andre mobile enheder inkl
253,hej hvorfor hænger du ikke med os du kan sige til dem jeg er ked af det men jeg er oversvømmet med arbejde eller jeg er oversvømmet med nogle andre ord som du kan bruge i stedet for oversvømmet hvis jeg har for meget at gøre
254,prøv nogle gyldne kartofler her de er rigtig gode og når du er gift med mig
255,jeg er enig med dig
256,disse servere er ansvarlige for wikipedia på alle sprog og for postlisterne
257,skal du ikke bekymre dig om det
258,udbrød dette er super vred
259,det gyldne brød engang i en lille landsby boede en kvinde ved navn marion
260,økonomien har været meget træg i år eller kampen er taget op efter en træg start
261,hvad din fejl var kom lad os fodre dig med noget pænt fra den dag og frem
262,beder om gentagelse
263,men du kan ikke få erfaring før du får et job catch blev opfundet af joseph heller i hans berømte bog med samme navn catch da han beskrev nogle modstridende regler der var gældende for soldater under  verdenskrig
264,forsøgte at hjælpe dig men kunne ikke nå det resultat du kan sige
265,lad os sige at du har mange opgaver og du har en test der kommer og dine venner kommer til dig og de siger
266,jeg har ikke frihed til at sige
267,torsdag den  januar  har den engelsksprogede wikipedia  artikler  aktive bidragydere og  administratorer
268,men nej i en ordning betyder at være i en besværlig situation andre ord som du kan bruge i stedet for i en rettelse er jeg er i en suppe eller jeg  m i et rod eller jeg er i en plet af plage eller bare jeg er i et sted smart ord nummer  er flummox flummox betyder at forvirre nogen
269,alle kan bekæmpe vandalisme og brugere der er blevet erfarne indenfor wikiprocedurerne kan vælges til administratorer
270,spørger jeg og så siger jeg til sidst
271,der er pt
272,jeg er bange for at jeg ikke kan fremsætter tilbud
273,undskylder
274,jeg giver dig det hemmelige tip til at lyde meget flydende
275,så dette er en fantastisk måde at øve på hvor var vi igen hvis du er midt i en samtale
276,okay lad os begynde
277,en anden måde at fortælle personen om ikke at være ked af er at du kan sige at ting sker som om det er okay
278,også hvis du kunne lide denne video skal du give tommelfingrene op ved at trykke på lignendeknappen og huske at abonnere på denne kanal ved at klikke på knappen abonner for at få mine seneste lektioner lige her på youtube
279,administratorer kan få taget deres rettigheder hvis de udøver magtmisbrug
