,Text
359,você arrasa se alguém não está trabalhando muito bem e você quer que ele trabalhe mais você pode dizer que você deve ir mais além o que significa que você deve ir mais além
360,há muito no meu prato estou me afogando no trabalho
361,foi um sonho muito egoísta mãe você não sabe o que está dizendo aquele sonho me fez perceber que eu preciso de comida muito mais grandiosa do que o tipo que como aqui em casa pão feito de ouro
362,de acordo com as regras da wikipédia só os temas considerados enciclopédicos são dignos de ter verbete na wikipédia e esse verbete não deve ser redigido como um verbete de dicionário
363,então você conhece alguém e você cronometra como está indo
364,em janeiro de  um tribunal alemão ordenou o fechamento da wikipédia em alemão na alemanha por ter publicado o nome completo do boris floricic também conhecido como tron um hacker que era antigamente membro do chaos computer club
365,seus amigos estou me sentindo muito lento
366,se algo te surpreender você também pode dizer que deve estar brincando comigo como ai meu deus
367,o comediante stephen colbert citou a wikipédia em vários episódios de seu programa the colbert report e cunhou o termo relacionado wikiality que significa juntos podemos criar uma realidade que todos nós concordamos
368,eu acordei ela era toda sorrisos e risos aqui querida me diga com o que você sonhou
369,o que significa que leva a pessoa a repetir mais uma vez
370,você está no meio de algo e alguém está lhe pedindo para fazer algo que você diz desculpe
371,alguns como susningnu enciclopedia libre hudong baidu baike e wikiznanie também empregam processos formais de revisão enquanto outros usam métodos mais tradicionais de revisão por pares como encyclopedia of life stanford encyclopedia of philosophy scholarpedia hg e everything
372,não tenho liberdade para dizer
373,este incidente levou a mudanças nas políticas no site especificamente orientadas para o reforço verificabilidade de todos os artigos biográficos de pessoas vivas
374,a estrutura aberta da wikipédia faz com que ela seja um alvo fácil para os trolls spams e aqueles procuram usar o projeto para espalhar suas ideias
375,carne fedorenta melissa ela vai buscar o que você quiser eu ouvi muito sobre você pobre querido você está com fome não venha vamos para a mesa de jantar e vou pegar um pouco de comida para você obrigado eles foram para a sala de jantar e sobre a mesa estava a comida mais incrível que a narcisa já tinha visto porque é porque as geléias são feitas
376,embora em geral elogiando o artigo considerou sua conclusão indecisa alguns historiadores lembramse dele como um foradalei oportunista e sedento de sangue enquanto outros continuam a vêlo como um soldado audaz e um herói popular
377,muito suave tão inteligente palavra número quatro é atroz atroz a palavra atroz significa algo realmente ruim horrível terrível cruel apavorante ofensiva atroz tem uma raiz latina chamada que significa medo cruel ou terrível alguns exemplos da palavra atroz são os recentes incidentes de estupro em deli foram atrozes ou prisioneiros são tratados
378,o segundo foi o prêmio webby para a categoria comunidade
379,de maneira atroz às vezes nas prisões atroz também é usado no dia a dia para falar sobre alguma má ação comum e você deseja exagerar
380,fazer ofertas
381,a wikipédia publica dumps de seu conteúdo mas estes consistem apenas de texto em  não havia dumps disponíveis de imagens da wikipédia
382,a wikipédia recebe entre  e  pedidos de página por segundo dependendo da hora do dia
383,preparese para a cama mãe eu realmente espero que meu sonho se torne realidade você sabe oh narcisa no dia seguinte como narcisa e sua mãe estavam fora em seu jardim lindo
384,o conteúdo exibido na wikipédia também tem sido citado como fonte e referência em alguns relatórios da comunidade de inteligência dos estados unidos
385,entre os editores da wikipédia isto é frequentemente descrito como comprovação não a verdade para expressar a ideia de que os leitores e não a enciclopédia são responsáveis por verificar a veracidade dos artigos e fazer as suas próprias interpretações
386,nós aprendi muitas dessas palavras inteligentes e tendemos a enfiar duas três quatro delas em uma frase que não parece natural
387,foi classificada como a revista científica mais citada do mundo pela edição de  do journal citation reports sendo amplamente considerada como uma das poucas revistas acadêmicas remanescentes que publica pesquisas originais em uma ampla gama de campos científicos
388,eu sinto muito
389,vejo você mais tarde
390,você se importaria de me emprestar algum dinheiro
391,ele disse que a wikipédia é surpreendentemente precisa em relatar nomes datas e acontecimentos da história dos estados unidos o campo de estudo de rosenzweig e que a maioria dos poucos erros factuais que ele encontrou eram pequenos e negligenciáveis acrescentando que alguns deles simplesmente repetiam crenças divulgadas amplamente porém imprecisas que também são repetidas nas enciclopédias encarta e na britannica
392,por favor aceite minhas desculpas
393,posso dizer para cuidar o que significa cuidar de si mesmo
394,em  a nature em conjunto com a science recebeu o prêmio princesa das astúrias de comunicação e humanidade
395,no meu palácio por falar em comida estou com muita fome depois daquela cavalgada estou morrendo de fome posso comer um pouco daquela comida saborosa é claro
396,a palavra wikipédia é uma adequação lusófona da forma original anglófona sobre a fusão dos dois nomes que formam o termo
397,em seu livro  o futuro da internet e como parálo jonathan zittrain do oxford internet institute e do berkman center for internet  society pertencente à harvard law school cita o sucesso da wikipédia como um caso de como a colaboração aberta tem fomentado a inovação na web
398,além disso se você gostou deste vídeo dê um like clicando no botão curtir e lembrese de se inscrever neste canal clicando no botão inscreverse para obter minhas últimas lições aqui mesmo no youtube
399,perdi meu telefone e estou em apuros ou nosso ônibus quebrou esta manhã e eu estou em apuros meu amigo sempre pede ajuda quando está em apuros e quando as coisas estão boas ele se esquece
400,e aí
401,citando temores de publicidade comercial ser inserida no site e a falta de controle numa wikipédia que viam como sendo anglocêntrica usuários da wikipédia em espanhol criaram uma versão independente da wikipédia em fevereiro de  a enciclopedia libre
402,por favor procure por machine learning na wikipédia para buscar por títulos alternativos
403,em junho de  o expresidente da american library association michael gorman condenou a wikipédia juntamente com o google afirmando que os acadêmicos que apoiam o uso da wikipédia são o equivalente intelectual de um nutricionista que recomenda uma dieta constante de big macs com tudo
404,por exemplo a wikipédia em alemão mantém um sistema de versões estáveis de artigos para permitir que um leitor veja as versões dos artigos que passaram por certas revisões
405,eu ficaria feliz em ajudar
406,obrigado um milhão
407,os trabalhos que foram publicados nesta revista são internacionalmente aclamados pela manutenção de altos padrões de pesquisa
408,é uma espécie de batalha entre o direito de ser anônimo no ciberespaço e o direito de ser anônimo na vida real
409,e neste vídeo eu vou dar a vocês  palavras inteligentes para uso diário e no final deste vídeo
410,agora costumamos usar a palavra incrível aqui  s outra palavra que você pode usar no lugar de incrível estupendo por exemplo hoje eu obtive uma pontuação estupenda no meu teste o que significa que obtive uma pontuação muito alta ou
411,a preferência do projeto pelo consenso sobre credenciais foi rotulada como antielitismo
412,não foi capaz
413,agora mesmo
414,a posição de que a wikipédia é apenas um serviço de hospedagem tem sido utilizada com sucesso como uma defesa em tribunal
415,obter o conteúdo completo da wikipédia para reutilização apresenta desafios uma vez que a cópia direta através de um web crawler é desencorajada
416,o referendo ocorreu entre  e  de abril
417,visto que os contribuintes normalmente reescrevem pequenas porções de um verbete ao invés de fazer grandes revisões em todo o texto num mesmo artigo pode coexistir conteúdo de alta e de baixa qualidade
418,as informações inseridas no artigo de miriam qualificavam suas análises e previsões econômicas como desastrosas além de acusála de ter defendido apaixonadamente o banqueiro daniel dantas quando este foi preso pela polícia federal
419,feliz aprendizagem e vejo você em outra lição em breve
420,diga a eles que talvez eu esteja sendo obtuso mas não sei por que você está tão chateado
421,novos projetos inspirados na wikipédia  como o citizendium scholarpedia conservapedia e o knol da google onde os artigos são um pouco mais ensaísticos  foram iniciados para tratar de limitações de percepção da wikipédia como suas políticas sobre revisão por pares pesquisa original e publicidade comercial
422,tinha olhos tão pequenos quase como os de um pássaro e o outro tinha um nariz enorme que eu não gostaria de estar perto dele
423,tal bloqueio é aplicado com moderação geralmente apenas por curtos períodos de tempo enquanto os ataques parecerem propensos a continuar
424,atualmente a extensão lucene  é escrita em java e baseada na lucene library
425,outros sites centrados na colaboração à base de conhecimento têm se inspirado na wikipédia
426,obrigado pelo seu esforço
427,e você está pronto para ir e se você gostou deste vídeo não se esqueça de nos dar um polegar para cima com um comentário
428,sim por favor
429,eu não posso te agradecer o suficiente
430,dinheiro mas você não obterá esse empréstimo bancário a menos que prove ao banco que tem dinheiro suficiente então da próxima vez que estiver preso em uma situação difícil lembrese
431,não desculpe eu já fiz alguns planos
432,em fevereiro de  um artigo no jornal the harvard crimson informou que alguns dos professores da universidade de harvard incluem a wikipédia em suas ementas mas que há uma divisão na sua percepção do uso da wikipédia
433,claro o que você tem em mente
434,você é como sentar você pode dizer que eu não poderia me importar menos isso é tão chato
435,poderia me passar o sal por favor
436,você estava dizendo
437,em julho de  a bbc radio  transmitiu uma série de comédia chamada bigipedia baseada em um site que era uma paródia da wikipédia
438,você está absolutamente correto
439,a meta estabelecida por sue gardner diretora executiva da fundação wikimedia é ver as contribuições femininas aumentarem para  até
440,e então vá em frente e explique de onde você saiu entendi bem
441,como vão as coisas
442,você acerta o prego na cabeça
443,a natureza aberta do modelo de edição tem sido o mote da maioria das críticas à wikipédia
444,na sequência da queixa apresentada por larry sanger wales excluíu imagens sexuais sem consultar a comunidade
445,sugestões
446,uma série de enciclopédias interativas que incorporam artigos escritos pelo público já existiam muito antes da wikipédia ser fundada
447,depois que alguns editores argumentaram que a decisão de excluílas foi tomada demasiado às pressas wales voluntariamente renunciou a alguns dos poderes que detinha por seu estatuto de cofundador
448,o ciclo seja audaz reverta discuta ocorre algumas vezes quando um usuário faz uma edição outro usuário reverte essa edição e o assunto é discutido na página de discussão apropriada
449,como tá indo
450,do que o normal para parecer um pouco cansado e com falta no exemplo da energia um almoço pesado me deixa muito preguiçoso à tarde tem raízes da palavra que significa uma pessoa lenta e uma lesma é um animal que se move realmente muito devagar como um exemplo de caracol
451,quando surgem erros o tempo médio atual para suas correções é de dois minutos
452,eu vou te dar as  melhores frases em inglês que você pode usar na sua vida cotidiana
453,graças à colaboração de voluntários não raro consultores e editores wiki mesclamse numa só pessoa
454,desculpe eu não entendi isso
455,você pode fazer isso você pode passar o toefl você pode passar o gmat você vai conseguir vir
456,edições em artigos especificados são agora sujeitas a revisão de um editor estabelecido da wikipédia antes da publicação
457,larry sanger e jimmy wales fundaram a wikipédia
458,o cofundador jimmy wales salienta que enciclopédias de qualquer tipo normalmente não são apropriadas como fontes primárias e não devem ser invocadas como autoridades
459,tem ela eu acho que ela não iria querer mais pão de ouro agora hein você sabe
460,o wikipedia watch criticou o site em  quando listou dezenas de exemplos de plágio cometidos pelos editores da wikipédia em inglês
461,não se preocupe com isso
462,em janeiro de  a wikipédia entrou na lista dos dez sites mais populares nos estados unidos segundo a comscore networks inc com  milhões de visitantes únicos e o nono lugar a wikipédia superou os sites do the new york times  e apple inc
463,a utilização de arquivos de mídia por exemplo arquivos de imagem varia entre as várias edições em diferentes idiomas
464,no entanto ele fez uma crítica importante contrastando o tratamento dado a abraham lincoln na wikipédia com o oferecido na american national biography online pelo historiador da guerra civil james mcpherson rosenzweig disse que ambos eram essencialmente corretos e cobriam os episódios principais da vida de lincoln mas elogiou a contextualização mais rica de mcpherson seu hábil uso de citações para capturar a voz de lincoln a sua capacidade de transmitir uma mensagem profunda com apenas um punhado de palavras
465,por exemplo em agosto de  o site wikiscanner começou a rastrear as fontes das alterações feitas na wikipédia por editores anônimos sem contas registradas no site
466,a mudança foi efetivada em  de junho de
467,o wikinfo por exemplo não requer um ponto de vista neutro e permite pesquisas originais
468,você pode repetir
469,se você pedir a alguém para não ficar chateado e não chorar você pode dizer para não levar a sério
470,não você fez um trabalho incrível
471,essas páginas ajudam os contribuintes a chegarem a um consenso sobre o que o conteúdo dos artigos deve constar sobre quais regras do site podem mudar e tomar medidas com relação a qualquer problema dentro da comunidade
472,a wikipédia é uma ferramenta de pesquisa amplamente utilizada por estudantes e tem influenciado o trabalho de publicitários pedagogos sociólogos e jornalistas que usam seu material mesmo que nem sempre citem suas fontes
473,este é o meu erro
474,se isso é mesmo o que você quer então eu vou te levar para casa terrence levou o choro e infeliz
475,por exemplo em  a wikipédia rejeitou uma petição online contra a inclusão de representações de maomé em sua edição em inglês citando esta política
476,páginas fortemente atacadas artigos em particular podem ser semiprotegidos de modo que apenas usuários registrados estabelecidos possam editálos ou para casos particularmente controversos bloqueios podem ser usados para que apenas os administradores sejam capazes de fazer edições
477,a primeira delas foi a bbc domesday project em  que incluía textos que entraram na bbc micro computadores e fotografias feitos por mais de um milhão de contribuintes do reino unido cobrindo temas como geografia arte e cultura desse país
478,a wikipédia ganhou dois prêmios importantes em maio de
479,interrompendo educadamente
480,outras razões pelas quais esta mensagem pode aparecer estamos todos procurando maneiras rápidas de nos tornarmos mais fluentes em inglês eu sei que entendo o que acontece é que existem apenas algumas palavras circulando em nosso cérebro e precisamos fazer toda essa conversa usando apenas incrível incrível legal ou épico então que tal nós aprenda algumas palavras novas e inteligentes em inglês que você pode usar em sua vida diária e elevar seu vocabulário em minutos
481,estar atordoado tão estupendo é usado para descrever algo que é incrivelmente bom por exemplo ela parece estupenda naquele vestido ou que vista estupenda desta varanda ou eu estou lendo este livro estupendo que não consigo largar que tal você vai e contar
482,eu acho que você está enganado
483,uma pesquisa de  na revista nature mostrou que os artigos científicos que eles compararam chegavam perto do nível de precisão da encyclopædia britannica e tinham uma taxa semelhante de erros graves
484,naquele momento o narciso começou a rir em seu sono sua mãe ficou extremamente surpresa com o quão bom ela deve estar tendo um sonho muito engraçado na manhã seguinte quando narciso
485,espere um momento
486,usuários não registrados são em algum sentido cidadãos de segunda classe na wikipédia visto que os participantes são credenciados por membros da comunidade wiki que têm interesse em preservar a qualidade do produto do trabalho com base em sua participação em curso mas as contribuições de endereços de ip podem não necessariamente serem creditadas a um usuário em particular
487,eu vou ficar bem
488,e você fica tipo isso explica isso explica
489,estava com muito medo não se preocupe minha querida tudo isso acabará logo assim que ele disse isso a carruagem passou por outro portal e chegou à garagem
490,hoje eu poderia fazer com uma bebida energética outras palavras que você pode usar no lugar de lento poderia ser letárgico ou arrastar meus pés então essas foram as  palavras inteligentes e antes
491,eu também vou te dar uma dica inteligente para soar realmente fluente em um número de palavras inteligentes um está inundado inundado significa afogamento ou inundação mas inundado é frequentemente usado no contexto de trabalho como eu  estou atolado de trabalho tenho muito trabalho a fazer estou atolado de trabalho esta semana inteira mal tive tempo de respirar agora vamos dar uma olhada na raiz desta palavra
492,burocratas e verificadores são dois outros cargos que podem ser atribuídos a editores
493,a wikipédia começou como um projeto complementar para a nupedia um projeto de enciclopédia online gratuita de língua inglesa cujos artigos eram escritos por especialistas e revistos em um processo formal
494,enquanto os artigos dos  presidenciais estão sendo editados e debatidos inúmeras vezes a cada dia
495,a wikipédia tem sido criticada por permitir a publicação em seus artigos de materiais visuais de conteúdo sexual como imagens e vídeos de masturbação e ejaculação bem como cenas de filmes pesadamente pornográficos
496,a wikipédia também foi indicada para melhores práticas do webby
497,manter contato
498,o que está acontecendo se você não pegou algo ou ele não entendeu a pessoa que você sempre pode perguntar se entendi bem
499,os wikipedistas recebem por vezes prêmios ou medalhas por seu bom trabalho uma espécie de reforço positivo na forma de fichas personalizadas de apreço
500,foi um prazer te ver mais tarde
501,os pedidos que não podem ser atendidos a partir do cache são enviados para servidores de balanceamento de carga executando o software linux virtual server que por sua vez passa a solicitação para um dos servidores web apache para a renderização de páginas do banco de dados
502,estava tentando te ajudar mas não conseguiu alcançar o resultado que você pode dizer
503,você pergunta o que tem feito então o que está acontecendo em sua vida
504,a wikipédia afastase do estilo tradicional de construção de uma enciclopédia possuindo uma grande presença de conteúdo não acadêmico
505,de um enorme e magnífico castelo dourado narcisa ficou maravilhada com toda a beleza que viu eu sabia que mereço tantas riquezas eu sabia que você gostaria tudo o que quiser você encontrará aqui desde os vestidos mais bonitos até as comidas mais saborosas
506,o júri refere que figura entre os dez sites mais visitados do mundo  tem crescido continuamente  incluindo um número de línguas indígenas
507,em  de fevereiro de  a liminar contra a wikimedia deutschland foi anulada com o juiz rejeitando a noção de que o direito de privacidade de tron ou de seus pais estivesse sendo violado
508,e disse que queria se casar comigo ele tinha vindo em uma carruagem dourada e ele estava vestido de cima a baixo e de ouro também que sonho bobo
509,espere um segundo
510,oh querida uma noite quando ela estava dormindo sua mãe sentouse ao lado dela observandoa
511,ela correu para abraçar a mãe que estava sentada em casa triste nem irmã da minha querida filha pensei que nunca mais te veria
512,você vai ter que comer tudo isso eu pensei que você gostasse de coisas chiques não eu não quero casar com você eu quero ir para casa
513,se você quiser que alguém soe como se estivesse chorando e reclamando de algo que não está acontecendo você pode dizer venha estou você pode fazer isso
514,estas diferenças podem levar a alguns conflitos sobre diferenças de grafia por exemplo trem ou comboio goleiro ou guardaredes ou pontos de vista
515,ambos os projetos citados tinham semelhanças com a wikipédia mas também não davam privilégios editoriais completos para seus usuários
516,no dia  de janeiro de  a comunidade da wikipédia foi agraciada com o prêmio erasmus por sua ter promovido a disseminação do conhecimento através de uma enciclopédia ampla e universalmente acessível
