,Text
0,a wiki online citizendium foi iniciada pelo cofundador da wikipédia larry sanger na tentativa de criar um auxiliar para a wikipédia
1,como estão as coisas
2,alguns observadores afirmam que a wikipédia é uma ameaça econômica para os editores de enciclopédias tradicionais muitos dos quais podem ser incapazes de competir com um produto que é essencialmente livre
3,estas alegações foram contestadas por jimmy wales que negou o declínio e questionou a metodologia do estudo
4,na noite passada bem mãe foi um sonho incrível você sabe que havia um príncipe que veio até mim
5,o projeto encontrase sob administração da fundação wikimedia uma organização sem fins lucrativos cuja missão é empoderar e engajar pessoas pelo mundo para coletar e desenvolver conteúdo educacional sob uma licença livre ou no domínio público e para disseminálo efetivamente e globalmente
6,em outras palavras não deve apresentar por exemplo novas informações ou obras originais
7,faça alguns agradecendo com antecedência
8,você pode fazer isso se alguém está indo muito bem você pode dizer a ela continue o bom trabalho continue o bom trabalho como seja tão bom quanto você e continue o bom trabalho continue sendo outra frase coloquial e isso é o que os americanos dizer
9,eu não me importo se alguém está perguntando algo e esta é uma decisão muito fácil para você como se alguém dissesse para você pegar meu  milhão de dólares e você dissesse que isso é um acéfalo
10,editores com boa reputação na comunidade podem ser nomeados para um dos vários níveis de gestão de voluntários como os autorrevisores cujas edições são marcadas automaticamente como confiáveis reversores para os quais são simplificadas as ações que desfazem edições eliminadores que podem eliminar páginas e administradores englobando todos os outros além de poderem bloquear alterações em artigos em caso de vandalismo ou de disputas editoriais e bloquear contas de usuários
11,sanger mais tarde esclareceu que as imagens que eram relativas à pedofilia e uma sobre lolicon não eram fotos de crianças verdadeiras mas disse que eram representações visuais obscenas do abuso sexual de crianças nos termos do protect act de
12,estas fichas revelam uma ampla gama de trabalho valorizado indo muito além de simples edições para incluir suporte social ações administrativas e os tipos de trabalho de articulação
13,não se preocupe imagine que você chegou em casa e todos os seus amigos estão sentados no sofá
14,frase número um esta é outra maneira de perguntar
15,embora alguns contribuintes sejam autoridades em suas áreas a wikipédia exige que mesmo os seus contributos sejam apoiados por publicações e fontes verificáveis
16,eu sei
17,você se importaria de repetir isso
18,outro exemplo de catch é que você precisa de um empréstimo bancário porque não tem o suficiente
19,wales realizou um estudo onde constatou que mais de  de todas as edições são feitas por apenas  dos usuários ou seja  pessoas em  ano da pesquisa
20,talvez você estivesse falando ao telefone e alguém estivesse falando com você e você gosta
21,dedos cruzados
22,como quando paramos onde estávamos e você tem que repetir porque é o som que algumas pessoas confundem
23,por exemplo o metawiki fornece estatísticas importantes em todas as versões da wikipédia e mantém uma lista dos artigos essenciais que devem constar em todas as edições do projeto
24,e um ângulo agudo é este ângulo agudo de menos de  graus tão agudo quanto uma palavra é usada para denotar agudo e portanto também mentalmente agudo e obtuso denota embotado e portanto também um pouco lento na mente então frases de exemplo com obtuso são o homem era tão obtuso que deu sua senha para um chamador falso ou para a criança obtusa
25,o pão de ouro era uma vez em uma pequena aldeia onde vivia uma mulher chamada marion
26,a partir de janeiro de  segunda fase a wikipédia passou a contar com um software escrito em php wiki por meio de um banco de dados mysql feito sob medida para a wikipédia por magnus manske
27,a ordem judicial surgiu de uma ação movida pelos pais floricic exigindo que o sobrenome de seu filho fosse retirado da wikipédia
28,tudo bem se você quiser mais aulas sobre frases e frases comuns deixeme saber na seção de comentários abaixo
29,as crianças precisam ser ensinadas a usar a internet de forma crítica e adequada
30,está bem
31,sempre posso dizer isso porque eu não tinha t preparado muito bem para o exame fiquei confuso com algumas das perguntas outras palavras que você pode usar em vez de confuso são perplexo confuso ou perplexo palavra inteligente número oito é rendezvous rendezvous rendezvous
32,exceto por algumas páginas particularmente propensas ao vandalismo cada artigo pode ser editado de forma anônima ou com uma conta de usuário
33,claro sem problemas
34,em junho de  a wikipédia lançou o ptmobilewikipediaorg um site oficial para dispositivos sem fio
35,nicholas carr escreveu no ensaio a amoralidade da web  falando sobre a chamada web  como um todo implícita nas visões de êxtase de web  é a hegemonia do amador
36,em dezembro de  o acesso ao artigo da versão inglesa virgin killer foi bloqueado durante quatro dias pela maioria dos provedores de serviços de internet no reino unido depois que foi denunciado por um leitor como pornografia infantil
37,narcisa mudou seus hábitos ela lutou no início mas lentamente e pacientemente ela começou a se tornar muito mais legal um dia mellie e terry vieram se encontrar com marian novamente oh olá vocês dois então nos digam marian
38,o que você fará esta noite
39,continue
40,você pode pedir desculpas por incomodálo você sabe que vê
41,com certeza vá
42,resultados novos são excessivamente relatados em artigos de revistas enquanto informações relevantes são omitidas do noticiário
43,uma alegação que é suscetível de ser questionada requer pelo menos uma referência a uma fonte confiável
44,no entanto como a wikipédia cresce através do seu modelo não convencional de construção de enciclopédia quem escreve a wikipédia
45,seus amigos que é este canal estupendo para estudantes e algumas outras palavras que você pode usar ao invés de estupendo são incríveis fantásticas ou excepcionalmente boas ok então antes de continuarmos com as cinco palavras equilibradas neste vídeo lembrese de colocar um comentário abaixo deste vídeo
46,nenhum artigo ou o seu conteúdo é propriedade do seu criador ou de qualquer outro editor ou é avaliado por qualquer autoridade reconhecida ao contrário os conteúdos são acordados por consenso
47,o wikiscanner pode ajudar a evitar que uma organização ou indivíduos editem páginas que não deveriam
48,eu não estava ouvindo outra frase que uso o tempo todo
49,embora a wikipédia em inglês tenha chegado aos três milhões de artigos em agosto de  o crescimento de edições em termos de números de artigos e de colaboradores parece ter estabilizado em torno do início de
50,no entanto trabalhos acadêmicos sugerem que os vandalismos são geralmente de curta duração
51,o the new york times publicou uma coluna com uma pesquisa sobre a wikipédia no momento do seu décimo aniversário citando que  wikimedia foundation colaborou em um estudo da base contribuinte da wikipédia e descobriu que ela era composta por apenas  de mulheres e a média de idade de um contribuinte estava entre os  e  anos de acordo com o estudo conjunto de um centro da universidade das nações unidas e da universidade de maastricht e também observa que as pesquisas sugerem que menos de  de suas centenas de milhares de colaboradores são mulheres
52,como os interesses das pessoas são variadíssimos o acervo da wikipédia abrange várias tribos culturais
53,as afirmações da enciclopédia são cada vez mais utilizadas como fonte por organizações como os tribunais federais dos estados unidos e da organização mundial da propriedade intelectual mas principalmente para obter informações de apoio ao invés de informações decisivas em um caso
54,ficamos muito animados porque
55,olá e bemvindo
56,um estudo de  revelou que usuários da wikipédia eram menos agradáveis e abertos embora mais conscientes que os nãousuários da wikipédia
57,a wikipédia é um projeto de enciclopédia multilíngue de licença livre baseado na web e escrito de maneira colaborativa
58,obrigado de qualquer maneira não importa mas obrigado de qualquer maneira
59,então hoje vamos aprender  novas palavras inteligentes seus significados palavrasraiz e frases de exemplo então vamos começar ei pessoal vocês estão assistindo
60,não tenho certeza se concordo
61,eles são bons para você seria melhor sem você e este é um significado negativo então realmente ouça a entonação
62,é melhor eu ir por outra maneira de dizer adeus
63,eu vou levar
64,a adição de spins políticos para artigos de organizações incluindo membros da câmara dos representantes dos estados unidos e grupos de interesses especiais foi observada e organizações como a microsoft têm oferecido incentivos financeiros para trabalhar em certos artigos
65,doulhe aquela dica secreta para parecer muito fluente
66,no mesmo artigo jenny fry um pesquisador do oxford internet institute comentou sobre acadêmicos que citam a wikipédia dizendo que você não pode dizer que as crianças são intelectualmente preguiçosas porque elas estão usando a internet quando os acadêmicos estão usando os motores de busca em suas pesquisas
67,agradeço antecipadamente se alguém cometer um erro e ele estiver muito chateado com isso
68,deixeme ver
69,quando a revista time reconheceu você como a pessoa do ano de  devido ao sucesso acelerado da colaboração online e da interação de milhões de usuários ao redor do mundo citou a wikipédia como um dos vários exemplos de serviços da web  juntamente com youtube myspace e facebook
70,o acesso à wikipédia partir de telefones móveis foi possível já em  através do wireless application protocol wap através do serviço wapedia
71,os cientistas da pesquisa são o público principal da revista mas resumos e artigos de acompanhamento destinamse a fazer muitos dos estudos importantes mais compreensíveis para cientistas de outras áreas e para o público educado
72,vários dispositivos e aplicações otimizam ou melhoram a exibição do conteúdo da wikipédia para dispositivos móveis enquanto alguns também incorporam funcionalidades adicionais tais como o uso de metadados da wikipédia como a geoinformação
73,para mim esse é o melhor restaurante da cidade
74,saiba que se alguém conta uma piada legal você percebe que é uma boa piada
75,tive uma pontuação quase perfeita a palavra stupendous tem raízes latinas clássicas da palavra que significa
76,em seu próprio reflexo no espelho ou o turista ficava perplexo com os diferentes costumes que
77,este é o melhor vídeo para começar então vamos  frases em inglês em  minutos
78,eu realmente sinto muito por isso
79,se você ainda não pressionou o botão de inscrição e o ícone de sino ao lado dele e feliz assistindo
80,eu pergunto e depois digo no final
81,na verdade são  horas
82,minha querida criança você é tão linda e amável mas não se importa com nada além da sua beleza
83,hey acalmese juntos outra frase que
84,então esta é uma ótima maneira de praticar onde estávamos novamente se você estiver no meio de uma conversa
85,quando ele espirrou oh oh e a última parada não não quero ouvir mais nada tudo que pude ver foi que aqueles homens eram realmente legais minha querida você deve conhecer essa beleza
86,oh mãe eu te amo tanto e você estava certa aparência e riquezas não são tudo o pão de ouro era inútil porque eu não poderia comêlo e o homem mesmo ele era bonito ele não se importava nem um pouco comigo mas minha querida você percebe que é exatamente assim que você tratava os outros
87,pedindo repetição
88,o artigo sobre virgin killer um álbum de  da banda alemã de heavy metal scorpions apresenta uma imagem da capa original do álbum que retrata uma menina préadolescente nua
89,no entanto uma investigação relatada na revista nature em  sugeriu que os artigos científicos da wikipédia chegaram perto do nível de precisão da encyclopædia britannica e tinham uma taxa semelhante de erros graves
90,essa é uma ótima piada então a frase é boa
91,dos usuários registrados nunca fazem outra edição após as suas primeiras  horas
92,o problema de privacidade na wikipédia envolve o direito de um cidadão de permanecer privado continuar a ser um cidadão em vez de uma figura pública aos olhos da lei
93,não vale a pena eu pessoalmente adoro a frase que você arrasa o que significa que você é incrível
94,como o conteúdo da wikipédia é distribuído sob uma licença aberta qualquer um pode reutilizar ou redistribuílo sem nenhum custo
95,mas estava com o coração partido por tudo que era intragável ela logo começou a chorar eu não quero isso mas a comida é muito boa
96,estou tão feliz que tenham sido  frases em inglês me digam se isso foi útil curtindo este vídeo e comentando abaixo se vocês souberem de mais alguma frase legal
97,em um estudo de  sobre a comunidade da wikipédia a doutoranda em economia andrea ciffolilli argumentou que os baixos custos de transação de participar de software wiki criaram um catalisador para o desenvolvimento colaborativo e que uma abordagem de  construção criativa incentiva a participação
98,em abril de  uma extensão apache lucene foi adicionada ao software mediawiki em bultin e o banco de dados de indexação que até aí era mysql passou a ser do tipo lucene
99,em  de setembro de  o the washington post informou que a wikipédia se tornou um ponto focal na eleições dos eua de  dizendo digite o nome do candidato no google e dentre os primeiros resultados estará uma página da wikipédia tornandoa sem dúvida tão importante quanto qualquer anúncio na definição de um candidato
100,em  cerca de  artigos foram adicionados diariamente à enciclopédia até  essa média era de cerca de
101,é como se não importasse
102,uma situação complicada é quando você não consegue um emprego sem ter experiência de trabalho
103,não acredito que você deve estar brincando comigo para dizer a alguém para sorrir e para ser feliz você pode sempre dizer animese animese
104,eu estou indo para a roupa de qualquer maneira
105,você se importa se eu pular aqui
106,um estudo de  realizado por henry blodget mostrou que uma amostra aleatória de grandes artigos na wikipédia medido pela quantidade de texto que sobreviveu na última edição da amostra foi criada por novatos ou anônimos usuários com baixas contagens de edições enquanto a maioria da edição e formatação é feita por usuários experientes um grupo selecionado de usuários estabelecidos
107,adoraria fazer algo mas não posso
108,páginas e verbetes podem ser apagados por usuários que possuem os cargos de eliminador ou administrador através de votações ou por eliminação rápida quando descumprem alguma política do site
109,a política do ponto de vista neutro da wikipédianota  foi codificada em seus meses iniciais e era semelhante à política anterior da nupedia de nãoparcialidade
110,não vale a pena
111,por outro lado ele deu um exemplo de prosa da wikipédia que considerou verborreica e sem graça
112,os resultados foram  sim  não e  sem opinião
113,não muito
114,nota  esta característica torna mais fácil comparar antigas e novas versões do artigo desfazer alterações que um editor considera indesejáveis ou restaurar um conteúdo perdido
115,bemeducado culto e sofisticado
116,qual foi o seu erro vamos alimentar você com algo legal daquele dia em diante
117,em sua ideia original a wikipédia tinha sido feita para que usuários a lessem e editassem o conteúdo utilizando qualquer navegador de web padrão através de uma conexão de internet fixa
118,para minha mãe deixeme ir para casa melissa e terrence se entreolharam e piscaram bem
119,a wikipédia foi formalmente lançada em  de janeiro de  como uma única edição em inglês em wwwwikipediacom e anunciada por sanger na lista de discussão da nupedia
120,em setembro de  os artigos da wikipédia cobriam cerca de meio milhão de lugares na terra
121,a the economist observou que a qualidade da escrita dos artigos da wikipédia pode ser um guia para o leitor a prosa deselegante ou o discurso retórico geralmente refletem pensamentos confusos e informações incompletas
122,a importância da wikipédia tem sido notada não apenas como uma referência enciclopédica mas também como um recurso de notícias atualizado com frequência por conta da rapidez com que artigos sobre acontecimentos recentes aparecem
123,as solicitações de página são servidas por uma camada de servidores de cache squid
124,um estudo de  sugeriu que havia indícios de uma crescente resistência da comunidade da wikipédia a novos conteúdos
125,pântano é um pedaço de pântano e se alguém pisar no lugar errado em um pântano eles podem facilmente se afogar e a forma verbal de pântano significa afundar então veja como você pode usar essa palavra
126,em português o prefixo wiki é somado ao sufixo de enciclopédia ganhando acento diacrítico agudo no e para atender à gramática lusófona
127,eu amo você me vendeu porque às vezes as pessoas descrevem sua viagem ou alguém que compraram e descrevem muito bem
128,os críticos argumentam que por vezes edições de nãoespecialistas minam a qualidade
129,um projeto nãowiki similar o gnupedia coexistia com a nupedia no início de sua história
130,eu estraguei tudo eu estraguei tudo se você quer que alguém trabalhe em vez de mim você pode dizer
131,frase número dois quando você não vê alguém por um tempo você diz a ela há muito tempo que não vê então isso significa que você não vê essa pessoa há semanas ou meses há muito tempo sem ver a frase número
132,agradeço antecipadamente o que significa que realmente espero que você vá
133,e você sabe que a melhor parte foi quando eu estava com meu vestido de noiva que era de ouro também é claro que todo mundo estava olhando só para mim narcisa não há nada de incrível nesse sonho
134,infelizmente tenho que dizer não
135,análises estatísticas sugerem que a resolução de disputas na wikipédia ignora o conteúdo das disputas de usuários e centrase ao invés disso na conduta do usuário funcionando não tanto para resolver disputas e promover a paz entre os usuários conflitantes mas para eliminar usuários problemáticos enquanto os usuários potencialmente produtivos voltam a participar
136,por outro lado inicialmente havia relativamente poucas regras e a wikipédia operava independentemente da nupedia
137,fazendo planos
138,o primeiro foi um nica de ouro das comunidades digitais no concurso anual prix ars electronica valendo  mil euros e um convite para assistir à cyberarts pae festival na áustria mais tarde naquele ano
139,eu não estou interessado
140,nota  até mesmo essas regras são armazenadas em forma de wiki e os editores da wikipédia como uma comunidade podem escrever e revisar as políticas e diretrizes e aplicálas por exclusão marcando com etiquetas tags ou modificando o conteúdo dos artigos para deixálos de acordo com tais regulamentações
141,outra pesquisa de  realizada pelo foresee results e divulgada pela cnet mostrou que em uma escala de satisfação de  a  os internautas atribuíram  pontos à wikipédia um resultado maior que o de outros sites consagrados como youtube e facebook
142,esta última acusação ocorreu em razão de comentário de miriam na rádio cbn onde ela defendia a inocência de dantas
143,em  um novo serviço móvel foi lançado oficialmente localizado em ptmwikipediaorg que atende aos mais avançados dispositivos móveis como o iphone dispositivos baseados no android ou o palm pre
144,estes incluem páginas onde os usuários podem verificar edições por exemplo páginas vigiadas e mudanças recentes programas de computador bots que são cuidadosamente projetados para tentar detectar ataques e corrigilos automaticamente ou semiautomaticamente filtros que avisam os usuários sobre fazer indesejáveis edições bloqueios sobre a criação de links para sites em particular e bloqueios de edições de contas específicas endereços de ip ou intervalos de endereços
145,um estudo de artigos sobre câncer realizado por yaacov lawrence do kimmel cancer center na universidade thomas jefferson descobriu que os verbetes eram em sua maioria precisos mas eram escritos no nível de leitura da faculdade ao contrário do nível de colegial visto no physician data query
146,se alguém está chorando e não quer
147,como s narcisismo agora marian contou a ambos tudo o que tinha acontecido e ela mudou muito desde aquela época
148,por padrão qualquer edição em um artigo se torna disponível imediatamente antes de qualquer revisão
149,oh isso é quase louco
150,a wikipédia também gerou vários projetos irmãos que são executados pela wikimedia foundation
151,não estou bem obrigado
152,jimmy wales afirmou certa vez que apenas uma comunidade um grupo dedicado de algumas centenas de voluntários faz a maior parte das contribuições para a wikipédia e que o projeto é portanto como qualquer organização tradicional
153,o programa revelou que muitas dessas edições foram feitas por empresas ou agências do governo para alterar o conteúdo de artigos relacionados a eles seu pessoal ou seu trabalho
154,receio que discordo
155,frases se você está aprendendo inglês há algum tempo e deseja retomar o aprendizado
156,john seigenthaler o diretor editorial fundador do usa today e fundador do centro primeira emenda da universidade vanderbilt chamou jimmy wales e perguntoulhe se existia alguma forma de saber quem contribuiu com a desinformação
157,estudantes têm sido orientados a escrever artigos para a wikipédia como um exercício de explicar de forma clara e sucinta conceitos difíceis para um público não iniciado
158,desculpe eu não posso agora
159,em  de janeiro de  a wikipédia também foi premiada com a classificação de quarta melhor marca pelos leitores do brandchannelcom recebendo  dos votos em resposta à pergunta qual marca teve mais impacto em nossas vidas em
160,estou livre o fim de semana todo vamos fazer alguma coisa
161,no lugar de proibir edições de usuários novos ou não registrados haveria um novo sistema chamado de alterações pendentes que como jimmy wales disse à bbc permitiria à wikipédia em inglês liberar os artigos que foram protegidos ou semiprotegidos por anos para a edição geral
162,ela viveria sua vida naquele dia dois amigos vieram visitar a mãe narciso eles eram mellie e terry os três eram amigos há muito tempo mas terry e ellie tinham um segredo dos dois
163,no entanto ele também adverte que erros são frequentemente encontrados em sites de internet e que os acadêmicos e especialistas devem estar atentos para corrigilos
164,na frança encontro anterior era usado pelo exército para indicar um local de encontro para as tropas agora há algo um pouco excitante e secreto sobre a palavra encontro embora você possa usar o encontro para qualquer reunião
165,olá pessoal sejam bem vindos ao meu canal neste vídeo
166,existem fóruns especializados que centralizam as discussões de decisões específicas como por exemplo se um artigo deve ou não ser eliminado
167,e com isso ela entrou em sua carruagem e sem nem mesmo se despedir de sua mãe cavalgou com o anjo enquanto eles estavam viajando a carruagem de repente entrou em um portal mágico lá viajou por uma área tempestuosa a carruagem sacolejou tremendamente e narcissa
168,então se você está prestes a embarcar em sua jornada
169,você pode dizer graças a deus é sextafeira ou pensar que céus disse descoberta de sábado fim de semana
170,em  tinha cerca de  milhões de leitores
171,o sistema de alterações pendentes foi introduzido em  de junho de  pouco depois das  horas no tempo médio de greenwich gmt
172,a diferença é que eles têm mais experiência para serem críticos sobre o que estão pesquisando e se ele é autoritário
173,é você sabe
174,sua confiabilidade e precisão também são alvo de críticas
175,o que você acha de irmos ao cinema
176,evitando uma pergunta
177,mais tarde naquele ano wales anunciou que a wikipédia não iria exibir anúncios publicitários e seu site foi movido para wikipediaorg
178,outras palavras que você pode usar em vez de em uma solução são estou em uma sopa ou eu  estou bagunçado ou em um ponto de incômodo ou apenas em um ponto a palavra inteligente número  é flummox flummox significa confundir alguém
179,my number one doctor em um episódio de  do programa de televisão scrubs também satirizou a dependência da wikipédia sobre editores que editam os artigos da cultura erudita e pop em uma cena em que dr perry cox reage a um paciente que diz que um artigo da wikipédia indica que o crudivorismo reverte os efeitos da tumor ósseo por autoclavagem e que o mesmo editor que escreveu que o artigo também escreveu a lista de episódios de battlestar galactica
180,o primeiro em memória  de setembro wiki criado em outubro de  falava sobre os ataques de  de setembro de  este projeto foi inativado em outubro de
181,a maioria dos artigos são escritos sobre a américa do norte europa e ásia oriental com muito pouca cobertura de grandes partes do mundo em desenvolvimento incluindo a maior parte da áfrica
