,Text
280,en anden måde at spørge om du ikke fangede en del af en sætning kan du sige at jeg ikke fangede det sidste ord
281,jeg er fri hele weekenden lad os gøre noget
282,i  modtog nature prince of asturias award for communications and humanity sammen med science
283,nogle brugere har kæpheste som at bekæmpe dåsedansk og patruljerer dawikipediaorg regelmæssigt
284,har du noget imod at gentage det
285,jeg lyttede ikke fordi du måske havde travlt
286,generelt men det vandt  t være meget passende for et officielt møde så hvis du har en dato kan du sikkert kalde at et møde med smart ord nummer  er stump stump stump er en fornærmelse du ville bruge det når du prøver at kalde nogen stum eller uintelligent eller svag nu har du hørt ordet stump i geometri stump vinkel og spids vinkel så en stump vinkel er en vinkel større end  grader men mindre end  grader
287,og du er klar til at gå og hvis du kan lide denne video så glem ikke at give os tommelfingre med en kommentar
288,jeg kan ikke tro det du skal være en sjov på mig for at bede nogen om at smile og for at være glad kan du altid sige opmuntring opmuntre
289,og hør udtalen en eller to gange
290,jeg kunne ikke være mere enig
291,hvis nogen fik et job med sine drømme om hvad du kan sige heldig dig eller nogen kom ind på universitetet i deres drømme som heldig dig er dette en måde at lykønske den person der er heldig dig eller som bare at understrege at han er heldig heldig en anden måde at sige at du virkelig er vred er at sige at jeg flippede ud som om jeg var så vred jeg
292,hvad laver du i aften
293,det ville være godt tak
294,og du er som åh det forklarer det der forklarer det
295,så du møder nogen og du tid hvordan går det
296,kunne du give mig saltet vær venlig
297,oprindeligt var det udelukkende en engelsksproget encyklopædi men andre sprogversioner blev hurtigt udviklet
298,enkelte kontroversielle artikler kan være semibeskyttet dvs
